id,titulo,conteudo,link
1505,Create forms (legacy),"Use legacy forms to gather important information about your visitors and contacts. In HubSpot, you can easily create forms to add to your HubSpot pages or external site. Please note: it’s recommended to use the updated forms editor to create and manage forms instead. This article should be used as a reference for existing forms built with the legacy editor only. Create a legacy form To create a legacy form: In your HubSpot account, navigate to Marketing > Forms . In the upper right, click Create form . Please note: you can only associate a form with a Business Unit when creating the form. Learn more about associating a form to a Business Unit . Select Legacy Form Editor . In the top right, click Next . In the left panel, select Blank template to start with a blank form or a pre-made template to start with a form with pre-selected fields for a specific use case. The form preview for a selected template will appear in the right panel. If you have Account Access permissions , you can select the Support template to create tickets from form submissions. This will connect the form to your conversations inbox or help desk , where your team can respond to customers' inquiries. Please note: accounts created after April 1st, 2024 can only create tickets from forms connected to help desk . In the upper right, click Start . At the top of the form editor, click the edit pencil icon to edit the form name. Add and edit form fields Add form fields to collect information from your website visitors and contacts. You can also add rich text areas between form fields to add customizable text, create headers, or add spacing to your form. If you're using a multiple checkbox, radio select, dropdown select, date, file upload, phone number, or blog subscription field, learn more about the additional customization options available with these field types . Please note: By default, the Email field is required for form submissions to create contacts. HubSpot will check whether an email address is valid before allowing a user to submit the form. Learn more about allowing form submissions without email addresses to create contacts. Score, calculation, rich text, and HubSpot user properties cannot be used in a form. To add a form field: In the left panel, use the search bar to search for an existing field, or browse through your property groups. The object type of the field added can determine whether the form submission appears on the activity timeline of associated records. To create a new property and use it as a field on your form, click the Create new tab. Select the form field type . In the right panel, set up your form field: Property label: enter text to name the property. Object type: select an object type. You can add Contact , Company, and Custom object fields. Ticket properties can be added if Automatic ticket creation is toggled on. Business Unit : select the Business unit where you wish to create the property ( Business units add-on only). Group: select a property group. Review your property options and click Create . Click and drag fields onto the form preview on the right to include them on your form. Fields can be placed above, below, or next to other fields. If you've set up the payments tool in HubSpot, learn how to collect payments with forms . When the Payment option is turned on, you cannot create tickets from the same form. To create a ticket from each form submission, super admins or users with Account Access permissions can toggle on the Automatic ticket creation switch in the Ticket Properties section. This will connect the form to your conversations inbox or help desk , where your team can respond to customers' inquiries. When the Automatic ticket creation option is turned on, you cannot collect payments from the same form. Please note: accounts created after April 1st, 2024 can only create tickets from forms connected to help desk . Manage your form field's options To edit a field's options: In the right panel, click the field in the form preview . In the left panel, edit the field's options as needed. The options here may vary depending on the field's property type, learn more about the additional field customization options available . In the Basic tab: Make this field required: when this option is toggled on, the field must be completed to submit the form. If a form field has been set as required, it cannot be set as hidden. Make this field hidden: when this option is toggled on, the field will not appear on the form but can be used to pass values to contact properties for all submissions. Label: the name of the field that will appear on the form. Help Text: informational text below the field's label to help the visitor complete the field. Placeholder text: text that appears in the input box for the field. The text will disappear when the visitor enters a value in the field, and will not come through in the submission, even if the field is left empty. Default value: a value that will be submitted for the field by default unless changed by the visitor. In the Logic tab: Progressive field s: select the action to take if the field has been previously submitted. Learn more about progressive fields in forms. Dependent fields: display additional fields based on visitors' responses to a previous field. Learn more about dependent fields in forms. Customize your form options From the Options tab, configure what happens after a form is submitted. You can configure submission settings, user notifications, the language for form and error messages, and more. Some options may not be displayed, depending on your HubSpot subscription. What should happen after someone submits this form: select what displays after a form submission. This sets the action for forms embedded on non-HubSpot pages or shared as standalone pages only ; it will not set or change the action for forms added to HubSpot pages . Thank you message: configure a thank you message to appear after the form is submitted. HubSpot page or External URL: redirect visitors to a different page after the form is submitted. You can select a published HubSpot page or use an external URL. Scheduling page: if you have a Sales or Service Hub Enterprise subscription, you can redirect visitors to a specified meeting scheduling page to book a meeting, any s ubmitted form fields will automatically be populated. Conditionally redirect to a scheduling page, HubSpot page or external URL: if you have a Sales or Service Hub Enterprise subscription, you can redirect visitors to a specified meeting scheduling page, HubSpot page, or external URL. If you are redirecting users to a meeting scheduling page, any s ubmitted form fields will automatically be populated. Learn about conditionally redirecting a form to a meeting scheduling page , HubSpot page, or external URL Customize lifecycle stage based on submissions: click the Set lifecycle stage to dropdown menu and select a lifecycle stage . When visitors submit the form, any new or existing records will be set to the selected lifecycle stage. You cannot move a record's lifecycle stage backwards. If an existing contact or company with a later lifecycle stage submits a form, the lifecycle stage will not be updated. The lifecycle stage set in a form will overwrite the default lifecycle stage configured in your HubSpot settings . Follow-up options: select the Send submission email notifications to the contact's owner checkbox to automatically send a notification to the contact's owner. If a contact has no owner, no notifications will be sent. Learn more about object ownership in HubSpot . Send submission email notifications to: click the dropdown menu to select the default teams or individuals to send submission email notifications to, regardless of contact ownership. Recipients set here will be overwritten by recipients set in the form options on HubSpot pages. Form and error message language: select the language for default field labels and errors displayed to visitors when the form is filled out incorrectly. Add to marketing campaign: if you have a Marketing Hub Professional or Enterprise subscription, you can associate the form with a campaign: To associate your form with an existing campaign, click the Campaign dropdown menu and select a campaign . To associate your form with a new campaign, click the Campaign dropdown menu and click Create campaign . Then, continue setting up your campaign . If you've never created a campaign before, click Create a campaign . Then, continue setting up your campaign . Always create contact for new email address: select this option to create a new contact record for every submission with a unique email address . If the email address submitted matches an existing contact record in your database, the details on the existing record will be updated. If this option is turned off , HubSpot will first attempt to associate the submission with an existing contact with the submitted email address. If no contact exists at that email address, HubSpot will recognize and update your contacts based on the cookies in their browsers. This may result in contacts being overwritten if the same form is submitted multiple times from the same device. If this option is turned on , when a contact submits the form using a different email on a browser where there is already a cookie, views will not be tracked for this contact. The Pre-populate contact fields with known values option will also be automatically turned off. Set contacts created as marketing contacts: if your HubSpot account has access to marketing contacts , you can automatically set any contacts who have submitted this form as marketing. This includes both new and existing contacts. Add link to reset the form: select this option to allow visitors to remove any pre-populated fields on the form and to create a new contact on submission. When turned on, visitors can click a Not you? Click here to reset link that resets the form. This will also turn off cookie tracking in the form submission, preventing any cookie overwrites. Pre-populate fields with known values: if a contact previously visited your site and submitted a form, and HubSpot was able to store and track their cookies, any known field values can be pre-populated on the form. This option is turned on by default. Learn more about pre-populated form fields . Style and preview your form From the Style & preview tab, customize the styling of your form . A preview of the form will update in the right panel as you adjust the form's styles or test its features. You can customize the following: Set as raw HTML form: if you have a Marketing Hub or Content Hub Professional or Enterprise subscription, you can select this option to render the form as a raw HTML element rather than inside an iframe. Do note the following: Any HubSpot styling configured in the Style tab will be removed. The form should be styled with CSS in your external stylesheet . Input options: select one of four available themes for field and button styles. Style: customize the form's field width, fonts, and colors. Test: if you have progressive fields or dependent fields on this form, you can test how they'll appear to your visitors. Use automations with forms Use simple automation features such as sending a follow-up email to a contact or sending automatic internal email notifications with your forms. You can also use the form submission as a trigger in a simple workflow. Learn more about how to use automation with the forms tool. At the top, click the Automation tab . From the Automation tab, you can configure what happens after the form is submitted. In the Automate what happens after a form is submitted section, customize the settings for your form as needed. In the Create your own simple workflow section, set up a simple workflow to automate follow-up actions such as sending an email or setting a contact property. Use your form After creating a new form or making your form updates, you'll need to update your form to make the changes go live. Then, add it to your HubSpot content , use the form embed code to add it to an external page, or share it as a standalone page with a share link . In your HubSpot account, navigate to Marketing > Forms . Create a new form or hover over an existing form and click Edit . In the top right, click Update to publish your form updates. Forms cannot be unpublished. If the form is embedded on an external page, you can manually remove the form embed code. However, the only way to disable the standalone form page is to delete the form . Forms",https://knowledge.hubspot.com/forms/create-forms
1506,Gravação de chamadas não salva no HubSpot,"Há alguns motivos possíveis pelos quais sua gravação de chamadas com a ferramenta de chamadas da HubSpot não foi salva em uma linha do tempo do contato. A gravação de chamadas está desligada A capacidade de gravar chamadas é uma configuração completa de conta, afetando todos os usuários que estão fazendo chamadas na conta. Ela pode ser ativada ou desativada por um usuário com permissões de Acesso à conta : Na sua conta HubSpot, clique no ícone de configurações settings icon na barra de navegação superior. No menu da barra lateral esquerda, acesse Chamadas . Clique no separador Configurações de Chamada . Seleccione a caixa de verificação Permitir a gravação de chamadas . Se essa configuração estiver desativada, o botão Gravar não será exibido ao fazer uma chamada. Se você não estiver vendo a opção para gravar, verifique com os outros administradores na sua conta para ver se eles tiveram essa configuração desligada. Gravação com o consentimento de duas partes Algumas áreas têm as leis de consentimento de duas partes , que significa que ambas as partes (a pessoa que faz a chamada e o contato recebe a chamada) devem consentir à chamada ser gravada. Se você costuma chamar números de estados dos EUA que não exigem o consentimento de duas pessoas, você pode estar acostumado a gravar suas chamadas por padrão sem precisar clicar no botão Gravar ao fazer a chamada. No entanto, ao ligar para um dos 13 estados dos EUA ou fazer chamadas internacionais em que o consentimento de duas partes é necessário, você deve clicar no botão Gravar . Na caixa pop-up que aparece, você deve selecionar Eu os informei para confirmar que você obteve o consentimento do destinatário para gravar a chamada. Se você não clicar no botão Gravar e confirmar que tem consentimento, a chamada não será gravada. Saiba mais sobre as leis de gravação de chamadas . A gravação foi desligada antes de a chamada terminar Se o botão Gravar estiver vermelho quando a chamada terminar, a gravação da chamada será salva. No entanto, se a gravação estiver ativada no início da chamada e depois desligar antes de a chamada terminar, essa gravação não será salva. Gravação em: Gravação desligada: Para gravar sua chamada, verifique se o botão de gravação está ativado ao fazer a chamada e não desligue o botão de gravação a qualquer momento durante a chamada. Quando a chamada terminar, clique no botão Salvar para que a chamada e a gravação sejam salvas na linha do tempo do contato. A gravação foi excluída manualmente Qualquer usuário com acesso à linha do tempo do contato pode excluir uma gravação clicando no ícone de exclusão delete ao lado da gravação e confirmando a exclusão na janela pop-up exibida. Se uma gravação que você viu anteriormente em um cronograma de contato estiver faltando, verifique com todos os usuários da conta que também estejam trabalhando com esse contato para ver se eles o excluíram. A chamada não conectou A chamada deve se conectar para iniciar a gravação. As chamadas com um status de ""Sem resposta"" não foram conectadas à linha de telefone do destinatário e nenhuma chamada foi realizada, portanto, não havia nada para ser gravado. Calling",https://knowledge.hubspot.com/pt/calling/why-wasnt-my-call-recorded-in-hubspot-sales
1507,Manage settings for the deals and leads tabs in the sales workspace,"If you're a Super Admin , you can configure the sales workplace settings so that only specific users or teams can view the Deals and Leads tabs. This makes it possible for admins to customize the view their sales reps have. You can also update the deals sidebar , which is located on the Deals tab . Turn on the Leads tab In your HubSpot account, click the settings settings icon in the top navigation bar. In the left sidebar menu, navigate to Sales Workspace . Toggle the Show the Leads tab switch on. To exclude specific users from viewing the Leads tab, click the Exclude users from viewing Leads dropdown menu and select the users you'd like to exclude. To exclude specific teams from viewing the Leads tab, click the Exclude teams from viewing Leads dropdown menu and select the teams you'd like to exclude. Turn on the Deals tab In your HubSpot account, click the settings settings icon in the top navigation bar. In the left sidebar menu, navigate to Sales Workspace . Toggle the Show the Deals tab switch on. To exclude specific users from viewing the Deals tab, click the Exclude users from viewing Deals dropdown menu and select the users you'd like to exclude. To exclude specific teams from viewing the Deals tab, click the Exclude teams from viewing Deals dropdown menu and select the teams you'd like to exclude. Click Save . Sequences Meetings Tasks",https://knowledge.hubspot.com/prospecting/configure-the-sales-workspace-settings
1508,Solucionando problemas comuns de publicação social,"Se você está tendo problemas para publicar suas postagens sociais por meio do HubSpot, revise os diferentes problemas comuns de publicação social e as etapas para resolvê-los. Vários erros comuns que resultam em problemas na publicação de posts nas mídias sociais por meio do HubSpot incluem: Erro Etapas para resolver Imagem rejeitada Revise suas imagens para o seguinte: Verifique se a imagem do post está dentro do limite de tamanho e dos parâmetros de tamanho recomendados para a rede social em que você está publicando. Verifique o formato do arquivo da foto é JPEG ou PNG e se a URL da imagem ainda está ativa. Falha na autorização Verifique se sua conta está autorizada para publicação no HubSpot. Para fazer isso, conecte a conta novamente . Problema de rede de terceiros Verifique se a sua imagem é válida e se a sua conta está autorizada. Depois de fazer isso, clone seu post social e publique-o novamente . Se você encontrar o mesmo problema, você pode querer obter ajuda com o HubSpot . Limite de taxa do Facebook O Facebook tem um limite de API . Isso pode afetar a publicação na sua conta do Facebook por meio do HubSpot. Se você estiver encontrando esse erro, recomendamos esperar um dia antes de publicar novamente. Esse limite será ajustado em um período de 24 horas. Batida de limite mensal bitly Este erro ocorre quando o limite mensal do Bitly para sua conta foi atingido. Para verificar os limites da sua conta, entre em contato com o suporte do Bitly . Para resolver isso, você pode considerar o seguinte: Aguardando seu limite do Bitly ser redefinido. Atualizando o Bitly para aumentar o seu limite. Desconectar sua conta do Bitly. Isso permitirá que você continue postando no HubSpot sem links curtos personalizados. Para desconectar sua conta, você deve ter todas as contas acessíveis ou permissões de redes sociais de suas contas conectadas, ou ser um Superadministrador . Para desconectar sua conta do Bitly: Na sua conta HubSpot, clique no ícone de configurações settings icon na barra de navegação superior. No menu da barra lateral esquerda, acesse Marketing > Social . Clique na guia Publicação e role para baixo. Na seção Publicar com links de links curtos personalizados, clique em Desconectar . Social",https://knowledge.hubspot.com/pt/social/what-are-the-most-common-unsuccessful-social-message-errors
1509,Receba pagamentos com formulários,"Crie formulários que incluam a capacidade de coletar pagamentos digitais por meio de Processamento de pagamento stripe ou Pagamentos HubSpot . Tanto o dados de envio do formulário e a detalhes do pagamento estará então disponível no HubSpot. Observe: Pagamentos HubSpot está disponível para empresas sediadas nos Estados Unidos com contas Starter, Professional e Enterprise. Processamento de pagamento stripe está disponível para todas as assinaturas e disponível internacionalmente com algumas exceções . Crie um formulário de pagamento Para criar um formulário com um ou mais links de pagamento: Na sua conta HubSpot, acesse Marketing > Formulários . No canto superior direito, clique em Criar formulário . Selecione o tipo de formulário . No canto superior direito, clique em Próximo . No painel esquerdo, selecione Modelo em branco para começar com um formulário em branco ou selecione o Pagamento modelo. No canto superior direito, clique em Começar . Se você selecionou o Pagamento modelo, você será direcionado automaticamente para as opções de link de pagamento em seu formulário. Se você estiver criando um formulário do zero, para configurar seus links de pagamento: No editor de formulários, ative o Pagamento alterne no painel esquerdo. Clique Selecione Link de Pagamento . No painel esquerdo, clique no Link de pagamento menu suspenso e selecione um link de pagamento . Introduzir um Rótulo para o seu link de pagamento. Para adicionar outro link de pagamento, clique em + Adicione uma opção . Para remover um link de pagamento, passe o mouse sobre o link e clique Remover . Para organizar suas opções de link de pagamento, clique e arraste o dragHandle ícone ao lado do link de pagamento. Para classificar seus links de pagamento em ordem alfabética, clique em Organizar . Para pré-selecionar um link de pagamento, clique no botão botao de radio ao lado do link de pagamento. Para limpar quaisquer opções pré-selecionadas no campo do link de pagamento, clique em Limpar pré-selecionado . Com o campo do link de pagamento configurado, continue configurando o formulário , incluindo a adição de quaisquer outros campos necessários. Observação: Os formulários de pagamento não suportam cálculo, arquivo e usuário HubSpot tipos de campo . O campo de pagamento não pode ser ocultado ou configurado com lógica de campo progressivo ou dependente. Para publicar o formulário, no canto superior direito, clique em Atualizar . Em seguida, no painel direito, clique em Publicar . Quando um visitante envia o formulário, ele pode selecionar qual link de pagamento usar para envio. O HubSpot capturará os dados de envio do formulário e o visitante será redirecionado para a página de checkout correspondente, onde poderá concluir a compra. Aprender mais sobre gerenciamento de pagamentos . Veja os envios de formulários de pagamento no HubSpot Você pode visualizar os envios de formulários de pagamento da mesma forma que faria ver outros tipos de envios de formulários : Na sua conta HubSpot, acesse Marketing > Formulários . Clique no nome do formulário de pagamento. Na página de detalhes do formulário, clique no botão Envios aba. No Envios guia, você pode revisar os pagamentos que foram enviados. O Status do pagamento coluna exibirá o status do pagamento, que pode incluir os seguintes valores: Pendente: o pagamento está sendo processado. Depois que o pagamento for processado, o status mudará para Sucesso ou Fracassado . Saiba mais sobre os tempos de processamento . Sucesso: o pagamento foi cobrado com sucesso do comprador. Fracassado: a forma de pagamento do comprador não foi cobrada com sucesso. Este status se aplica apenas a pagamentos feitos por meio de métodos de débito bancário, como ACH, ou pagamentos de assinatura. Abrir: o comprador começou a preencher o formulário, mas ainda não concluiu o processo de finalização do pagamento. Payments",https://knowledge.hubspot.com/pt/payments/collect-payments-with-forms
