id,titulo,conteudo,link
991,HubSpot connected inboxes | Frequently Asked Questions,"Find answers and general information quickly regarding connecting your email inbox to HubSpot. A connected inbox is required to send emails through the CRM and make use of certain Sales Hub and Service Hub features . What does connecting an inbox to HubSpot do? After you connect your inbox, any replies to emails that you sent from the CRM, or from your mail client using the HubSpot sales email extension, will then automatically log in your CRM. You can also track any email sent from your CRM in your connected inbox's Sent folder (Google Apps, Gmail, and Office 365 inboxes only ). How are emails and attachments processed for connected Office 365 and Exchange Online inboxes? HubSpot tracks and logs your emails differently based on the type of inbox you connect. How are attachments handled by HubSpot? By default, attachments will be logged to the associated record in the CRM, as long as the overall size of the email is less than 50 MB. To turn off attachment logging, follow the instructions in this article . Can I connect my inbox to HubSpot via POP3? No. HubSpot only provides the ability for users to connect their inboxes to HubSpot via IMAP . POP3 and IMAP are both methods used to access your email from a server. POP3 POP3 downloads the email to your machine. When an email is sent to your email address, it's stored on your email server. When you open your email client, the email client will actually download the email to your device. Once it's downloaded to your device, it is removed from the email server and only stored locally on your machine. For example, if you have your email set up via POP3 and open your email on your mobile device, it will download the emails there. If you check your email on a computer, there won't be any emails to show you since they were already downloaded to your mobile phone. IMAP IMAP allows you to access their emails across devices. When you access your email via IMAP, it keeps the original email on the email server and simply downloads a local copy of the email to your device. This way, you can access all of your email on any device, at any time. HubSpot needs to be able to access your email at all times. For this reason, your email needs to always be available on your email server so that HubSpot can see it. Connecting via IMAP allows for this; POP3 doesn't. If you're looking at your email client settings and notice that you're set up via POP3, you'll need to work with your IT team to change this to IMAP. Once that's done, you should see the IMAP/SMTP servers and ports in your email client settings to input into HubSpot to connect . How does HubSpot find replies to log after I connect my inbox? Once you connect your inbox, HubSpot has access to information about your emails including the email address you’re sending from, the email addresses of recipients, the subject line, and the body of the email. Every “reply” email contains a reference to the unique ID number of the original email. The HubSpot CRM will monitor incoming mail for replies that tie back to an email sent from the CRM or logged (BCC’d) to the CRM. The HubSpot CRM will only read and store the email body for email threads that have been previously logged in the CRM or sent from the CRM. What information is logged in the CRM? When you log an email to a contact record in the CRM or receive an email reply from them, the HubSpot CRM stores your contact’s email address, name, subject line, and body text so that the email can be displayed as part of their contact record in the CRM. The email is stored and displayed just as if you had BCC’d or forwarded that email to the CRM. Attachments sent outside of the CRM will be stored in the Attachments section in the contact record. What does the HubSpot CRM do with the body text of emails I send through the CRM? The HubSpot CRM only ever uses the text of your emails to display the emails on the contact record of the recipient in your CRM. HubSpot doesn’t share that information to people outside your team, sell it, or engage in any sort of anonymized collection of email bodies for analytics. How does HubSpot handle security with connected inboxes? Whenever HubSpot transmits or stores your personal data, HubSpot works hard to protect it. For example, HubSpot encrypts data while exchanging it with your computer and uses top security measures to prevent unauthorized or unintended access to our network. Read more about how HubSpot safeguards your data on HubSpot's security page . How long is email data stored in HubSpot? Emails sent using the sequences tool are stored indefinitely unless your HubSpot account is deleted. Emails sent from the contact timeline are retained unless the corresponding engagement or your HubSpot account is deleted, at which point they may be retained for up to 90 days before being purged. Emails received in a connected inbox and logged to the contact timeline will be retained unless the corresponding engagement or your HubSpot account is deleted, at which point they'll be retained for up to 90 days before being purged. All email bodies from all connected inboxes, regardless of whether they're shown on a contact timeline, are stored for 7 days before they are automatically purged. All email metadata from all connected inboxes, regardless of whether they're shown on the contact timeline, are stored for up to 60 days for all connected inboxes before being automatically purged. This metadata is stored for triage purposes when contacting support, and includes information in the email headers. Metadata does not include the email body (e.g., attachments, plain text, and/or the HTML section of the email). Why is the email sent from my inbox taking a long time to appear in the CRM? If you're using Microsoft Outlook or Exchange, performance issues can occur when syncing from folders with over 100,000 items. To resolve this, review Microsoft's documentation for recommendations . Why isn't the email I sent from the CRM showing up in the sent folder in my email inbox? After connecting your email inbox to HubSpot using IMAP , the emails you send from contact, company, or deal records in HubSpot may not appear in your sent folder. When an email is sent through the CRM, the email's data is actually transferred from HubSpot to your email provider. Your email provider then sends the email to the recipient through their SMTP servers. If the inbox that you connected using IMAP supports special-use mailboxes flags , such as mailboxes for draft messages or sent messages, HubSpot will copy the message to the folder with the sent attribute. If the mailbox does not support special-use mailboxes, HubSpot will copy the message to the first folder it can find that contains sent in the label. Why did my email inbox get disconnected? If you receive a notification that your email inbox was disconnected, an issue may have occurred with your email provider, and you'll need to reconnect your inbox . Common issues that will cause an inbox to disconnect include: Access was revoked to the HubSpot app. Your password to the email inbox account changed. This will also disconnect any calendars you've connected to HubSpot, and you'll be unable to book any meetings through your scheduling pages until you reconnect your inbox. Based on the type of inbox you connected, there might be other reasons why your inbox got disconnected: Office 365 : your mailbox has undergone a migration . IMAP : your IMAP server was unavailable for an extended period of time, or the server revoked HubSpot's connection. Learn more about troubleshooting IMAP connection errors. Exchange : your Exchange server was unavailable for an extended period of time, or the server revoked HubSpot's connection. Learn more about troubleshooting Exchange connection errors . Gmail : you revoked access to the HubSpot app in Google Security Center . Why are unrelated emails showing in the same thread? If you're seeing unrelated emails in the same thread, this could be because of how you're composing new emails. When writing a new email to a new contact, if you click forward on a sent email, remove the forwarded text at the top, then change the email recipient before sending, these emails will appear in the same thread. This is because the other emails reference the original email and therefore thread together. While the exact steps may differ between email clients, it is not recommended to click the reply or forward buttons to send a new email, but rather use the templates tool to quickly send pre-made emails to different contacts. Connected Email",https://knowledge.hubspot.com/connected-email/hubspot-crm-email-integration-faq
992,Import Salesforce records,"After connecting HubSpot and Salesforce, you can import Salesforce objects to bring all your data into HubSpot. In your HubSpot account, navigate to CRM > Contacts . In the upper right, click Import . Click Import a file . Select Objects from an app . Select Salesforce records , then click Next . Select the object type , then click Next . Standard objects: choose the object you want to import. You can import leads, contacts, accounts, opportunities, tasks, a campaign, cases, and events into HubSpot. Custom objects: select the custom object you want to import. Click Review . Please note: to import a campaign, it must be set to Active in Salesforce. Filter the import You can filter the import to only import in records from Salesforce based on specific criteria. To do so: On the Objects screen, click Add filter . In the right panel, click the Select a filter dropdown menu and select a filter. Select the property operators . Click Apply filter . Review the import On the Confirm screen, review your Salesforce import: If you select Everything , note that large imports may take several hours in order to make the best use of your Salesforce API calls. If you select Leads, Contacts , Leads & Contacts , Accounts , Opportunities , or Tasks , review the number of records that will be imported from Salesforce into HubSpot. If you select A campaign , click the Choose a campaign dropdown menu and select the Salesforce campaign to import into HubSpot, then click Review . If you select Leads, Contacts or Leads & Contacts , toggle the Selective Sync switch on to add these records to your inclusion list. Click Begin import . You'll be redirected back to the Imports screen. When your import is complete, it will appear in the import table. To view any errors that occur in the Salesforce import: In your HubSpot account, click the settings settings icon in the top navigation bar. In the left sidebar menu, navigate to Integrations > Connected Apps . Under My Apps c lick Salesforce . View the errors on the Sync Health tab. Please note: if you are importing leads and/or contacts from Salesforce, only the lead/contact's email address will be synced over from Salesforce at the time of import. In accounts with no inclusion list , or for contacts in an inclusion list, a sync is automatically triggered after the import, which will sync over the remaining Salesforce field values. For contacts not in the inclusion list, all other contact properties will remain blank. Integrations",https://knowledge.hubspot.com/salesforce/import-salesforce-records
993,Troubleshoot issues connecting your LinkedIn page to the HubSpot Social tool,"When connecting your LinkedIn account to HubSpot , your company page may not appear as an option. This can occur in the following instances: If your LinkedIn account doesn't have the necessary permissions for the page. If a connection issue occurred when authorizing LinkedIn permissions for the HubSpot Social tool. Review your LinkedIn page admin permissions If you don't see your page when connecting your LinkedIn account to HubSpot, it usually means you do not have the necessary permissions: Ensure that you have Super Admin access for the LinkedIn Company pages you're connecting to HubSpot. Only users with administrator role permissions on LinkedIn can connect, users with content admin role permissions will not be able to do so. To ensure you can connect your page to HubSpot, confirm that your LinkedIn account has the necessary LinkedIn page admin permissions: Log in to your LinkedIn account. In the left sidebar menu, under My pages , select the page to sync. In the left sidebar menu, scroll down and click Settings . In the right panel, click Manage Admins . Under the Page Admins tab, locate your LinkedIn user and confirm that you're listed as a super admin . If you're not listed as a LinkedIn page super admin, you will need to request admin access to the LinkedIn page . Once the admin permissions have been granted , navigate back to your HubSpot account and reconnect your LinkedIn account . Reset your HubSpot social tool connection If you have the necessary LinkedIn page permissions, but still don't see your page, a connection issue may have occurred when adding your LinkedIn account to HubSpot. To resolve the issue, follow the steps to reset your connection. Open a new incognito or private window in your browser. Log in to your HubSpot account . In your HubSpot account, click the settings settings icon in the top navigation bar. In the left sidebar menu, navigate to Marketing > Social . On the Accounts tab, hover over your LinkedIn account and click Disconnect . Log in to your LinkedIn account to reset the HubSpot social tool connection: Ensure that you have Super Admin access for the LinkedIn Company pages you're connecting to HubSpot. In the upper right, click your photo or avatar and select Settings & Privacy . In the left sidebar, click Data privacy . Scroll down to the Other applications section. Then, click Permitted services . In the HubSpot or HubSpot Social v2 section, click Remove . Navigate back to your HubSpot account and reconnect your LinkedIn account . Social",https://knowledge.hubspot.com/social/troubleshoot-issues-connecting-your-linkedin-page-to-the-hubspot-social-tool
994,Insert and edit icons in rich text modules,"You can add any icon in the Font Awesome library to rich text modules on blog posts and pages. Once the icon is added, you can customize its color, positioning, and size. Please note: icons cannot be added directly to marketing emails. To use an icon in an email, save the icon as an image, then insert the image into the email editor . Add an icon to your content in a rich text module Navigate to your content: Website Pages : In your HubSpot account, navigate to Content > Website Pages . Landing Pages : In your HubSpot account, navigate to Content > Landing Pages . Blog : In your HubSpot account, navigate to Content > Blog . Click the name of your content. Click the rich text module where you want the icon to appear. In the upper right of the rich text toolbar, click the Insert dropdown menu and select Icon. In the pop-up box, search for the icon in the search bar. Click the icon to insert it into your rich text module. Edit an icon Once you've inserted your icon, you can edit its appearance and position, or link to other content. Navigate to your content: Website Pages : In your HubSpot account, navigate to Content > Website Pages . Landing Pages : In your HubSpot account, navigate to Content > Landing Pages . Blog : In your HubSpot account, navigate to Content > Blog . Click the name of your content. In the content editor, click your icon to open the icon editor. To edit the icon's color, click the backgroundColor icon color dropdown menu and select a color. To enter a hex value or RGB color value, click the Advanced tab. Use the indent indent iconiconicon icons to move the icon right or left. Use the blockAlignmentBottom alignment icons to adjust the icon's position within a block of text. To add a link to your icon, click the link link icon, then insert a link . To resize your icon, click and drag the icon's corners in the editor or enter pixel values for the width and height in the toolbar. To remove an icon from a rich text module, click the image, then click the delete trash icon . To replace the icon, click the image, then click the replace replace icon and add a new icon. Edit advanced icon options You can edit advanced options for your icon to add accessibility text or customize the icon link. In the content editor, click the icon. Click the edit edit icon. In the pop-up box, click Advanced . If your icon has a link, you can select one or more link types . This tells search engines how this link relates to your website. Learn more about different link types . Select a purpose for your image. If your icon is intended to convey information, select Read by screen readers and add a title that describes its purpose. If your icon does not convey information, select Ignored by screen readers . Click Apply . Landing Pages Blog Website Pages",https://knowledge.hubspot.com/website-pages/insert-and-edit-icons-in-rich-text-modules
995,Organize your files with folders,"After uploading files to the files tool in HubSpot, you can organize your files with folders. If you want to restrict access to a specific file or folder, learn how to partition your files and folders . To manage your individual files, learn how to manage your individual file details . Organize files in folders To organize your files with folders: In your HubSpot account, navigate to Library > Files . From the files dashboard, in the top right, click Create folder . In the dialog box, enter a name for your folder, then click Save . After creating your folder, you can browse through your files or use the search bar at the top to search by file name. To see archived files, click the Filter by dropdown menu and select Archived files . To move a file to a folder, hover over a file and click Actions . Then, select Move . Select the folder you want to move the file to and click Move . You can also move files in bulk by selecting the checkboxes next to the file names, and clicking Move at the top of the table. After adding your files to a folder, you can restrict access to individual files or the overall folder . Filter and search your files To find specific files you've uploaded, you can search by name and filter by file type: In the top search bar, enter the name of the file you want to locate. You can refine your search results by filtering by file type: To filter your files by category, click the All types dropdown menu, then select a category . Categories include Images , Documents , as well as the following three video file filters: All videos: all uploaded videos will appear. Videos with advanced features: only videos with the Advanced features toggle switched on will appear. These videos can be used in lists, workflows, forms, and in the CTAs tool. You can also toggle on subtitles and review the view count of the video. Learn more about videos with advanced features in this article . Videos without advanced features: only videos with the Advanced features toggled switched off will appear. To filter by a file's extension: Enter the file extension (e.g., jpg, pdf, mp3) in the top search bar. You can also include the file's name in your search, separated by a space. For example, entering dog png in the search bar would result in all png files that have titles that include the text dog . Files",https://knowledge.hubspot.com/files/organize-your-files-with-folders
996,Erros de resolvedor,"Quando um valor de propriedade é mesclado ou excluído, ou quando o valor interno é editado, qualquer fluxo de trabalho que use esse valor para fazer uma inscrição mostrará um erro: Isso ocorre porque o fluxo de trabalho está tentando usar um valor de propriedade que não existe mais. Para corrigir esse erro, você pode atualizar os critérios de inscrição: No editor de fluxo de trabalho, clique na caixa Disparador de inscrição No painel direito, localize o gatilho com o erro e clique no gatilho para editá-lo. Para remover o valor de propriedade que está causando o erro, clique no x ao lado do filtro. Clique em Atualizar filtro . Clique em Salvar . O fluxo de trabalho não mostrará mais erros para o disparador de inscrição. Workflows",https://knowledge.hubspot.com/pt/workflows/resolve-invalid-filter-errors
