id,titulo,conteudo,link
1709,Crie e publique postagens sociais no aplicativo móvel da HubSpot,"Enquanto estiver em trânsito, você pode criar uma postagem social e publicá-la no aplicativo móvel da HubSpot. Se você estiver usando um computador ou laptop, saiba como criar e publicar postagens sociais no desktop . No aplicativo móvel HubSpot, você também pode gerenciar e revisar suas postagens sociais . Criar e publicar publicações sociais Ao publicar uma postagem social do HubSpot, t A rede social exibirá o nome do usuário que conectou a conta social ao HubSpot como o criador da postagem . Isso ocorre porque a HubSpot publica a postagem na rede social usando suas credenciais . Para criar uma nova postagem social no aplicativo móvel HubSpot: Abra o aplicativo HubSpot no dispositivo. Na parte inferior direita, toque em + Criar . Em seguida, toque em Postagem social . Selecione os caixas de seleção ao lado dos nomes da conta da rede social na qual você deseja publicar. Em seguida, toque em Concluído . Você pode publicar postagens sociais no Facebook, Instagram, X, LinkedIn ou YouTube. Cada rede social tem seu próprio limite de caracteres: Facebook: 2.500 caracteres Instagram: 2.200 caracteres LinkedIn: 3.000 caracteres X: 280 caracteres YouTube: 5000 caracteres Configure o rascunho do conteúdo da sua postagem nas diferentes redes sociais: Na caixa de texto, insira o contente para sua postagem social. É recomendado adicionar @menções como última etapa ao configurar suas postagens sociais nas guias específicas da rede social. Para adicionar um link à sua postagem, insira o contente link diretamente na caixa de texto. Uma visualização do link do conteúdo deve exibir: Para exibir apenas a imagem de visualização, toque no visualização do link .  Em seguida, toque em Usar apenas imagem de visualização . Para ocultar a visualização, toque no visualização do link .  Em seguida, toque em Remover visualização do link . Para adicionar uma imagem ou vídeo à sua postagem: No canto inferior esquerdo, toque no ícone da câmera . Em seguida, selecione Escolher Foto , Escolha o vídeo , ou Tire uma foto ou grave um vídeo . Depois de selecionar uma foto ou vídeo, no canto superior direito, toque em Adicionar . Depois de tirar uma nova foto ou vídeo, no canto inferior direito, clique Usar foto ou Usar vídeo . Para adicionar outra foto ou vídeo, toque no ícone da câmera . Para excluir uma foto ou um vídeo, toque na foto ou no vídeo . Em seguida, toque em Remover . Para adicionar uma imagem ou vídeo do seu gerenciador de arquivos à sua postagem: No canto inferior esquerdo, toque no attach anexar ícone . Em seguida, selecione Escolha a imagem dos arquivos HubSpot ou Escolha o vídeo dos arquivos HubSpot . Selecione os caixa de seleção ao lado das fotos ou vídeos que você deseja adicionar. Para adicionar outra foto ou vídeo, toque no attach anexar ícone . Para excluir uma foto ou um vídeo, toque na foto ou no vídeo . Em seguida, toque em Remover . Se você estiver usando um dispositivo Android, você pode cortar suas imagens ao configurar seu rascunho social: Toque na imagem e clique Cortar a imagem . No editor, toque e arraste o quadro contornado para cortar no tamanho desejado. No canto superior direito, toque em Cortar . Por padrão, a postagem será configurada para publicação imediata. Para agendar sua postagem: No canto inferior esquerdo, toque em Horário de publicação . Na parte superior, toque em Data personalizada . Selecione um específico data e tempo .  Por padrão, isso será definido de acordo com o fuso horário da sua conta. Para associar a postagem a uma campanha: No canto inferior direito, toque em Selecione a campanha . Toque em nome da campanha. No canto superior direito, clique em Avançar . Depois de montar o seu rascunho, é recomendável revisar a postagem em cada rede social, pois cada rede social pode ter requisitos de caráter e imagem diferentes. Para revisar a postagem e personalizar ainda mais o conteúdo de cada rede social, toque no botão nome da rede social na parte superior da tela. Para personalizar o conteúdo da postagem para cada rede social, na caixa de texto: Para adicionar hashtags, use o #símbolo .  Depois de adicionar sua hashtag, toque no hashtag para visualizá-lo na rede social. Para @mencionar outras contas, toque no @ símbolo para mencionar ou marcar outras contas. Depois de adicionar sua menção, você pode tocar no @menção para visualizar a conta na rede social. Para as redes sociais específicas, observe também o seguinte: Facebook: A API do Facebook só permite menções ou tags para páginas do Facebook. Você não pode mencionar ou marcar usuários individuais do Facebook ou eventos do Facebook ao criar uma postagem social no HubSpot. Instagram: as menções não serão preenchidas automaticamente, mas o Instagram reconhecerá a menção quando a publicação estiver ativa. LinkedIn: você pode mencionar as páginas corporativas do LinkedIn e os perfis pessoais que seguem sua página do LinkedIn. Se um usuário do LinkedIn desativou o perfil público visibilidade , o perfil deles não aparecerá e não poderá ser mencionado. X: apenas X contas que você segue aparecerão no menu suspenso de preenchimento automático. Para mencionar contas que você não segue, insira o identificador X completo. A menção será reconhecida quando a postagem estiver no ar. Para salvar a postagem como rascunho, na parte inferior, toque em Salvar como rascunho . Para agendar ou publicar a postagem: Na parte inferior, toque em Próximo . Depois de revisar suas postagens sociais, clique em Publicar agora , Agendar postagem , ou Salvar como rascunho . Personalize detalhes adicionais de postagem no Instagram Se estiver postando especificamente no Instagram, você pode personalizar detalhes adicionais, como tipo de postagem, primeiro comentário e localização: Por padrão, uma postagem normal do Instagram será selecionada. Você também pode criar rolos de Instagram ou histórias: Para criar um rolo de Instagram, toque no menu suspenso Tipo de post e selecione Rolo . Para configurar se o rolo será exibido ou não no feed principal da sua conta, toque para definir o Compartilhe também no feed alternar. Para criar uma história no Instagram, toque no menu suspenso Tipo de post e selecione História . Para adicionar um local à sua postagem ou rolo do Instagram: Na parte inferior da caixa de texto, toque no ícone de localização . No Pesquisar locais caixa de texto, insira o nome do local que você deseja adicionar. Então, rolagem para pesquisar os vários locais disponíveis. Toque em Localização pretendida . Ao personalizar sua postagem no Instagram, se a imagem não atender aos requisitos de taxa de proporção do Instagram, um alerta será exibido: Imagem tem taxa de proporção incorreta. Para resolver isso: No alerta, toque em Corrigir problema. No editor, a proporção será automaticamente definida para a proporção padrão do instagram. Cortar a imagem adequadamente. Depois de recortar a imagem, no canto superior direito, toque em Concluído . Para interagir com seus seguidores e adicionar o primeiro comentário ao seu rolo, insira seu Primeiro comentário do Instagram .  Você também pode usar hashtags (#) em seu primeiro comentário. Para salvar a postagem como rascunho, toque em Salvar como rascunho . Para agendar ou publicar a postagem: Na parte inferior, toque em Próximo . Depois de revisar suas postagens sociais, clique em Publicar agora , Agendar postagem , ou Salvar como rascunho . Publicar postagens de documento do LinkedIn Se estiver postando especificamente no LinkedIn, você também poderá criar e publicar uma postagem de documento do LinkedIn e adicionar um documento PDF rolável à sua postagem. Para criar uma postagem de documento do LinkedIn, toque na lista suspensa Tipo de postagem e selecione Documento . Na seção Adicionar documento , você pode adicionar documentos PDF do seu dispositivo móvel ou da ferramenta de arquivos HubSpot: Para adicionar documentos do dispositivo móvel, toque em Do dispositivo . Em seguida, selecione seu arquivo . Para adicionar documentos do seu dispositivo móvel, toque em Arquivos HubSpot . Em seguida, selecione seu arquivo . Ao adicionar um documento PDF a partir da ferramenta de arquivos, apenas os arquivos com visibilidade pública podem ser usados. Publicar vídeos do YouTube Para publicar um vídeo do YouTube a partir do aplicativo móvel HubSpot: Abra o aplicativo HubSpot no dispositivo. Na parte inferior direita, toque em + Criar . Em seguida, toque em Postagem social . Marque as caixas de seleção da próxima conta do YouTube na qual você gostaria de postar. Em seguida, toque em Concluído . Configure o seguinte: Título do vídeo: o título do seu vídeo do YouTube. Este campo é obrigatório. Você pode usar no máximo 100 caracteres. O título não pode incluir caracteres inválidos, como '<'. O que você gostaria de dizer à sua rede: carregue um vídeo e adicione uma descrição para a sua postagem. Isso é necessário. Ao inserir uma descrição, você pode incluir palavras-chave para ajudar os usuários a encontrar seu vídeo ao pesquisar no YouTube. Há um limite de 5.000 caracteres. Para carregar um vídeo para a sua conta do YouTube, toque no ícone da câmera . Em seguida, toque em Escolher vídeo ou Tirar vídeo . Ao selecionar um vídeo existente na ferramenta de arquivos, o vídeo deve ter a visibilidade definida como Pública ou Pública - noindex . Se a visibilidade do vídeo tiver sido definida como Privada , você não poderá selecionar o vídeo. O vídeo deve atender às especificações de formatação de vídeo e áudio do YouTube . Para publicar um curta no YouTube, o vídeo deve ter menos de 60 segundos. Os vídeos regulares devem ter menos de 15 minutos. Depois de carregar o vídeo, para gerenciar a imagem em miniatura, toque no vídeo carregado. Para visualizar a imagem em miniatura, toque em Visualizar . Para alterar a imagem em miniatura, selecione Definir miniatura do quadro de vídeo ou Definir miniatura dos arquivos HubSpot . Para remover o vídeo, toque no vídeo carregado . Em seguida, selecione Remover . Tempo de Publicação: opte por publicar seu vídeo imediatamente ou por agendar a publicação do vídeo em uma data e hora específicas. Campanha: opte por associar seu vídeo a uma campanha nova ou existente. Público: selecione Sim, é feito para crianças ou Não, não é feito para crianças para determinar se o seu vídeo é adequado para crianças. Lista de reprodução: selecione uma lista de reprodução do YouTube existente à qual adicionar este vídeo. Saiba mais sobre como criar e gerenciar listas de reprodução do YouTube . Idioma: selecione o idioma principal do vídeo do YouTube. Categoria: selecione uma categoria para ajudar os usuários a encontrar seu vídeo mais facilmente. Por exemplo, categorize um vídeo instrucional como Educacional . Visibilidade: defina uma opção de visibilidade para o vídeo do YouTube. Você pode definir um vídeo como Privado, Não listado ou Público. Saiba mais sobre as opções de visibilidade do YouTube . Adicionar tag...: adicione tags ao seu vídeo do YouTube para permitir que os usuários encontrem o seu vídeo mais facilmente. Cada tag deve ser separada por uma vírgula. Saiba mais sobre as marcas do YouTube Licença: selecione o tipo de licença para o vídeo. Por padrão, a Licença padrão do YouTube será selecionada. Permitir incorporação: permitir que outros usuários incorporem seus vídeos do YouTube em seus sites. Publicar nas assinaturas feed e notificar os assinantes: notifique os seus assinantes do YouTube quando tiver publicado este vídeo. Depois de configurar seu vídeo do YouTube, na parte inferior, toque em Próximo ou Salvar como rascunho . Depois de rever os detalhes do seu vídeo do YouTube, toque em Publicar agora , Agendar postagem ou em Salvar como rascunho . Social",https://knowledge.hubspot.com/pt/social/publish-and-review-social-posts-in-the-hubspot-mobile-app
1710,Adicionar um arquivo Javascript ao HubSpot,"Pode alojar e editar ficheiros JavaScript no gestor de design. Saiba como criar um ficheiro JavaScript e ligá-lo a um modelo ou domínio. Criar um ficheiro JavaScript Na sua conta da HubSpot, acesse Conteúdo > Design Manager . No menu da barra lateral esquerda, clique em Ficheiro > Novo ficheiro . Poderá ser necessário clicar no ícone da pasta folder para expandir o menu. Na caixa de diálogo, clique no menu suspenso O que gostaria de construir hoje? e seleccione JavaScript . Clique em Próximo . No campo File name , introduza um nome para o seu ficheiro JavaScript. Para atualizar a localização do ficheiro, na secção Localização do ficheiro , clique em Alterar e seleccione a pasta para adicionar o ficheiro. Clique em Criar . Escreva ou cole o seu JavaScript no editor de código. Se tiver ativado o ESLint , pode ver quaisquer avisos ou erros de JavaScript clicando para ativar o botão Mostrar saída . No canto superior direito, clique em Publicar alterações para aplicar as alterações. Anexar um ficheiro JavaScript a um modelo No localizador à esquerda, clique no modelo que pretende atualizar. No inspetor à direita, clique no separador Editar . Na seção de arquivos do JavaScript vinculados , clique no menu suspenso Adicionar e selecione seu arquivo JavaScript . No canto superior direito, clique em Publicar alterações para aplicar as alterações. Incluir um ficheiro JavaScript nas páginas do HubSpot Você pode incluir seu arquivo JavaScript em todas as páginas de um domínio hospedado pela HubSpot ou em páginas individuais usando a URL pública. Para aceder ao URL público do ficheiro: No menu da barra lateral esquerda, seleccione o ficheiro JavaScript . Clique em Acções > Copiar URL público . Para adicionar o ficheiro a todas as suas páginas do HubSpot num domínio: Na sua conta HubSpot, clique no ícone de configurações settings icon na barra de navegação superior. No menu da barra lateral esquerda, navegue para Conteúdo > Páginas . Clique no menu pendente Escolher um domínio para editar as suas definições e seleccionar o domínio para adicionar o ficheiro JavaScript. Pode seleccionar Definições por defeito para todos os domínios se quiser que o ficheiro JavaScript se aplique a todos os domínios ligados Na secção HTML do rodapé do site , cole o URL público como o valor da fonte da etiqueta de script: <!-- start Main.js Do Not Remove --> <script src=' insert your file's public URL here '></script> <!---End Main.js--> Clique em Salvar . Ou, para adicionar o arquivo a uma página individual: Acesse seu conteúdo: Páginas do site : Na sua conta da HubSpot, acesse Conteúdo > Páginas do site . Landing Pages : Na sua conta da HubSpot, acesse Conteúdo > Landing pages . Passe o rato sobre a página que pretende editar e clique em Editar . No editor de páginas, clique no menu Settings e seleccione Advanced . . Na secção Footer HTML da caixa de diálogo, cole o URL público como o valor da fonte da etiqueta de script: <!-- start Main.js Do Not Remove --> <script src=' insert your file's public URL here '></script> <!---End Main.js--> No canto superior direito, clique em Publicar ou Atualizar . Design Manager",https://knowledge.hubspot.com/pt/design-manager/add-a-javascript-file-to-hubspot
1711,Criar e usar trechos,"Os snippets são blocos de texto curtos e reutilizáveis que podem ser usados em registros de contatos, empresas, tickets, negócios e objetos personalizados. Você pode inserir snippets em modelos de e-mail, conversas de chat e ao registrar uma atividade ou observação. Se você quiser crie e-mails reutilizáveis , saiba mais sobre ferramenta de modelos . Observação: para criar e editar snippets , você deve atender a um dos seguintes critérios: Se você for um usuário em uma conta de Vendas ou de Service hub Sales hub Service hub Profissional ou Empresa, você deverá ter uma conta atribuída Se você for um um usuário de uma conta do Sales ou Service Hub Starter , deve ter uma licença principal atribuída . A partir de 18 de setembro de 2024, o número de fragmentos disponíveis dependerá da data de criação da conta. Os usuários que não atenderem aos requisitos poderão criar e editar os primeiros três ou cinco fragmentos na conta. As contas criadas antes de 18 de setembro de 2024 podem editar, acessar e usar os primeiros cinco fragmentos na conta. Para contas criadas após 18 de setembro, o limite é de três fragmentos . Se não houver snippets na conta, os usuários poderão criar snippets, até o total de três ou cinco snippet , com base em quando a conta foi criada. Você pode ver o número total de snippets que já foram criados em sua conta no canto superior direito do painel snippets. Saiba mais sobre esses limites no Catálogo de produtos e serviços da HubSpot . Crie snippets. Os usuários com uma licença obrigatória e acesso de Vendas podem criar snippets. Ao criar e formatar seu snippet, observe o seguinte: O Teclado móvel HubSpot só permite que você acesse até 100 trechos. Os usuários só podem ver os snippets que possuem ao usar o teclado móvel HubSpot. Criar um snippet com chaves em vez de tokens de personalização causa problemas no serviço de renderização de modelo do HubSpot. Remova todas as chaves para salvar o snippet. Há um limite de 2.500 caracteres por snippet. Se seu snippet incluir um idioma com caracteres de byte duplo, como o japonês, você poderá atingir o limite com menos de 2.500 caracteres. Para criar um snippet: Na sua conta HubSpot, acesse Biblioteca > Snippets . No canto superior direito, clique em Criar snippet . No campo Nome interno , insira um nome para o snippet. No editor de rich text na seção de texto do Snippet , insira corpo do seu snippet. Para modificar o texto, use as opções de formatação na parte inferior da janela de edição. Para editar o estilo de fonte e o tamanho, ou editar o alinhamento de texto, clique no menu suspenso Mais . Para adicionar texto com hiperlink, clique no ícone de link link . Para incluir tokens de personalização em seu snippet, clique no menu suspenso Personalizar . Aprender mais sobre adicionando tokens de personalização ao seu snippet . Insira um nome para o atalho do snippet no campo Atalho . Este atalho será usado para inserir o snippet em um registro, modelo de e-mail, conversa de chat ao vivo ou ao registrar uma atividade. Quando terminar de criar seu snippet, clique em Salvar snippet . Gerenciar snippets Você pode editar, clonar, mover e excluir snippets no painel Snippets . Os usuários com uma licença obrigatória e acesso de Vendas podem editar ou excluir snippets. Na sua conta HubSpot, acesse Biblioteca > Snippets . Use a barra de pesquisa no canto superior esquerdo para procurar um snippet pelo nome. Para editar um snippet, clique no nome do snippet. Na caixa de diálogo, edite os campos que você deseja alterar. Em seguida, clique em Salvar snippet . Passe o cursor do mouse sobre o snippet e clique no menu suspenso Ações : Para clonar o snippet, clique em Clonar . No campo Nomeie a cópia deste snippet , insira um nome para o snippet, clique no menu suspenso Salvar Snippet em uma Pasta e selecione uma pasta . No campo Atalho , insira um nome para o atalho do snippet. Quando você tiver terminado de criar o clone do snippet, clique em Salvar . Para mover um snippet para uma pasta, clique em Mover . Na caixa de diálogo, selecione uma pasta para o snippet e clique em Mover . Para apagar o snippet, clique em Excluir . Na caixa de diálogo, clique em Sim, excluir snippet . Para criar novas pastas para os seus snippets: No canto superior direito do painel de Snippets , clique em Nova pasta . Na caixa de diálogo, insira um nome para sua pasta e depois clique em Adicionar pasta . Para renomear uma pasta, clique na caixa de seleção ao lado da pasta. A partir da barra de menu, clicar em Renomear . No campo Renomear pasta , insira um nome para a pasta. Clique em Salvar pasta . Usar snippets Use snippets para deixar observações sobre os prospects no CRM, obter rapidamente detalhes importantes ao escrever um e-mail a um prospect ou como respostas rápidas durante uma conversa por chat ao vivo. Você também pode inserir um snippet ao registrar uma atividade ou deixar um comentário em um registro com o app para dispositivos móveis HubSpot para Android. Há duas maneiras de adicionar um snippet: Observe: se você usou fichas de personalização no seu snippet, esses tokens só serão preenchidos quando você usar o snippet no E-mail guia de um registro de contato, empresa, negócio ou ticket. Digite o símbolo # no editor de texto. Comece a digitar o atalho do snippet e selecione o snippet no menu suspenso. O snippet será preenchido automaticamente no editor de texto. Na parte inferior do editor de texto, clique no textSnippet ícone de snippets e selecione um snippet no menu suspenso . Você também pode inserir snippets em e-mails da sua caixa de entrada usando o Extensão HubSpot Sales para Chrome ou o Suplemento para desktop do HubSpot Sales Outlook . Snippets",https://knowledge.hubspot.com/pt/conversations/use-snippets
1712,Manage marketing tasks in the HubSpot mobile app,"If you're on your mobile device, you can create, manage, and edit your marketing tasks using the HubSpot mobile app . You can easily prioritize your tasks to help you stay productive as you review and resolve tasks in your queue. Please note: creating and editing tasks in the mobile app is currently supported for iOS users only. Manage your marketing tasks in the mobile app To manage and edit marketing tasks in the HubSpot mobile app: Open the HubSpot app on your mobile device. In the top left of the app, tap the Menu icon . In the left panel, confirm that your Selected Experience is set to Marketing , then tap Home . You can tap View all to review all your marketing tasks, which you can sort by their status by tapping the tab at the top of the app. Tap a task to view additional details about it. You can tap the vertical menu icon to edit or delete the task. While editing a task, you can edit its name, status, due date, or assets with the task . To create a new task on the Marketing Home screen, tap + Create in the bottom right of the app, then tap Task . You can also create tasks directly when reviewing your marketing tasks in the Tasks widget by tapping View all on the Marketing Home screen, then tapping + Task . Campaigns",https://knowledge.hubspot.com/campaigns/manage-marketing-tasks-in-the-hubspot-mobile-app
1713,Use form shortening,"With form shortening, when a visitor begins filling out a form , HubSpot will check the enrichment dataset for existing data. Then, only fields that can’t be enriched are displayed to the visitor, so the visitor only completes the shortened form. This minimizes the effort needed to fill out forms, increases form completion rates, and ensures high-quality data collection without redundant fields. Learn how form shortening uses Breeze Intelligence credits . Please note: this feature utilizes the Enrichment product, which may require you to take extra compliance steps. Learn more about contact and company enrichment and consult with your own counsel for additional guidance. Configure form shortening settings Once you enable form shortening for your account, you'll be able to apply it to any of your forms. Please note: To use form shortening, you need to have purchased Breeze intelligence credits. Form shortening can only be used with forms built using the updated form editor . It's not possible to use form shortening with legacy forms . Conditional Logic or Redirects aren't supported with enriched properties. In your HubSpot account, click the settings settings icon in the top navigation bar. In the left sidebar menu, click Data Enrichment . Click the Tools tab. Toggle the Forms switch on/off. Create and edit forms using form shortening After turning on form shortening for your account, you can begin turning it on for each form. In your HubSpot account, navigate to Marketing > Forms . In the top right, click Create form and continue creating your form , or hover over an existing form and click Edit . In the left panel, click the settings icon. Toggle the Forms shortening switch on. When a visitor starts filling out a form, only the Email field will be displayed initially. Once the visitor enters their email, HubSpot will check the enrichment dataset for existing data. If the visitor’s details are not found, they will be prompted to complete the form. However, if the information is found, only fields that either have no value, or have been populated by a non-enrichment source (e.g., manual updates, workflows, integrations), will be shown, while fields enriched previously will remain hidden Analyze individual form submissions In your HubSpot account, navigate to Marketing > Forms . To view the details of a specific form submission, hover over the submission and click View submission . In the right panel, you'll see the name or email address of the contact, the date they submitted the form, and any additional fields included in their submission. Properties that were populated by enrichment are marked with an AI icon. Learn more about analyzing form submissions . Forms",https://knowledge.hubspot.com/forms/use-form-shortening
