id,titulo,conteudo,link
860,Configurar o opt-in duplo para e-mails,"O double opt-in oferece uma etapa de confirmação extra para verificar cada endereço de e-mail adicionado ao seu banco de dados de contato . Quando esta configuração estiver ativada, os contatos criados por meio de um Formulário HubSpot , formulário não HubSpot , formulário de envio de anúncio de lead , ou por meio da API de formulários receberá automaticamente um e-mail de acompanhamento com um link para confirmar sua assinatura de e-mail. Observação: Este recurso é atualmente exclusivo para mensagens de confirmação por e-mail e não inclui suporte para confirmação dupla para O que você acha do WhatsApp? ou SMS assinaturas. Qualquer contato que você criar manualmente será não receber automaticamente um e-mail de dupla aceitação. Você precisará enviar um e-mail de inscrição para o contato manualmente através do registro de contato . Como funciona o double opt-in no HubSpot Se o recurso de dupla aceitação for desabilitado em algum momento: Todos os contatos criados durante o período em que ele esteve habilitado ficarão qualificados para receber e-mail. Se você tem acesso à ferramenta de fluxos de trabalho , e você tem um fluxo de trabalho configurado para envie um e-mail para um contato registrado , eles receberão o e-mail conforme programado, sem exigir confirmação de inscrição. Todos os e-mails anteriores que não foram enviados devido à falta de confirmação serão enviados imediatamente. Se o seu formulário já incluir um e-mail de acompanhamento, os contatos receberão o e-mail de acompanhamento assim que clicarem no link do e-mail de dupla aceitação para confirmar que desejam participar. As configurações de double opt-in são específicas para o endereço de e-mail enviado no formulário ou para o endereço de e-mail com o qual o registro foi criado. Se o endereço de e-mail principal em alterações no registro de um contato, as configurações de assinatura não serão transferidas. Se você precisar revisar o endereço de e-mail de um contato, certifique-se de atualizar seus tipos de assinatura no registro de contato. Se você tem ativou as configurações de privacidade de dados na sua conta, clicar no e-mail de confirmação de dupla aceitação não definirá automaticamente um contato como aceito em sua conta. tipo de assinatura . Um contato só pode optar por um tipo de assinatura por meio de um dos seus formulários, marcando a caixa de seleção em seu aviso e consentimento campo. Se você tiver um fluxo de trabalho configurado para envie um e-mail para um contato registrado, e o contato ainda não confirmou seu status de dupla aceitação, o fluxo de trabalho enviará a ele até três e-mails de marketing automatizados até que ele confirme seu status de aceitação. Se o contato ainda não tiver confirmado seu status de dupla aceitação após três tentativas, o fluxo de trabalho interromperá as novas tentativas e passará para a próxima ação. Como o opt-in duplo afeta seus contatos Quando o opt-in duplo estiver habilitado, os contatos que não confirmaram o opt-in serão excluídos de todos os e-mails de marketing: Isso inclui novos contatos que preencheram um formulário aplicável e não clicaram no link de confirmação no e-mail de dupla aceitação, bem como contatos existentes que nunca receberam um e-mail de marketing da HubSpot. Os critérios para os quais os formulários são habilitados para dupla aceitação dependem da assinatura da sua conta: Todas as assinaturas de conta permitem que você configure a confirmação dupla em todos os formulários da sua conta. Se você tem um Centro de Marketing Profissional ou Empresa conta, você tem a opção de habilitar o double opt-in para formulários ou páginas específicas. Se sua conta tiver configurações de privacidade de dados ativadas e o e-mail inclui um link de confirmação de assinatura , os contatos que não confirmaram a adesão serão não serão automaticamente removidos dos e-mails de marketing. Os contatos que receberam e-mails de marketing da sua conta HubSpot antes da ativação do double opt-in serão considerados confirmados e permanecerão qualificados para receber e-mails seus. Contatos criados a partir de um e-mail enviado com a extensão do HubSpot Sales para Chrome ou o complemento do HubSpot Sales para Outlook precisarão confirmar sua assinatura antes de serem incluídos em e-mails de marketing. Esses contatos permanecerão qualificados para receber e-mails de vendas enviados do registro de contato. Depois de ativar o recurso de opt-in duplo, você pode enviar manualmente um e-mail de adesão para um contato não confirmado de seu registro de contato. Acima do nome do contato em seu registro de contato, clique em Ações menu suspenso e selecione Enviar e-mail de inscrição . Se o contato já tiver confirmado a inscrição, este e-mail de inscrição não será enviado. Observe: O envio manual de um e-mail de inscrição não funcionará para contatos cancelados, pois viola Leis CAN-SPAM . Depois de habilitar o recurso de dupla aceitação, você pode atualizar o status de dupla aceitação para seus contatos em massa a partir do seu contatos casa . Isto irá não acionará o envio de e-mail de opt-in, mas marcará os contatos como tendo opt-in duplo confirmado. Esta opção foi projetada para casos de uso específicos, como quando você migra para o HubSpot de outra plataforma de marketing por e-mail e deseja manter o status de adesão dupla dos contatos existentes. Na sua conta HubSpot, acesse CRM > Contatos . Clique nas caixas de seleção ao lado dos contatos que você deseja atualizar. Na parte superior da tabela, clique no menu suspenso Mais e selecione Atualizar status de adesão (opt-in) dupla . Na caixa de diálogo, marque o botão de seleção Confirmar adesão (opt-in) dupla para os contatos selecionados e clique em Salvar . Configurar opt-in duplo para Centro de Marketing Profissional e Contas empresariais Na sua conta HubSpot, clique no ícone de configurações settings icon na barra de navegação superior. No menu da barra lateral esquerda, acesse Marketing > E-mail . Clique na guia Assinaturas . Role para baixo até o Opt-in duplo seção e clique para alternar o Ativar double opt-in ligar. Clique no Selecione onde o DOI deve estar ligado menu suspenso e selecione uma opção: Todos os formulários e páginas: use double opt-in em todos os seus formulários, páginas e formulários não HubSpot. Novos contatos criados por meio de uma importação ou usando a API de importação precisarão ter seus tipos de assinatura confirmados. Ative somente para alguns formulários e páginas: limitar o double opt-in a páginas ou formulários específicos. Em seguida, clique no Páginas e Formulários menus suspensos e selecione o caixas de seleção ao lado das páginas ou formulários associados. Desative somente para alguns formulários e páginas: O double opt-in será habilitado para todas as páginas e formulários exceto aqueles que você configura. Clique no Páginas ou Formulários menus suspensos e selecione o caixas de seleção ao lado das páginas ou formulários que você faz não deseja que o double opt-in seja habilitado. Observe: configurando double opt-in para formulários específicos com o Complemento de unidades de negócios é não atualmente suportado. Para selecionar a página que um contato visitará clicando no link de confirmação no e-mail enviado após o envio do formulário: Clique no Página de confirmação menu suspenso e, em seguida, selecione um página de destino ou página do site que você criou no HubSpot. Se você não tiver uma página de confirmação pronta, você pode clicar Criar nova página para criar uma nova landing page. Se você deseja que seus contatos recebam um e-mail de acompanhamento adicional após confirmarem a assinatura do e-mail, selecione Incluir e-mail de acompanhamento caixa de seleção. Para personalizar e publicar seu e-mail, clique em Publicar e-mail de acompanhamento . Se você já criou um e-mail de acompanhamento, pode clicar em Editar e-mail de acompanhamento para revisar seu e-mail de acompanhamento e fazer alterações adicionais. No canto inferior esquerdo, clique em Salvar . Configurar opt-in duplo para Iniciador do Marketing Hub e HubSpot CRM contas Na sua conta HubSpot, clique no ícone de configurações settings icon na barra de navegação superior. No menu da barra lateral esquerda, acesse Marketing > E-mail . Clique no Opt-in duplo aba. Clique para ativar o botão Enviar e-mail de opt-in duplo para ativar esse recurso. Em suas configurações, você pode personalizar os seguintes detalhes: Remetente: use o menu suspenso para especificar para quem o e-mail é enviado. Idioma do e-mail de adesão (opt-in) dupla: use o menu suspenso para selecionar o idioma do seu e-mail. Linha de assunto: personalize a linha de assunto do e-mail de confirmação de adesão (opt-in) dupla. Você verá uma visualização de como o e-mail será renderizado na parte inferior do painel. Marketing Email",https://knowledge.hubspot.com/pt/marketing-email/set-up-double-opt-in-for-emails
861,Clone and move workflow actions,"After adding actions, you can copy or move them to create workflows more efficiently. This can be especially useful when building out repetitive actions that need only minor adjustments. When building these kinds of workflows, you can also consider using go-to-actions . For example, you're building a workflow to create deals based on a contact's location. Instead of creating four Create deal actions, you could create one action, clone it three times, and make adjustments. To clone or move workflow actions: In your HubSpot account, navigate to Automations > Workflows . Click the name of a workflow, or create a new workflow . Add a new action to the workflow , or locate an existing action you want to clone or move. To clone a workflow action: In the action box, click the duplicate Clone icon. Then, select from the following options: Clone this action only : clone only the selected action. Clone this action and all following actions: clone the selected action and all following actions. Choose where the cloned actions will be placed by clicking Place here in the desired location. In the dialog box, click Save Please note: cloned if/then branches can be placed only at the end points of a workflow. To move a workflow action: In the action box, click the move Move icon. Then, select from the following options: Move this action only: move only the selected action Move this action and all following actions: move the selected action and all following actions. Choose where the selected action will be placed by clicking Place here in the desired location. After moving your action, click Save . Workflows",https://knowledge.hubspot.com/workflows/clone-and-move-workflow-actions
862,Gerenciar notificações no Google Chat,"Depois de conectar o aplicativo Google Chat à sua conta HubSpot , você pode receber notificações do usuário do HubSpot, notificações de conversas e notificações de chamadas e anotações como mensagens do Google Chat. Você deve adicionar o aplicativo HubSpot ao espaço de Chat do Google para receber notificações. Adicione o aplicativo HubSpot a um espaço de Chat do Google Você deve adicionar o aplicativo HubSpot a qualquer espaço de Chat do Google para receber notificações nesse espaço. Para adicionar o aplicativo: Observe: certifique-se de que seu usuário esteja mapeado entre o HubSpot e o Google Chat antes de adicionar o aplicativo. Em sua conta do Google Chat, abra o espaço ao qual deseja adicionar o aplicativo HubSpot. Adicione o aplicativo digitando @hubspot na caixa de chat, clicando no aplicativo HubSpot for Google Chat e pressionando enter no teclado. Clique em Adicionar ao espaço para confirmar. Um novo chat do bot HubSpot será recebido, confirmando a instalação. Você deve repetir esse processo para cada espaço que deseja usar com a integração do Google Chat. Receba notificações do HubSpot no Google Chat Notificações de usuário do HubSpot As notificações do usuário no HubSpot incluem menções em registros, envios de formulários, atribuições de tarefas e lembretes. Para receber notificações do usuário do HubSpot no Google Chat: Na sua conta HubSpot, clique no ícone de configurações settings icon na barra de navegação superior. No menu da barra lateral esquerda, acesse Notificações . Clique na guia Outros aplicativos . Clique para ativar a opção Google Chat para obter notificações, tarefas e comandos de barra do HubSpot no Google Chat. Na seção Sobre o que ser notificado , expanda o tópico para o qual deseja receber notificações e marque a caixa de seleção para o tipo de notificação específico. As notificações serão enviadas para o aplicativo HubSpot no Google Chat por padrão. Você receberá automaticamente suas notificações do HubSpot dentro do Google Chat se o seu email de usuário do HubSpot corresponder ao do seu usuário do Google Chat. Saiba o que fazer se o seu email de usuário do HubSpot não corresponder ao seu email do Google Chatuser . Para impedir que notificações de usuários sejam enviadas ao Google Chat: Na sua conta HubSpot, clique no ícone de configurações settings icon na barra de navegação superior. No menu da barra lateral esquerda, acesse Notificações . Clique na guia Outros aplicativos . Para interromper notificações específicas, desmarque a caixa de seleção ao lado do tipo de notificação e clique em Salvar . Para interromper todas as notificações do usuário, clique para alternar a desativação do Google Chat para interromper todas as notificações do HubSpot no Google Chat. Notificações da caixa de entrada HubSpot Após instalar o aplicativo Google Chat , você pode selecionar para qual espaço Google Chat novas conversas de chat ao vivo de HubSpot devem ser enviadas: Na sua conta HubSpot, clique no ícone de < configurações< < settings icon< na barra de navegação superior. No menu da barra lateral esquerda, acesse < Integrações< > < Apps conectados< . Clique em Google Chat . Na guia Comunicações , configure os espaços do Google Chat para suas caixas de entrada: Ative a opção Ligar/Desligar para sincronizar uma caixa de entrada HubSpot com um espaço de Bate-papo do Google. Clique no menu suspenso Espaço e selecione o espaço ao qual você deseja associar a caixa de entrada. Clique no menu suspenso Inbox Channel Types (Tipos de canal de caixa de entrada) e selecione os tipos de canal a serem sincronizados com o HubSpot. Depois de associar o espaço Google Chat com a caixa de entrada, você receberá notificações para bate-papos ao vivo de entrada. Você também pode conversar com os visitantes diretamente através do Google Chat thread. Clique em Responder na caixa de entrada para acessar a conversa no HubSpot. Ou, se for um chat ao vivo, você pode responder através de um segmento de bate-papo do Google. A conversa inteira ainda será registrada na caixa de entrada. Observação: Para enviar uma resposta através do Google Chat thread, você precisa convidar o aplicativo HubSpot para esse espaço. Você deve mapear o usuário HubSpot para o usuário do Google Chat para poder enviar respostas. Envie notificações personalizadas do Google Chat por meio de fluxos de trabalho (somente para Profissionais e Empresas ) Você pode automatizar notificações personalizadas do Google Chat a partir de sua conta HubSpot usando fluxos de trabalho. Para enviar uma notificação do Google Chat com um fluxo de trabalho: Na sua conta HubSpot, acesse Automações > Fluxos de trabalho . Clique no nome de um fluxo de trabalho existente para editá-lo. Ou clique em Criar fluxo de trabalho para criar um novo fluxo de trabalho . Na linha do tempo de ação do fluxo de trabalho, clique no + ícone de adição para adicionar uma ação de fluxo de trabalho. No painel esquerdo, em Aplicativos integrados , clique em Google Chat e selecione GerenciarEnviar notificação do Google Chat. Para notificar usuários individuais do Google Chat, clique no menu suspenso Enviar notificação a usuários e selecione os usuários a serem notificados. Somente os usuários que mapearam seus endereços de e-mail aparecerão no menu suspenso. Para notificar um espaço de Bate-papo do Google, clique no menu suspenso Enviar notificação para espaço e selecione um espaço para notificar. Você não verá espaços privados a menos que tenha adicionado o aplicativo HubSpot a ele . Para notificar o proprietário do registro, marque a caixa de seleção Enviar notificações aos proprietários existentes . Na caixa de texto Mensagem , insira a mensagem de notificação. Clique no menu suspenso Propriedades a serem incluídas na mensagem e selecione as propriedades que deseja incluir na mensagem de notificação (opcional). Quando terminar, clique em Salvar . Quando um registro é inscrito no fluxo de trabalho e a ação é executada, a notificação será enviada ao usuário ou espaço do Google Chat selecionado. Se o espaço Google Chat for renomeado, isso não afetará o fluxo de trabalho. Notificações do suporte técnico Revise como conectar o HubSpot help desk ao Google Chat para gerenciar tíquetes e receber notificações do HubSpot no Google Chat. Integrations Notifications Inbox",https://knowledge.hubspot.com/pt/integrations/manage-your-notifications-in-google-chat
863,Gerencie as próximas renovações de clientes,"Gerencie as próximas renovações de clientes, com informações sobre as próximas mudanças contratuais de seus clientes. Na sua conta da HubSpot, navegue até Parceiro > Painel . No menu da barra lateral esquerda, clique em Renovações . Aqui, você pode visualizar informações sobre clientes com próximas renovações: Cliente: o domínio do cliente. Renovações de produtos: os produtos que o cliente possui e pretende exigir uma decisão de renovação. Prazo de renovação: a última data para alteração dos termos do contrato. Isto significa 45 dias antes da data de início de renovação. MRR atual: a receita recorrente mensal atual. Renovação MRR: a receita recorrente mensal de renovação. Proprietário da empresa : o dono da empresa. Proprietário de sucesso: o Gerente de Desenvolvimento de Parceiros na HubSpot. Para ver mais detalhes sobre a renovação, clique no nome do cliente nome . No painel direito: No Renovações seção, revise a data de renovação e a assinatura de renovação. No Detalhes do cliente seção, revise as informações sobre o cliente. Para visualizar a conta HubSpot do cliente, passe o mouse sobre o cliente e clique em Ações > Abra o portal do cliente . Partner Tools",https://knowledge.hubspot.com/pt/partner-tools/manage-upcoming-client-renewals
864,Envie um e-mail de marketing de teste,"Usuários da sua conta da HubSpot que tenham Editar permissões para e-mails de marketing pode enviar uma versão de teste de um e-mail marketing para si mesmos ou para um membro da equipe antes de enviar o e-mail real para seus contatos. Você também pode enviar um e-mail de teste usando o Aplicativo móvel HubSpot . Para enviar um e-mail de teste: No canto superior direito, clique em Visualização e selecione Enviar e-mail de teste . No painel à direita, clique no menu suspenso Escolher um ou mais destinatários para selecionar o(s) destinatário(s) para seu e-mail de teste. (Opcional) Clique nos menu suspenso Receber visualização do e-mail para visualizar o e-mail como ele aparecerá com opções específicas de personalização. Você também pode marcar a caixa de seleção Enviar versão de texto simples para enviar a versão de texto simples do seu e-mail , que exclui qualquer estilo. Clique em Enviar e-mail de teste . Por que os e-mails de teste têm Envio de visualização de e-mail de marketing como o nome de exibição? Todos os e-mails de teste são enviados de noreply@hubspot.com com um nome de exibição de Envio de visualização de e-mail de marketing , para proteger suas taxas de entrega de e-mail. Quando você terminar o teste e enviar o e-mail para seus contatos, ele será enviado com o De nome e A partir do endereço você especificou. Email Marketing Email",https://knowledge.hubspot.com/pt/marketing-email/how-do-i-send-a-test-email
865,Migrar assinaturas do Stripe para o HubSpot,"Quando conectando sua conta Stripe para usar o processamento de pagamentos Stripe, você pode ter a opção de migrar suas assinaturas Stripe existentes para o HubSpot. Ao migrar suas assinaturas existentes do Stripe para o HubSpot, você poderá: Sincronize a cobrança do cliente com dados de vendas, marketing e suporte. Dê visibilidade às suas equipes sobre cada assinante. Use o fluxos de trabalho HubSpot para automatizar lembretes de pagamento, campanhas de venda adicional e muito mais. Monitorar métricas de receita recorrentes, como RECEITAS MENSAIS RECORRENTES, RECEITAS RECORRENTES ANUAIS e taxas de cancelamento de clientes, juntamente com KPIs de marketing e vendas. Abaixo, saiba mais sobre o que esperar ao migrar suas assinaturas do Stripe para o HubSpot. Elegibilidade O HubSpot pode migrar assinaturas de cobrança simples e de taxa uniforme que estão ativas no momento. Os serviços de migração estão limitados a uma conta do Stripe por conta da HubSpot. As assinaturas do Stripe com um dos seguintes critérios não podem ser migradas no momento: Impostos em nível de itens de linha (por exemplo, tributar produtos individuais, em vez de tributar toda a assinatura). Faturamento medido ou baseado no uso (conhecido como faturamento baseado no uso ou no consumo ). Assinaturas com regras de desconto complexas. Por exemplo, uma assinatura de vários anos que tem descontos diferentes para cada ano. Descontos ou promoções em itens de linha recorrentes. Se quiser continuar com a migração, navegue até os detalhes da assinatura no painel Faixa e remova todos os descontos associados. Cálculo automático de imposto. Se quiser continuar com a migração, navegue até os detalhes da assinatura no painel Faixa e remova qualquer configuração de cálculo automático de imposto. Assinaturas de avaliação. Assinaturas que não completaram sua primeira data de cobrança. Assinaturas pagas com estes métodos de pagamento: Cartão. Conta bancária dos EUA. Assinaturas definidas para cobrança automática. As assinaturas com qualquer um dos critérios acima não estão qualificadas para migração, mas podem continuar a ser gerenciadas no Stripe. Como funciona a migração Depois de confirmar sua qualificação, você pode iniciar o processo de migração. Solicite o serviço aqui . Um especialista em migração HubSpot irá contato-lo dentro de sete dias da sua solicitação. Durante a chamada, eles confirmarão quais assinaturas são qualificadas, abordarão suas preocupações e o guiarão pelas próximas etapas. Após confirmar seus dados, o HubSpot lerá suas assinaturas Stripe e criará novos registros de assinatura no HubSpot. Nenhum dado é excluído da Faixa e as assinaturas migradas são pausadas, permitindo que você faça referência a elas novamente ou retome a cobrança na Faixa, se necessário. Para proteger a continuidade de cobrança de seus negócios, as assinaturas definidas para cobrança dentro de 72 horas do início da migração serão excluídas e precisarão ser migradas após o período de 72 horas. Quando a migração for concluída, o especialista verificará se todas as assinaturas qualificadas foram movidas. Em seguida, você pode gerenciar o faturamento, faturamento e renovações diretamente no HubSpot. O que acontece com seus dados No HubSpot Para cada assinatura migrada, a HubSpot criará o seguinte: Registros de assinatura: Na sua conta HubSpot, acesse Comércio > Assinaturas . As assinaturas migradas aparecerão aqui. NFFs: um registro de NFF será criado para cada assinatura. Registros de Contato: se um contato ainda não existir no HubSpot, um novo registro será criado e associado às assinaturas e faturas relevantes. No Stripe As assinaturas qualificadas que você migra estão em pausa e não excluídas. Se você decidir alternar a cobrança de volta para Stripe, poderá retomar a assinatura de Stripe. Observação: cancelar uma assinatura no HubSpot envia um e-mail de cancelamento aos clientes. Considere notificá-los se trocar de sistema para evitar confusão ou desativar as notificações antecipadamente. Hospedagem de dados e privacidade Se sua conta HubSpot estiver hospedada no data center da UE, seus dados permanecerão sujeitos aos Termos de Serviço da HubSpot . Ao usar o Processamento de pagamentos com Stripe, você concorda com as condições de Processamento de pagamentos com Stripe . Observe que alguns dados podem ser roteados pelo data center da Stripe na UE. Após a migração Quando sua migração estiver concluída, visualize suas assinaturas migradas: Na sua conta HubSpot, acesse Comércio > Assinaturas . Exiba suas assinaturas e clique no nome de qualquer assinatura para exibir mais informações sobre ela. Saiba mais sobre visualizando suas assinaturas no HubSpot . Verifique se a contagem de assinaturas migradas corresponde às suas expectativas. Gerencie a cobrança no HubSpot daqui para frente. Você pode criar fluxos de trabalho , rastrear renovações e unificar dados do cliente. Faça o Contato do especialista em migração ou da equipe de suporte HubSpot se precisar de ajuda adicional ou detectar discrepâncias. Subscriptions",https://knowledge.hubspot.com/pt/subscriptions/migrate-stripe-subscriptions-to-hubspot
