id,titulo,conteudo,link
1288,Schedule a one-to-one email from the CRM,"With the Send Later feature, compose an email in the CRM and schedule it to send at a later time. Once an email is scheduled, it cannot be edited, only deleted and replaced with a new scheduled email. Schedule an email from a contact, company, deal, or ticket record Please note: your inbox must be successfully connected in order to schedule an email for later. Gmail, Office 365, and IMAP connected inboxes support the send later feature when scheduling emails from the CRM . In your HubSpot account, navigate to your contacts, companies, deals, or tickets . Click the name of the record. In the left panel, click Email email . In the pop-up box, write your email body and add a subject line. At the bottom of the email editor, click the downCarat dowdodo down carat icon and select Send Later. Click Send Later ag ain, then select one of the following options: Tomorrow: send the email tomorrow at 8am click the dropdown menu to specify the recipient's timezone. Custom : set a specific date and time for your send. You can schedule an email up to 6 months in advance. Best time to send : ( Sales Hub Professional or Enterprise only) select within 24 hours or Best time to send this week to schedule a time with a higher likelihood of opens, clicks, and replies based on the recipient's previous email engagement. Click Schedule . Please note: do not press the tab key to select your send later options while scheduling an email send. This will prevent HubSpot from adding the necessary tracking information to the email send. Once the email has been scheduled, the email will be logged on the record with a status of Scheduled. To cancel the email send, the user who originally scheduled the email must delete it from the timeline . Hover over the email activity on the timeline and in the upper right, click Delete . Please note: emails scheduled for later in the HubSpot CRM will not show up in your Gmail drafts folder. How does HubSpot determine the best time to schedule the email? When predicting the best time to send, the data about the email you're sending and emails that have been sent with HubSpot in the past are taken into consideration. HubSpot calculates the probability that a person will open an email at a given time to find the best send time. The prediction takes the following into consideration: Your recipient’s engagement with HubSpot-sent emails in the past. This data is gathered by looking at recipients' email history in your HubSpot account your send history is not shared with other HubSpot users. Similar recipients’ engagement with HubSpot-sent emails in the past. Your recipient’s email address. Your recipient’s device (mobile or computer). Your recipient’s industry. Your recipient’s time zone. Your recipient’s country. Your recipient’s job title. What if my scheduled email is not sent? If your inbox is disconnected at the time your email is scheduled to send, the email will not be sent. Reconnect your inbox to HubSpot, then reschedule the email. One-to-one Email",https://knowledge.hubspot.com/one-to-one-email/schedule-a-one-to-one-email-from-the-crm
1289,Troubleshoot link previews in social posts,"When you add links to social posts in HubSpot, a preview including a featured image, page title, and page description will be displayed. Social previews are based on meta tags in the <head> section of your page HTML. These tags tell social media sites platforms what to focus on when creating a preview of your shared link. The basic meta tags are: og:title: the title of your content. og:type: the type of your content, such as a video or a web page. og:image: the URL of the image to represent your content. og:url: the unique URL of your content that will be used as its permanent ID. og:description: the description that summarizes your image. The title, meta description, and the featured image are automatically set for blog posts . For landing pages and website pages, while the title and meta description are set also automatically, the featured image must be set manually . Please note: LinkedIn will show your featured image, page title, and URL in their preview card, but will not include your meta description. Featured image, page title, or page description isn't displaying in the post preview If your social post preview isn't showing the expected featured image, page title, or page description, you can troubleshoot in HubSpot or by using external debugging tools. Troubleshooting within HubSpot If you're linking to a HubSpot-hosted blog post, landing page, or website page, make sure a featured image is set in the page or post’s settings. You can also manually set an og:image tag to add a featured image: Navigate to your content: Website Pages : In your HubSpot account, navigate to Content > Website Pages . Landing Pages : In your HubSpot account, navigate to Content > Landing Pages . Click the name of your page. In the content editor, click the Settings menu and select click. In the dialog box, paste this code snippet into the Head HTML field: <meta property=""og:image"" content=""IMG URL""> Replace IMG URL with the URL of your image file . To further optimize an image for X , enter this additional code snippet into the Head HTML field: <meta name=""twitter:card"" content=""summary_large_image""> In the top right, click Publish or Update to set the changes live. Troubleshooting with browser developer tools If you're sharing an external page in your social post, you can use browser developer tools such as Chrome Developer tools to make sure the meta tags for the page are set up correctly. View the page's source, then check and confirm the following: The og:image and other meta tags are correctly displayed. The details for each tag are correct. For example, check that the featured image URL for the og:image tag is correct. There is only one occurrence of each type of meta tag. If there are multiple occurrences of the same meta tag, social networks may not select the correct one when generating a link preview. Your meta tags are near the top of the HTML. If you have extra code or markup before your meta tags, social network crawlers may not be able to locate these tags. Troubleshooting with social network debugging tools If you're seeing a discrepancy between your social preview and the meta tags, the social network may need to recrawl that page. Use the following validation tools for each social network to surface any errors or trigger a page recrawl: Facebook Sharing Debugger : Facebook automatically recrawls shared content every 24 hours. To manually trigger a recrawl, click Scrape Again in the Sharing Debugger. X Card Validator : X caches content for 7 days after publishing a post. Enter your URL and click Preview card in the Card Validator to trigger a recrawl of your content. LinkedIn Post Inspector : LinkedIn caches content for 7 days after publishing a post. Click Inspect in the Post Inspector to trigger a recrawl of your content. In general, any posts published prior to recrawling the page will still retain the incorrect image. If the og:image tag has not been set for a page, the social network will scan the page to find the most appropriate image to include in social posts, which is usually the first image it finds. A link preview image may not appear at all if a robots.txt file or security software is used to prevent page crawling. Featured image display issues If your social post preview is displaying the expected featured image, but the image is displaying incorrectly, you can check the following. Image size or ratio is incorrect If the featured image isn't appearing correctly in your social preview (e.g., the image is cut off or the ratio is incorrect), you may need to edit the image so it has the right dimensions for the social network you're posting to, then republish the page. The following dimensions are recommended for featured image optimization on each network: Facebook : 1.91:1 X: 16:9 for photo posts and 1.91:1 for featured images in link posts Instagram (square): 1:1 Instagram (portrait): 4:5 Instagram (landscape): 1.91:1 LinkedIn (landscape): 1.91:1 Ensure that any media included in your social posts follows the file size guidelines for each network. If HubSpot determines that a file is too large to post to a certain network, a warning will appear when creating the social post. These are the maximum file sizes for each social network: Facebook: 8MB (under 1MB recommended for PNG files to avoid pixelation) Instagram: 8MB X: 5MB (15MB for GIFs) LinkedIn: 10MB Differences in image color Embedded color profiles may impact how your featured image appears in your social post. Different systems process uncommon color profiles in different ways, which is why the colors may look different when previewing the image in your file manager. You can run your image URL through an external tool to see if it’s using an uncommon color profile. If necessary, you can remove the interfering color profile in an external photo editing tool like Photoshop, then republish the page before publishing your social post. Differences in image clarity HubSpot’s file manager uses image compression on JPEGs and PNGs to help optimize loading speeds on your HubSpot-hosted content. Social media networks also use image compression in posts, which may vary in quality from what you see in HubSpot. For this reason, it’s recommended to use relatively high-resolution images for each network. If your image doesn’t conform with a social network’s requirements, a warning will appear in HubSpot’s social publishing tool to help adjust your image accordingly. Social",https://knowledge.hubspot.com/social/featured-image-not-displaying-correctly-in-social-preview
1290,Use the intelligence tab,"The intelligence tab is featured on company records and provides data enrichment and website visit-based data insights for the company. With the intelligence tab, you can quickly assess fit and inform key account-based qualification, routing, prospecting, and outreach decisions. To navigate to the intelligence tab: In your HubSpot account, navigate to CRM > Companies . Click the name of the company you’d like to enrich. At the top, click the Intelligence tab. Properties populated by the intelligence tab The intelligence tab populates enriched data for the following default company properties as available: Annual revenue Company domain name Company keywords Company logo Company name Country/Region Description Employee range Facebook company page Industry Industry group Is public LinkedIn company page LinkedIn handle Number of employees Phone number Postal code Revenue range State/Region Street Address Total Money Raised Web Technologies Website URL X account handle Year founded Update your data If you have a Starter , Professional , or Enterprise subscription and you've purchased Breeze Intelligence credits , you can enrich your data. If any company properties are incorrect or missing, there'll be an enrichment prompt at the top of the Intelligence tab. When enriching your data, current property values will be populated or overwritten. To update your data: In your HubSpot account, navigate to CRM > Companies . Click the name of the company you’d like enrich. At the top, click the Intelligence tab If new data is available, click Enrich . If your data is up to date, no action is needed and the Enrich button won't be available. In the right panel, review the properties you want to enrich. By default, all properties will be selected. If you’d like to retain any of your current property values, click the property checkbox to de-select properties you don’t want to enrich. Click Enrich . Review visitor activity If you have a Starter , Professional , or Enterprise subscription and you've purchased Breeze Intelligence credits , i n the top right of the intelligence tab, you can find information about the company visiting your website in the last 30 rolling days. In your HubSpot account, navigate to CRM > Companies . Click the name of the company to review. At the top, click the Intelligence tab In the Visitor activity table, you can review: Website visits : the total number of times people from the company have visited your website. The arrow and percentage shows if visits have changed month over month. Line graph : shows the number of visits over the last 30 days. Unique visitors: total number of unique visitors to your website from the company. Last seen: when someone from the company last visited your site. Top pages & paths: website pages most frequently visited by people from the company. This includes the total number of visits to each page. Review company information To review company information on the Intelligence tab: In your HubSpot account, navigate to CRM > Companies . Click the name of the company to review. At the top, click the Intelligence tab. If you have a Starter , Professional , or Enterprise subscription and you've purchased Breeze Intelligence add-on, at the top, you can review key information about the company including: Employees : the total number of employees. Type: indicates if it is public or private company. Annual revenue: the total amount of money earned by the company over a 12-month period. Below, you can also review basic information about the company such as address, industry, description, and company keywords . To review additional information about the company’s general information, industry, financials, location, tech, and social channels, click the relevant title to expand each section. If you are a user in an account with free tools or you haven't purchased Breeze Intelligence credits , at the top, you can review information about the company including: description, industry, country, employees, founded year. properties CRM records AI Tools",https://knowledge.hubspot.com/records/use-the-intelligence-tab
1291,Create programmable emails (BETA),"Programmable emails allow you to use advanced HubL syntax to fully personalize the content of your emails. Learn more about how to create modules and render data from your CRM in HubSpot's developer documentation . Please note: you should thoroughly test any modules or templates, along with their associated dependents, before running a live email campaign. Data sources available for programmable emails The data you can use in a programmable email depends on your HubSpot subscription: If you have a Marketing Hub Professional account, you can render data from standard CRM objects, such as contacts, companies, and products. If you have a Marketing Hub Enterprise subscription, you can include structured data sources such as HubDB tables and custom objects in programmable emails. Enable programmable email for your modules or templates Before you start creating programmable emails, you must first enable the feature for the associated module or coded template: In your HubSpot account, navigate to Content > Design Manager . To enable programmable email for a module: Create a new module , and select the Email templates checkbox when choosing where the module will be used. In the inspector on the right, toggle the Enable module for programmable email beta switch on. In the dialog box, review whether the module has any dependents. If the module has any dependents, review them, then select the I have reviewed the dependents checkbox. Click Enable . To enable programmable email for a custom coded template: Create a new template , and under Template type , select Email . Add the isEnabledForEmailV3Rendering: true annotation to the top of the template file. When you're done editing your template, click Publish changes in the top right. In the dialog box, review whether the module has any dependents. If the module has any dependents, review them, then select the I have reviewed the dependents checkbox. Click Enable . To use programmable email in a template you're creating in the drag and drop editor , drag a module that you've already enabled for programmable email into the template. If you're drafting an email in the drag and drop email editor , you can use a programmable module you've created by dragging the module into the body of the email. BETA Marketing Email",https://knowledge.hubspot.com/marketing-email/create-programmable-emails
1292,Analise o desempenho do seu bot,"Compare o desempenho de cada bot lado a lado e determine quais bots têm a maior taxa de conclusão de conversação. Também pode ver uma análise da forma como os seus visitantes interagem com cada acção do bot. Na sua conta HubSpot, acesse Automações > Fluxos de chat . Passe o cursor do rato sobre o bot que pretende analisar e clique em Details . Clique no menu pendente Date range para filtrar os seus dados por um intervalo de tempo específico. Se seleccionar um intervalo de datas constituído por uma semana, o dia de início predefinido é o domingo. Na parte superior do relatório, veja uma contagem total de conversas de bot que foram iniciadas, concluídas ou abandonadas. Iniciado: o número de conversas iniciadas com o bot. Conclusões: o número de sessões em que um utilizador interagiu com o bot até uma acção final. A duração da sessão é definida na configuração Session timeout do bot. Abandoned: o número de sessões em que um utilizador interagiu com o bot, mas não completou uma ação final. A duração da sessão é definida na definição do bot Session timeout . Analise os seus dados na visualização do gráfico Action Completion . Na parte superior da visualização do gráfico, clique numa métrica para personalizar os dados apresentados no relatório. Para adicionar este relatório ao seu painel de controlo, clique em + Guardar no painel de controlo . Clique no menu suspenso Actions selected para exibir os dados de uma ação de bot específica na visualização do gráfico. Seleccione a caixa de verificação junto a uma acção que pretenda visualizar. Abaixo da visualização de gráfico, use a tabela para ver os detalhes de cada ação do bot. Veja uma contagem do número de vezes que cada acção foi iniciada, quantas foram concluídas com êxito e quantas não foram desencadeadas. Inbox",https://knowledge.hubspot.com/pt/chatflows/analyze-your-bots-performance
1293,Imposto sobre valor agregado (IVA) da Rússia | Perguntas frequentes,"Observação: este artigo foi preparado apenas para fins informativos. Ele não se destina a fornecer e não deve ser considerado como aconselhamento fiscal. Em caso de dúvidas, você deve consultar seus próprios consultores tributários e/ou jurídicos. Se a sua empresa estiver localizada na Rússia, saiba como a HubSpot administra o IVA e como você pode atualizar o HubSpot com suas informações relacionadas ao IVA. O IVA geralmente é atribuído na venda e no fornecimento de produtos e/ou serviços. O IVA aplica-se a maioria dos produtos e serviços que são comprados e vendidos para uso ou consumo na Rússia. Geralmente, o IVA é faturado pelo fornecedor dos produtos ou serviços e recolhido do cliente. Em seguida, o fornecedor informará e remeterá o IVA recolhido para as autoridades fiscais. O governo da Federação Russa mudou as regras de IVA para serviços digitais prestados por fornecedores estrangeiros, como a HubSpot. Os fornecedores estrangeiros que são obrigados a se registrar para o IVA devem coletar o imposto relevante sobre as vendas de serviços digitais para todos os clientes na Federação Russa. A partir de 1 de maio de 2021 , a HubSpot cobra o IVA aos clientes cujo endereço principal da empresa seja na Federação Russa. Saiba como verificar como o endereço principal da sua empresa está definido na HubSpot . Veja abaixo as perguntas frequentes relacionadas ao IVA para clientes na Rússia. Quais serviços da HubSpot estão sujeitos ao IVA? Os serviços de assinatura são considerados um serviço digital para fins de IVA na Rússia e têm uma taxa de 16,67% do valor bruto. Isso inclui todas as ferramentas e serviços da HubSpot. Embora não seja considerado um serviço digital, o suporte ao cliente está sujeito ao IVA como um serviço de consultoria, pois o local de fornecimento é a Rússia. Como atualizar o HubSpot com minhas informações de IVA? Entre em contato com billing@hubspot.com com os seguintes detalhes: Uma confirmação se você pagou o IVA atuando como agente fiscal (em nome do fornecedor estrangeiro, a HubSpot) em qualquer fatura da HubSpot. Se você pagou o IVA em todas as faturas da HubSpot, a HubSpot pode solicitar as devoluções de IVA relacionadas e a ordem de pagamento para suporte. Seu número de identificação fiscal (NFI). Há um valor de compra mínimo antes que o IVA seja aplicado? Não. Todo o fornecimento de serviços eletrônicos, hospedagem e consultoria para clientes na Rússia (empresas e pessoas físicas) estão sujeitos ao IVA russo. O HubSpot fornece serviços isentos de IVA ou não tributáveis? Não. Todos os serviços atualmente fornecidos pela HubSpot aos clientes na Rússia estão sujeitos ao IVA russo. Há isenções especiais aplicáveis a instituições de caridade sob as quais o IVA não pode ser cobrado? Não. Não há isenções de IVA disponíveis de acordo com as regras de IVA da Rússia para os serviços que a HubSpot fornece às instituições de caridade na Rússia. O IVA será aplicado mesmo se uma empresa russa fornecer um número de identificação fiscal válido para a HubSpot? Sim. O IVA aplica-se a todos os serviços que a HubSpot fornece aos clientes na Rússia. Como cliente, tenho alguma obrigação de IVA? Não. Se você está registrado para o IVA na Rússia e deseja reivindicar um crédito de imposto a montante para o IVA pago à HubSpot, no mínimo, mantenha uma cópia da fatura da HubSpot para seus registros. Para quaisquer outras questões sobre como reivindicar um crédito de imposto a montante, entre em contato com o seu consultor fiscal. billing",https://knowledge.hubspot.com/pt/account/russia-value-added-tax-vat-faq
1294,Add personalization tokens to an email subject line,"When creating a marketing email, you use personalize the subject line to affirm you value your audience and that the content is relevant to them. The best email subject lines stand out in a subscriber's inbox. Personalization allows you greet your subscriber by name, feature a topic they've expressed interest in, or congratulate them on a birthday or anniversary. Research shows that personalization leads to more email opens and clicks . To add a personalization token to your email: In your HubSpot account, navigate to Marketing > Email . Hover over the name of the email you want to edit and click Edit , or click Create email at the upper right. Click the Settings tab. Locate the Subject line field and click Personalize . In the dialog box, click the Type dropdown menu and select Contacts or Company . Click the Property dropdown menu, and select the contact property or company property you want to use. Add a local default value or choose to Use this property's global default value . Click Insert .",https://knowledge.hubspot.com/marketing-email/how-do-i-personalize-the-subject-line-of-my-email
