id,titulo,conteudo,link
1315,Assign the Partner Seat to Partner and Provider employees,"The Partner Seat is a free Seat that gives eligible HubSpot Solutions Partner and Provider employees access to all features in a client's HubSpot account. Below, learn more about the Partner Seats and how to assign it to users. Before you begin Partner Seats grant eligible Solutions Partner and Provider employees the eligibility to have access to all features in a client's account. It does not automatically assign the permissions to the users. Users with a Partner Seat can be assigned the Partner admin permission template during permission setup. This template gives all the functionality of the super admin permission template with added multi-account employee management capabilities. You can only assign users to a Partner Seat one at a time. To be assigned to a Partner Seat, users must be eligible Solutions Partner or Provider employees with a partner employee email domain and HubSpot Partner account. Partner Seats are eligible for all permissions but can be granted more granular access only by users with Add and edit users and Modify billing permissions. Users must be assigned a Partner Seat to be a Partner admin, but they do not need to be a Partner admin to be assigned a Partner Seat. Assign the Partner Seat There are two methods to add a Solutions Partner and Provider employee to a client's account: from the Partner account or directly in the client's account. Learn more about how to assign the Partner Seat via these two methods. Assign the Partner Seat via the Partner's account The employee is automatically granted eligibility and access to the Partner Seat when added as a Partner admin in the client account directly via the Client Access Manager . Assign the Partner Seat in the client's account To assign a user in the client's account to a Partner Seat: In your HubSpot account, click the settings settings icon in the top navigation bar. In the left sidebar menu, navigate to Users & Teams . In the top right, click Create user . Enter the employee's email address into the Add email address(es) field. If the user is also a user in an existing Solutions Partner account and has an approved email partner domain, you can assign the user a Partner Seat from the Seat assignment dropdown menu. If the user does not meet this criteria, you can assign the user a Core Seat or a View-Only Seat . In the Choose to narrow access section, select which permission template you want to assign to the user. Click Next. Click Send to create the user. The user will receive am email notification stating that they've been added as a user in the client's account. Please note: the Partner user must have Add and edit users permissions to add a user in the client account. Change a user's seat to a Partner Seat If you mistakenly added a user to a Core or View-Only Seat and you want to change it to a Partner Seat, there are two ways to do so: from the Partner account or directly in the client's account. Change to the Partner Seat via the Partner's account The user is automatically granted eligibility and access to a Partner Seat when a Partner admin makes any permission changes on a user in the Partner account. No extra steps are required. Change to the Partner Seat via the client's account You must either be a super admin or have Add and edit user and Modify billing permissions to edit a user's seat. To change a user's seat to a Partner Seat: In your HubSpot account, click the settings settings icon in the top navigation bar. In the left sidebar menu, navigate to Users & Teams . Hover over the user and click Edit permissions . Click the Seat assignment dropdown menu, then select Partner Seat . In the Choose to narrow access section, select which permission template you want to assign to the user. Click Save . Partner Tools",https://knowledge.hubspot.com/partner-tools/assign-the-partner-seat-to-partner-and-provider-employees
1316,Understand your comment notifications,"Use comments to collaborate with your team on activities such as notes and calls in CRM records as well as content assets such as social posts or landing pages. Then, review your comment notifications to get an overview of comments added to assets you may be working on. Comment notification emails will include information such as the associated asset or activity, the date and time the comment was added, and any previous comments in the same thread. Manage your comment notification settings To receive comment notifications, your comment notification settings must be toggled on. To manage your general comment notification settings: In your HubSpot account, click the settings settings icon in the top navigation bar. In the left sidebar menu, navigate to Notifications . Ensure that each of your notification types have been toggled on . At the top, click the Email tab or Desktop tab. In the What you get notified about section, click to expand the Comments section. Select the checkbox next to the notification topics that you'd like to receive notifications for: Comments on an activity you're involved in: receive notifications when there's a new comment on an activity you own, commented on, or were mentioned in. Comments you're mentioned in: receive notifications when a teammate @mentions you in a comment. At the bottom, click Save . Understand comment notification recipients Generally, the author of the comment will not receive a comment notification email. If you have a Professional or Enterprise subscription, you can customize the notification preferences for specific content assets. Otherwise, content asset and CRM comment notification emails will be sent to the following users in these instances: The owner of the content asset or CRM records will be notified whenever another user comments or replies to a comment thread on the asset. For HubSpot campaigns, this refers to the user assigned as the campaign owner . For other content assets such as marketing emails, website pages, or workflows, this generally refers to the user that created the asset. Generally, @mentioned users will be notified: For any content assets, any users or teams @mentioned in a comment or comment reply will be notified. For CRM records, users directly @mentioned in an activity will be notified of all comments on the activity. Specifically for comments on content assets only: If a user replies in a thread, all users who have previously replied in the same thread will be notified. When up to three replies are left on a thread within a 60-second timeframe, the three comments will be bundled into one single notification email. Users who have previously commented directly on the asset, and users replying to other comment threads will not be notified. Please note: to receive comment notification emails, the user's email notification settings must be toggled on. Understand comment notification emails from CRM records Comments on the following activities in CRM records can trigger comment notification emails: Calls Tasks Notes Meetings Manually logged emails. Manually logged postal mail Manually logged SMS messages Manually logged WhatsApp messages Manually logged LinkedIn messages If an activity is associated with multiple CRM records, the record referenced in the comment notification email will be prioritized in the following order: Company Contact Deal Ticket Quote Custom object Set notification preferences on specific content assets ( Professional and Enterprise only) When using the collaboration sidebar to add comments on content assets, you can set notification preferences to specify when exactly you'd like to be notified. To set notification preferences on specific content assets: In your HubSpot account, navigate to the asset that you want to comment on. From the collaboration sidebar, click the comments c comment icon . In the right panel, click on the notification bell icon . In the dialog box, choose from the following options: All comments: receive notifications for all comments added to this content asset, including threads that you are not involved in. This will be the default option selected for users that have created the asset. @mentions and threads involved in: receive notifications for comments where you have been mentioned and threads that you're involved in. This will be the default option selected for users reviewing the thread for the first time. @mentions only: only receive notifications for comments where you have been mentioned. Click Save . You can change your comment notification preferences at any time. Email Forms Workflows Campaigns Blog Website Pages",https://knowledge.hubspot.com/campaigns/comment-notification-emails
1317,Create a chatflow for Facebook Messenger,"When you connect your Facebook Messenger account to HubSpot, a default instant reply chatflow will be created and enabled in your account. This is the primary chatflow used on your Facebook Messenger page. You can also create additional chatflows and use the direct URLs for these chatflows in your content. Once your Facebook Messenger account is connected to HubSpot, learn how to respond to incoming messages in your conversations inbox. Only new messages sent after you connected Facebook Messenger to HubSpot will appear in the conversations inbox. If incoming messages aren't appearing in your inbox, make sure HubSpot is set as the primary receiver for Facebook Messenger. To create a chatflow for your website pages, learn how to create a chatflow with live chat or a chatflow with a bot . Customize the default Facebook Messenger chatflow You can customize the chatflow's instant reply message and routing rules: In your HubSpot account, navigate to Automations > Chatflows . Click the Facebook Messenger tab. Hover over the chatflow and click Edit . On the Build tab, customize the chatflow's instant reply message and routing rules . Click Save . To copy a direct link to your Messenger account, click the Options tab, then click Copy next to the URL. This can be added to CTAs, emails, and your website. Create additional Facebook Messenger chatflows You can only have one primary chatflow for each connected Facebook Messenger account. This is the default chatflow that visitors will see when messaging you. You can, however, create additional instant reply chatflows or bot chatflows and use the direct URLs for these chatflows in your content. Add direct URLs to your CTAs, marketing emails, or website pages so visitors can immediately start a conversation with your team in Messenger. To create additional Facebook Messenger chatflows: In your HubSpot account, navigate to Automations > Chatflows . In the upper right, click Create chatflow . Select Facebook Messenger . You can create a chatflow with an instant reply or a chatflow with a bot . Learn more about the different bot templates you can choose from. When you're ready to continue, in the left sidebar, select which type of chatflow you're creating, then click Next . On the left, customize the inbox and language settings: To select an inbox to connect the chatflow to, click the Inbox dropdown menu. To change the chatflow's language , click the Language dropdown menu. If you're creating a Knowledge base + support bot or an Offline bot , to control which users receive incoming messages, click the Select inbox users dropdown menu. Click Next . On the Build tab, customize the instant reply and routing rules. If you're creating an instant reply chatflow, enter a message in the Write an instant reply text box. Click the Assign incoming conversations to dropdown menu and decide who incoming messages should be routed to. If you're creating a bot, to edit the instant reply message, click the Instant reply action, then edit the message in the right panel. You can also edit the existing actions or add additional actions to the bot's flow. Click the Options tab. If you're creating a bot, you can customize additional bot display options : To set a delay between each message that is sent to visitors, click the Typing delay between messages dropdown menu and select an option. To customize the amount of time after inactivity before the chat session is reset to the beginning, click the Session timeout dropdown menu and select an option. The chat session will not reset if a visitor completed every bot action in a past session. In the Generic error message text box, type the message to display when a request can't be delivered. To change the bot's display language, click the Select a language dropdown menu and select a different language. To preview your chatflow in Facebook Messenger, click View in Facebook Messenger in the top right. To enable the chatflow, in the top right, click to toggle the switch on. Next to the Facebook Messenger URL , click Copy to copy the direct URL for your chatflow. This can be added to CTAs, emails, and your website. Your new chatflow will now appear on the Facebook Messenger tab of the chatflows tool. If you add the Messenger URL to your content, when a contact clicks the URL, they'll be brought directly to Messenger where they can start a conversation with your team. To make one of your new chatflows the primary chatflow that visitors will see when visiting your Facebook Business page, hover over the chatflow, click the More dropdown menu, and select Set as primary . Chatflows",https://knowledge.hubspot.com/chatflows/create-a-facebook-messenger-chatflow
1318,Inscrever contatos em cursos do Teachable usando fluxos de trabalho,"Integre o Teachable aos fluxos de trabalho do HubSpot para inscrever seus contatos em cursos online e experiências de coaching. Requisitos Para inscrever os contatos nos cursos do Teachable usando fluxos de trabalho, você deve: Ter uma assinatura do Marketing Hub , Sales Hub , Service Hub ou do Operations Hub Professional ou Enterprise . Ter uma assinatura de conta Teachable Pro+. Conectar o Teachable ao HubSpot Antes de inscrever contatos nos cursos do Teachable com fluxos de trabalho, você precisará conectar o Teachable à sua conta da HubSpot. Pode ligar a aplicação a partir do App Marketplace ou de um fluxo de trabalho. Na sua conta HubSpot, acesse Automações > Fluxos de trabalho . Crie um fluxo de trabalho baseado em contatos . Clique no + ícone de mais para adicionar uma ação. No painel direito, navegue para na guia Conectar um aplicativo . Na caixa de pesquisa, digite Teachable e selecione o aplicativo Teachable . Copie a chave de API da sua conta Teachable . Introduza a sua chave de API do Teachable na janela e, em seguida, clique em Connect . Inscrever um contato em um curso do Teachable Na sua conta HubSpot, acesse Automações > Fluxos de trabalho . Crie um fluxo de trabalho baseado em contatos . Clique no + ícone de mais para adicionar uma ação. Selecione a opção do Teachable Inscrever em um curso . Selecione a propriedade do HubSpot que corresponde ao e-mail da conta Teachable do contato. Se o contato não tiver uma conta Teachable correspondente, o HubSpot criará automaticamente uma. Para desativar essa funcionalidade, marque a caixa de seleção Não criar uma nova conta no Teachable se não existir uma conta com um e-mail correspondente . Clique no menu suspenso Curso do Teachable para selecionar o curso no qual deseja inscrever o contato. Clique em Salvar . Workflows",https://knowledge.hubspot.com/pt/workflows/enroll-contacts-in-teachable-courses-using-workflows
1319,Criar uma lista com base nas interações de anúncios,"Depois de conectar as suas contas de Anúncios do Facebook , Anúncios do Google e Anúncios  doLinkedIn ao HubSpot, você pode segmentar contatos em listas com base em suas interações de anúncios em cada rede. As interações entre anúncios incluem quando os usuários clicam no seu anúncios ou enviam um formulário depois de se engajarem no seu anúncio. Cada filtro de interação de anúncios representa uma interação de anúncio rastreável, como identificar quais contatos clicaram em seu site a partir de uma campanha específica do Google Anúncios. Observação: Para usar os filtros de interação de anúncios, a(s) conta(s) de anúncios relevante(s) deve(m) ser conectada(s) ao HubSpot, o rastreamento automático de anúncios deve estar habilitado e a URL de destino da campanha de anúncio deve ter o código de rastreamento HubSpot presente. Os filtros de interação de anúncios refletem as informações nas atividades de anúncios nas linhas de tempo do contato . Essas informações não se refletem em nenhuma propriedade de contato. Filtros de interações de anúncios Facebook Google LinkedIn Anúncio no Facebook IDFome do anúncio no Facebook grupo de anúncios IDFome do grupo de anúncios no FacebookCampanha no Facebook IDFome da campanha no FacebookTipo de anúncio no FacebookOcorrido ID do anúncio do Google Ads Nome do anúncio do Google Ads ID do grupo de anúncios do Google Ads Nome do grupo de anúncios do Google Ads ID da campanha do Google Ads Nome da campanha do Google Ads Tipo de anúncio do Google Ads Ocorreu ID da palavra-chave do Google Ads Nome da palavra-chave do Google Ads ID do anúncio do LinkedIn Nome do anúncio do LinkedIn ID da campanha do LinkedIn Nome da campanha do LinkedIn ID de grupo de campanhas do LinkedIn Nome do grupo de campanhas do LinkedIn Tipo de anúncio do LinkedIn Ocorreu Usar os filtros de interação de anúncios para criar suas listas Na sua conta da HubSpot, acesse CRM > Listas . No canto superior direito, clique em Criar lista . No painel esquerdo, selecione Baseado em contatos para criar uma lista de contatos ou Baseado em empresas para criar uma lista de empresas. No painel direito, insira um nome para sua lista e selecione Lista ativa ou Lista estática . No canto superior direito, clique em Próximo . Na seção Tipo de filtro , selecione Interações de anúncios . Clique no nome de um filtro de interação de anúncios e refine o filtro de acordo. Filtrar pelo ID do seu ativo de anúncios Se você souber a ID do ativo de anúncio (por exemplo, a ID do anúncio, conjunto de anúncios, grupo de anúncios, campanha de anúncio ou grupo de campanha de anúncio) pelo qual deseja filtrar, clique no menu suspenso abaixo de é qualquer um dos botões de seleção e digite a ID do ativo de anúncio. Cada filtro de ID também suporta a pesquisa pelo nome do ativo, mas se vários ativos tiverem o mesmo nome, todos serão mostrados. Filtrar pelo nome do seu ativo de anúncios Os filtros de Nome da interação de anúncios permitem correspondências parciais (ou seja, contém , começa com e termina com ). As pesquisas por nome de entidade diferenciam maiúsculas de minúsculas. Filtrar pela data em que ocorreu uma interação com o anúncio O filtro de interação anúncios Ocorrido permite especificar um período de tempo para a interação do anúncio. Lists ads",https://knowledge.hubspot.com/pt/ads/segment-contacts-based-on-ads-interactions
1320,Personalizar os seus webhooks (BETA),"Se estiver a utilizar webhooks em fluxos de trabalho para enviar pedidos POST ou GET dos seus fluxos de trabalho, pode personalizar os seus webhooks para controlar os dados enviados e recebidos. Nos seus pedidos POST, pode especificar as propriedades enviadas para quaisquer sistemas externos, como um CRM. Do mesmo modo, nos seus pedidos GET, pode especificar as propriedades pedidas através de parâmetros de consulta. Saiba mais sobre webhooks na documentação para desenvolvedores sobre webhooks . Se você tiver dúvidas sobre sua implementação específica de webhooks com o HubSpot, entre em contato com o HubSpot Developers Forums . Observação: O HubSpot tentará novamente os webhooks com falha por até três dias, começando um minuto após a falha. As falhas subsequentes serão tentadas novamente em intervalos crescentes, com uma lacuna máxima de oito horas entre as tentativas. Saiba sobre as exceções de código de erro específicas na Documentação para desenvolvedores da HubSpot . Configurar o webhook Para criar e personalizar os seus webhooks: Na sua conta HubSpot, acesse Automações > Fluxos de trabalho . Clique no nome do fluxo de trabalho. Clique no ícone + para adicionar uma ação. No painel direito, selecione Enviar um webhook . Clique no menu suspenso Método e selecione POST ou GET . Digite o URL do webhook . As URLs de webhook estão restritas a um protocolo seguro e devem começar com HTTPS. Para solicitar informações específicas, pode adicionar parâmetros de consulta como ?queryparameter=abc ao URL do Webhook . Se nenhum parâmetro de consulta tiver sido adicionado, uma solicitação genérica POST ou GET será enviada. Configure seu tipo de autenticação para autenticar solicitações ao webhook: Para usar uma assinatura de solicitação no cabeçalho do webhook: Clique no menu suspenso Tipo de autenticação . Selecione Incluir assinatura de solicitação no cabeçalho . Digite o ID do aplicativo HubSpot . Saiba como verificar assinaturas de pedidos . Também pode utilizar uma chave API para autenticação. Ao utilizar uma chave de API para autenticação, o nome da chave de API e a localização da chave API usada dependerão de como o webhook foi configurado. Por motivos de segurança, a chave de API não será exibida em nenhuma solicitação de teste. Para utilizar uma chave de API: Clique no menu suspenso Tipo de autenticação . Selecione a chave de API . Insira o nome da chave de API . Clique na localização da chave da API menu pendente. Em seguida, selecione Parâmetros de consulta ou Cabeçalho da solicitação . Saiba mais sobre como usar chaves de API no HubSpot . Personalize suas solicitações POST Se estiver a configurar um pedido POST, pode optar por incluir todas as propriedades do registo CRM ou enviar apenas propriedades específicas: Para incluir todas as propriedades, na seção Personalizar corpo da solicitação , selecione Incluir todas as propriedades . Para incluir apenas propriedades específicas: Na seção Personalizar corpo da solicitação , selecione Escolher propriedades específicas . Clique no menu suspenso Escolher propriedade . Em seguida, clique em [objeto] neste fluxo de trabalho e selecione uma propriedade . Para alterar o nome de uma propriedade no webhook, edite o campo de texto Nome da propriedade . Isso apenas atualizará o nome da propriedade na solicitação POST, não atualizará o nome da propriedade nem o nome interno no HubSpot. Para adicionar outra propriedade, clique em Adicionar propriedade . Para remover uma propriedade, clique no ícone do caixote do lixo delete . Personalize suas solicitações GET Se estiver a configurar um pedido GET, pode utilizar propriedades como parâmetros de consulta para obter dados específicos: Na seção Parâmetros de consulta , clique no menu suspenso Escolher propriedade . Em seguida, clique em [objeto] neste fluxo de trabalho e selecione uma propriedade . Para alterar o nome de uma propriedade no parâmetro de consulta, edite o campo de texto do nome da propriedade . Isso apenas atualizará o nome da propriedade na solicitação GET, não atualizará o nome da propriedade nem o nome interno no HubSpot. Para adicionar outra propriedade, clique em Adicionar parâmetro de consulta . Para remover uma propriedade, clique no ícone do caixote do lixo delete . Clique em Salvar . Workflows",https://knowledge.hubspot.com/pt/workflows/customize-webhooks
