id,titulo,conteudo,link
869,Criar formulários (antigos),"Use formulários antigos para coletar informações importantes sobre seus visitantes e contatos. Na HubSpot, você pode criar facilmente formulários para adicionar à sua página ou site externo. Observação: é recomendado usar o editor de formulários atualizado para criar e gerenciar formulários. Este artigo deve ser usado como referência para formulários existentes criados somente com o editor antigo . Criar um formulário antigo Para criar um formulário antigo: Na sua conta HubSpot, acesse Marketing > Formulários . No canto superior direito, clique em Criar formulário . Observação: você somente pode associar um formulário a uma Unidade de negócios ao criar o formulário. Saiba mais sobre como associar um formulário a uma Unidade de negócios . Selecione Editor de formulários antigos . No canto superior direito, clique em Avançar . No painel esquerdo, selecione Modelo em branco para começar com um formulário em branco ou um modelo predefinido para começar com um formulário com campos pré-selecionados para um caso de uso específico. A visualização do modelo de formulário selecionado aparecerá no painel direito. Se você tiver permissões de Acesso à conta , poderá selecionar o modelo Suporte para criar tickets a partir de envios de formulários. Isso conectará o formulário à sua caixa de entrada de conversas ou help desk , onde sua equipe poderá responder às consultas dos clientes. Observação: contas criadas após 1º de abril de 2024 somente podem criar tickets a partir de formulários conectados ao help desk . No canto superior direito, clique em Iniciar . Na parte superior do editor de formulário, clique no edit ícone de lápis para editar o nome do formulário. Adicionar e editar campos de formulário Adicione campos de formulário para coletar informações dos contatos e visitantes de seu site. Você também pode adicionar áreas de texto rico entre campos de formulário para adicionar texto personalizável, criar cabeçalhos ou adicionar espaçamento ao formulário. Se estiver usando múltiplos campos de caixa de seleção, botão de opção, menu suspenso, data, upload de arquivos, número de telefone ou assinatura de blog, saiba mais sobre as opções de personalização adicionais disponíveis com esses tipos de campo . Observação: Por padrão, o campo Email é necessário para envios de formulários para criar contatos. O HubSpot verificará se um endereço de e-mail é válido antes de permitir que um usuário envie o formulário. Saiba mais sobre como permitir envios de formulário sem endereços de e-mail para criar contatos. Propriedades de pontuação, cálculo, rich text e do usuário da HubSpot não podem ser utilizadas em um formulário. Para adicionar um campo de formulário: No painel esquerdo, use a barra de pesquisa para pesquisar um campo existente ou navegar pelos grupos de propriedades. O tipo de objeto do campo adicionado pode determinar se o envio de formulário é exibido na linha do tempo da atividade dos registros associados. Para criar uma nova propriedade e usá-la como um campo no seu formulário, clique na guia Criar nova . Selecione o Tipo de campo de formulário . No painel direito, configure o campo do formulário: Rótulo da propriedade: digite o texto para dar um nome para a propriedade. Tipo de objeto: selecione um tipo de objeto. Você pode adicionar campos de Contato , Empresa e Objeto personalizado . As propriedades do ticket podem ser adicionadas se a opção Criação automática de tickets estiver ativada. Unidade de negócios : selecione a Unidade de negócios em que deseja criar a propriedade (somente para o complemento de Unidades de negócios ). Grupo: selecione um grupo de propriedades. Revise as opções de propriedade e clique em Criar . Clique e solte os campos na visualização do formulário à direita para incluí-los no formulário. Os campos podem ser colocados acima, abaixo ou próximos a outros campos. Caso tenha configurado a ferramenta de pagamentos no HubSpot, saiba como receber pagamentos com formulários . Quando a opção Pagamento está ativada, não é possível criar tickets a partir do mesmo formulário. Para criar um ticket de cada envio de formulário, os superadministradores ou usuários com permissões de Acesso à conta podem ativar o botão Criação automática de tickets na seção Propriedades do ticket . Isso conectará o formulário à sua caixa de entrada de conversas ou help desk , onde sua equipe poderá responder às consultas dos clientes. Quando a opção Criação automática de tickets está ativada, não é possível receber pagamentos a partir do mesmo formulário. Observação: contas criadas após 1º de abril de 2024 somente podem criar tickets a partir de formulários conectados ao help desk . Gerenciar as opções do seu campo de formulário Para editar as opções de um campo: No painel direito, clique no campo na visualização do formulário . No painel à esquerda, edite as opções do campo conforme o necessário. As opções podem variar dependendo do tipo de propriedade do campo. Saiba mais sobre as opções adicionais de personalização de campo disponíveis . Na guia Básico : Tornar este campo obrigatório: quando esta opção estiver ativada, o campo deverá ser preenchido para que o formulário seja enviado. Se um campo de formulário for obrigatório, ele não poderá ser definido como oculto. Tornar este campo oculto: quando esta opção estiver ativada, o campo não aparecerá no formulário, mas poderá ser usado para passar valores às propriedades de contato para todos os envios. Rótulo: o nome do campo que aparecerá no formulário. Texto de ajuda: um texto informativo abaixo do rótulo do campo que ajuda o visitante a preencher o campo. Texto temporário: o texto que aparece na caixa de entrada do campo. O campo desaparecerá quando o visitante inserir um valor no campo e não irá no envio, mesmo se o campo for deixado em branco. Valor padrão : um valor que será enviado para o campo por padrão, a menos que seja alterado pelo visitante. Na guia Lógica : Campos progressivos: selecione a ação a ser executada se o campo tiver sido enviado anteriormente. Saiba mais sobre os campos progressivos em formulários. Campos dependentes: exibem campos adicionais com base nas respostas de visitantes a um campo anterior. Saiba mais sobre os campos dependentes em formulários. Personalize suas opções de formulário Na guia Opções , configure o que acontece depois que um formulário é enviado. É possível definir as configurações de envio, notificações do usuário, o idioma do formulário e mensagens de erro, e muito mais. Algumas opções podem não ser exibidas, dependendo da sua assinatura do HubSpot. O que deve acontecer depois que alguém enviar este formulário: selecione o que será exibido após um envio de formulário. Essa opção define a ação de formulários incorporados em páginas não HubSpot ou compartilhados como páginas independentes somente ; não definirá nem alterará a ação dos formulários adicionados às páginas da HubSpot . Mensagem de agradecimento: configure uma mensagem de agradecimento para aparecer após o envio do formulário. Página do HubSpot ou URL externo: redirecione os visitantes para uma página diferente após o envio do formulário. Você pode selecionar uma página da HubSpot publicada ou usar um URL externo. Página de agendamento: se você tiver uma assinatura do Sales ou do Service Hub Enterprise , poderá redirecionar os visitantes a uma página de agendamento de reuniões específica para agendar uma reunião; os campos de formulário enviados serão preenchidos automaticamente. Redirecionar condicionalmente para uma página de agendamento, página do HubSpot ou URL externo: se você tiver uma assinatura do Sales ou do Service Hub Enterprise , poderá redirecionar os visitantes para uma página de agendamento de reuniões específica, página do HubSpot ou URL externo. Se estiver redirecionando os usuários para uma página de agendamento de reuniões, todos os campos de formulário enviados serão preenchidos automaticamente. Saiba mais sobre o redirecionamento condicional de um formulário para uma página de agendamento de reunião , página do HubSpot ou URL externo Personalizar fases do ciclo de vida com base nos envios: clique no menu suspenso Definir fases do ciclo de vida como e selecione uma fase do ciclo de vida . Quando os visitantes enviam o formulário, quaisquer registros novos ou existentes serão definidos para a fase do ciclo de vida selecionada. Não é possível retroceder as fases do ciclo de vida de um registro. Se um contato ou empresa existente com uma fase do ciclo de vida posterior enviar um formulário, a fase do ciclo de vida não será atualizada. A fase do ciclo de vida definida em um formulário substituirá a fase do ciclo de vida padrão definida em suas configurações do HubSpot . Opções de acompanhamento: marque a caixa de seleção Enviar notificações por e-mail de envio para o proprietário do contato para enviar automaticamente uma notificação ao proprietário do contato. Se um contato não tiver um proprietário, não serão enviadas notificações. Saiba mais sobre a propriedade de objetos no HubSpot . Enviar notificações de envio de formulário a: clique no menu suspenso para selecionar as equipes ou indivíduos aos quais enviar por padrão notificações de e-mail sobre os envios, independentemente da propriedade de contato. Os destinatários definidos aqui serão substituídos pelos destinatários definidos nas opções do formulário nas páginas da HubSpot. Idioma do formulário e da mensagem de erro: selecione o idioma dos rótulos de campo padrão e erros exibidos aos visitantes quando o formulário for preenchido incorretamente. Adicionar à campanha de marketing: se você tiver uma assinatura do Marketing Hub Professional ou Enterprise , poderá associar o formulário a uma campanha: Para associar o formulário a uma campanha existente, clique no menu suspenso Campanha e selecione uma campanha . Para associar o formulário a uma nova campanha, clique no menu suspenso Campanha e em Criar campanha . Em seguida, continue a configurar a sua campanha . Se você nunca criou uma campanha antes, clique em Criar uma campanha . Em seguida, continue a configurar a sua campanha . Criar sempre contato para novo endereço de e-mail: selecione esta opção para criar um novo registro de contato para cada envio com um endereço de e-mail exclusivo . Se o endereço de e-mail enviado corresponder a um registro de contato existente no seu banco de dados, os detalhes no registro existente serão atualizados. Se essa opção estiver desativada , o HubSpot tentará primeiro associar o envio a um contato existente com o endereço de e-mail enviado. Se não existir nenhum contato nesse endereço de e-mail, o HubSpot reconhecerá e atualizará seus contatos com base nos cookies em seus navegadores. Se o mesmo formulário for enviado várias vezes no mesmo dispositivo, isso pode resultar na substituição dos contatos. Caso essa opção esteja ativada , quando um contato enviar o formulário usando um e-mail diferente em um navegador onde já exista um cookie, as visualizações desse contato não serão rastreadas. A opção Preencher previamente os campos de contato com os valores conhecidos também será desativada automaticamente. Definir contatos criados como contatos de marketing: se sua conta da HubSpot tiver acesso a contatos de marketing , você poderá definir automaticamente quaisquer contatos que enviaram este formulário como marketing. Isso inclui contatos novos e existentes. Adicionar link para redefinir o formulário: selecione esta opção para permitir que os visitantes removam qualquer campo preenchido previamente no formulário e criem um novo contato no envio. Quando ativado, os visitantes podem clicar em Não é você? Clique aqui para redefinir link que redefine o formulário. Isso também desativará o rastreamento de cookies no envio de formulários, impedindo a substituição de cookies. Preencher previamente os campos com os valores conhecidos: se um contato já tiver visitado seu site e enviado um formulário, e a HubSpot foi capaz de armazenar e rastrear seus cookies, qualquer valor de campo conhecido poderá ser preenchido previamente no formulário. Essa opção está ativada por padrão. Saiba mais sobre os campos de formulário preenchidos previamente . Estilize e pré-visualize seu formulário Na guia Estilo e Prévia , personalize o estilo do seu formulário . Uma prévia do formulário aparecerá no painel direito conforme você ajusta os estilos ou testa os recursos. Veja o que é possível personalizar: Definir como formulário HTML bruto: caso você tenha uma assinatura do Marketing Hub ou Content Hub Professional ou Enterprise , você poderá selecionar essa opção para renderizar o formulário como um elemento HTML bruto em vez de dentro de um iframe. Observe o seguinte: Qualquer estilo no HubSpot configurado na guia Estilo será removido. O formulário deve ser estilizado com CSS na sua folha de estilo externa . Opções de entrada: selecione um dos quatro temas disponíveis para os estilos de campos e botões. Estilo: personalize a largura do campo, as fontes e as cores do formulário. Teste: se você tiver campos progressivos ou dependentes neste formulário, poderá testar como eles serão exibidos para os visitantes. Utilizar automações com formulários Utilize recursos de automação simples, tais como enviar um e-mail de acompanhamento a um contato ou enviar notificações internas automáticas por e-mail com seus formulários. Você também pode utilizar o envio de formulário como um gatilho em um fluxo de trabalho simples. Saiba mais sobre como utilizar automação com a ferramenta de formulários. Na parte superior, clique na guia Automação . Na guia Automação , você pode configurar o que acontece depois que o formulário é enviado. Na seção Automatize o que acontece depois que um formulário é enviado , personalize as configurações do seu formulário conforme necessário. Na seção Crie seu próprio fluxo de trabalho simples , configure um fluxo de trabalho simples para automatizar as ações de acompanhamento, como o envio de um e-mail ou a definição de uma propriedade de contato. Usar um formulário Depois de criar um novo formulário ou fazer atualizações em um formulário existente, você precisará atualizar o formulário para que as alterações sejam aplicadas. Em seguida, adicione-o ao conteúdo do HubSpot , use o código de inserção de formulário para adicioná-lo a uma página externa ou compartilhe-o como uma página autônoma com um link de compartilhamento . Na sua conta da HubSpot, navegue até Marketing > Formulários . Crie um novo formulário ou passe o mouse sobre um formulário existente e clique em Editar . No canto superior direito, clique em Atualizar para publicar as atualizações do formulário. A publicação dos formulários não pode ser cancelada. Se o formulário for incorporado a uma página externa, você poderá remover manualmente o código de incorporação. No entanto, a única forma de desativar a página do formulário independente é excluindo o formulário . Forms",https://knowledge.hubspot.com/pt/forms/create-forms
870,Sync ownership between contacts and companies,"The Contact owner and Company owner properties assign users as owners of contact and company records. By default, the properties are independent of each other, so the user who owns a company record may not own the associated contacts . To maintain consistent ownership between associated companies and contacts, you can turn on the sync ownership setting. To sync ownership between contacts and companies: In your HubSpot account, click the settings settings icon in the top navigation bar. In the left sidebar menu, navigate to Objects > Contacts. In the Automation section, select the checkbox to Assign company owner to contact by default . With this setting enabled: For a contact's primary company association , the Company owner property will update the Contact owner property. The Contact owner property will not overwrite the associated primary company's Company owner property, unless the Company owner property is blank. You can manually assign a new contact owner. In this case, the Contact owner property will not revert back to the value in the associated Company owner property. The setting does not update the owner or records retroactively and it does not affect any custom HubSpot user field type properties . CRM records Object Settings",https://knowledge.hubspot.com/object-settings/sync-ownership-between-contacts-and-companies
871,Usar as ramificações se/então em bots,"Use ramificações if/then para personalizar o fluxo de conversas de bot . Você pode adicionar condições para mandar o bot ignorar uma ação específica com base na resposta do visitante, nos valores de uma propriedade de contato ou na disponibilidade da sua equipe. Configure uma ramificação se/então para ações de bot ou para cada resposta rápida em uma ação. Da mesma forma que as ramificações de fluxo de trabalho , as ramificações se/então permitem enviar um visitante por um caminho específico, dependendo dos critérios definidos. Por exemplo, você pode enviar visitantes para diferentes ações de bot, dependendo se eles responderem “sim” ou “não” à pergunta do bot. Isso ajuda a desencadear diferentes ações de bot para que você possa adaptar o fluxo da conversa ao visitante individual com base nas informações que ele fornece. Observe: usuários gratuitos e Iniciante os usuários não podem adicionar ramificações if/then ao seu bot. Configurar uma ramificação se/então para uma ação de bot Adicione uma ramificação se/então a uma ação de bot para controlar a ação seguinte quando o visitante cumprir determinados critérios. Na sua conta HubSpot, acesse Automações > Fluxos de chat . Passe o mouse sobre o bot e clique Editar , ou crie um novo bot . No editor de bot, selecione um Ação . No painel direito, clique na guia Ramificações se/então . Clique em Adicionar ramificação se/então . Crie condições para esta ação. Você pode basear a lógica na resposta do usuário, em um valor de propriedade de contato ou na disponibilidade do agente. Clique no primeiro menu suspenso e defina seus critérios: Resposta do visitante: use esta opção para direcionar os visitantes por um caminho específico com base em suas respostas. Por exemplo, você pode enviar visitantes para diferentes ações de bot, dependendo se eles responderem “sim” ou “não” à pergunta do bot. Clique no menu suspenso e selecione uma opção de filtro . Clique em Adicionar valores e digite qualquer valor pelo qual você queira filtrar as conversas, e clique em Enter . Clique no menu suspenso Próxima ação se todas as condições forem verdadeiras e selecione uma ação . Imóvel de contato: enviar um visitante por um caminho específico com base em um valor de propriedade de contato. Clique no Selecione uma propriedade menu suspenso e selecione um propriedade . Clique no menu suspenso e selecione uma opção de filtro . Clique no Adicionar valores menu suspenso e selecione valores de propriedade ou digite qualquer valor você deseja criar condições e pressione Digitar para adicioná-lo à sua lista. Clique no menu suspenso Próxima ação se todas as condições forem verdadeiras e selecione uma ação . Disponibilidade do agente (somente para Sales Hub ou Service Hub Professional ou Enterprise ): envie um visitante por um caminho específico com base na disponibilidade do membro da equipe. Por exemplo, se um membro da equipe estiver indisponível, você poderá enviar o visitante para o Envie um tíquete Ação para que você ainda possa acompanhar o problema do visitante. Observe: você só pode selecionar usuários no menu suspenso que estão atribuídos a um pago Centro de vendas ou Centro de serviços assento . Saiba mais sobre o requisitos para roteamento automático de conversas . Clique no primeiro menu suspenso e decida a quem encaminhar o visitante com base na disponibilidade: Usuários e equipes específicos: envie o visitante por um caminho específico com base na disponibilidade de um usuário ou equipes específicas. Clique no menu suspenso Adicionar um usuário ou equipe e marque as caixas de seleção ao lado dos usuários ou equipes a incluir. Proprietário do contato: envie o visitante por um caminho específico com base na disponibilidade do proprietário do contato. Clique no Se não houver proprietário do contato, atribua a menu suspenso e selecione uma opção alternativa para visitantes novos ou não atribuídos que iniciam uma conversa. O usuário selecionado deve ter um atribuído Centro de vendas ou Centro de serviços assento pago . Para definir a lógica com base na disponibilidade ou indisponibilidade do membro da equipe, clique no último menu suspenso e selecione está indisponível ou está disponível . Clique no menu suspenso Próxima ação se todas as condições forem verdadeiras e selecione uma ação . Clique E para criar regras adicionais. Clique em Salvar . Você também pode enviar um visitante para uma ação anterior . Depois de clicar no menu suspenso Próxima ação se todas as condições forem verdadeiras , selecione uma ação anterior no menu suspenso. O contato irá “voltar” para a etapa anterior. Configurar a ramificação se/então para respostas rápidas Se você estiver usando respostas rápidas em um ação de bot para exibir uma série de respostas predefinidas durante uma conversa, configure ramificações se/então com base nessas respostas rápidas. Dependendo da resposta predefinida que ele selecionar, o visitante irá para a ação especificada. Na sua conta HubSpot, acesse Automações > Fluxos de chat . Selecione uma ação para modificar. No painel direito, clique no Respostas rápidas menu suspenso e digite para adicionar respostas que seu visitante pode selecionar como respostas ao seu prompt de mensagem. aperte o Digitar chave para salvar cada um. Ao conversar com um visitante, as respostas rápidas aparecerão como opções selecionáveis. Para exigir que os visitantes escolham uma de suas respostas pré-determinadas, selecione a opção Desativar respostas abertas caixa de seleção. Clique no Salvar na propriedade HubSpot menu suspenso para selecionar ou pesquisar o propriedade que armazenará sua resposta. Depois de inserir suas respostas rápidas, clique em Vá para a ação com base na resposta para configurar a ramificação se/então. Por padrão, o bot enviará o visitante à próxima ação. Ao lado de cada resposta, clique no Continuar para a próxima ação menu suspenso e selecione outro Ação . Clique no X ao lado de uma ação para remover a ramificação. Observação: se você clicar no X para remover a ramificação, também removerá a opção como resposta rápida. Você precisará adicionar novamente a resposta rápida para que ela seja exibida durante uma conversa. Depois de personalizar a lógica do seu bot, clique no botão Caso contrário, vá para menu suspenso e selecione qual ação deve ocorrer a seguir se o visitante o fizer não atender a qualquer uma das condições estabelecidas. Clique em Salvar . Revise sua lógica de ramificação e clique em Salvar no canto inferior esquerdo. Quando um visitante se envolve com o bot no seu site, ele vai para a próxima ação especificada em sua lógica de ramificação se/então com base na resposta rápida selecionada. Observação: você não pode excluir uma ação que está usando uma ramificação se/então. Exclua primeiro a ramificação se/então e, em seguida, exclua a ação. Revisar ramificação Para ver o caminho que os visitantes seguirão quando atenderem a uma determinada condição, selecione uma resposta de ramificação se/então . A próxima ação será exibida no criador de bot. Para revisar e solucionar problemas da sua lógica de ramificação: No canto superior direito do editor de bot, clique em Ir para a ação . Selecione uma ação no menu suspenso. A ação aparecerá no editor de bot para você revisar e editar. Chatflows",https://knowledge.hubspot.com/pt/chatflows/use-if-then-branches-with-chatflows
