id,titulo,conteudo,link
551,Solucionar problemas de integração de sincronização de dados do QuickBooks Online,"Revise os possíveis motivos pelos quais os registros não estão sincronizando entre HubSpot e QuickBooks. Erros comuns Se você não estiver vendo a sincronização da sua fatura com o QuickBooks Online dentro de alguns minutos, há vários motivos pelos quais a sincronização pode falhar. Se alguma fatura não for sincronizada, um banner será exibido no topo da página de índice de faturas. Clicando Detalhes da falha de sincronização vai abrir o Falha na sincronização painel no Configurações de integração do QuickBooks . Você também pode verificar se a sincronização da fatura foi bem-sucedida consultando o Cartão de sincronização de integrações no painel de visualização da fatura. Todas as falhas de sincronização, incluindo a sincronização de faturas, podem ser encontradas no seu Página de configurações on-line do QuickBooks . Abaixo estão alguns erros comuns que você pode encontrar e como resolvê-los. Uma fatura deve ter um cliente associado. Certifique-se de que o cliente associado esteja presente no HubSpot e no QuickBooks Online para sincronizar esta fatura Ocorre porque o contato na fatura não foi encontrado no QuickBooks Online quando a fatura tentou sincronizar. Na maioria das vezes, isso ocorre porque o contato na fatura não compartilha o endereço de e-mail do cliente no QuickBooks. Se você alterar o contato na fatura no HubSpot para o contato que corresponde ao e-mail do cliente no QuickBooks, a fatura será sincronizada. O nome de exibição é uma duplicata Nome de exibição os campos devem ser exclusivos no Quickbooks Online. O primeiro contato de uma empresa terá seu Nome de exibição definido como o nome da empresa, mas todos os contatos dessa empresa que tentarem sincronizar com QuickBooks Online após o primeiro contato não conseguirão sincronizar, porque seus Nome de exibição já está em uso. Consulte Este artigo . Erro de validação comercial: insira uma data de serviço para o item de linha de reconhecimento de receita Este erro pode ocorrer se você estiver usando QuickBooks Online Funcionalidade de reconhecimento de receita . O reconhecimento de receita exige que todos os itens de linha de uma fatura tenham uma data de serviço. Não é possível adicionar uma data de serviço aos itens de linha do HubSpot, portanto, é recomendável desativar a configuração de reconhecimento de receita em QuickBooks e fazer relatórios de reconhecimento de receita separadamente. Modificações de itens de linha ou valores de faturas em faturas nativas da HubSpot não podem ser feitas por meio de aplicativos externos. Faça as alterações necessárias diretamente no HubSpot Ocorre porque uma fatura criada no HubSpot foi alterada no QuickBooks Online. Reverta as alterações na fatura no QuickBooks e faça esses ajustes na fatura no HubSpot para continuar a sincronização. Erro de número de documento duplicado: você deve especificar um número diferente. Este número já foi usado Ocorre quando a integração tenta enviar uma fatura para QuickBooks Online com um número de fatura que já foi usado por outra fatura ou nota de crédito em QuickBooks. Na maioria das vezes, isso ocorre porque você tem o Configuração de número de transação personalizado ativado, o que faz com que Quickbooks adotem o prefixo e o número do HubSpot automaticamente. Para corrigir esse erro, é recomendável atualizar os números nas faturas ou notas de crédito no QuickBooks Online para permitir que as faturas do HubSpot fluam para o QuickBooks, em seguida, desative a configuração Números de transação personalizados . Modificações de item de linha ou valor da fatura em faturas nativas da HubSpot não podem ser feitas por meio de aplicativos externos. Faça as alterações necessárias diretamente no HubSpot Indica que uma fatura criada no HubSpot e sincronizada com QuickBooks Online teve informações financeiras (por exemplo, itens de linha, impostos) adicionadas, removidas ou modificadas no QuickBooks. Essas alterações não podem ser sincronizadas novamente no HubSpot, portanto, a sincronização da fatura está falhando. Para corrigir o erro, reverta as alterações no QuickBooks. Se você precisar modificar os detalhes financeiros de uma fatura do HubSpot, é recomendável fazer essa alteração no HubSpot e permitir a sincronização com QuickBooks. Integrations products Invoices",https://knowledge.hubspot.com/pt/integrations/troubleshoot-the-quickbooks-online-data-sync-integration
552,Chilean Value Added Tax (VAT) | Frequently asked questions,"Please note: this article has been prepared for informational purposes only. It is not intended to provide, and should not be relied on as tax advice. For any questions you should consult your own tax and/or legal advisors. If your business is located in Chile, learn how HubSpot handles VAT and how you can update HubSpot with your VAT-related information. Value Added Tax (VAT) is generally due when goods and/or services are sold and supplied. VAT applies to most goods and services that are bought and sold for use or consumption in Chile. Generally, VAT is invoiced by the supplier of goods or services, then collected from the customer. The supplier then reports and remits the collected VAT to the tax authorities. Below are frequently asked questions related to VAT for customers in Chile. Who is liable to pay VAT? Whether you're subject to VAT for HubSpot's services depends on whether you carry out activities that are subject to VAT in Chile. HubSpot will collect VAT if your business doesn’t carry out activities that are subject to VAT in Chile. If your business does carry out activities that are subject to VAT in Chile, you'll need to self-assess VAT under the reverse charge mechanism. You’re liable to pay VAT unless you provide HubSpot with the following information: A Chilean address as a your primary company address Your Tax ID number A confirmation that you’re a VAT taxpayer in Chile VAT will be charged by HubSpot if the details for points 1 and 2 are not provided in a timely fashion. How do I update HubSpot with my VAT information? Please update your HubSpot account with your current RUT number to ensure that it is included on your invoices moving forward. Only users with Account Access permissions can add VAT information to their HubSpot account. To update your VAT information: In your HubSpot account, click your account name in the top right corner, then click Account & Billing . In the Company Info tab, update your VAT number. HubSpot cannot retroactively credit or refund VAT from any current or previously issued invoices. What happens if I don’t have a Tax ID Number? A TAX ID (RUT) Number is a unique 9-digit number (XX.XXX.XXX-X) that identifies a person or entity as being registered for VAT and other tax purposes in Chile. This number should only be provided to HubSpot in the event that you are a VAT Taxpayer, and this information can be verified on the official Chile website . If you’re unable to provide a valid Tax ID Number or if you don’t confirm your VAT taxpayer status (as either a VAT taxpayer or Non-VAT taxpayer), HubSpot will charge, collect, & remit Chilean VAT to the Chilean tax authorities on its services. Why is there a VAT charge on my HubSpot Invoice? HubSpot is required to collect and remit Chilean VAT for customers who don't carry out activities that are subject to VAT in Chile. If your business carries out activities that are subject to VAT in Chile, you may need to self-assess VAT on the services purchased from HubSpot. What if I carry out activities subject to VAT in Chile and I forget to provide a Chilean Tax ID number & Taxpayer Status? Reach out to billing@hubspot.com with your Chilean Tax ID number and taxpayer status as soon as possible. HubSpot will then confirm your details with the Chilean tax authority and update your account. With a valid VAT number and taxpayer status on file, VAT will not be assessed to your account in future billing. HubSpot cannot retroactively credit or refund VAT from the current or past invoices. Is there any threshold for VAT on electronically supplied services (ESS)? No. VAT applies to all sales of HubSpot’s services in Chile where the customer does not carry out activities that are subject to VAT in Chile. Are there any exemptions for charities under which VAT may not be charged? No. VAT will be charged on all services made to charities unless you provide a Tax ID Number and confirm that you’re a VAT taxpayer. Does HubSpot provide VAT exemptions for services that are not subject to VAT? If you provide evidence that you carry out activities that are subject to VAT in Chile by providing a Tax ID Number and confirming they are a VAT taxpayer, you will not be charged VAT by HubSpot. There are currently no other exemptions available. billing",https://knowledge.hubspot.com/account/chile-value-added-tax-faq
553,Organize your feedback surveys,"Filter and segment feedback surveys and save views for future use. You can also review feedback surveys by specific responses or response tags. View your feedback surveys To view all your feedback surveys: In your HubSpot account, navigate to Automations > Surveys . On the Manage tab, view all the feedback surveys. You can filter for specific surveys and create views. On the All Responses tab, view all the responses you've received to your feedback surveys. On the Response tags tab, view all the tags created for your feedback survey submissions. Manage your feedback survey views In your HubSpot account, navigate to Automations > Surveys . In the top search bar, enter the name of the survey you want to locate. You can refine your search results by filtering by survey type, delivery method, or advanced filters: Type: Customer support (CES), Customer satisfaction (CSAT), Custom survey, or Customer loyalty (NPS) Delivery : chat, email, shareable link, or web. To filter by advanced details such as the language or published date, click Advanced filters . In the right panel, click Add filter . Select the filter criteria and refine it, then click Apply filter . To add more filter criteria, click AND or OR . Learn more about using AND and OR logic in HubSpot. To clone a filter group, click Clone . To delete a filter group, click Delete . To remove existing filter criteria, hover over the criteria and click the delete icon . To customize the feedback survey data displayed in the view, click Edit columns . You can select up to 10 columns. In the dialog box: On the left, select the checkboxes next to the properties or associations you want to appear in the view. On the right, click and drag the properties to rearrange them in the view. To remove a property, click x . To remove all columns, click Remove all columns . Click Save . To save the selected filters as a view, click Save view in the top right. Click Save to save the filters, or Save as new to save as a new view. If adding a new view, enter a name for the view and select which users can view it. Click Confirm . Feedback Surveys",https://knowledge.hubspot.com/customer-feedback/organize-your-feedback-surveys
554,Criar um segmento de correio electrónico numa sequência,"Com o encadeamento, pode configurar a sua sequência de modo a que cada e-mail seja enviado como resposta ao e-mail anterior com a mesma linha de assunto. Isto dá contexto aos seus contactos e permite-lhes ver todas as suas interacções consigo num único local. Observação: O encadeamento de sequências só está disponível com uma caixa de entrada do Gmail (G Suite) ou do Office 365 ligada . Se já estiver a enviar um e-mail a um contacto antes de o inscrever numa sequência, não pode continuar a conversa. É necessário iniciar um novo encadeamento se pretender encadear as mensagens de correio electrónico subsequentes numa sequência. Para criar uma nova mensagem de correio electrónico para enviar como resposta a uma mensagem de correio electrónico anterior numa sequência: Na sua conta HubSpot, acesse Automações > Sequências . Coloque o cursor sobre a sequência que pretende editar e clique em Edit . Clique no ícone + mais . No painel direito, clique em Correio electrónico automatizado . Em Tipo de correio electrónico , seleccionar Responder . Tenha em atenção que, se esta for a primeira mensagem de correio electrónico da sequência, só poderá seleccionar Novo tópico ; pode então seleccionar Responder para as mensagens subsequentes. Em Qual a mensagem de correio electrónico a que pretende responder? seleccione a mensagem de correio electrónico anterior na sequência à qual pretende responder. Clique em Seguinte: Adicionar conteúdo de correio electrónico . Continue os passos para criar um modelo ou utilizar um modelo existente . Os e-mails que são respostas a um e-mail anterior aparecerão como parte de uma conversa contínua na caixa de entrada deste contacto, em vez de tópicos de e-mail separados. Ele se parecerá com o threading em um thread de e-mail normal. No HubSpot, os e-mails que são respostas incluirão um ícone de resposta ao lado da linha de assunto. Para editar o encadeamento de uma mensagem de correio electrónico existente numa sequência: Na sua conta HubSpot, acesse Automações > Sequências . Seleccione o nome da sequência que pretende editar. No canto superior direito, clique em Editar . Para alterar a opção de encadeamento de uma mensagem de correio electrónico existente, clique no menu pendente Acções e seleccione Editar encadeamento . No painel direito, altere o seu tipo de correio electrónico. Clique em Salvar . Observação: há um limite de tamanho de arquivo de 20 MB para arquivos anexados aos e-mails de vendas . Ao encadear e-mails de sequências, quaisquer anexos de e-mail serão incluídos em todas as respostas no thread, o que poderá atingir o limite de tamanho do arquivo. Sequences",https://knowledge.hubspot.com/pt/sequences/create-an-email-thread-with-your-sequence
555,Configurar os tipos de assinatura de e-mail,"Os tipos de assinatura representam a base jurídica para se comunicar com seus contatos por e-mail . Os contatos podem gerenciar suas preferências de e-mail para que mantenham a assinatura somente dos e-mails que desejam receber. Se sua conta tiver acesso a contatos de marketing , somente e-mails de marketing poderão ser enviados. Observação: os tipos de assinatura personalizados não estão disponíveis para contas do CRM da HubSpot; porém, se você tiver ativado a opção de privacidade de dados na sua conta, poderá adicionar os tipos de assinatura de E-mail de marketing ou E-mail de vendas aos contatos manualmente. Compreender as preferências de assinatura e os tipos de assinatura Para verificar o status de um contato para um tipo de assinatura: Na sua conta HubSpot, acesse CRM > Contatos . Clique no nome de um contato. Na seção Assinaturas de comunicação , ao lado esquerdo do registro do contato, clique em Visualizar assinaturas . No painel direito, revise o status para cada um dos seus tipos de assinatura. Os três status possíveis para um tipo de assinatura são Assinado , Assinatura cancelada ou Não especificado . Se você tiver ativado a opção de privacidade de dados , esse status corresponderá ao estado de adesão, que determina se você pode enviar e-mails: Se você tiver a opção de privacidade de dados ativada e aplicada, os tipos de assinatura capturarão três status para representar claramente o consentimento de um contato para comunicação. Para cada tipo de assinatura, os contatos podem ter um dos três status a seguir: Optou por aderir: se um contato tiver esse status, ele consentiu explicitamente em receber e-mails da sua marca. Isso corresponde a um status de Assinatura para um determinado tipo de assinatura. Não fez nenhuma opção (padrão): um contato com esse status ainda não concordou se deve ou não receber e-mails da sua marca. Esse status corresponde ao de Não especificado para um tipo de assinatura. Você não pode enviar um e-mail a um contato nesse status sem obter primeiro um consentimento explícito . Optou por não aderir: um contato com esse status cancelou a o recebimento de e-mails da sua marca. Esse status corresponde ao de Assinatura cancelada para um determinado tipo de assinatura. Você não pode enviar um e-mail a um contato se o status associado ao tipo de assinatura do e-mail for de Assinatura cancelada . Se você não tiver a opção de privacidade de dados ativada, o status de um contato para um tipo de assinatura pode ter um dos dois status a seguir: Optou por aderir ou Optou por não aderir (padrão) : um contato pode ter esse status se ele se inscreveu em um determinado tipo de assinatura ou ainda não concordou em receber e-mails da sua marca. Esse status corresponde ao de Assinado e Não especificado para um determinado tipo de assinatura. Observação: se a opção de privacidade de dados estiver desativada, você poderá enviar e-mails aos contatos se o tipo de assinatura deles for Não especificado , mas é altamente recomendado obter o consentimento explícito antes de se comunicar com eles para manter uma boa reputação de envio de e-mails. Optou por não aderir: um contato com esse status cancelou a o recebimento de e-mails da sua marca. Esse status corresponde ao de Assinatura cancelada para um determinado tipo de assinatura. Você não pode enviar um e-mail a um contato se o status associado ao tipo de assinatura do e-mail for de Não especificado. Os status do tipo de assinatura podem ser atualizados manualmente por um indivíduo, em massa com um fluxo de trabalho ou via API . Comunicar-se com os contatos Se você tiver ativado a opção de privacidade de dados na sua conta e marcado a caixa de seleção Somente permitir o envio de e-mails de marketing para contatos que tenham uma base jurídica para a comunicação nas configurações da conta, os e-mails só poderão ser enviados para os contatos que tiverem o status Optou por aderir . Os contatos podem optar por aderir aos tipos de assinatura de e-mail por meio de um formulário que inclui um aviso de consentimento . Ao aplicar manualmente a base jurídica , você também selecionará uma base jurídica para se comunicar. Se você precisar estabelecer um consentimento com seus contatos existentes, poderá enviar aos contatos um link para atualizar suas preferências de e-mail ou executar uma campanha de permissão . Se não estiver usando as ferramentas de privacidade de dados na sua conta, os e-mails poderão ser enviados para os contatos com status Inscrito ou Saiu ou não inscrito . Os e-mails não serão entregues aos contatos que optaram por não aderir a esse tipo de assinatura. Para rastrear quais contatos querem assinar cada um dos tipos de assinatura, use uma propriedade personalizada em um formulário . Observação: os e-mails que contêm um link de confirmação de assinatura contornarão o processo de aplicação da privacidade de dados e continuarão a ser recebidos pelos contatos que não optaram explicitamente por aderir. Além das opções de privacidade de dados acima, se você tiver acesso à funcionalidade de contatos de marketing , os e-mails de marketing somente poderão ser enviados para os contatos de marketing. Configurar um tipo de assinatura Um tipo de assinatura de e-mail pode ser criado e gerenciado nas configurações de e-mail: Na sua conta HubSpot, clique no ícone de configurações settings icon na barra de navegação superior. No menu da barra lateral esquerda, clique em Marketing > E-mail . Clique na guia Tipos de assinatura . Clique em Criar tipo de assinatura .​​ Insira um nome e uma breve descrição de como esse tipo de assinatura será usado. Se você ativou a opção de privacidade de dados na sua conta, poderá configurar opcionalmente seu tipo de assinatura para deixar claro aos assinantes como e por que você entrará em contato com eles. Clique no menu suspenso Finalidade da assinatura e selecione uma finalidade para o tipo de assinatura. Essa finalidade deve se alinhar com a natureza dos e-mails que você pretende enviar aos assinantes associados. Saiba mais sobre tipos de assinatura comuns no blog de marketing da HubSpot . Clique no menu suspenso Método de comunicação e selecione um método para como você pretende entrar em contato com os assinantes. Quando um contato avalia seu tipo de assinatura, primeiro serão exibidos a finalidade e o método de comunicação, seguidos pelo nome e descrição. Você pode confirmar como seu tipo de assinatura será exibido em Visualização . Clique em Salvar . Na guia Tipos de assinatura , clique em um tipo de assinatura e arraste-o e solte-o na posição para reordenar seus tipos de assinatura. Isso controla a ordem que os tipos de assinatura aparecem na página de preferências de assinatura . Observação: Se você tiver contatos internacionais, poderá criar traduções dos seus tipos de assinatura de e-mail, que serão renderizadas com base no idioma do navegador dos destinatários. Saiba mais sobre como adicionar traduções para cada um dos seus tipos de assinatura neste artigo . Você pode criar até 1.000 tipos de assinatura na sua conta da HubSpot. Editar um tipo de assinatura. Para fazer alterações nas informações do tipo de assinatura: Na sua conta HubSpot, clique no ícone de configurações settings icon na barra de navegação superior. No menu da barra lateral esquerda, clique em Marketing > E-mail . Clique na guia Tipos de assinatura . Passe o cursor do mouse sobre o tipo e clique em Editar . Faça as alterações conforme necessário e clique em Salvar . Observação: se você tiver ativado a opção de privacidade de dados na sua conta , não será possível editar o campo Finalidade da assinatura ou Método de comunicação para os tipos de assinatura padrão, como os tipos de assinatura de Vendas e Serviços . Arquivar uma assinatura Se não precisar mais de um tipo de assinatura, você pode arquivá-lo: Na sua conta HubSpot, clique no ícone de configurações settings icon na barra de navegação superior. No menu da barra lateral esquerda, acesse Marketing > E-mail . Clique na guia Tipos de assinatura . Passe o cursor sobre o tipo de assinatura que pretende arquivar, clique em Ações e , em seguida, clique em Arquivar . Na caixa de diálogo, clique em Arquivar tipo de assinatura . Observação: se você arquivar o tipo de assinatura Individual , mas depois enviar um e-mail individual ou usar o tipo de assinatura em outra ferramenta, como um formulário, sequência ou fluxo de trabalho, o HubSpot desarquivará o tipo de assinatura automaticamente e ele ficará visível novamente na sua página de preferências de assinatura . Gerenciar propriedades de contato para tipos de assinatura Depois de criar um novo tipo de assinatura, uma propriedade de contato Optou por não aderir: [Tipo de assinatura de e-mail] correspondente será criada. Enquanto a propriedade estará visível no registro de um contato imediatamente, os contatos existentes não terão um valor definido para isso até que um dos seguintes eventos ocorra: O contato está mesclado com outro contato. O contato tem suas propriedades de endereço de e-mail alteradas. O contato explicitamente opta ou não optou desse tipo de e-mail. Uma integração (ou seja, API pública) marca explicitamente o contato como ativado ou desativado desse tipo de e-mail. Qualquer alteração no tipo de assinatura atualizará essa propriedade de contato existente. Renomear um tipo de e-mail fará com que a propriedade correspondente seja renomeada. Marcar um tipo de e-mail como inativo fará com que a propriedade correspondente seja ocultada do registro do contato e vice-versa. Marketing Email",https://knowledge.hubspot.com/pt/marketing-email/set-up-email-subscription-types
