id,titulo,conteudo,link
1501,Export your CTA (legacy) performance data,"After creating a CTA (legacy) and reviewing the CTA's performance, you can export this data in a csv, xls, or xlsx file from your CTA dashboard. Please note: accounts created after March 17th, 2025, do not have access to the CTA (legacy) tool. To export your CTA performance data: In your HubSpot account, navigate to Marketing > CTAs . In the top left, click the dropdown menu and select CTAs (Legacy) . In the upper right, click download Export Data . In the dialog box, select the File Type for your export file and enter the Email address to send export to . Click Export to receive an email with a download link to the export file. The download link will be valid for 90 days. CTAs",https://knowledge.hubspot.com/cta/can-i-export-my-cta-data
1502,Adicione conteúdo padrão ao seu modelo,"Você pode adicionar conteúdo padrão à maioria dos módulos de modelo, que podem ser usados para criar um ponto de partida para o conteúdo usando esse módulo. Você pode editar o conteúdo no editor de conteúdo ou também pode evitar edição em editores de conteúdo para bloquear o conteúdo padrão no modelo. Observe: depois que um módulo contendo conteúdo padrão for editado no editor de conteúdo, qualquer novo conteúdo padrão no gerenciador de design não substituirá as versões editadas desse módulo. Acesse seu conteúdo: Páginas do site : Na sua conta da HubSpot, acesse Conteúdo > Páginas do site . Landing Pages : Na sua conta da HubSpot, acesse Conteúdo > Landing pages . Blog : Na sua conta da HubSpot, acesse Conteúdo > Blog . E-mail : Na sua conta da HubSpot, navegue até Marketing > E-mail . Clique no nome do seu conteúdo. Para postagens e páginas de blog: No editor de conteúdo, clique no botão Configurações menu e selecione Modelo . Na caixa de diálogo, clique em Edite este modelo . Para e-mails: No editor da barra lateral, clique no botão Projeto aba. No Modelo seção, clique no Ações menu suspenso e selecione Edite este modelo . No gerenciador de design, clique no botão módulo no editor de layout. Na coluna da direita, role para baixo até o Conteúdo padrão seção. As opções que aparecem nesta seção variam de acordo com o módulo. Para evitar que o conteúdo padrão deste módulo seja editado no editor de conteúdo, role para baixo até o Opções do editor seção na coluna da direita e clique para alternar a Impedir a edição em editores de conteúdo ligar. Para visualizar seu conteúdo padrão no modelo, clique no botão Visualização menu suspenso no canto superior direito e selecione Visualização ao vivo com opções de exibição . Para ativar suas alterações, clique em Publicar alterações no canto superior direito. Design Manager",https://knowledge.hubspot.com/pt/design-manager/add-default-content-to-your-template
1503,Preencher automaticamente campos de formulário com uma linha de consulta,"Você pode preencher automaticamente os campos de formulário em uma página adicionando strings de consulta à URL da página antes de enviá-lo aos seus contatos. Os campos serão preenchidos com base na string de consulta adicionada. Isso também funciona para campos de formulário ocultos . Por exemplo, você pode criar propriedades UTM personalizadas e usar parâmetros UTM para preencher automaticamente um campo de formulário oculto . Para criar uma URL com uma string de consulta, você precisará copiar o nome da propriedade interna de quaisquer campos que queira preencher previamente, depois adicioná-los ao final da URL da página. Observe: não é possível usar sequências de consulta para campos para preencher automaticamente campos de formulário dependentes . A HubSpot também não pode disparar campos dependentes com base em vários valores dentro das strings de consulta. Copiar o nome interno da propriedade Para encontrar o nome interno de uma propriedade: Na sua conta HubSpot, clique no ícone de configurações settings icon na barra de navegação superior. No menu da barra lateral esquerda, vá para Propriedades . Clique no nome de uma propriedade para preencher previamente os valores. Copiar o nome interno da propriedade. Saiba mais sobre nomes internos aqui . Repita isso para quaisquer outras propriedades que você deseja pré-preencher no seu formulário. Create static query strings with pre-defined values Após copiar os nomes das propriedades internas, configure o URL da página que você enviará aos contatos: No navegador, acesse a página do seu formulário. Em seguida, copie o URL . Adicionar um sinal de interrogação (?) ao final do URL da página. Adicione o nome interno da propriedade, seguido por um sinal de igual e o valor para preencher automaticamente no campo. Anote as regras para adicionar valores, dependendo do tipo de campo da propriedade Caixa de seleção única: as sequências de consulta devem conter um valor verdadeiro ou falso, não sim ou não. Selecionador de data: As sequências de consulta devem conter um valor de data em um formato AAAA-MM-DD. Várias caixas de seleção: valores de linha de consulta devem coincidir exatamente com as opções de valor da propriedade, com uma divisão de vários valores. Seleção de botões de seleção/menu suspenso: valores de linha de consulta devem corresponder exatamente às opções de valor da propriedade. Para todos os tipos de campo: ao criar strings de consulta, essas regras se aplicam a todos os tipos de campo. Os espaços em um valor de propriedade devem ser separados por %20. Várias propriedades diferentes devem ser separadas com um ""e"" comercial (&). Exemplo de URL com uma string de consulta Após criar o URL com as sequências de consulta estática, você pode usá-lo como um link em seu conteúdo, como e-mails e páginas. Um contato que clicar no link verá o formulário na página preenchido automaticamente com os valores predefinidos na string de consulta. Veja um exemplo e um detalhamento de uma URL com strings de consulta estática formatadas corretamente: http://www.domain.com/marketing-offer ?firstname=John&lastname=Smith&email=jsmith@email.com &favorite_season=Winter%20Season&favorite_fast_food=Burger;Taco&number_property=7 &will_you_come_to_the_party=Maybe&do_you_like_parties=true&date_of_party=2018-10-24 Início da linha de consulta e campo de texto de linha única: ?nome=John Campo de texto de linha única: &sobrenome=Smith Campo de texto de linha única: &e-mail=jsmik@e-mail.com Campo de seleção do menu suspenso: &favorite_season=Winter%20Season Vários campos de caixas de seleção: &favorite_fast_food=Burger;Tacos Campo de números: &número_favorito=7 Campo de seleção de e-mail: &você_irá_vir_para_a_festa=Talvez Campo de caixa de seleção única: &você_gosta_de_festas=verdadeiro Campo de escolha de data: &date_of_party=2018-10-2 Criar strings de consulta dinâmicas com tokens de personalização (somente Marketing Hub Professional ou Enterprise ) Você pode usar tokens de personalização para criar sequências de consulta dinâmica que serão preenchidos automaticamente com base nas propriedades de contato conhecidas. Observação: As strings de consulta dinâmicas com tokens de personalização somente funcionarão corretamente quando o URL for direcionado para uma página hospedada pela HubSpot com um formulário da HubSpot. Esta funcionalidade não funcionará se o URL for direcionado para uma página de formulário independente da HubSpot . O URL com as strings de consulta dinâmicas também deve ser adicionado ao seu conteúdo da HubSpot ou a uma página externa que tenha seu código de rastreamento da HubSpot . Recupere seu token de personalização Primeiro, recupere os tokens de personalização necessários para criar as strings de consulta. Para recuperar um token de personalização de uma propriedade: Na sua conta da HubSpot, navegue até Marketing > E-mail . Clique em Criar e-mail ou o nome de um e-mail de rascunho. Na barra de ferramentas de rich text, clique em Personalizar . Configure seus tokens de personalização: Na caixa de diálogo, selecione um token de personalização para preencher automaticamente no seu formulário. Marque a caixa de seleção Usar o valor padrão global dessa propriedade ao inserir o token de personalização. Continue adicionando tokens de personalização adicionais se necessário. Na barra de ferramentas de rich text, clique em Mais > codef ícone de código-fonte para exibir o HTML do e-mail. No código fonte, você verá o código bruto para cada token de personalização adicionado ao corpo do e-mail. Cada token será colocado entre colchetes duplos {{ }}. Destaque um token (por exemplo, {{ contact.firstname }} ), clique com o botão direito do mouse e selecione Copiar . Repita isso para qualquer tokens de personalização que você deseja pré-preencher no seu formulário. Na parte inferior da caixa de diálogo, clique em Cancelar e fechar para sair do código-fonte. Crie seu URL com strings de consulta dinâmicas Utilize os tokens de personalização para criar um URL com strings de consulta dinâmicas. Este URL pode ser usado como um link no conteúdo do HubSpot, como e-mails e páginas, ou como uma página externa com seu código de rastreamento da HubSpot . Um contato que clicar no link verá o formulário na página preenchido automaticamente com suas informações se tiver valores conhecidos para os campos na string de consulta. Para criar um URL com strings de consulta dinâmicas: No navegador, acesse a página do seu formulário. Em seguida, copie o URL . Usando o URL da página e os tokens de personalização, formate a string de consulta dinâmica: Adicionar um sinal de interrogação (?) ao final do URL da página. Adicione o nome interno da propriedade, seguido por um símbolo igual e token de personalização. Verifique se todos os espaços foram removidos do token (por exemplo, {{contact.firstname}}). Separe várias propriedades com e comercial (&). Veja um exemplo de um URL com strings de consultas dinâmicas formatadas corretamente: http://www.domain.com/marketing-offer ?firstname={{contact.firstname}}&lastname={{contact.lastname}}&email={{contact.email}} Forms",https://knowledge.hubspot.com/pt/forms/can-i-auto-populate-form-fields-through-a-query-string
1504,Use journeys (BETA),"Use journeys to build engaging and personalized marketing automation experiences all within the same view, instead of building across a handful of workflows . Marketers can build out marketing strategies, including lead generation, lead nurturing, or customer re-engagement campaigns. After creating your journey, you can analyze your journey's performance and report on your marketing automation efforts. Please note: this feature is in BETA, learn how to opt your account into the beta . Create journeys When creating journeys, enroll contacts using an enumeration property and selected lists. You can assign each journey stage to a different property value. Each stage will work as an automated flow. Contacts will move through the journey on different paths depending on their progress through each stage. In each journey, you can set one goal exit end based on your goals, corresponding to the journey property value selected. However, you can have multiple unsuccessful ends based on different property values. For example, you can set up a journey with the new default Journey stage property. Then, create stages for each of the Journey stage property values and add actions to automatically execute at each stage. Finally, set Journey stage property values for your goal exit and exits . Create a new journey Each user can create up to 10 journeys. To create a new journey: In your HubSpot account, navigate to Automations > Journeys . In the top right, click Create journey . To create a journey from scratch: In the right panel, select Start from scratch . In the bottom right, click Next . You'll be directed to the journey editor. Then, continue setting up your journey. To create a journey from a template: In the right panel, select Use a template . In the bottom right, click Next . Select your template . Then, click Next . You'll be directed to the journey editor. Then, continue setting up your journey. If you're creating a journey for the first time, to learn how to create a journey from scratch: In the right panel, select Guided setup . In the bottom right, click Next . Then, follow the guided tour to create a new journey. In the journey editor, you can review your journey as different engagement paths, or as a single journey tree. To select your view, in the top right, click the engagement path icon or the tree icon . Set up journey enrollment When building a new journey, select your lists for enrollment and center your journey around a property such as Journey stage or lifecycle stage . You can use any enumeration property such as a dropdown select, multiple checkboxes, or radio select type property. When setting up a journey, you can assign specific property values to different journey stages. When a contact is updated with a specific property value, they will enroll in the corresponding stage. After setting up your journey, it is still possible to change the journey's enrollment property and property values used for each stage. Please note: you cannot select the same eligibility lists and property as another journey. To set up a new journey, you must select different lists or a different property for enrollment. To set up your enrollment criteria: In the top left, click Enrollment . Click the They're in any of the selected lists dropdown menu and select the contact lists with contacts eligible to enroll in the journey. This does not mean that the contacts will automatically enroll. Contacts will still need to meet either the journey's starting criteria or any of the stage values in order to enroll. Contacts will still continue in the journey even if removed from lists after enrolling. You can select up to five lists. Learn more about using lists . Click the Contact property equals value dropdown menu and select a property . Set up journey unenrollment To set up unenrollment criteria in the journey editor: In the top left, click Enrollment . In the left panel, click the Unenrollment tab. Select the checkboxes next to the unenrollment criteria that you'd like to apply: Are on or join a suppression list: unenroll contacts from the journey when they're added to any of the selected suppression lists. Are removed from enrollment lists: unenroll contacts from the journey if they're no longer in the enrollment lists. Match an end stage early: unenroll contacts from the journey if they match an end stage in the journey. When selecting this option, contacts will skip any final actions associated with the end stage. Change the journey enrollment criteria If you've previously set up your journey with a different property, to update the property used: In the top left, click Enrollment . In the right panel, click the Contact property equals value dropdown menu and select a new property . At the top, click Save . In the dialog box, select a corresponding stage value based on the new property. At the bottom, click Save updates . To select the stages' property values later, click Skip . Select a journey's starting stage Select a property value from the enrollment property to begin enrolling contacts into your journey: In the journey editor, from the starting stage, click Details . In the left panel, set up your journey starting stage: Click the first dropdown menu and select a property . If you've previously selected a property when setting up enrollment, the property will appear by default. Click the second dropdown menu and select a property value to set as your enrollment stage value. To enroll new contacts with no property value for the selected property, select the Enroll contacts with blank value in this stage checkbox. In the top, click Save . Configure your journey stages and actions To add more stages and actions to each of your journey stages: In the journey editor, hover over the line and click the + icon . Then, select Add new stage . When adding a new stage to an unsuccessful path: If you are in the tree view, this will create a new branch. If you are in the engagement path view, this will create a new alternative path section in the editor. You can click the collapse icon to collapse and expand each section. You can add up 10 stages per journey. . After adding a stage you can add actions to your newly added stages. In the stage, click the menu icon and select Edit flow . You must add at least one action for each stage. You can add up to 50 actions per stage. Select from the following action types: Touchpoint actions: select from the following touchpoint actions. Send Assets: send an automated marketing email, SMS, or WhatsApp message to the contact. When setting up this action, you can trigger all three asset types to send at once. Wait: add a delay for a specified amount of time. Wait until activity: delay until a specific user activity occurs. For example, delay until the user submits a form, visits a specific page on a website, replies to an email, or more. Process actions: select from the following process actions. Create task: create and add a task to the enrolled contact. This task will also appear in the tasks page. Learn more about using tasks. Set property: set a specific property value for the enrolled contact. You can configure the stage used for the journey automation. Send notification: send an in-app or internal email notification. You can send the notification to specific users, teams, or the enrolled contact's existing owners. Go to: associate the stage with a successful or unsuccessful end. After setting up your actions, in the top left click Exit to journey . . To route a contact back to an earlier stage, hover over the line and click the + icon . Then, select Go to stage . This option can only be selected for stages, go to paths cannot be added between stages. To end a journey, hover over the line and click the + icon . Then, select End journey . This will automatically add a Goal exit or Exit . Determine the success of your journey Select a property value to determine the success or failure of your journey. To set up your Goal exit or Exit : In the Goal exit or Exit box, click the Set up . In the right panel, click the Set [property name] to dropdown menu and select a property value . For each end, you can also click the Add to static list dropdown menu and select a static list . This will add all contacts who have finished the journey to the selected static list. This is an optional step. Please note: you can only select one Goal exit end per journey. Turn on your journey After setting up your journey automation, in the top right, click Review and publish . In the right panel, you can review the number of contacts eligible for the journey. You can also configure the following: Do you want to enroll contacts that currently meet the enrollment criteria when the workflow turns on: choose to enroll records that currently meet the enrollment criteria or only enroll records that meet the criteria in the future. Yes, enroll existing contacts who meet the enrollment criteria immediately when the journey is turned on: enroll all existing records that meet the enrollment criteria. No, only enroll contacts who meet the enrollment criteria after the journey is turned on: only enroll records that meet the enrollment criteria after the workflow is turned on. Create dashboard with stage reports: select this option to automatically create a dashboard and reports for each stage of your journey. The dashboard and reports will count towards your reporting limits. At the bottom, click Turn on journey . Manage your journeys After turning on your journey, you can analyze the individual performance and enrollment history of each journey. In your HubSpot account, navigate to Automations > Journeys . To edit an existing journey, click Edit . You can only edit journeys that are turned off. To see which assets were used in a journey, such as emails or SMS messages, click More and select See assets used . The assets will appear in the right panel. To delete a journey, click More and select Delete . In your HubSpot account, navigate to Automations > Journeys . To review the performance of a journey, click More and select View details . In the left panel, review the journey's details. To edit the journey, at the top, click Actions . Then, select Edit . To delete a journey, at the top, click Actions . Then, select Delete . Then, select Delete . Review your journey’s performance After turning on your journey, you can analyze the enrollment history and individual performance of each journey. This includes the journey’s metrics, reporting, and details such as conversion metrics. Create and review journey reports You can create a dashboard and generate reports for your journey while publishing or at any point from within the journey editor. When publishing updates to your journey, you can also update the journey reports to match. In your HubSpot account, navigate to Automations > Journeys . Click the name of an existing journey . To create a new journey dashboard and reports: In the top right of the journey editor, click View and select Reporting . In the right panel, enter your Dashboard name . Click the Which stages do you want to create reports for dropdown menu and select the stages that you want to create reports for. By default, all stages will be selected. Click Create dashboard . You can also create a dashboard and corresponding reports when turning on the journey. After creating your dashboard and reports, to review reports for each stage: In the top right of the journey editor, click View and select Reporting . To review the overall journey dashboard, click Go to dashboard . In the Stage reports section, click Preview report for the stage you want to preview. To review the report in the reports editor, click Go to report . Please note: you cannot edit journey reports. Review a journey’s conversion metrics From the journey editor, you can review your journey’s conversion metrics for each stage of the journey. In your HubSpot account, navigate to Automations > Journeys . Click the name of an existing journey . To review your journey metrics, in the top right, click View and select Metrics . From the metrics page, you can review the following: The total enrollment count for the journey. The percentage and count of enrollments that reached each endpoint. For each stage, the percentage of enrollments that continued along each path. Review a journey’s performance To review a journey's overall performance metrics: In your HubSpot account, navigate to Automations > Journeys . Hover over the journey. Then, click More and select View details . From the Performance tab, you can review the following performance reports. The reports will only show data from when the journey was turned on. Top metrics: this report displays the total number of enrolled contacts out of all eligible contacts, the number of successful contacts, and unsuccessful contacts. Successful conversions: the percentage of successful conversions with the count of eligible contacts, enrolled contacts, and contacts that reached the journey with a successful end. Unsuccessful conversions: the percentage of successful conversions with the count of eligible contacts, enrolled contacts, and contacts that reached the journey with an unsuccessful end. Review journey enrollments To review a list of contacts that have enrolled in your journey: In your HubSpot account, navigate to Automations > Journeys . Hover over a journey. Then, click More and select View details . At the top, click the Action and enrollment logs tab. Please note: each contact can only enroll in a journey once. Contacts cannot re-enroll in a journey. Workflows",https://knowledge.hubspot.com/workflows/use-journeys
