id,titulo,conteudo,link
1808,Usando perfis de contato com a extensão do HubSpot Sales para Chrome,"Os perfis de contato aparecem no painel da barra lateral direita da sua conta de e-mail do Gmail. Você pode usar perfis de contato para acessar informações sobre seus contatos e executar ações como iniciar chamadas ou criando tarefas ou negócios , tudo isso sem sair da sua caixa de entrada. Você também pode acessar os perfis de contato em qualquer página da web, saiba mais sobre como usar o Extensão do HubSpot Sales para Chrome na web . Pesquisar o banco de dados de contatos da HubSpot Usando perfis de contato, você pode pesquisar os contatos que armazenou na HubSpot sem precisar sair da sua caixa de entrada: Faça login no Gmail. No painel direito da caixa de entrada do Gmail, clique no botão ícone de roda dentada sprocket . Observe: pode ser necessário exibir o painel lateral direito da caixa de entrada do Gmail para acessar os perfis de contato. Se o painel lateral não aparecer, no canto inferior direito, clique em Mostrar painel lateral . Para pesquisar um contato específico pelo nome ou endereço de e-mail, digite o nome ou o e-mail na barra de pesquisa. Clique no contato nome . O registro de contato do HubSpot aparecerá na barra lateral. Você também pode usar seu filtros salvos do HubSpot para pesquisar seus contatos na barra lateral de perfis de contato. Clique no Todos os contatos menu suspenso e selecione um filtro salvo . Editar propriedades de contato e criar tarefas ou negócios associados As informações sobre o contato que está armazenado no CRM aparecerão no painel lateral direito, incluindo o nome do contato Sobre seção, negócios, tarefas e atividade da linha do tempo. Você pode editar as propriedades do contato, criar uma tarefa ou negócio ou fazer uma chamada diretamente do perfil do contato. Observe: apenas chamadas, e-mails, atividades de rastreamento de e-mail, visualizações de páginas e alterações no estágio do ciclo de vida aparecem no Linha do tempo seção no perfil de contato. Para navegar diretamente para o registro do contato no CRM, clique em Abrir no CRM abaixo do nome do contato. Se o contato propriedade Cancelou a inscrição de todos os e-mails é verdadeiro, você verá uma mensagem no painel abaixo do endereço de e-mail. Editar propriedades de contato Você pode editar as propriedades do contato no perfil do contato e essas alterações também serão aplicadas ao registro do contato no CRM. Clique para expandir o Sobre seção . As propriedades listadas aqui são aquelas exibidas na visualização da barra lateral do contato. Para editar as propriedades listadas, saiba como personalize a barra lateral de visualização do seu registro . Passe o mouse sobre a propriedade do contato e clique no botão edit ícone de lápis . Insira um novo valor para a propriedade e clique em Salvar . Criar tarefas para um contato Você pode criar uma tarefa que será associada ao contato diretamente do perfil do contato. No perfil de contato, clique para expandir o Tarefas seção. Aqui, você verá as tarefas existentes que você criou que foram atribuídas a você. Clique Adicionar para criar uma nova tarefa para o contato. Insira a tarefa nome e selecione um data de vencimento para a tarefa. Clique em Salvar . A tarefa também aparecerá no página de índice de tarefas e no cadastro do contato no CRM. Criar negócios para um contato No perfil de contato, clique para expandir o Ofertas seção. O primeiro 10 negócios associados aparecerá aqui. Clique Adicionar para criar um novo acordo para registro. Digite ou selecione um valor para cada um dos campos obrigatórios. Você pode atualizar quais campos aparecem ao criar um novo negócio . No Acordo de associado com seção, clique no Contato menu suspenso e selecione o caixas de seleção para quaisquer contatos adicionais para associar ao negócio. Se necessário, clique no Empresa menu suspenso para selecionar um diferente empresa para associar o negócio. Clique Criar negócio . O acordo recém-criado aparecerá agora no perfil de contato no Gmail assim como no seu página de índice de negócios no HubSpot. Faça uma ligação Você também pode iniciar uma chamada a partir do contato perfil. No perfil de contato, clique no botão Ações menu suspenso e selecione Chamar . Você será levado ao registro do contato no HubSpot e o Chamar janela será aberta para que você possa imediatamente iniciar a chamada . Adicione os destinatários de e-mail como contatos Ao enviar um e-mail para alguém que não está em seu banco de dados de contatos do HubSpot, no perfil de contato, clique em Adicionar ao HubSpot para adicionar o contato à sua conta HubSpot. Depois de adicioná-lo, você pode editar suas respectivas propriedades de contato na barra lateral sem sair da sua conta do Gmail. Se você tiver a opção Capturar automaticamente os detalhes do contato de e-mails com a IA da HubSpot ativada na sua conta, a IA da HubSpot verificará o e-mail para obter as informações do contato. Se houver algum dado que não esteja armazenado no registro de contato, o HubSpot preencherá as propriedades ausentes com as informações obtidas do e-mail. Você pode substituir os valores de propriedade, se necessário, antes de salvar no HubSpot. Solucionando problemas com seus perfis de contato Se você vê consistentemente uma mensagem de login na barra lateral direita do Gmail ao tentar visualizar perfis de contato, pode ser necessário fazer alterações nas configurações do navegador e da caixa de entrada. Primeiro, ajuste suas configurações de cookies no Chrome: No canto superior direito do navegador Chrome, clique no botão Configurações menu (três pontos ou três linhas horizontais) e selecione Configurações . Role a tela para baixo e clique em Avançado . No Privacidade e segurança seção, clique Site Configurações . Em versões mais antigas do Chrome, isso aparece como Configurações de conteúdo . Clique Biscoitos. Certifique-se de que o Bloquear cookies de terceiros configuração está desativada. Suas alterações serão salvas automaticamente. Se você não conseguir alternar o Bloquear cookies de terceiros desligue, clique Adicionar no Permitir seção e adicione [*.]getsidekick.com , [*.].hubspot.com , e [*.]hsappstatic.net para permiti-los explicitamente. Atualize o Gmail. Além disso, alguns Gmail Labs são incompatíveis com a extensão HubSpot Sales para Chrome devido à formatação inconsistente de seus recursos beta. Especificamente, o Gmail Lab chamou Painel de visualização não é compatível com perfis de contato no Gmail. Desativar isso deve permitir que a barra lateral de perfis de contato apareça: Abrir Gmail . Clique no ícone de engrenagem e selecione Configurações . Clique no Laboratórios aba. Procurar Painel de visualização e desligue o recurso. Se ainda estiver com problemas para carregar seus perfis de contato, desative todos os outros recursos do Labs. Saiba mais sobre como solucionar problemas Extensão HubSpot Sales para Chrome . One-to-one Email",https://knowledge.hubspot.com/pt/one-to-one-email/use-contact-profiles-with-the-hubspot-sales-chrome-extension
1809,Instale o código de rastreamento do HubSpot,"O código de rastreamento da HubSpot é exclusivo para cada conta da HubSpot e permite que a HubSpot monitore o tráfego do seu site . O código de rastreamento é incluído automaticamente nas páginas de blog da HubSpot, landing pages e páginas do site. Se você tiver páginas hospedadas externamente (ou seja, páginas que não estão no HubSpot), você deve instalar o código de rastreamento da HubSpot manualmente para capturar análises para essas páginas. Saiba mais sobre como o código de rastreamento permite acompanhar os visitantes ao seu site . Se você usar o Código de rastreamento da HubSpot , os dados dos seus visitantes serão coletados e usados para monitorar o tráfego do site. A HubSpot também usa determinados dados coletados do código de rastreamento para melhorar seus produtos e serviços, incluindo o conjunto de dados comerciais do Breeze Intelligence. Você pode desativar o compartilhamento de dados com a HubSpot navegando até as configurações da conta. Saiba mais sobre os dados que são coletados pelo código de rastreamento da HubSpot . Observação: Você deve não instalar vários códigos de rastreamento da HubSpot em uma página. Se houver vários códigos de rastreamento da HubSpot instalados, o primeiro a ser carregado na página será disparado; qualquer código de rastreamento da HubSpot subsequente não funcionará. Se o seu administrador de TI ou o desenvolvedor da web estiver instalando o código, ele deverá ter uma conta de usuário da HubSpot . Se estiver usando um aplicativo de página única, confira a documentação para desenvolvedores para configurar o rastreamento. Se estiver hospedando todos os domínios ou subdomínios externamente, adicione também seu(s) domínio(s) e/ou subdomínio(s) às configurações no HubSpot. O código de rastreamento não é suportado em sites AMP. Se seu site externo estiver usando o WordPress, é recomendável instalar e usar o plug-in HubSpot All-in-One Marketing - Forms, Pop-ups, Live Chat WordPress . Isso instalará o código de rastreamento da HubSpot no site do WordPress. Se um visitante tiver um bloqueador de publicidade instalado, isso poderá interferir no código de rastreamento. Copiar o código de rastreamento do HubSpot Na sua conta HubSpot, clique no ícone de configurações settings icon na barra de navegação superior. Acesse as configurações de Rastreamento e análises : Nas contas que só têm acesso ao Marketing Starter ou às ferramentas gratuitas da HubSpot, acesse Código de rastreamento no menu da barra lateral esquerda. Para todas as outras assinaturas, acesse Rastreamento e análises > Código de rastreamento no menu da barra lateral esquerda. Na da seção Código incorporado , clique em Copiar ou em Enviar por e-mail para o desenvolvedor Web para enviar o código de rastreamento para o membro da equipe que o instalará no seu site. Instale o código de rastreamento no seu site . Instalar o código de rastreamento no seu site Para instalar o código de rastreamento, cole o código antes da tag de fechamento </body> no código HTML de cada página do seu site. Depois de instalar o código de rastreamento, saiba como verificar a instalação e a solução de problemas do código . Ao mesmo tempo, a maioria dos sistemas de gerenciamento de conteúdo e seus desenvolvedores podem instalar o código para todas as páginas no seu site, como um arquivo de rodapé citado em todas as páginas. Verifique com seus desenvolvedores como eles podem ajudar com isso. Depois de adicionar o código de rastreamento a qualquer página que não seja hospedada pela HubSpot, você deve adicionar os domínios de site externos às suas configurações de relatórios para incluí-los nas análises do HubSpot. As seções a seguir também podem ajudar se você estiver usando um sistema de gerenciamento de conteúdo específico. Observação: como cada site tem uma estrutura diferente, essas etapas podem não ser as instruções exatas sobre como acessar seu código HTML. Se não tiver certeza de como acessar o código HTML do seu site, entre em contato com o webmaster, o departamento de TI ou o desenvolvedor e mostre este artigo para eles. Instalar o código de rastreamento em um site do WordPress É altamente recomendado que você instale e use o plug-in do HubSpot All-in-One Marketing - Forms, Pop-ups, Live Chat WordPress . O plug-in instala automaticamente o código de rastreamento da HubSpot no site do WordPress para você. Se não for possível instalar o plug-in do WordPress para o HubSpot , você pode instalar manualmente o código de rastreamento da HubSpot: Siga as etapas acima para copiar o código de rastreamento da HubSpot na sua conta da HubSpot. Faça login na sua conta do WordPress. No menu da barra lateral esquerda, vá para Aparência > Editor . Na lista de arquivos de tema à direita do editor, selecione Rodapé . Cole o código de rastreamento e selecione Atualizar arquivo . Observação: Se você instalar manualmente o código de rastreamento e tiver uma assinatura do Marketing Hub da HubSpot, a HubSpot não poderá diferenciar posts e páginas do WordPress em suas análises. Se o seu site estiver hospedado no WordPress.com, você não poderá adicionar o código de rastreamento da HubSpot ao site, a menos que faça parte do plano Business deles. Outros planos (por exemplo, Premium, Personal) não permitem que os usuários adicionem qualquer código JavaScript . Instalar o código de rastreamento em um site Shopify Siga as etapas acima para copiar o código de rastreamento da HubSpot na sua conta da HubSpot. Faça login no seu painel de administração do Shopify. No menu da barra lateral à esquerda, vá para Loja online > Temas . Clique no menu suspenso Ações e selecione Editar código . Selecione o arquivo theme.liquid para o seu tema. Cole o código de rastreamento do HubSpot logo antes da tag </body> nesse arquivo. No canto superior direito, clique em Criar. Instalar o código de rastreamento em um site Drupal Siga as etapas acima para copiar o código de rastreamento da HubSpot na sua conta da HubSpot. Faça login no painel de administração do Drupal. No menu de navegação principal, vá para Estrutura . Clique em Blocos . Clique em + Adicionar bloco . Preencha os campos para o novo bloco. Cole o código de rastreamento no campo Corpo do bloco e clique em Salvar bloco . Instalar o código de rastreamento em um site Magento Siga as etapas acima para copiar o código de rastreamento da HubSpot na sua conta da HubSpot. Em seguida, c onsulte o guia do usuário de design do Magento para obter instruções sobre como instalar o código JavaScript de terceiros no HTML de cabeçalho. Instalar o código de rastreamento em um site Wix Use o App Market no Wix para adicionar um widget HTML à sua página: Siga as etapas acima para copiar o código de rastreamento da HubSpot na sua conta da HubSpot. Acesse Configurações no painel do seu site. Clique na guia Código personalizado na seção Avançado . Clique em + Adicionar código personalizado no canto superior direito. Cole o código de rastreamento na caixa de texto. Defina o Nome da nova ferramenta para o código de rastreamento da HubSpot . Em Adicionar código a páginas clique no botão de seleção para Todas as páginas e use o banner para selecionar Carregar código em cada nova página . Na seção Colocar código em , clique no botão de seleção para a opção Corpo - fim . Clique em Aplicar para salvar suas alterações. Se estiver usando um chat ao vivo ou um bot no seu site Wix, você poderá seguir as etapas acima para adicionar o fluxo de chat a todas as páginas, ou trabalhar com um desenvolvedor para usar o SDK do widget de chat para direcionar páginas específicas. Use o método .widget-refresh para especificar fluxos de chat diferentes em páginas diferentes. Saiba mais nos documentos para desenvolvedores da HubSpot. Como instalar o código de rastreamento em um site Joomla Há duas maneiras de adicionar o código de rastreamento do HubSpot a um site Joomla. Em qualquer um dos métodos, primeiro você precisará copiar o código de rastreamento do HubSpot seguindo as etapas acima . Selecione uma extensão no Diretório de extensões do Joomla no qual poderá colar o código de rastreamento do HubSpot. Outra opção é seguir as etapas abaixo para instalar o código de rastreamento: Faça login na sua conta do Joomla como administrador. No menu de navegação principal, vá para Extensões > Modelos > Modelos . Clique no nome do seu modelo e selecione index.php no menu da barra lateral esquerda. Cole o código de rastreamento do HubSpot diretamente sobre a tag </body>. Clique em Salvar . Instalar o código de rastreamento em um site do Squarespace Siga as etapas acima para copiar o código de rastreamento da HubSpot na sua conta da HubSpot. Faça login na sua conta do Squarespace. No menu da barra lateral esquerda, vá para Configurações . Na seção Site do menu, vá para Avançado e selecione Injeção de código . Cole o código de rastreamento no campo Cabeçalho . Na parte superior esquerda, clique em Salvar . Como instalar o código de rastreamento usando o Gerenciador de tags do Google Siga as etapas acima para copiar o código de rastreamento da HubSpot na sua conta da HubSpot. Em uma nova guia ou janela do navegador, faça login na sua conta do Gerenciador de tags do Google. Selecione seu contêiner . No menu da barra lateral esquerda, vá para Tags . Clique em Novo . Clique em Configuração da tag . Para o Tipo de tag , escolha Tag HTML personalizada . Em seguida, dê um nome à tag. Cole o código de rastreamento no campo HTML . Abaixo de Configuração da tag , clique em Disparar para configurar uma regra de disparo. Se você não configurar uma regra de disparo, a tag não será disparada, e os dados de análise do Hubspot não serão coletados. Para que a tag seja disparada em todas as páginas com o código do Gerenciador de tags do Google instalado (recomendado), selecione a opção para Todas as páginas . Clique em Salvar para salvar a nova tag. Na parte superior direita, clique em Publicar para salvar seu contêiner e as tags. Se ainda não tiver feito isso, instale o Gerenciador de tags do Google em seu site . Código adicionar para categorizar os dados em tipos de página do HubSpot Se estiver usando relatórios de atribuição de criação de contatos , relatórios de atribuição de receita ou a guia Páginas na ferramenta Análise de tráfego e quiser categorizar os dados dos visitantes das suas páginas externas em tipos de página específicos, peça para sua equipe de desenvolvedores adicionar o seguinte código às suas páginas: var _hsq = window._hsq = window._hsq || []; _hsq.push(['setContentType', 'CONTENT_TYPE']); Substitua o texto CONTENT_TYPE no código pela expressão do tipo de conteúdo ao qual deseja atribuir crédito. Para atribuir crédito ao tipo de conteúdo Página de site , use as expressões standard-page ou site-page . Para atribuir crédito ao tipo de conteúdo Landing page , use a expressão landing-page . Para atribuir crédito ao tipo de conteúdo Página de listagem , use a expressão listing-page . Para atribuir crédito ao tipo de conteúdo Post de blog , use a expressão blog-post . Para atribuir crédito ao tipo de conteúdo Artigo de conhecimento , use a expressão knowledge-article . Depois de adicionado, os dados relacionados à sua página externa deverão ser categorizados no tipo de página que você selecionou no código. Saiba como esse código funciona na documentação para desenvolvedores . Tracking Code",https://knowledge.hubspot.com/pt/reports/install-the-hubspot-tracking-code
1810,Resolução de erros ao ligar uma conta Exchange,"Poderá ocorrer um erro ao ligar a sua conta do Exchange ao HubSpot. A mensagem de erro de ligação aparecerá no separador de correio electrónico nas definições da sua conta. Saiba mais sobre como resolver erros comuns abaixo. Na sua conta HubSpot, clique no ícone de configurações settings icon na barra de navegação superior. No menu da barra lateral esquerda, acesse Geral . Clique na guia E-mail . Quaisquer mensagens de erro serão apresentadas no separador Email . Pode ser necessário entrar em contato com o departamento de TI ou seu provedor de e-mail para confirmar os detalhes sobre sua conta de usuário ou configuração do Exchange. A URL do Exchange é inválida O HubSpot não pode se conectar ao servidor do Exchange devido a um problema com a URL. Verifique se a URL do Exchange está correta e tem o formato: https://example.com/EWS/Exchange.asmx . Observação: certifique-se de que a URL não redirecione para uma página de login do Outlook Web App. Se usar uma URL do Outlook Web App ao conectar sua caixa de entrada do Exchange, você receberá um erro de URL inválida. Para encontrar a URL do servidor do Exchange, acesse sua conta de e-mail pelo navegador. Depois, copie o domínio da URL e cole-o no campo Exchange. Por exemplo, se o URL completo da sua conta de correio eletrónico for https://mail.example.com/home , o URL correto do Exchange será https://mail.example.com/ews/exchange.asmx . Não é possível se conectar devido à versão do Exchange O HubSpot não pode conectar sua caixa de entrada porque você usa uma versão mais antiga do Exchange. Você precisará atualizar seu servidor Exchange para o Exchange 2010 SP2 ou superior. Não é possível se conectar ao servidor Exchange O HubSpot encontrou um erro geral sem mensagens adicionais ao conectar sua caixa de entrada. Confirme que sua caixa de correio do Exchange tem um endereço SMTP, que é necessário para enviar e-mails. Verifique se o domínio da URL do Exchange está listado como um nome comum no certificado SSL instalado no servidor SSL. Não autorizado O HubSpot encontrou um erro de autenticação, o que indica que as credenciais inseridas estão incorretas: Confirme se seu endereço de e-mail e a senha estão corretos. Se utilizar a autenticação de dois factores, terá de introduzir uma palavra-passe de uma aplicação de terceiros. Consulte a documentação da Microsoft para saber como gerar uma senha de aplicativo de terceiros . Alguns servidores do Exchange exigem um nome de usuário personalizado para fazer login. O formato padrão de um login personalizado do Exchange é DOMAIN\ username . Confirme se o seu servidor Exchange requer um nome de utilizador personalizado para estabelecer ligação. Confirme se o HubSpot pode acessar seu servidor do Exchange usando Exchange Web Services . Sua equipe de TI pode permitir que apenas determinados endereços IP se autentiquem com sua caixa de entrada. Nesse caso, eles precisarão adicionar os endereços IP que a HubSpot usa para conectar sua caixa de entrada à sua lista de permissões. Falha no e-mail de teste Para verificar se a caixa de entrada está funcionando, o HubSpot envia um e-mail de teste da sua caixa de entrada para o endereço CCO da sua conta. Pode haver uma falha desse e-mail de teste devido a um problema de permissões. Confirme se sua conta de usuário no Exchange tem permissão para enviar e-mails em nome da conta de envio especificada. Connected Email",https://knowledge.hubspot.com/pt/connected-email/troubleshoot-errors-when-connecting-an-inbox-with-exchange
1811,Gerenciar as configurações de contatos de marketing para suas integrações,"No HubSpot, apenas os contactos marcados como marketing contacts podem receber e-mails de marketing e ser direccionados com anúncios. Se utilizar aplicações ligadas no HubSpot para criar contactos, pode definir automaticamente novos contactos como contactos de marketing. As aplicações no HubSpot podem ser ligadas através de OAuth, o que inclui aplicações do mercado de aplicações. Todos os novos contactos de marketing serão contabilizados para o seu limite de nível de contactos . Atenção: tem de ter Acesso aos contactos de marketing permissões para definir o estado de marketing dos seus contactos. Definir contactos criados pelo oAuth ou por aplicações do mercado de aplicações como contactos de marketing Pode decidir que aplicações ligadas à sua conta através da autenticação OAuth irão sincronizar contactos como contactos de marketing. Isso inclui aplicativos conectados a partir do HubSpot App Marketplace . Apenas os contactos criados depois de a alternância ter sido activada serão criados como contactos de marketing. Na sua conta HubSpot, clique no ícone de configurações settings icon na barra de navegação superior. No menu da barra lateral esquerda, navegue para Integrações e, em seguida, clique em Contactos de marketing . Na secção As suas aplicações ligadas , verá todas as aplicações ligadas no seu portal. Clique para alternar o interrutor em para quaisquer aplicações que pretenda sincronizar contactos com o HubSpot como contactos de marketing. Observação: Apenas os contactos criados após a ativação da alternância serão criados como contactos de marketing. Saiba como definir contactos existentes como contactos de marketing manualmente em massa ou através de fluxos de trabalho . Todas as aplicações ligadas ao seu portal serão listadas na secção As suas aplicações ligadas , mesmo que não criem contactos. Ao ativar a opção para aplicações que não criam contactos, não terá impacto nos seus contactos de marketing. Integrations",https://knowledge.hubspot.com/pt/integrations/manage-marketing-contacts-settings-for-your-integrations
