id,titulo,conteudo,link
2413,Adicione frases de chamariz (CTAs) ao seu conteúdo,"Depois criando sua frase de chamariz (CTA) , você pode adicionar o CTA ao HubSpot e a páginas externas. Ao configurar seu CTA para páginas externas, o Código de rastreamento HubSpot Deve ser instalado. Você também pode adicionar CTAs ao seu arraste e solte e-mails de marketing . A maneira como você adiciona um CTA a uma página depende do tipo de CTA que você criou: Se estiver usando CTAs incorporados, você poderá adicionar no máximo 100 CTAs incorporados por página. CTAs incorporados podem ser usados das seguintes maneiras: O módulo de call to action padrão nas páginas do HubSpot O módulo de botão padrão em um email de marketing Um snippet de código em seu site externo Se estiver usando um banner adesivo, uma caixa pop-up ou frases de chamariz deslizantes, você pode: Acione o CTA para aparecer quando um visitante clicar em um botão. Selecione um ou mais gatilhos de ativação , então defina metas usando o URL do site ou as informações do visitante. Quando o primeiro gatilho for atingido, o CTA aparecerá nas páginas segmentadas e para os visitantes especificados: Acionador na rolagem da página Acionar na intenção de saída Acionar após o tempo decorrido Gatilho após inatividade Adicione um CTA ao seu conteúdo HubSpot Nas páginas do HubSpot, o código de rastreamento é instalado automaticamente. Para a maioria gatilhos de ativação , o CTA aparecerá quando o primeiro gatilho for atendido. No entanto, para usar CTAs incorporados ou CTA que são acionados quando um visitante clica em um botão, você precisará adicionar o CTA manualmente. Adicionar um CTA a uma página do HubSpot Você pode incorporar CTAs em páginas hospedadas no HubSpot usando o módulo Call to action. Acesse seu conteúdo: Páginas do site : Na sua conta da HubSpot, acesse Conteúdo > Páginas do site . Landing pages : Na sua conta da HubSpot, acesse Conteúdo > Landing pages . Clique no nome do seu conteúdo. No editor de conteúdo, clique no botão acrescentar botão na barra lateral esquerda. No editor da barra lateral, pesquise e clique no botão Módulo de apelo à ação e arraste-o para a posição na página. No CTA seção, clique Selecione . Adicione um CTA a uma postagem do blog da HubSpot Na sua conta da HubSpot, acesse Conteúdo > Blog . Clique no nome da sua postagem. No editor de conteúdo, clique no botão módulo de rich text para personalizar seu conteúdo. Na barra de ferramentas de texto enriquecido, clique em Inserir > Chamada para ação . No painel direito, clique no CTAs aba. Selecione uma CTA inserir e clique em Inserir . No painel esquerdo, clique em Aplicar mudanças . O CTA selecionado agora será exibido no seu editor de rich text e na sua visualização. Acione seu CTA ao clicar no botão no HubSpot Você pode acionar seu banner adesivo, caixa pop-up ou CTA deslizante quando os visitantes clicam em um botão em uma página. Para configurar este gatilho usando um módulo de botão padrão em uma página do HubSpot: Acesse seu conteúdo: Páginas do site : Na sua conta da HubSpot, acesse Conteúdo > Páginas do site . Landing pages : Na sua conta da HubSpot, acesse Conteúdo > Landing pages . Clique no nome No painel esquerdo, no Adicionar guia, pesquise e selecione o padrão módulo de botão . Clique e arraste o módulo de botão na sua página. No painel esquerdo, clique no Link para menu suspenso e selecione CTA . Clique no CTA menu suspenso e selecione um CTA existente . Continue configurando seu módulo de botão. Adicione um CTA incorporado aos seus e-mails de marketing de arrastar e soltar Adicionar CTAs incorporados aos seus e-mails de marketing de arrastar e soltar e acompanhe a eficácia da sua oferta de CTA em vários pontos de contato. Para adicionar um CTA no editor de e-mail arrastar e soltar : Na sua conta da HubSpot, navegue até Marketing > E-mail . Passe o mouse sobre o e-mail ao qual deseja adicionar o CTA e clique em Editar . Ou crie um novo e-mail . No painel esquerdo, clique e arraste o Botão módulo no editor de e-mail. No painel esquerdo, clique no Link para menu suspenso. Em seguida, selecione CTA . Debaixo de Campo de CTA , clique Selecione . No painel direito, selecione um CTA inserir e clique em Inserir . Observe: apenas um único botão ou imagem é suportada ao criar ou selecionar um CTA para seu e-mail. CTAs com múltiplos elementos, como um botão e uma imagem, não podem ser usados. Personalize os botões de um tema para acionar seu CTA ao clicar no botão Se você estiver usando um tema personalizado no HubSpot, talvez seja necessário personalizar o módulo de botão do tema para acionar um CTA. Se você estiver editando um tema padrão, eles devem ser clonado primeiro. Temas comprados do Mercado de ativos não pode ser clonado; é recomendado criar um tema filho em vez de. Para personalizar o módulo de botão do seu tema: Na sua conta da HubSpot, acesse Conteúdo > Design Manager . No canto superior esquerdo, procure seu módulo de botão . No painel direito, passe o mouse sobre Botão (grupo de campos) e clique Editar . Em Campos agrupados, passe o mouse sobre URL (URL) e clique Editar . Clique no Tipos de URL suportados menu suspenso. Em seguida, selecione o CTA caixa de seleção. No canto superior direito, clique em Publicar alterações . Após publicar suas alterações, o CTA a opção deve aparecer ao usar o módulo de botão do tema em suas páginas. Adicione um CTA ao seu conteúdo externo Você pode adicionar CTAs às suas páginas externas. Antes de usar um CTA da HubSpot em seu site externo, você deve instale o Código de rastreamento HubSpot . Depois de instalar o código de rastreamento, para a maioria gatilhos de ativação , o CTA aparecerá quando o primeiro gatilho for atendido. No entanto, para usar CTAs incorporados ou CTA que são acionados quando um visitante clica em um botão, você precisará adicionar o CTA manualmente. Incorpore um CTA em seu site externo Para adicionar um CTA incorporado às suas páginas externas: Na sua conta HubSpot, acesse Marketing > CTAs . No canto superior esquerdo, clique no menu suspenso e selecione CTAs . Passe o mouse sobre um CTA e clique Ações > Embutir . Clique copiar para área de transferência para copiar o código CTA para sua área de transferência. Navegue até o sistema de gerenciamento de conteúdo (CMS) do seu site externo. Cole o código incorporado do CTA no HTML da sua página que não é do HubSpot, onde você deseja que o CTA apareça. Visualize seu CTA na página da web para verificar como ficará quando estiver ao vivo. Se o CTA não for exibido corretamente, verifique se o seu CMS externo não alterou o código. Quando terminar, publique sua página. Geralmente, editar o CTA não afetará seu código de incorporação. Por exemplo, editar o Abrir link em nova aba opção não mudará o target=""_blank"" atributo no código de incorporação. O snippet de código de incorporação atua como um espaço reservado antes que a versão iframe do CTA seja renderizada. Esta versão renderizada do CTA refletirá o correto Abrir em nova aba valor definido no editor. Para abrir um link na mesma janela no espaço reservado, os usuários podem alterar manualmente a tag de atributo de destino para target=""_self"" . Acione um CTA ao clicar no botão em seu site externo Antes de usar um CTA em seu site externo, você deve instalar o Código de rastreamento HubSpot . Para configurar seu gatilho em uma página externa: Na sua conta HubSpot, acesse Marketing > CTAs . No canto superior esquerdo, clique no menu suspenso e selecione CTAs . Passe o mouse sobre um CTA e clique Editar . Na parte superior, clique na guia Direcionamento . Sob o Gatilho no clique do botão seção, clique Trecho de código . Na caixa de diálogo, clique em cópia de . Cole as classes incorporadas no botão do seu site externo. Se você não tiver certeza de como adicionar classes CSS aos botões do seu site, talvez seja necessário consultar seu webmaster, departamento de TI ou desenvolvedor. CTAs",https://knowledge.hubspot.com/pt/ctas/add-ctas-to-your-emails
2414,HubSpot Sales Outlook desktop add-in error: 'The value of the property 'type' cannot be parsed',"Updating to the most recent version of the HubSpot Sales Outlook desktop add-in will sometimes cause this error: The value of the property 'type' cannot be parsed. The error is: Could not load file or assembly... or one of its dependencies. The system cannot find the file specified. HubSpot has worked with Microsoft to determine that this error is due to a known issue in Outlook. To resolve this error: Copy and paste %COMMONPROGRAMFILES(x86)%\Microsoft Shared\VSTO\10.0 into the Start menu in Windows and press Enter . Locate and delete the file VSTOInstaller.exe.Config . Download and install the HubSpot Sales Outlook desktop add-in again. If you cannot find the file in the directory above, try this directory instead: %COMMONPROGRAMFILES%\Microsoft Shared\VSTO\10.0 Connected Email",https://knowledge.hubspot.com/connected-email/hubspot-sales-outlook-error-the-value-of-the-property-type-cannot-be-parsed
2415,Connect HubSpot and SignalFx,"Integration requirements You must be either a super admin or App Marketplace Access permissions to connect SignalFx and HubSpot. Connect Signal FX and HubSpot Use the SignalFx integration to visualize and measure the performance of your company's sites and pages. In your HubSpot account, click the Marketplace icon marketplace in the top navigation bar, then select App Marketplace . Use the search bar to search for the SignalFx integration and click SignalFx in the results. In the top right, click Connect app . In the dialog box, enter the below details from your SignalFx account: Organization ID: click Dashboards and copy the Organization ID (a string of letters and numbers). Realm: in the top right corner click Settings , select My Profile and copy the value for Realm under the Organizations section. Access token: in the top right corner click Settings, and click Access Tokens. Custom prefix for metric names: write a unique name for all HubSpot data sent to SignalFx. Click Connect app . You will be redirected back to Connected apps and your data will sync between HubSpot and SignalFx. Learn more about accessing your metrics with the CMS Performance API . Integrations",https://knowledge.hubspot.com/integrations/connect-hubspot-and-signalfx
2416,Cookies definidos no navegador do seu visitante pelo HubSpot,"Se você hospede seu site por HubSpot ou ter instalou o código de rastreamento do HubSpot , os cookies abaixo podem ser definidos nos navegadores dos seus visitantes, dependendo da configuração do seu site. Você pode saber mais sobre os cookies configurados pelo HubSpot lendo abaixo. Observação: se você acessar seu próprio site para testar os cookies de rastreamento da HubSpot, poderá ver um erro do console no atributo SameSite para cookies relacionados a hubspot.com ou app.hubspot.com . Esses cookies são os cookies do seu aplicativo HubSpot (por exemplo, permitem fazer login no HubSpot) e não estão relacionados aos cookies de rastreamento para seus visitantes. Confira o thread da Comunidade para obter mais informações. Cookies necessários Esses são os cookies essenciais que não exigem consentimento. __hs_opt_out Este cookie é usado pela política de privacidade opt-in para lembrar de não solicitar que o visitante aceite cookies novamente. Esse cookie é definido quando você oferece aos visitantes a opção de não aderir aos cookies. Ele contém a cadeia “sim” ou “não”. Ele expira em 6 meses. __hs_do_not_track Este cookie pode ser definido para impedir que o código de rastreamento envie informações à HubSpot. Ele contém a cadeia “sim”. Ele expira em 6 meses. __hs_initial_opt_in Este cookie é usado para impedir que o banner seja sempre exibido quando os visitantes navegam no modo rigoroso. Ele contém a cadeia “sim” ou “não”. Expira em sete dias. __hs_cookie_cat_pref Este cookie é usado para registrar as categorias que um visitante consentiu. Contém dados sobre as categorias consentidas. Ele expira em 6 meses. __hs_gpc_banner_dismiss Este cookie é usado quando o banner de controle de privacidade global é descartado. Ele contém a cadeia “sim” ou “não”. Ele expira em 180 dias. __hs_notify_banner_dismiss Este cookie é usado quando o site usa um tipo de banner de Notificação de consentimento . Contém o valor booleano True . Ele expira em 180 dias. hs_ab_test Este cookie é usado para fornecer consistentemente aos visitantes a mesma versão de um Página de teste A/B eles já viram antes. Ele contém o id da página de teste A/B e o id da variação escolhida para o visitante. Ele expira no final da sessão. <id>_key Ao visitar uma página protegida por senha, esse cookie é definido para visitas futuras à página do mesmo navegador não requeiram o login novamente. O nome do cookie é exclusivo para cada página protegida por senha. Ele contém uma versão criptografada da senha para que as visitas futuras na página não exijam a senha novamente. Ele expira em 14 dias. hs-messages-is-open Este cookie é usado para determinar e salvar se o widget de chat está aberto para visitas futuras. Ele é definido no navegador do visitante quando ele começa um novo chat e redefinido para fechar novamente o widget após 30 minutos de inatividade. Se seu visitante fechar manualmente o widget de chat, ele o impedirá de reabrir em uma página subsequente carregada nessa sessão de navegador dentro de 30 minutos. Ele contém um valor booleano de Verdadeiro se houver. Expira em 30 minutos. hs-messages-hide-welcome-message Este cookie é usado para impedir que a mensagem de boas-vindas apareça novamente por um dia após ela ser descartada. Contém um valor booleano de Verdadeiro ou Falso . Expira em um dia. __hsmem Este cookie é definido quando os visitantes efetuarem login em um site hospedado pelo HubSpot. Ele contém dados criptografados que identificam o usuário membro quando eles estão logados no momento. Expira em sete dias. hs-membership-csrf Este cookie é usado para garantir que logins de associação de conteúdo não pode ser forjado. Contém uma cadeia aleatória de letras e números usados para verificar se um login de associação é autêntico. Ele expira no final da sessão. hublytics_events_53 Esta entrada de armazenamento do navegador é usada pelo Produto da HubSpot para armazenar temporariamente eventos de rastreamento criados pelo Produto da HubSpot até que sejam distribuídos pela rede. É salvo no Armazenamento de sessões do navegador ou no Armazenamento local com base na presença ou na ausência do consentimento com o rastreamento. Quando o consentimento com o rastreamento não é fornecido, este cookie permanece na sessão atual do navegador e expira no final da sessão. Este ""cookie"" permanecerá vazio e não armazenará nada. Ele contém metadados sobre eventos de rastreamento que a HubSpot coleta ao longo da jornada do usuário no HubSpot. Não contém informações pessoais identificáveis ou informações que possam identificar seu dispositivo ou hardware. Não pode ser removido manualmente e é criado automaticamente sempre que as condições forem atendidas. hs.superstore.laboratory.<id> Contém um cache offline de coortes que um usuário recebeu para experimentos de produtos da HubSpot. Não contém informações pessoais identificáveis ou informações que possam identificar seu dispositivo ou hardware. Os experimentos da HubSpot são anônimos e não estão associados às sessões do usuário. No entanto, se o consentimento de rastreamento for fornecido, experimentos específicos podem estar vinculados a sessões de usuário identificáveis. O conteúdo individual desta entrada de armazenamento expira automaticamente em datas específicas determinadas pelo Produto da HubSpot. Geralmente, é 48 horas. Não pode ser removido manualmente e é criado automaticamente sempre que as condições forem atendidas. __cfruid Este cookie é definido pelo provedor de CDN da HubSpot devido às políticas de limitação de taxa . Ele expira no final da sessão. Saiba mais sobre os cookies do Cloudflare . __cfuvid Este cookie é definido pelo provedor de CDN da HubSpot devido às políticas de limitação de taxa . Ele expira no final da sessão. Saiba mais sobre os cookies do Cloudflare . __cf_bm Este cookie é definido pelo fornecedor de CDN da HubSpot e é um cookie necessário para a proteção do bot. Expira em 30 minutos. Saiba mais sobre os cookies da Cloudflare . Cookies de análise Esses são cookies não essenciais controlados pelo banner de cookies. Se você for um visitante para um site suportado pelo HubSpot, você pode optar por não receber esses cookies ao não dar consentimento. __hstc O cookie principal para rastrear visitantes. Contém o domínio, o hubspotutk, o registro de data e hora inicial (primeira visita), o último registro de data e hora (última visita), o registro de data e hora atual (esta visita) e o número da sessão (incrementos para cada sessão subsequente). Ele expira em 6 meses. hubspotutk Este cookie acompanha a identidade de um visitante. Ele é passado para a HubSpot no envio de formulário e usado ao deduplicar os contatos Ele contém um GUID opaco para representar o visitante atual. Ele expira em 6 meses. __hssc Este cookie acompanha as sessões. Este cookie é usado para determinar se a HubSpot deve incrementar o número da sessão e os carimbos de data e hora no cookie __hstc. Ele contém o domínio, o viewCount (incrementa cada pageView em uma sessão) e o registro de data e hora do início da sessão. Expira em 30 minutos. __hssrc Sempre que a HubSpot muda a cookie da sessão, esse cookie também está definido para determinar se o visitante reiniciou seu navegador. Se esse cookie não existir quando o HubSpot gerencia cookies, é considerado uma nova sessão. Ele contém o valor ""1"" quando presente. Ele expira no final da sessão. Se você estiver conectado à HubSpot, a HubSpot definirá cookies de autenticação adicionais. Aprender mais sobre cookies definidos no produto HubSpot . Você também pode veja se um contato aceitou esses cookies em sua linha do tempo . Cookies de funcionalidade Cookies de fluxo de chat Este é o cookie usado para o ferramenta de fluxos de bate-papo . Se você for um visitante, isso permite conversar com um representante no site. messagesUtk Este cookie é usado para reconhecer visitantes que conversam com você através do ferramenta de fluxos de bate-papo . Se o visitante sair do seu site antes de ser adicionado como contato, terá esse cookie associado ao navegador. Com o Consentimento para coletar cookies de bate-papo contexto ligadas: Se você conversar com um visitante que depois retorna ao seu site no mesmo navegador com cookies, a ferramenta de fluxos de chat carregará o histórico de conversa dele. O cookie messagesUtk será tratado com um cookie necessário . Quando o Consentimento para coletar cookies de bate-papo configuração está desativada , o cookie messagesUtk é controlado pelo Consentimento para processar contexto em seu fluxo de bate-papo. A HubSpot não descartará o mensagens Utk cookie para visitantes que foram identificados por meio da API de identificação de visitantes. O banner de cookie de análise não será afetado. Este cookie será específico a um subdomínio e não será enviado para outros subdomínios. Por exemplo, o cookie em info.exampe.com não se aplicará ao visitante quando ele visitar www.example.com e vice-versa. Ele contém um GUID de opaco para representar o usuário do chat atual. Ele expira após seis meses. Texto de consentimento do cookie de fluxo de chat Com o Consentimento para coletar cookies de bate-papo contexto habilitado , a HubSpot solicitará o consentimento dos visitantes para colocar um cookie em seus navegadores antes de iniciar um bate-papo ou quando tentarem sair da página durante uma conversa de bate-papo. Este cookie é usado para interagir com os visitantes do site e fornece um histórico de chat do visitante . Se você optar por exibir o banner antes do visitante iniciar um chat e o visitante não dar consentimento, ele não poderá iniciar o chat. No entanto, se você escolher exibir o banner após a intenção de saída, o visitante poderá iniciar o chat, mas se ele não der consentimento para os cookies antes de sair da página, o widget de chat será redefinido e a conversa terminará. Com essa configuração desativada , um visitante pode iniciar um chat e fornecer consentimento para processar suas informações através da configuração Consentimento para processar . Os visitantes também podem aceitar ou recusar cookies no Banner de cookies da HubSpot se estiver habilitado em suas páginas. Se um visitante aceitar o cookie quando ele iniciar um chat, mas depois clicar em Recusar no banner de cookie da HubSpot, o cookie será removido. Se um visitante clicar em Recusar no banner de cookie da HubSpot antes de iniciar um chat, o HubSpot não colocará um cookie ou solicitará o consentimento para os cookies no widget de chat. Cookies de publicidade Os cookies de publicidade são cookies de pixel de anúncios (como Facebook, LinkedIn e Google) que você pode optar por instalar usando a ferramenta de anúncios da HubSpot . Se você tiver o código do pixel do Facebook instalado em seu site, o Facebook pode definir um cookie no navegador de um visitante. Se você usar a ferramenta de anúncios da HubSpot para selecionar e instalar o pixel do Facebook em páginas com o código de rastreamento da HubSpot, a HubSpot vinculará a adição desse código de pixel ao banner de notificação do cookie. Se você exigir consentimento de opt-in via banner, o pixel do Facebook não poderá definir nenhum cookie até que o visitante opte por aderir. Se você colocou manualmente o código pixel nas páginas (por exemplo, editando o cabeçalho do seu site HTML), a HubSpot não poderá controlar em quais visitantes o Facebook define os cookies. Para obter informações adicionais, consulte os Termos das ferramentas de negócios do Facebook e o Guia de consentimento de cookies do Facebook . Cookies de sistemas de terceiros A HubSpot não pode controlar cookies adicionados por script de terceiros no seu site. Quando um visitante aceita cookies por meio do banner de consentimento da HubSpot, ele consente apenas com os cookies da HubSpot. No entanto, você pode implantar um código para saber quando um visitante aceitou ou recusou o rastreamento de cookies da HubSpot e, em seguida, enviar essas informações para o sistema de terceiros. Saiba mais sobre como usar o banner de consentimento do HubSpot para scripts de terceiros . Scripts externos Se você estiver inserindo scripts externos no seu site, consulte a documentação do desenvolvedor do HubSpot para saber mais sobre como associar esses scripts ao banner da cookies. Outras informações Saiba como remover os cookies criados pelo código de rastreamento HubSpot que estão incluídos na faixa de consentimento em privacidade de dados. Quando os cookies do visitante forem removidos, o visitante será considerado “novo” e verá o banner de política de cookies na próxima vez que ele visitar seu site. Os visitantes que visitaram seu site antes de seu banner de política de cookies ser configurado já terão os cookies criados pelo código de rastreamento da HubSpot no navegador. Assim, eles não verão o banner de política de cookie até que os cookies expirem ou sejam removidos. Se você usar o Código de rastreamento da HubSpot , os dados dos seus visitantes serão coletados e usados para monitorar o tráfego do site. A HubSpot também usa determinados dados coletados do código de rastreamento para melhorar seus produtos e serviços, incluindo o conjunto de dados comerciais do Breeze Intelligence. Você pode desativar o compartilhamento de dados com a HubSpot navegando até as configurações da conta. Saiba mais sobre os dados que são coletados pelo código de rastreamento da HubSpot . Tracking Code",https://knowledge.hubspot.com/pt/privacy-and-consent/what-cookies-does-hubspot-set-in-a-visitor-s-browser
