id,titulo,conteudo,link
1519,Configurar regras para pipelines de negócios,"Para gerenciar como os usuários podem criar e mover registros por meio de uma pipeline, os Superadministradores podem definir regras para seus pipelines de negócio, ticket, leads (BETA) e objeto personalizado. As seguintes regras podem ser aplicadas atualmente para cada pipeline: Defina fases em que novos negócios possam ser criados. Restrinja ações para ignorar fases no pipeline. Restrinja o retrocesso de registros nos pipelines. Limitar quem pode editar negociações em determinados estágios da pipeline (somente negociações). Configurar um processo de aprovação para negociações na pipeline (somente Negociações, Sales hub Empreendimento apenas). Exigir a criação de um negócio (somente Clientes Potenciais, Profissional Sales hub e CorporativoApenas). Por exemplo, se você não permitir que os usuários pulem fases ou retrocedam negócios, a edição da fase de um negócio será semelhante ao seguinte: Configurar regras de pipeline de objeto As regras de Pipeline são aplicadas ao criar ou atualizar manualmente registros na área de trabalho , no aplicativo móvel HubSpot e por meio de integrações ou APIs públicas HubSpot quando uma ID de usuário está sendo passada. As regras do pipeline fazem não aplicam-se ao criar ou editar registros por meio de fluxos de trabalho, outras APIs ou por usuários com Superadministrador ou Editar configurações de propriedade permissões. Nesses casos, as regras de pipeline habilitadas podem ser ignoradas. Para configurar regras: Na sua conta HubSpot, clique no ícone de configurações settings icon na barra de navegação superior. No menu da barra lateral esquerda, navegue até Objetos e selecione o objeto para o qual deseja definir regras de pipeline. As regras para pipelines estão disponíveis apenas para ofertas, ingressos e objetos personalizados. Navegue até a guia Pipelines . Clique no menu suspenso Selecionar um pipeline e, em seguida, selecione o pipeline para o qual deseja definir regras. Na parte inferior, clique na guia Regras do pipeline . Em cada linha, clique para ativar o botão para aplicar a regra. Dependendo da regra, personalize as configurações: Limitar a criação de [registro] a estágios específicos : selecione os estágios nos quais novos registros podem ser criados. Com esta regra ativada, os usuários só poderão criar registros nessas etapas no HubSpot , bem como por meio de integrações e APIs HubSpot. Restringir [registros] de ignorar estágios : para impedir que os usuários ignorem qualquer estágio na pipeline, selecione Todos os estágios . Para evitar que os usuários ignorem determinadas fases, selecione Selecionar etapas e, em seguida, selecione as fases que não podem ser ignoradas. Os usuários ainda poderão ignorar estágios se um registro estiver passando para um estágio Fechado / Perdido (para clientes potenciais Qualificados ou). Esta regra também se aplica ao editar registros via API e integrações . Restringir a movimentação de [registros] para trás : para impedir que os usuários movam registros para trás de qualquer estágio da pipeline, selecione Todos os estágios . Para evitar que os usuários retrocedam os registros após atingirem determinadas fases, selecione Selecionar fases e, em seguida, selecione as fases . Com essa regra ativada, depois que um registro tiver sido movido para ou passado pelos estágios selecionados, os usuários não poderão mover o registro de volta para qualquer estágio antes dos estágios selecionados. Isso se aplica ao editar no HubSpot , bem como via API e integrações. Os usuários ainda poderão mover um registro para trás de um estágio Fechado / Perdido ( para clientes potenciais Qualificados ou não qualificados) se um registro for reaberto. Observe que: para clientes potenciais, a restrição é limitada a Todos os estágios e não pode ser personalizada. Controlar o acesso de edição do negócio : selecione os estágios que terão acesso de edição limitado e, em seguida, selecione quem deverá ter acesso: Somente superadministradores ou superadministradores Se você selecionou usuários e equipes específicos , clique no menu suspenso Adicionar um usuário ou equipe e, em seguida, marque as caixas de seleção ao lado dos usuários e equipes que poderão editar os negócios nas fases selecionadas. Adicionar processo de aprovação para negócios (apenas Sales Hub Enterprise ): configure a fase de aprovação. Exigir a criação de um negócio ( somente Sales hub Profissional): o usuário deverá criar um negócio se o estágio de lead for Qualified. Clique em Salvar . Uma vez definidas ou atualizadas, as regras de pipeline são salvas automaticamente e serão aplicadas aos usuários com acesso ao objeto que está avançando. As regras do pipeline fazem não aplicar a usuários com Superadministrador ou Editar configurações de propriedade permissões. Observação: quando as regras estiverem ativadas para um pipeline, os usuários também não poderão editar em massa o pipeline ou a fase dos registros nesse pipeline. Editar ou desativar regras de pipeline Para gerenciar regras de pipeline existentes: Na sua conta HubSpot, clique no ícone de configurações settings icon na barra de navegação superior. No menu da barra lateral esquerda, navegue até Objetos e selecione o objeto para o qual deseja atualizar as regras de pipeline. Navegue até a guia Pipelines . Clique no menu suspenso Selecionar um pipeline e selecione a pipeline para a qual deseja atualizar as regras. Na parte inferior, clique na guia Regras do pipeline . Para editar uma regra existente, clique no ícone de edição edit na linha da regra. Faça sua alteração no painel direito e clique em Salvar . Para desativar uma regra, clique para desativar o botão . Na caixa de diálogo, clique em Excluir regra de pipeline para confirmar. Saiba mais sobre a personalização de pipelines . CRM records Object Settings",https://knowledge.hubspot.com/pt/object-settings/set-up-pipeline-rules
1520,Image size requirements for social posts,"When you create a social post in HubSpot , any image or video you include in your post should adhere to specific requirements, such as file size and aspect ratio. The recommendations for image and video for each network are listed below. X images Photos can be up to 5MB, animated GIFs can be up to 5MB on mobile, and up to 15MB on web. Supported image types are GIF, JPEG, and PNG files. BMP and TIFF files are not supported. Your image will be automatically scaled when a user expands a post, or when displayed in your gallery Learn more about X image requirements in X's Help Center . X videos Minimum resolution: 32 x 32 Maximum resolution: 1920 x 1200 (and 1200 x 1900) Aspect ratios: 1:2.39 - 2.39:1 range (inclusive) Maximum frame rate: 40 fps Maximum bitrate: 25 Mbps Learn more about X image requirements in X's Help Center . LinkedIn images The size limit for an upload is 5 MB. The recommended image size is at least 552 (width) x 276 (height) pixels. The image frame ratio ranges from 3:1 to 2:3 (width/height). If the ratio is larger, the image will be centered and cropped. Uploaded images can't be resized. Small, low-resolution photos may appear in a low-quality. Learn more about LinkedIn image recommendations in LinkedIn's Help Center . LinkedIn videos Max file size: 5GB Minimum file size: 75KB Max video duration: 10 minutes Minimum video duration: 3 seconds Resolution range: 256x144 to 4096x2304 Aspect ratio: 1:2.4 - 2.4:1 Frame rates: 10fps - 60 fps Bit rates: 192 kbps - 30 Mbps Learn more about LinkedIn video requirements in LinkedIn's Help Center . Facebook and Instagram images Minimum image dimensions: 200x200 Maximum file size: 8 MB For high resolution devices, use images that are at least 1200x630 pixels Aim for a 1.91:1 aspect ratio to ensure that your full image displays in the News Feed without cropping. Learn more about Facebook and Instagram image requirements in Facebook's developer documentation . Facebook and Instagram videos Supported file types are MP4, MOV, or GIF. Optimal aspect ratio is 4:5. The minimum width is 500 pixels. The optimal resolution is at least 1080x1080 pixels. Your video's length can be between 1 second and 2 minutes on Facebook and between 1 second and 1 minute on Instagram. The maximum file size is 30 MB. Learn more about video recommendations for Instagram in Facebook's Help Center . Social",https://knowledge.hubspot.com/social/image-size-requirements-for-social-posts
1521,Delete your HubSpot user,"When a user's access is removed from a HubSpot account , the user cannot access the account. However, the user associated with the email address will continue to exist. You can fully delete your user account once it no longer has access to any HubSpot accounts. Please note: deleting your user will delete any Academy certifications associated with that email address. To maintain your certifications, you can transfer your certifications to a new email address before deleting your user. To permanently delete your user account: Log in to the user you want to delete. Ensure it does not have access to any HubSpot accounts. In your HubSpot account, click your account name in the top right corner, then click Profile & Preferences . In the left sidebar menu, click Security . Under Permanently Remove , click Delete my user account . In the dialog box, enter your user email address , then click Delete user . User Management",https://knowledge.hubspot.com/user-management/delete-your-hubspot-user
1522,Add re-enrollment triggers to a workflow,"Use re-enrollment in your workflow to enroll records in a workflow again. By default, records are only enrolled in workflows the first time they meet the workflow enrollment triggers or are enrolled manually. Re-enrollment triggers allow records to be re-enrolled in your workflows. How re-enrollment triggers work When setting up your re-enrollment triggers, take note of the following: When re-enrollment is enabled, records can re-enroll in workflows either by manual re-enrollment or by meeting at least one selected re-enrollment trigger. Records that meet a re-enrollment trigger will only enroll if they also meet the workflow's initial enrollment triggers at the time of re-enrollment. Records that are manually re-enrolled do not have to meet the initial enrollment triggers to enroll. A record won't re-enroll in a workflow while it's already enrolled. When using the property filter is known for re-enrollment, in addition to meeting the criteria listed above, records can re-enroll in two ways: The property gains a value after not previously having one. The property is updated from one value to another. For example, a contact's lifecycle stage changing from Lead to Subscriber would qualify for Lifecycle stage is known . Each time this contact's lifecycle stage is updated, they would re-enroll in the workflow, provided the contact also meets the workflow's initial enrollment triggers . Records will re-enroll each time they are updated from not matching to matching a re-enrollment trigger. For example, if a re-enrollment trigger is based on list membership, a contact will re-enroll when they join the list. If the contact stays in the list, they will not re-enroll each time they finish the workflow. If the contact leaves the list, they will re-enroll in the workflow once they join that list again. When a record is re-enrolled in a workflow, they will complete all workflow actions again (e.g., receiving any automated emails). While enrollment triggers can be refined by date or number, refinement won't apply to re-enrollment. For example: Date: your workflow has the enrollment trigger Contact has filled out Any form submission on Homepage between 1/1/2019 and 2/1/2019 . The date range will not be taken into account for re-enrollment. Instead, contacts will re-enroll any time they submit that form, even if it's outside the date range. Number: your workflow has the enrollment trigger Contact has filled out any form on Any page at most 5 times . The number of times a contact has filled out your forms will not be taken into account for re-enrollment. Instead, contacts will re-enroll any time they submit that form. Not all enrollment triggers can be used for re-enrollment. Learn more about the available re-enrollment triggers . If a workflow contains an action of Enroll in another workflow , records will still re-enroll if they meet re-enrollment criteria. Add re-enrollment triggers to contact-based workflows In your HubSpot account, navigate to Automations > Workflows . Click the name of a contact-based workflow. Click the Contact enrollment trigger box. In the left panel, click the Re-enrollment tab. Click to toggle the Allow contacts who meet the trigger criteria to re-enroll switch on. Under Re-enroll contacts if they meet the trigger criteria and any of the following occurs to, select the checkboxes next to the triggers you want to use for re-enrollment. Learn more about which triggers can be used for re-enrollment . Click Done . Click Save . Add re-enrollment triggers to company, deal, ticket, quote, or custom object-based workflows In your HubSpot account, navigate to Automations > Workflows . Click the name of a company-based, deal-based, ticket-based, or quote-based workflow. Click the [Objects] enrollment trigger box. In the left panel, click the Re-enrollment tab. Click to toggle the Re-enrollment switch on. Select the triggers you want to use for re-enrollment. Learn more about which triggers you can use for re-enrollment Click Save . Available re-enrollment triggers Whether you can use an enrollment trigger for re-enrollment depends on the type of trigger and operator. The following rules apply to all workflow types: In general, properties can only be used for re-enrollment when they're the same type as the workflow. For example, in company-based workflows, you can only re-enroll using company properties. Activities and activity properties cannot be used for re-enrollment in any type of workflow. Below are lists of enrollment triggers that can be used for re-enrollment. The lists may not be exhaustive. To check whether or not a current enrollment trigger can be used for re-enrollment: In your HubSpot account, navigate to Automations > Workflows . Click the name of the workflow. Click the Enrollment triggers box. In the right panel, click the Re-enrollment tab. Any enrollment conditions that can't be used for re-enrollment will be listed in the The following enrollment conditions can't be used for re-enrollment section. Please note: Re-enrollment based on Last modified date is known is not supported. From September 10, 2024, re-enrollment based on Now in workflow property is no longer supported. Existing workflows that use the Now in workflow property for re-enrollment will not be affected. Contact-based workflows Before setting up re-enrollment triggers in contact-based workflows, take note of the following exceptions: Privacy consent events cannot be used for re-enrollment. Calculation properties , including default calculated properties such as Recent Conversion and Number of unique forms submitted cannot be used for re-enrollment. Re-enrollment triggers cannot be refined by date or number. Learn more about how refinement filters apply to re-enrollment . The is any of , is equal to all of , and is equal to any of operators cannot be used for re-enrollment if they have multiple values. For example, a single trigger of Field of study is equal to any of Neurosurgery or Catsitting cannot be used for re-enrollment. Instead, you can split it into two triggers of Field of study is equal to any of Neurosurgery OR Field of study is equal to any of Catsitting . In contact-based workflows, the following triggers can be used for re-enrollment: Contact properties can be used for re-enrollment when paired with certain operators: Any contact properties using is known . Single-line text, multi-line text properties using is equal to any of . Text, number, and date properties using is equal to . Single checkbox, dropdown select, and radio select properties using is any of . Multiple checkbox properties using is equal to all of . Contact is a member of list Contact has filled out form Contact has viewed as least one URL equal to Contact has viewed at least one URL containing Contact has completed event Any integration triggers, including Mailchimp and Zoom Company, deal, quote, ticket, and custom object-based workflows In company, deal, quote, and ticket-based workflows, you can only trigger re-enrollment using properties specific to the workflow object. For example, in a company-based workflow, you can only re-enroll based on company properties. Activities and lists cannot be used for re-enrollment. Only the following property operators can be used for re-enrollment: is any of is none of is equal to is not equal to has ever contained exactly is greater than is greater than or equal to is less than Is less than x days ago is less than x days from now is more than x days ago is more than x days from now updated in the last x days not updated in the last x days is before date is after date is between is not between is known is unknown contains exactly doesn’t contain exactly starts with ends with When using any of the following filters for re-enrollment in company, deal, quote, and ticket-based workflows, special rules apply: Is less than x days ago is less than x days from now is more than x days ago is more than x days from now updated in the last x days not updated in the last x days If a record is enrolled in a workflow within the specified timeframe, they will not re-enroll if they are updated again within the specified timeframe. Once the specified amount of time has passed after enrollment, the record is eligible for re-enrollment. For example: Your workflow is set to re-enroll companies when they meet the criteria Lifecycle stage has been updated in the last 5 days . A company enrolls in the workflow after their lifecycle stage updates to Customer . Three days later, the company's lifecycle stage is updated again. The company will not re-enroll in the workflow, because 3 days is still within the original 5-day window from when it enrolled. A week later, the company's lifecycle stage is updated to Evangelist . The company will then re-enroll in the workflow, because the original 5 days have passed since enrollment. Workflows",https://knowledge.hubspot.com/workflows/add-re-enrollment-triggers-to-a-workflow
1523,Atualize os detalhes da empresa na sua fatura e recibo,"Observação: se você for um Parceiro de soluções da HubSpot , entre em contato com o Gerente de desenvolvimento de parceiros para atualizar os dados da sua empresa. Antes de começar Observe o seguinte antes de atualizar os dados da sua empresa: Não é possível atualizar ou alterar os dados da empresa em faturas que já foram pagas. O endereço de cobrança é o endereço associado à sua forma de pagamento. O endereço de envio é o endereço físico onde você usa o HubSpot e a partir do qual o imposto/IVA é calculado. A HubSpot refere-se ao endereço de entrega como Endereço principal da empresa ou Endereço principal . Atualizar os dados da sua empresa Revise e atualize o nome e o endereço da empresa que aparecem nas suas faturas e recibos nas configurações de Conta e cobrança . Para encontrar as informações da sua empresa: No seu portal da HubSpot, clique no nome da conta no canto superior direito e, em seguida, em Conta e cobrança . Clique na guia Informações da empresa . Sob Informações da empresa , veja o nome e endereço atuais da sua empresa. Para atualizar o nome da sua empresa: Clique em Editar nome à direita do nome da sua empresa. Na caixa de diálogo, insira o novo nome para sua empresa no campo Nova empresa . Clique em Concordo e Atualize Nome da empresa . Para atualizar o endereço da sua empresa: Clique em Editar endereço . Na caixa de diálogo, insira os dados do endereço da sua empresa. Clique em Enviar . O nome e o endereço da sua empresa serão atualizados em todas as faturas em aberto e futuras. Todos os administradores em sua conta receberão um contrato por e-mail em relação à alteração de seu nome. Você também pode encontrar uma versão em PDF do e-mail na guia Documentos da página Conta e Cobrança: No seu portal da HubSpot, clique no nome da conta no canto superior direito e, em seguida, em Conta e cobrança . Clique na guia Documentos . A confirmação terá um título semelhante à NameChangeConfirmation-1234.pdf e será listada como Confirmação da alteração de nome na coluna Tipo . Clique no nome do documento para baixar o PDF. billing",https://knowledge.hubspot.com/pt/account/change-the-company-name-on-your-invoice-and-receipt
