id,titulo,conteudo,link
1510,Inserir e editar ícones em módulos de rich text,"Você pode adicionar qualquer ícone no Fonte incrível biblioteca para módulos de rich text em postagens e páginas de blog. Quando o ícone for adicionado, você pode personalizar sua cor, posicionamento e tamanho. Observação: os ícones não podem ser adicionados diretamente aos e-mails de marketing. Para usar um ícone em um e-mail, salve o ícone como uma imagem e insira a imagem no editor de e-mail . Adicione um ícone ao seu conteúdo em um módulo rich text Acesse seu conteúdo: Páginas do site : Na sua conta da HubSpot, acesse Conteúdo > Páginas do site . Landing Pages : Na sua conta da HubSpot, acesse Conteúdo > Landing pages . Blog : Na sua conta da HubSpot, acesse Conteúdo > Blog . Clique no nome do seu conteúdo. Clique no módulo de rich text onde deseja exibir o ícone. No canto superior direito da barra de ferramentas de rich text, clique no menu suspenso Inserir e selecione Ícone. Na caixa pop-up, procure o ícone na barra de pesquisa. Clique no ícone para inseri-lo no seu módulo de rich text. Editar um ícone Depois de inserir o ícone, você pode editar sua aparência e posição ou vinculá-lo a outro conteúdo. Acesse seu conteúdo: Páginas do site : Na sua conta da HubSpot, acesse Conteúdo > Páginas do site . Landing Pages : Na sua conta da HubSpot, acesse Conteúdo > Landing pages . Blog : Na sua conta da HubSpot, acesse Conteúdo > Blog . Clique no nome do seu conteúdo. No editor de conteúdo, clique no ícone para abrir o editor de ícone. Para editar a cor do ícone, clique no botão backgroundColor cor do ícone menu suspenso e selecione um cor. Para inserir um valor hexadecimal ou Valor da cor RGB, Clique no Avançado aba. Use o indent recuar iconiconicon ícones para mover o ícone para a direita ou para a esquerda. Use o blockAlignmentBottom alinhamento ícones para ajustar a posição do ícone dentro de um bloco de texto. Para adicionar um link ao seu ícone, clique no botão link link ícone, então insira um link . Para redimensionar seu ícone, clique e arraste o ícone cantos no editor ou digite valores de pixels para a largura e altura na barra de ferramentas. Para remover um ícone de um módulo rich text, clique na imagem e, em seguida, clique no botão delete ícone da lixeira . Para substituir o ícone, clique na imagem e depois clique no replace substituir ícone e adicione um novo ícone. Editar opções avançadas de ícone Você pode editar as opções avançadas do seu ícone para adicionar um texto de acessibilidade ou personalizar o link do ícone. No editor de conteúdo, clique no ícone. Clique no edit editar ícone. Na caixa pop-up, clique em Avançado . Se o seu ícone tiver um link, você poderá selecionar um ou mais tipos de links . Isso informa aos mecanismos de pesquisa como esse link está relacionado ao seu site. Aprender mais sobre diferentes tipos de links . Selecione uma finalidade para sua imagem. Se o seu ícone pretende transmitir informações, selecione Lido por leitores de tela e adicione um título que descreve seu propósito. Se o seu ícone não transmitir informações, selecione Ignorado pelos leitores de tela . Clique em Aplicar . Landing Pages Blog Website Pages",https://knowledge.hubspot.com/pt/cos-general/how-to-install-font-awesome
1511,Imposto na Arábia Saudita — IVA | Perguntas frequentes,"Observação: este artigo foi preparado apenas para fins informativos. Ele não se destina a fornecer e não deve ser considerado como aconselhamento fiscal. Em caso de dúvidas, você deve consultar seus próprios consultores tributários e/ou jurídicos. Se sua empresa está localizada na Arábia Saudita, saiba como a HubSpot gerencia o Imposto sobre Valor Agregado (IVA, ou VAT em inglês) e como você pode atualizar a HubSpot com suas informações relacionadas ao IVA. O que é o Imposto sobre Valor Agregado (IVA)? O IVA é um imposto que incide sobre a maioria dos fornecimentos de bens e serviços consumidos na Arábia Saudita. Por que o IVA está sendo cobrado? A HubSpot está registrada para efeitos de IVA na Arábia Saudita, uma vez que presta serviços eletrônicos aos clientes. Portanto, é obrigada a cobrar e recolher o IVA à taxa vigente para todos os clientes que não estão registrados para IVA. Quais serviços da HubSpot estão sujeitos ao IVA? Todos os serviços da HubSpot estão sujeitos ao IVA. Como a HubSpot determina quais clientes estão sujeitos ao IVA da Arábia Saudita? Se o seu endereço de envio principal for na Arábia Saudita e você não tiver adicionado um Número de Registro Tributário (TRN) válido à sua conta , o IVA será cobrado. Saiba como verificar qual é o endereço principal da sua empresa configurado na HubSpot . Como faço para provar que sou um cliente comercial registrado com IVA? Todas as empresas registradas para fins de IVA junto à Autoridade Geral de Zakat e Impostos (GAZT) na Arábia Saudita devem adicionar seu TRN à conta de faturamento da HubSpot. Depois que um TRN válido for adicionado à sua conta , a HubSpot não incluirá a cobrança de VAT na sua fatura. Observação : talvez você tenha que autoliquidar o IVA de acordo com o mecanismo de cobrança reversa. Estou registrado para IVA na Arábia Saudita, ainda assim serei cobrado pelo IVA? Se você adicionou um TRN válido à sua conta da HubSpot , sua empresa não será cobrada pelo IVA. Observação : talvez você tenha que autoliquidar o IVA de acordo com o mecanismo de cobrança reversa. Como posso adicionar meu TRN? Apenas usuários com permissões de Acesso à Conta podem adicionar informações de TRN à conta da HubSpot. Para atualizar seu TRN: No seu portal da HubSpot, clique no nome da conta no canto superior direito e, em seguida, em Conta e cobrança . Na guia Informações da empresa , clique em Editar endereço . Adicione seu número de IVA e clique em Enviar Há isenções para instituições sob as quais o IVA não pode ser cobrado? Se sua empresa estiver isenta de cobrança de IVA, você precisará enviar à HubSpot um certificado de isenção válido e garantir que a sua empresa atenda a todos os critérios de isenção. Os certificados de isenção devem ser enviados para billing@hubspot.com para processamento . billing",https://knowledge.hubspot.com/pt/account/ksa-tax-frequently-asked-questions
1512,Receber chamadas no HubSpot,"Você pode atender chamadas telefônicas no HubSpot. Você pode acessar registros e escrever observações do computador sem encaminhar a chamada para o celular. As chamadas recebidas são salvas na página índice de chamadas assim que atendidas, para que você possa fazer observações em tempo real e revisar a chamada depois que ela for encerrada. Observação: você deve usar um navegador compatível para receber chamadas no HubSpot. O Safari não é compatível com chamadas recebidas no navegador. Todas as chamadas feitas e recebidas no data center da HubSpot na UE são encaminhadas pelo data center da Twilio na Irlanda. Isso significa que, quando você utiliza o Twilio a partir do data center da UE, os seus dados de voz são encaminhados por meio da Twilio na Irlanda. Os dados de mensagens do Twilio não estão no escopo desta alteração. Para os clientes integrados ao data center da UE, essa alteração foi aplicada aos dados de chamadas de saída após 1º de dezembro de 2022 e aos dados de chamadas de entrada após 30 de agosto de 2023. Se você é um Superadministrador , saiba como incluir sua conta na versão mais atualizada das chamadas remotas . Configurar chamadas recebidas Configure um número fornecido pela HubSpot . Para receber chamadas no navegador do HubSpot: Na sua conta HubSpot, clique no ícone de configurações settings icon na barra de navegação superior. No menu da barra lateral esquerda, acesse Geral . Em seguida, clique na guia Chamadas . Em Preferências de toque , clique no menu suspenso e selecione Toque no navegador da HubSpot . Defina o seu status de disponibilidade como Disponível . Depois de configurar o número fornecido pela HubSpot e o método de toque do dispositivo, clique no ícone de Chamadas recebidas calling na barra de navegação superior direita. No banner pop-up, clique na guia Abrir chamada . A Janela de chamadas será aberta em uma janela separada onde você poderá receber chamadas no seu navegador da HubSpot. A janela de chamadas deve permanecer aberta para receber chamadas. Receber e gerenciar chamadas recebidas As chamadas recebidas em seu número de telefone aparecerão na caixa de diálogo Chamada remota ao lado do calling ícone de Chamada recebida na barra de navegação superior direita e na Janela de chamadas . Você pode atender a chamada em qualquer lugar. (Chamada remota no HubSpot) (Página da guia Chamada) O nome do contato, o nome da empresa e um link para o registro de contato podem ser exibidos. Observação: o identificador de chamadas pode não funcionar se você tiver vários contatos com o mesmo número de telefone. Para atender uma chamada recebida: Clique em Atender para atender a chamada na caixa de diálogo Chamada remota ou na página da guia Chamada . A chamada mostrará que está conectada com um círculo verde intermitente ao lado do ícone de Chamada recebida calling ou um círculo vermelho na guia da página da guia de Chamada . Se você clicar na página da guia da Chamada , verá um banner verde dizendo Chamada ativa . Para colocar o chamador em espera, na caixa de diálogo Chamada remota ou na página da guia de Chamada , clique em Espera . Enquanto aguardam, os chamadores ouvirão uma música de espera. Para remover um chamador da espera, clique em Espera novamente. Para acessar o registro da chamada e fazer observações durante a chamada: Na caixa de diálogo Chamada remota : Navegue até a caixa de diálogo Chamada remota ao lado da barra de navegação superior direita. Clique em Detalhes da chamada . Na página da guia Chamada : Navegue até a guia da sua conta da HubSpot no navegador. Na sua conta HubSpot, acesse CRM > Chamadas . (BETA) Para fazer perguntas sobre sua chamada atual e obter contexto útil sem esperar o processamento da transcrição, clique no breezeSingleStar ícone do Copilot. Em seguida, use o chat para inserir perguntas. Na tela Chamadas , o registro de chamadas recebidas aparecerá na parte superior do índice de chamadas. Clique no título para acessar o registro de chamadas. No registro da chamada, você pode fazer observações durante a chamada e associar a chamada a outros registros do CRM. Se tiver uma licença paga do Sales Hub ou Service Hub Professional ou Enterprise , você poderá acessar as transcrições a partir da sua chamada recebida: Para fazer observações: Na tela do registro da chamada, clique em Editar observação . Insira observações na caixa de texto. Clique em Salvar . Para associar registros do CRM à chamada: Na barra lateral direita da tela de registro da chamada, clique em objectAssociations Associações . Clique em + Adicionar ao lado de Contatos , Empresas , Negócios ou Tickets para associar um novo registro ou registro existente à chamada recebida. Clique em Salvar . Para acessar as transcrições e escrever comentários (somente Sales Hub ou Service Hub Professional ou Enterprise ), na tela de registro da chamada, revise as transcrições e escreva comentários após a conclusão da chamada. Chamadas perdidas Se você não conseguir atender uma chamada recebida, o usuário ouvirá a mensagem: ""Lamento. Você ligou para uma pessoa que não está disponível. Tente novamente em breve. Você receberá uma notificação de que a chamada foi registrada. Se você tiver a opção Permitir gravação de chamadas ativada , os chamadores poderão deixar mensagens de voz. Saiba mais sobre como acessar as mensagens de voz na página Índice de chamadas. Calling",https://knowledge.hubspot.com/pt/calling/receive-calls-in-hubspot
1513,Custom coded marketing emails look different in Outlook,"If you created a custom coded marketing email , you may notice discrepancies in the way your email renders in Outlook, such as positioning or spacing issues. You can follow the troubleshooting steps in the sections below to help If you notice that email positioning or spacing looks wrong in Outlook, follow the troubleshooting steps below. Learn more about email design on in the HubSpot Designers Community . Spacing There are two methods for adjusting spacing around images in Outlook: using hspace or vspace, and using tables. Using hspace and vspace The HTML attribute vspace defines vertical space and will add equal spacing to the top and bottom of your image. The hspace attribute defines horizontal space and will add equal spacing to the right and left of your image. In your HubSpot account, navigate to Marketing > Email . Hover over the name of the email with a custom coded template , then click Edit . Click into the content module. At the end of the image code, add either or both of the following code: hspace=""10"" vspace=""10"" , replacing 10 with the desired amount of spacing. Using tables You can use a 3-column table to evenly contain your image, spacing, and text: In your HubSpot account, navigate to Marketing > Email . Hover the name of the email with a custom coded template , then click Edit . In the rich text editor toolbar, click Insert > Table . Create a 3x1 table. In the rich text editor toolbar, click Advanced , then select Source code . Specify a width in the empty cell, such as <td width=""10""> , for the amount of spacing you would like between the image and text. Specify a font family, font size, font color, and line height such as style=""font-family: sans-serif; font-size:15px; line-height: 1.5em; color: #000000"" as Outlook will add its own styling when unspecified. Troubleshoot unexpected horizontal lines appearing in your email Due to a known bug in some versions of Outlook, a horizontal line may appear between sections in your email. While there isn't a consistent way to fix the issue, you can try the following troubleshooting steps: Set the background color of your email to be the same as its body color. Update your content's font size and line-height to be even numbers. Include the following CSS styles in the head section of your email template : ms-text-size-adjust: none; mso-line-height-rule: exactly; Marketing Email",https://knowledge.hubspot.com/marketing-email/emails-look-different-in-outlook
1514,Bulk upload and schedule social posts,"With the bulk scheduling feature in HubSpot's social publishing tool, you can plan and schedule your social posts in advance. When doing so, you can schedule up to 300 posts per bulk upload. This allows you and your team to coordinate campaigns, improve your reach, and scale your social media marketing. Prepare your bulk scheduling import file To schedule social posts in bulk, first you'll need to prepare your import file: In your HubSpot account, navigate to Marketing > Social . In the upper left, click Schedule in bulk . In the dialog box, select one of the following options: Download Excel import template (Recommended): download a template with a date column pre-populated based on your custom social publishing schedule . Download CSV import template: download a generic template. Open the downloaded import template file on your device. There are six main columns in the import template files: Account: the social account where you want the post published. If you're using the Excel template file, you can select an account from the dropdown menu in the column cells. This field is required. Date: dates must entered in the format ""mm/dd/yy hh:mm"". For example, ""3:00 PM on April 15, 2025"" would be formatted as ""04/15/25 15:00"". You can use formulas to calculate your date fields, and HubSpot will use the derived value of the formula. This field is required. Message: the actual content of your post. When bulk uploading social posts, you cannot use @mentions or tags for Facebook or LinkedIn social posts. However, for Instagram and X, any mentions will not be auto-completed, but will be acknowledged by the network when the post is live. This field is required. Link: the URL that you are sharing in your post. All links will be shortened automatically. You can also include your link in the message column as part of your post, or publish a post with no link at all. This field is optional. Photo URL : the URL of the image you want to attach to your post. This field is optional. Campaign: the campaign to associate with your post. Match the spelling and capitalization of an existing campaign to associate it or enter a new campaign name to have that campaign created in HubSpot. If you're using the Excel template file, you can select a campaign from the dropdown menu in the column cells. This field is optional. These columns can be in any order in the file you upload, but they must be present on the first page of your spreadsheet. Any information included on other pages or in other columns will be ignored. When you're done adding your social posts, save your template file and navigate back to HubSpot. Please note: if your social posts include accented characters (e.g. in German or French) or non-Latin symbols (e.g. in Japanese), you must save your template as an XLS or XLSX file. Upload your bulk scheduling import file After preparing your import file, upload it to schedule your posts. Depending on how many posts you're scheduling, your import can take 15 minutes to 24 hours to process. Any posts in the import that are scheduled to publish while the file is being processed will result in an error. To avoid this, we recommend uploading scheduled posts a day in advance. In your HubSpot account, navigate to Marketing > Social . In the upper left, click Schedule in bulk . In the dialog box, click Select a file or drag and drop your import template file into the Upload CSV/Excel File box. In the bottom left, click Upload . Once your import template file has been uploaded and processed, you'll be redirected to the Uploaded tab in the social publishing tool. Review your uploaded social posts You can return to your uploaded posts at any time. To review all uploaded posts: In your HubSpot account, navigate to Marketing > Social . In the left sidebar menu, click Uploaded . To schedule the posts for publishing, click Schedule [x] posts . To keep editing the posts in HubSpot, click Move all to drafts . To delete the uploaded posts, click Cancel upload . You can also manage individual posts: To edit a post, hover over the post and click Edit . To clone a post, hover over the post and click Clone . Then, continue editing your post . To delete a post, hover over the post and click Action . Then, click Delete . In the dialog box, click Delete post . Social",https://knowledge.hubspot.com/social/bulk-upload-and-schedule-social-posts
