id,titulo,conteudo,link
1801,Manage tickets in your inbox,"You can create a ticket for any incoming conversations in your inbox to better manage your contact's experience with your company. When responding to conversations in the inbox, you can view and manage the associated ticket's details as you follow-up with the contact or update the ticket status. In the right sidebar, use the contextual information about the associated ticket, contact, and past conversations to inform your response to the contact's inquiry. Please note: accounts created after April 1st, 2024 cannot create or manage tickets in the inbox. Creating a ticket in the inbox will move both the ticket and conversation to help desk. Learn how to manage tickets in help desk . In your HubSpot account, navigate to CRM > Inbox . In the left panel, click a conversation to open it. Please note: you can only associate one ticket per conversation and cannot dissociate a ticket from a conversation. In the right sidebar, click to expand the Ticket section. To edit the ticket property values, click the property and enter a new value. Please note: i f you change the owner of a conversation, the owner of the ticket also updates. However, if you change the owner of a ticket, the owner of an associated conversation is not updated. To view additional ticket information, click View more on the ticket card. In the panel that opens on the right, click Edit the shown properties to customize the properties that display in the Ticket details panel. You cannot edit the properties that display on the associated ticket cards in the inbox. To respond to the contact, use the reply editor at the bottom. Learn how to respond to a conversation in the inbox. To access the ticket record, click the ticket name at the top of the conversation. The ticket record will open in another tab in your web browser. When you're done, you can close the ticket and/or conversation to mark the visitor's issue or inquiry as resolved. To close the ticket, at the top of the reply editor, click the Ticket Status dropdown menu and select Closed . This will also close any associated conversations. To reopen a closed ticket, click the Ticket Status dropdown menu and select another status. If the ticket is associated with only one conversation, that conversation will also be reopened. If the ticket is associated with multiple conversations, none of the conversations will be reopened. If you want to close the conversation but leave the ticket open, click the Three dots icon and select Close conversation . This will close only the selected conversation. The associated ticket and any of the ticket's other associated conversation threads will remain open. When you delete the conversation from the inbox, the ticket will be deleted as well. Click the More dropdown menu and select Move to trash . Additionally, if you delete a ticket from the CRM, the associated conversation is also deleted. records",https://knowledge.hubspot.com/records/manage-the-tickets-in-your-inbox
1802,Criar e gerenciar tags de blog,"Com as tags, você pode gerenciar seus posts de blog por assunto. Depois de adicionar tags às suas postagens, você poderá personalizar seus modelos para link para um feed de todas as postagens por tag. Você também pode adicionar um módulo de pós-filtro para que os visitantes possam filtrar as postagens por tag. Criar uma tag de blog Você pode criar uma nova tag no painel de tags de blog ou no editor de conteúdo . Na sua conta da HubSpot, acesse Conteúdo > Blog . No canto superior esquerdo, clique no menu suspenso Posts de blog e selecione Tags . No canto superior direito, clique em Adicionar nova tag . Na caixa de diálogo, insira um nome no campo Nome da tag . Clique no menu suspenso Idioma e selecione um idioma e clique em Criar . Editar uma tag de blog Na sua conta da HubSpot, acesse Conteúdo > Blog . No canto superior esquerdo, clique no menu suspenso Posts de blog e selecione Tags . Passe o cursor do mouse sobre a tag do blog e clique em Editar . Na caixa de diálogo, insira um novo nome para a tag e clique em Atualizar . Combinar tags de blog Na sua conta da HubSpot, acesse Conteúdo > Blog . No canto superior esquerdo, clique no menu suspenso Posts de blog e selecione Tags . Marque as caixas de seleção ao lado das tags que deseja combinar. Observe: para combinar tags de blog com o mesmo nome, você deve primeiro alterar um dos nomes das tags. Na parte superior da tabela, clique em Combinar . Na caixa pop-up, clique no menu suspenso Tag para reatribuir aos posts de blog e selecione uma tag. Essa tag substituirá as tags selecionadas nos posts do blog existentes. Excluir uma tag de blog Na sua conta da HubSpot, acesse Conteúdo > Blog . No canto superior esquerdo, clique no menu suspenso Posts de blog e selecione Tags . Passe o cursor do mouse sobre a tag e clique no menu suspenso Mais , em seguida, selecione Excluir. Digite excluir no campo de texto e clique em Excluir para finalizar a exclusão da tag. Adicione ou crie uma tag para um post de blog no editor Na sua conta da HubSpot, acesse Conteúdo > Blog . Clique no nome da sua postagem. No editor de conteúdo, clique no menu Configurações e selecione Geral . Na seção Autor e tags da caixa de diálogo, clique no menu suspenso Tags e selecione a tag . Para criar uma nova tag: Clique no menu suspenso Tags . Insira a tag no campo. Clique em + Adicionar [""nome da sua nova tag""] tag para adicionar a nova tag. Para aplicar suas alterações, clique em Publicar ou Atualizar no canto superior direito. Blog",https://knowledge.hubspot.com/pt/blog/create-and-manage-blog-tags
1803,Manage the contacts enrolled in your sequence,"On the sequence summary page, you can keep track of which contacts are currently enrolled in the sequence. You can monitor their enrollment status and unenroll the contacts from the sequence. You can also pause or resume sequences, which is helpful when you are out of the office or on holiday. Additionally, you can also re-enroll contacts who were unenrolled because of an error . Use the sequence summary page On the sequence summary page, you can view which contacts are currently enrolled in your sequence. In your HubSpot account, navigate to Automations > Sequences . Click the name of your sequence. At the top of the sequence summary page, use the filters to view enrollment data from a specific time range or for a specific user. Learn more about reporting on sequences . In the upper right of the sequence summary page, you can take the following actions: If you want to clone the sequence, delete the sequence, or move the sequence to a folder, click the Actions dropdown menu. If you want to make changes to the sequence, click Edit . Learn more about editing an active sequence . If you want to enroll more contacts in your sequence, click Enroll contacts . The sequence summary page also includes a table with information about the enrolled contacts. To filter the data by the contacts' enrollment status, click the Status dropdown menu above the table. The table includes the following information: The name of the contact. The company the contact is associated with. The date and name of the user who enrolled the contact. The latest step the contact has received in the sequence. The status of the sequence. The progress details of the sequence An Actions dropdown menu, where you can edit the sequence or unenroll the contact . Hover over the contact name and click the Actions dropdown menu to edit the enrollment, or pause, resume, unenroll or reenroll the contact. To navigate to the contact's record to view more details, click the contact's name . If you need to make changes to a sequence enrollment, learn more about editing an active sequence . Pause and resume sequences After you enroll contacts in a sequence , you may need to pause scheduled emails and tasks while you’re out of the office. You can pause an individual sequence or pause every sequence where there are contacts actively enrolled. When you pause a sequence, only emails and tasks scheduled for the contacts that you enrolled will be paused. Contacts enrolled by other users won’t be paused. To pause and resume an individual sequence: In your HubSpot account, navigate to Automations > Sequences . Click the name of the sequence. In the top right, click the Actions dropdown, then select Pause . To resume the sequence, in the top right, click the Actions dropdown, then select Resume . You can also pause and resume an individual sequence from the Manage tab by hovering over the sequence and clicking the Actions dropdown menu. To pause and resume all sequences at once: In your HubSpot account, navigate to Automations > Sequences . Click the Manage tab. In the top right, click the Actions dropdown, then select Pause all . To resume the sequences, in the top right, click the Actions dropdown, then select Resume all . Pause and resume individual sequence enrollments You pause an individual contact's sequence enrollment from the contact's record. Users who have access to communicate with the contact can pause or unenroll from any sequence, including sequences that are private or shared with only specific users and teams . To pause a contact's sequence enrollment from the contact record: In your HubSpot account, navigate to CRM > Contacts . Click the name of the contact enrolled in the sequence. In the top right, in the alert above the contact's avatar, click Pause or Resume. Once the contact's enrollment resumes, the sequence will start again where it left off. For example, if there was a two-day delay before the next step, the delay will start when the sequence resumes. Two days later, the next step will execute. When a sequence is paused during a delay, the sequence will wait out the remainder of the delay before the next step executes. For example, if there is a three day delay in a sequence that is paused after two days, when the sequence resumes, there will still be one day left in the delay. Re-enroll a contact in the sequence If a contact is unexpectedly unenrolled from your sequence, you can manually re-enroll them from the sequence summary page. To re-enroll a contact, the inbox used for the contact’s original enrollment must still be connected. Please note: if you made edits to an active sequence , the changes will not apply if you use the Re-enroll option on the sequence summary page. Learn how to re-enroll contacts after making updates to the sequence . In your HubSpot account, navigate to Automations > Sequences . Click the name of your sequence. Hover over the contact you want to re-enroll and click the Actions dropdown menu, then select Reenroll . Modify the sequence in the dialog box if needed, then click Send . Please note: contacts who have unsubscribed from emails cannot be re-enrolled. Create saved filters/lists using the 'Now in Sequence' contact property You may want to create a list or filter to keep track of all of your contacts who are enrolled in sequences. You can use the Now in Sequence contact property to create a saved filter of contacts who are or are not currently enrolled in a sequence: If you have a HubSpot Marketing Hub Basic or Professional subscription, use the Now in Sequence contact property to create lists of contacts currently enrolled in a sequence. Learn more about the other available sequences contact properties that can be used when making filters and lists. Sequence Tasks Please note: if you have tasks included in the sequence, you cannot complete the tasks in bulk. You will need to navigate to each contact record after the task is created to complete the task. When a follow-up task reminder includes an email template, the task will be created when the contact reaches that sequence step. If you added the task to a queue: In your HubSpot account, navigate to CRM > Tasks . Click the name of the task. The email composer will open on the contact's record with the email template’s content already populated. If you didn't add the task to a queue, the email composer will not automatically open when you navigate to the contact record. In your HubSpot account, navigate to Contacts > Contacts . Select the contact . Locate the Manual email task on the contact record, then click Review and send . The email composer will open with the email template content. Sequences",https://knowledge.hubspot.com/sequences/monitor-the-contacts-enrolled-in-your-sequence
1804,Generate subject lines for marketing emails using HubSpot AI,"You can generate an effective and engaging subject line for your marketing email using HubSpot AI. This allows you to focus your time on refining and optimizing the content of the email campaign itself. Please note: Please avoid sharing any sensitive information in your enabled data inputs for AI features, including your prompts. Admins can configure generative AI features in account management settings. For information on how HubSpot AI uses your data to provide trustworthy AI, with you in control of your data, you can refer to our HubSpot AI Trust FAQs . Understand AI-generated content best practices Proofread and edit your AI-generated content before publishing it. Edit AI-generated content to maintain your brand's voice and style. Balance the use of AI-generated content with content written by a human. While HubSpot has security measures in place, content assistant may occasionally generate incorrect, biased, offensive, or misleading information. Verify the accuracy of the output's content, especially any statistics or facts. The large language model that powers content assistant tends to produce inconsistent results in non-English languages. HubSpot is working on better supporting these languages in the coming months. For now, use extra care in checking non-English content for accuracy and clarity. Manage subject line assistant setting for all users By default, the subject line assistant will be available to all users in your account. You can turn this setting off in your account settings: In your HubSpot account, click the settings settings icon in the top navigation bar. In the left sidebar menu, in the Account Management section, navigate to AI . In the Access tab of your AI settings, click to toggle the Give users access to generative AI tools and features switch on. Generate subject lines using HubSpot AI To generate a subject line for your marketing email: In your HubSpot account, navigate to Marketing > Email . Click the name of a drafted marketing email. Click the Settings tab. Under Subject line , click Generate . After a short delay, three subject lines will be generated for you to choose from: To use one of the generated subject lines, click Insert . If you want to iterate on one of the specific lines, click More like this to generate three new subject lines that are similar in sentiment. If none of the originally generated lines fit the tone or theme or your email, you can click Generate new ideas to generate new subject lines. As you generate potential subject lines, you can click the left arrow and right arrow icons in the bottom right of the dialog box to review the options that've been created so far. You can also generate subject lines for your marketing emails using the HubSpot mobile app . Learn more about how to design and edit emails in the mobile app . Please note: After the first time you generate your first set of suggested subject lines, you can only generate new ideas up to five additional times for a single email. The generated subject lines will be in the language you set in your marketing email settings . Email AI Tools",https://knowledge.hubspot.com/marketing-email/generate-subject-lines-for-marketing-emails-with-hubspot-ai
1805,Usar conversas no aplicativo para dispositivos móveis da HubSpot,"Acesse a caixa de entrada de conversas enquanto estiver no seu aplicativo móvel do HubSpot para iOS e Android. Você pode responder a uma conversa aberta, adicionar um comentário para outro membro da equipe ou reatribuir uma conversa para outro membro da equipe. Abra o aplicativo HubSpot no dispositivo. Toque em Menu e depois em Conversas na barra lateral esquerda. Se você for um usuário em uma conta paga e tiver várias caixas de entrada, toque no menu suspenso na parte superior e selecione uma caixa de entrada . Por padrão, uma lista de conversas atribuídas a você aparecerá. Para exibir todas as conversas na caixa de entrada, toque em Tudo aberto . Use os menus suspensos para filtrar conversas por status, canal ou destinatário. Para navegar para uma exibição de caixa de entrada diferente , toque no ícone de menu listView . Se você tiver SLAs configurados em sua caixa de entrada , uma etiqueta será exibida na visualização da mensagem se uma resposta estiver vencida ou o ticket precisar ser fechado. Para responder a um tópico, toque em uma conversa para abri-la: No início da conversa, o nome do contato e o status online/offline serão exibidos. Para visualizar ou editar o registro do contato , toque no nome do contato . Se o visitante que iniciou a conversa for desconhecido, toque no ícone adicionar mais e, em seguida, pesquise e selecione um contato existente para associar a conversa. Se você estiver usando um dispositivo Android e tiver acesso para editar tickets , toque no ícone do menu verticalMenu e toque em Criar ticket . Para exibir e fazer edições em um ticket associado existente, toque no número de identificação do ticket : Na guia Associações, adicione ou remova o contato existente, a empresa ou as associações de negócios . Para atualizar os valores de propriedade do tíquete, toque na guia Sobre e toque em Editar . Faça edições nas informações do ticket e clique em Salvar . Para excluir o tíquete associado, na guia Sobre, toque em Editar e em Excluir . Se algum usuário com licença paga do Service Hub atribuída já estiver respondendo ao visitante ou visualizando o thread, seu avatar aparecerá no editor de resposta e um indicador de digitação sinalizará que ele está respondendo ativamente. Você deve abrir outra conversa não atribuída . Digite uma resposta no editor de respostas, usando os ícones para anexar um arquivo, inserir um snippet ou compartilhar um artigo da base de conhecimento. Em seguida, toque no ícone de envio . Para adicionar um comentário e mencionar outro membro da equipe, toque na guia Comentário. Digite @ e o nome do membro da equipe , depois insira sua mensagem . Toque no ícone de envio . Para encaminhar um thread de e-mail, toque no ícone de menu verticalMenu na mensagem no thread e em Avançar . No canto superior direito, toque no menu verticalMenu para ações adicionais, incluindo marcar uma conversa como fechada , reatribuir uma conversa , bloquear um remetente ou mover a conversa para outra caixa de entrada . Toque na seta para voltar à lista de conversas. Para alterar seu status para Ausente , toque no avatar no canto superior direito. Mobile App Inbox",https://knowledge.hubspot.com/pt/inbox/use-conversations-on-the-hubspot-mobile-app
1806,Add a chatflow to your WordPress pages,"Once you've successfully installed the HubSpot All-In-One Marketing – Forms, Popups, Live Chat WordPress plugin, you can create a chatflow and add it to your WordPress pages from your WordPress account. In your WordPress account, navigate to HubSpot > Chatflows in the left sidebar menu. In the upper right, click Create chatflow . You'll be redirected to your HubSpot account's chatflow builder, where you can create a chatflow to add to your website. To add the chatflow to a WordPress page, you need to specifically target the WordPress page when setting up the chatflow: At the top of the chatflow builder, click the Target tab. In the Website URL section, click the first dropdown menu and select Website URL , then click the next dropdown menu and select is as your target criteria. Enter your WordPress page URL in the text field. At the bottom, click Save . Finish setting up your chatflow, then in the upper right, click to toggle the switch on. In a separate browser tab, navigate to your WordPress page. The chatflow will appear in the bottom right corner of the webpage. Learn how to chat with your website visitors directly from the conversations inbox in your HubSpot account. Chatflows",https://knowledge.hubspot.com/chatflows/add-a-chatflow-to-your-wordpress-pages
1807,Remove a stylesheet from a page,"You can remove a stylesheet from an individual page in the page editor. Any stylesheets applied to a template can be removed in your design manager tool. To remove a stylesheet applied to all content hosted on a subdomain, you can update your settings. Remove a stylesheet from a page You can remove a stylesheet from being applied to a specific page in the content editor. Navigate to your content: Website Pages : In your HubSpot account, navigate to Content > Website Pages . Landing Pages : In your HubSpot account, navigate to Content > Landing Pages . Click the name of your page. In the content editor, click the Settings menu and select Advanced . In the Page stylesheets section of the dialog box , click the x next to the stylesheet you'd like to remove. To turn off stylesheets that are inherited from the template or domain, click the dropdown menu next to the stylesheet and select Disabled . Remove a stylesheet from a template You can remove a stylesheet from a template in the design manager. This will remove it from all pages using that template. In your HubSpot account, navigate to Content > Design Manager . Click the name of the template where you want to attach your stylesheet to select it in the inspector. Under the Head and Body Options in the inspector, you can click the X next to the linked stylesheets you'd like to remove. This will remove the stylesheet from all pages using this template. Click Publish changes . Remove a stylesheet from a domain You can remove a stylesheet that's being applied to all pages on a domain in settings. In your HubSpot account, click the settings settings icon in the top navigation bar. On the left, click Website > Pages . In the CSS & Stylesheets section, click the X next to the stylesheet. In the bottom left, click Save . Design Manager Website Pages Account Management",https://knowledge.hubspot.com/design-manager/remove-a-stylesheet-from-a-page
