id,titulo,conteudo,link
751,Map HubSpot properties to Salesforce fields,"After installing the HubSpot-Salesforce integration , you can set up and manage the sync between HubSpot properties and Salesforce fields for contacts, companies, and deals. Create or edit field mappings Add a new field mapping In your HubSpot account, click the settings settings icon in the top navigation bar. In the left sidebar menu, navigate to Integrations > Connected Apps . In the list of connected apps, click Salesforce . Click the tab for the object you want to map: Contacts , Companies , or Deals . Please note: object sync must be enabled for Companies or Deals between HubSpot and Salesforce to set up company or deal field mappings. To add a new field meeting, click Add new field mapping . In the right panel, use the dropdown menus to select the HubSpot property and Salesforce field that you want to map. You must select compatible property and field maps in order to create a mapping. The following table shows the HubSpot property field types that can sync to Salesforce, the corresponding API names, and the matching Salesforce field types. HubSpot property field type Salesforce field type Dropdown select/Radio select picklist, reference Multiple checkboxes multipicklist Single checkbox boolean Number double/int Single-line text string, textarea Multi-line text textarea Date picker date, datetime Please note: If there is a type mismatch, or if one of your selected properties or fields is already mapped, messaging will appear above the dropdown menus. Click the message to learn more. Any custom properties with the HubSpot user field type cannot be mapped to Salesforce fields. Click Next . Select a sync rule The sync rule for your mapping dictates how data will be synced between HubSpot and Salesforce. Select a sync rule: Prefer Salesforce unless blank HubSpot will only pass a value to Salesforce if there is currently no value in Salesforce. If a value exists in Salesforce, this value will always overwrite the existing value in HubSpot. If you delete the value in Salesforce, the value will also be deleted in HubSpot. Always use Salesforce HubSpot will never pass data to Salesforce, even if there is no value in Salesforce. If there is a value in Salesforce, the value will always overwrite the existing value in HubSpot. If you delete the value in Salesforce, the value will also be deleted in HubSpot. Two-way The most recent value will always overwrite any existing values. If the value is deleted in HubSpot, it will also be deleted in Salesforce, and vice versa. Don't sync Data will never pass between HubSpot and Salesforce. If the value is deleted in HubSpot, it will not be deleted in Salesforce, and vice versa. Click Save to create your mapping. Please note: while your HubSpot account may show Prefer Salesforce unless blank for the Owner mapping, the Owner mapping can only be mapped two-way between HubSpot and Salesforce. The new mapping will now appear in the list of mappings for the selected object. To edit an existing mapping, hover over it and click Edit mapping . Once you've added your mappings, begin syncing the selected object with Salesforce by clicking to toggle the Sync [Object] switch on. For contacts, this is enabled by default and cannot be disabled. Please note: there is a limit of 500 field mappings per object. Resolve field mapping errors When a field mapping has errors or needs to be updated, data may not be able to pass between HubSpot and Salesforce. To fix or refresh field mappings: In your HubSpot account, click the settings settings icon in the top navigation bar. In the left sidebar menu, navigate to Integrations > Connected Apps . Click Salesforce . Click the object tab for your mapping: Contacts , Companies , or Deals . If there are any sync errors or warnings, this will be indicated in the Status column. Click Issue or Warning to see more information and take action. If a mapping includes a Salesforce picklist field, you can refresh the field to check for any new picklist options in Salesforce and add the options to the corresponding dropdown menu property in HubSpot. To do so, hover over the mapping and click Refresh . Please note: when bulk resyncing company/account field mappings, HubSpot cannot sync more than 200,000 companies at the same time. This can result in a We couldn't sync all your updates for this mapping error. Delete custom field mappings If you no longer want to sync data between a HubSpot property and Salesforce field in a custom field mapping, you can delete the mapping. Please note: only custom field mappings can be deleted in HubSpot. While standard field mappings can't be deleted, data syncing can be stopped by setting the update rule to Don't Sync . This does not apply to the Unsubscribed from all email contact property. In your HubSpot account, click the settings settings icon in the top navigation bar. In the left sidebar menu, navigate to Integrations > Connected Apps . Click Salesforce . Click the object tab for your mapping: Contacts , Companies , or Deals . Hover over the mapping and click Delete mapping . Export field mappings To export the list of field mappings: In your HubSpot account, click the settings settings icon in the top navigation bar. In the left sidebar menu, navigate to Integrations > Connected Apps . Click Salesforce . Click the object tab for the mappings you want to export. Click [objects] property mappings . Click Export field mappings (CSV) . Integrations",https://knowledge.hubspot.com/salesforce/map-hubspot-properties-to-salesforce-fields
752,Pass contact property values with hidden form fields,"You can use a hidden form field to pass a value into a property without requiring contacts to fill in the corresponding form field. For example, when a contact submits a Request a quote form, you may want them to automatically have a Status of Open . You can use a hidden field to set a value of Open on the Status contact property without the contact explicitly filling out that form field. When using hidden form fields, please note the following: If the Make this field required option is toggled on for your form field, this field cannot be set as hidden. If the Pre-populate fields with known values option is toggled on for your form, the specified value for your hidden form field may be overwritten depending on the property's field type . To set a form field as hidden: In your HubSpot account, navigate to Marketing > Forms . Click the name of a form or create a new form . In the form editor, hover over a form field to hide and click the edit pencil icon . In the left panel, click to toggle the Make this field hidden switch on. Specify the value to pass into the property on the contact record when the form is submitted. This varies depending on the property field type : Date picker/Number/Single-line text/Multi-line text: enter the value in the Default value text field. Dropdown select/Multiple checkboxes/Radio select: select the checkbox next to the options you want to use from Field options . Single checkbox: select the Yes , No , or No value radio button. In the top right, click Publish . Forms",https://knowledge.hubspot.com/forms/pass-contact-property-values-with-hidden-form-fields
753,Create sales goals,"With sales goals, managers can create user-specific quotas for their sales teams based on templates provided by HubSpot. Managers can then assign these goals at the user, team, or pipeline level. Use goals in reports to visualize and track attainment over time, providing better contextual insights into performance. Learn how to create custom goals from scratch . Different subscription tiers have access to different goals: Sales Hub and Service Hub Starter provide access to only the Revenue goal measure. Sales Hub Professional and Enterprise provides access to Deals created , Calls made , Revenue and Meetings booked . Service Hub Professional and Enterprise provides access to the Average ticket resolution time , Average ticket response time , Revenue , and Tickets closed goal measures. Please note: you must be a user with a paid Sales or Service Hub Professional or Enterprise seat or a Super Admin to create, edit, and delete sales or service goals in your account. To be assigned a goal, however, you must have either a paid Sales or Service Hub Professional or Enterprise seat. Learn more about managing goals permissions for users . Create sales goals In your HubSpot account, navigate to Reporting > Goals . In the top right, click Create goal . Select to create a goal using a template or from scratch. Learn more about creating goals from scratch . Select Create from template . In the left panel under Category , select Sales . Select the goal type you want to create, then click Set goal . To create a forecasted goal, select the Forecasted revenue goal template. Please note: if the Revenue template is selected, the goal is either monthly or quarterly and the goal is set to track All pipelines or a single pipeline, the goal template will be categorized as Forecasted revenue . On the Setup page, customize your goal name, contributors, and duration. In the Goal name field, enter a name for your goal. To set up goal contributors: Under contributors, select either User goals only or Teams with user goals . Based on your selection, on the Users or Teams dropdown menu, select the users or teams for the sales goal. Team goals can be based on each individual user on the team or the team as a whole. To include extra team members in a team goal, click Include contributions from extra team members checkbox. If a user is a member of more than one team, a goal target can only be applied for one of the teams they are a member of. If a user is a primary member of one of those teams, that's the only team their target can be applied to. To set up Duration: On the Duration dropdown menu, select whether you want this sales goal to be measured Weekly, Monthly, Quarterly, Yearly, or Custom . If you select Custom , enter the start date and end date . To align the duration with your fiscal year settings , click the Align with your fiscal year settings? checkbox. If you're using a Forecasted revenue goal template, select a Year and Pipeline this goal applies to . The year will align with the account's fiscal year chosen in the settings. Please note: when creating a goal, the goal Duration must match the Forecast period to display in your forecast. For example, if the goal duration is set to quarterly, then the forecast period must also be set to quarterly. In the bottom right, click Next . On the Performance page, set up your targets for the year: For each user or team you select, set and edit different values for each month, quarter, or year. If you want to set the same monthly or quarterly goal for the entire year, select the checkbox to the left of a user or team, then click Apply targets . For Sales Hub Professional+ and Service Hub Professional+ users you can select both team and user goals. If you opted not to use forecasts for your goal, you can click the Pipeline dropdown for each user or team and select a pipeline . Please note: to view or edit users in Team goals, the user must have a paid Sales Hub Starter, Professional , or Enterprise seat, or a Service Hub Enterprise seat and view/edit permissions . If you opted not to use forecasts for your goal, and you want to set the same pipeline for every user or team you selected, select the checkbox in the top left of the table, then click Apply pipelines . In the dialog box, click the Select pipelines dropdown menu then select a pipeline . Click Apply . In the bottom right, click Next . Select the checkbox next to any goal milestones that you want to trigger a notification for. In the bottom right, click Done . Manage your goals View your goals by measurement type, team, and pipeline. To manage goals in your HubSpot account, the user must have a paid seat . In your HubSpot account, navigate to Reporting > Goals . In the Overview tab, to filter your goals: Goal template: to filter your goals by template, click the Goal template dropdown menu. Goal name: to filter your goals by their name, click the Goal name dropdown menu. Duration: to filter your goals by duration, click the Duration dropdown menu. Teams: to filter your goals by team, click the T eams dropdown menu. Users: to filter your goals by users, click the Users dropdown menu. Pipelines: if you're tracking revenue, click the Pipelines dropdown menu to view goals for a specific pipeline. To edit a month's goal or change the notification settings for reaching a specific goal milestone, hover over the user or team, then click Edit . In the right panel, make any changes to the contributor's goal values, or click the Notifications tab to edit notification settings. When you're done making changes, click Save . To clone a goal, hover over a goal, then click Clone . If you want to remove a user from your goals dashboard, select the checkbox to the left of their name, then at the top of the table, click Delete . TT Please note: Goal progress will update every 24 hours. While the goal is on-going, changes will be reflected in the next goal progress update. Changes made to a deal after a goal is due will not update the goal's progress. If the goal's assigned user has been deactivated or deleted, the goal's KPI progress, status, or last calculated data will no longer be actively calculated or updated. Use goals in reports Deal-based sales goals can be used in reports to visualize goal target data. Reference lines can also be added to the report builder for sales goals. Learn more about reporting on goals . Reports Goals",https://knowledge.hubspot.com/reports/create-sales-goals
754,Exportar seus registros,"Exporte seus registros (por exemplo, registros do contato) na sua conta da HubSpot. Você também pode visualizar uma lista de exportações passadas da sua conta . Atividades em registros, como observações ou e-mails, não podem ser exportados. Para recuperar atividades, você pode exportar determinados relatórios de atividades ou usar a API de engajamentos . Exportar registros Acesse seus registros: Chamadas: Na sua conta HubSpot, acesse CRM > Chamadas . Contatos: Na sua conta HubSpot, acesse CRM > Contatos . Empresas: Na sua conta HubSpot, acesse CRM > Empresas . Negócios: Na sua conta HubSpot, acesse CRM > Negócios . Pagamentos : Na sua conta HubSpot, acesse Comércio > Pagamentos . Tickets: Na sua conta HubSpot, acesse CRM > Tickets . Objetos personalizados: Na sua conta HubSpot, acesse CRM e selecione objeto personalizado . Para abrir a exibição que você pretende exportar: Na exibição de lista listView , clique na guia da exibição ou em + Adicionar exibição e, em seguida, selecione a exibição no menu suspenso. Para exportar todos os registos desse objeto, abra a exibição Todos os [registros] . Na grid exibição de quadro (somente negócios, tickets ou objetos personalizados), clique no menu suspenso pipeline e selecione o pipeline com a exibição que deseja exportar. Em seguida, clique no menu suspenso e selecione a exibição . Para exportar todos os registros no pipeline, abra a exibição Todos os [registros] . Para exportar os relatórios: Na exibição de lista listView , no canto superior direito da tabela, clique em Exportar. Na exibição de quadro grid , no canto superior direito, clique em Opções do quadro e selecione Exportar exibição . Na caixa de diálogo, para escolher o formato do arquivo exportado, clique no menu suspenso Formato de arquivo e selecione o formato . Para escolher o idioma dos cabeçalhos das colunas no arquivo exportado, clique no menu suspenso Idioma dos cabeçalhos de coluna e selecione o idioma . Por padrão, o menu suspenso mostrará o idioma padrão selecionados nas configurações. Os cabeçalhos de coluna de propriedades padrão serão traduzidos, mas os valores de propriedade dentro de cada coluna não serão traduzidos para o idioma selecionado. Por padrão, somente as propriedades e associações na exibição serão incluídas no arquivo e, para associações, isso incluirá até mil registros associados por coluna de associação . Para editar quais propriedades e associações estão incluídas, clique em Personalizar e selecione uma das seguintes opções: Contatos com vários endereços de e-mail : marque a caixa de seleção Incluir todos os endereços de e-mail para incluir todos os endereços de e-mail dos contatos com vários e-mails no arquivo de exportação. Empresas com vários domínios : marque a caixa de seleção Incluir todos os domínios para incluir todos os nomes de domínio para empresas com vários domínios no arquivo de exportação. Propriedades incluídas na exportação : as opções incluem Propriedades e associações na sua exibição (padrão), Todas as propriedades nos registros (ou seja, sem associações), ou Todas as propriedades e associações nos registros. A ordem das colunas no arquivo de exportação depende da opção que você selecionar: Se exportar apenas propriedades na exibição, as colunas serão mostradas na mesma ordem definida para as propriedades na exibição . Se você exportar todas as propriedades, as colunas serão mostradas em ordem alfabética, com exceção do ID do registro , que será a primeira coluna do arquivo. Se você exportar todas as propriedades e associações, as associações serão incluídas no final. Associações incluídas na exportação : as opções incluem Até 1.000 registros associados (padrão) ou Todos os registros associados (somente arquivos CSV). Clique em Exportar . Você receberá um e-mail com um link de download para seu arquivo de exportação. Todos os links de download dos arquivos de exportação expirarão após 30 dias. Se os registros exportados tiverem registros associados, cada objeto associado terá sua própria coluna dentro do arquivo. Dependendo do objeto, você pode exportar informações sobre contatos, empresas, negócios, tickets, registros de objetos personalizados, itens de linha, assinaturas ou pagamentos associados. Para cada objeto associado, o arquivo exportado contém os seguintes cabeçalhos e informações: IDs de [objetos] associados: os IDs dos registros associados. Múltiplos valores de ID são separados por ponto e vírgula. [Objeto] associado: o nome do registro associado (por exemplo, nome do contato, nome da empresa etc.). Múltiplos nomes de registros são separados por ponto e vírgula. Configurar uma notificação de aviso de exportação grande Se você for um superadministrador , poderá configurar uma notificação de aviso de exportação grande para saber quando os usuários exportam dados de registos da sua conta. Cada superadministrador pode personalizar sua notificação de acordo com suas próprias necessidades. Na sua conta HubSpot, clique no ícone de configurações settings icon na barra de navegação superior. No menu da barra lateral esquerda, acesse Importar e exportar . Em Exportar , digite ou use as setas para ajustar o número. Você será notificado sempre que ocorrer uma exportação de um número de registros igual ou superior ao número especificado. Limites técnicos O seguinte é esperado ao concluir as exportações de registros: Você pode realizar até 300 exportações dentro de um período contínuo de 24 horas, e até três exportações ao mesmo tempo. Todas as exportações adicionais serão enfileiradas até que uma das três exportações simultâneas seja concluída. Pode levar algumas horas para concluir uma grande exportação e vários arquivos podem ser gerados em um arquivo zip. Vários arquivos são esperados ao exportar arquivos CSV ou XLSX com mais de 1.000.000 linhas e arquivos XLS com mais de 65.535 linhas. Um arquivo CSV exportado será compactado automaticamente se o arquivo resultante for maior que 2 MB. Para arquivos XLS e XLSX, há um limite no número de colunas que podem ser exportadas (256 para XLS e 16.384 para XLSX). Se a exportação contiver mais colunas do que o limite, as colunas adicionais não serão incluídas no arquivo. Para exportações com um grande número de colunas, é recomendado exportar arquivos CSV, que não têm um limite de colunas. CRM records Import & Export",https://knowledge.hubspot.com/pt/import-and-export/export-records
755,Set up conditional logic for enumeration properties,"You can set conditional logic for properties that are triggered when users set certain values during record creation or when manually updating property values for existing records. This conditional logic is available only for enumeration property types , which includes dropdown select, multiple checkboxes, single checkbox, and radio select properties. For example, you can set up logic to require the Mobile phone number property once a contact's value for Preferred communication method is set to Text . Please note: any previously set conditional logic (i.e. conditional stage logic and Create record form conditional logic ) will now be enforced when manually creating or editing records on desktop on a record or object index page, in the HubSpot Sales extension , and in playbooks. Create record form conditional logic will also be automatically added to the Conditional property logi c tab in the property settings, where it can be edited . Add conditional logic Users must have Edit property settings permissions to set conditional logic for properties. To set up new logic: In your HubSpot account, click the settings settings icon in the top navigation bar. In the left sidebar menu, navigate to Properties . Click the Select an object dropdown menu, then select Contact, Company, Deal, Ticket, or [Custom object] properties. Click the Conditional property logic tab. To add conditional logic, click Create logic . You'll be brought to the property logic editor. Set up the controlling property: Click the Controlling property dropdown menu, then select the property in the form that will trigger conditional logic. Once a property is selected, click the Value dropdown menu, then select the option that will cause additional properties to appear or become required when selected. Set up the dependent properties that will appear when the controlling property's value is selected: Click + Add dependent property , then select the property . To require a property, select the Required checkbox. If a property is required, users cannot create or update the record until they set a value for the property. To reorder the properties, click and drag a property to a new position. The properties will be displayed in this order when they appear in the create record form or when editing a record. Once you're done, click Save logic . Moving forward, the logic will apply when manually creating or editing record on desktop, on a record, the object home page, or in the HubSpot Sales extension . The logic will not apply when editing records with other HubSpot tools, including in the HubSpot mobile app or via workflows. For example, if you've set up logic to require the Mobile phone number property when SMS is the contact's Preferred communication method , the dependent property will appear when setting the controlling property value in the following scenarios: Manually creating a record. Editing the value on a record . Editing the value on the object home page , including board view for deals, tickets, and custom objects. Editing the value while using a playbook . Edit or delete existing conditional logic Users must have Edit property settings permissions to edit or remove conditional logic for properties. In your HubSpot account, click the settings settings icon in the top navigation bar. In the left sidebar menu, navigate to Properties . Click the Select an object dropdown menu, then select Contact, Company, Deal, Ticket, or [Custom object] properties. Click the Conditional property logic tab. To edit existing logic: Hover over the logic, then click Edit . In the editor, update the controlling or dependent properties, then click Save logic to confirm your changes. To delete existing logic: Hover over the logic, then click Delete . In the dialog box, click Delete to confirm. properties CRM",https://knowledge.hubspot.com/properties/set-up-conditional-logic-for-enumeration-properties
