id,titulo,conteudo,link
842,Manage invoices,"After creating invoices , you can manage them from the invoice index page, like managing other CRM records . Manage invoices To manage your invoices: In your HubSpot account, navigate to Commerce > Invoices . Click the name of the invoice. In the right panel, you can set the invoice owner using the Owner field, view its properties, view payments made, and manage the invoice's associations, including adding additional contacts and companies. Manage drafted invoices For drafted invoices, you can access the following options by clicking the Actions dropdown menu in the upper right: Edit: continue setting up the invoice. View property history: check the past property values for the invoice. Clone: create a new invoice with the same details. Delete: delete the invoice draft. Manage finalized invoices For finalized invoices, you can access the following options by clicking the Actions dropdown menu in the upper right: Edit: if the setting to edit invoices has been turned on, Super Admins and users with the edit permission for invoices can edit finalized invoices from the invoices index page. Once changes have been saved, it's recommended that communication is sent to the customer to inform them that the invoice has changed, including details of the changes. Please note: An invoice cannot be edited if a payment has been made on it. If the customer is in the process of making a payment while you are making edits, saving the edited invoice will cancel an open checkout. If the payment is made first, then editing will be disabled. Invoices created from subscriptions can't be edited. Record payment: manually mark the invoice as paid by creating a new payment record or applying an existing one. After selecting this option: To create a new payment record, fill out the payment detail fields in the right sidebar, then click Record payment . The payment will then appear under Payments when viewing the invoice's details. To apply an existing payment to the invoice, in the right sidebar click the Apply existing tab. Then, search for a payment record by the payment amount, ID, or contact email address associated with the payment. Select the payment , then click Apply payment . The payment will then appear under Payments when viewing the invoice's details. Please note: when manually marking the invoice as paid, contacts will not receive a receipt automatically. If a receipt is required, you can send one to the contact from the payments index page. To delete a payment: In your HubSpot account, navigate to Commerce > Invoices . Click the name of the invoice. In the right sidebar, in the Payments section, click View associated Payment . Click the payment amount . Click the Actions dropdown menu in the upper right, then click Delete . Click Delete record to confirm. View invoice: open the invoice in a separate browser tab. View property history: check the past property values for the invoice. Copy link: copy the invoice URL to send to a buyer. Send: send the invoice through an email. Learn more about sending invoice emails . Download: download a PDF of the invoice. Edit reminders: delete an upcoming invoice reminder . Charge payment method: charge the invoice to a customer's stored payment method . Both you and the customer will receive a receipt via email. Clone: create a new invoice with the same details. Delete: if the setting to delete invoices has been turned on, Super Admins and users with the edit permission for invoices can delete unpaid finalized invoices from the invoices index page. Invoice deletion is permanent and can't be undone. Please note: invoice numbers will continue to increment sequentially from the last created invoice (even if that, or any other invoice has been deleted). Thus, invoice deletion may create a permanent gap in invoice numbering. Numbering can only be reset if all invoices are deleted (but paid invoices can't be deleted). You should consult with your accounting team to ensure it will work with your current systems. Void: mark the invoice as void. After marking an invoice as void, you can no longer collect payment on the invoice or void it. This can't be undone. If an online payment has been made against the invoice, it isn't possible to void the invoice, even if a refund is issued. If a manual payment has been recorded against the invoice, the payment must be deleted before you can void the invoice. Filter and export invoices To filter the index page by specific invoice properties: Click Advanced filters in the upper left. In the right panel, click + Add filter to set up a new filter. Search for and select the property you want to filter by, then set the filter criteria. To select another property, click AND or OR . Learn more about setting up filters and saving views . To edit the columns that appear in the table, click Edit columns in the top right of the table. Click Export in the top right of the table to export all of your invoices. Learn more about exporting records . Send created invoices After creating an invoice, you can share it through an email, using a direct link, downloading a PDF, or insert invoices while composing messages in CRM records and the conversations inbox. If you want to automate the sending of invoices, follow these steps . Send the invoice via email To send the invoice via email: In your HubSpot account, navigate to Commerce > Invoices . Click the name of the invoice. In the right sidebar, click Actions , then select Send . In the Send invoice email tab, set up your email address fields: The To field will automatically be filled with the email address of the contact associated with the invoice. To change this address, click the dropdown menu and select a contact . You can also enter a new email address and HubSpot will automatically create a contact record for them after sending. To add an email address to the Cc field, click Add cc recipients . Click the dropdown menu , select the contacts, or enter custom email addresses . You can add up to nine email addresses in the CC field. If a default email address has been set up in the invoice settings , the From field will automatically be filled with the default email address. Otherwise, it'll be filled with your personal email address. If a default email has been set, but the setting to allow users to send invoices from their personal email or other team emails they have access to has been turned on, you'll be able to select a different email. If no default email address has been set, the email address you select will become the default address for future invoice sends, but can be changed before each send. Replies to this email will be routed to the From address. If you select an email address that's being used for a connected inbox , including shared team email inboxes , you can manage follow-up in HubSpot's conversations inbox . As you update the fields, a live preview will display to the right of the fields. To send the email: Click Send invoice email to send the email as displayed. The buyer will then receive an email containing the invoice details with a link to view the invoice in their browser, along with a PDF version of the invoice as an attachment. To instead manually compose a one-to-one email with a link to the invoice, click Create custom email in your CRM . Send the invoice via a link or PDF To copy a link to send the invoice, or download a PDF of the invoice: Please note: if you send an invoice in a manually written email or by inserting a link, the Last sent date property will not be updated. Learn more about invoice properties . In your HubSpot account, navigate to Commerce > Invoices . Click the name of the invoice. In the right sidebar, click Actions , then select Send . Click the Copy link, download PDF tab. A preview of the invoice will display in the right side of the window. Click Copy link to copy a link to the invoice. Click Download PDF to download a PDF of the invoice. Click the X or click Close when you are done. Insert an invoice into a one-to-one email or message in the conversations inbox To insert an invoice into a one-to-one email or message in the conversations inbox: In the message composer, click Insert , then select Invoices . Select an invoice or click Manage to navigate to the invoices index page. After selecting an invoice, a hyperlink will be added to the message using the invoice number. Get the link of an invoice to share To get the link of an invoice to share on your preferred platform: In your HubSpot account, navigate to Commerce > Invoices . Click the name of the invoice. In the right sidebar, click Actions , then select Copy link . You can then insert the link into your preferred messaging platform, and the buyer can click the link to view the invoice at the URL you configured during invoice creation . Review edit history You can view the history of edits to an invoice, including any status changes, and when invoice emails were sent, which users performed the action, and the date and time an action occurred. In your HubSpot account, navigate to Commerce > Invoices . Click the name of the invoice. In the right panel, scroll down to the history panel. Please note: currently, HubSpot-built account integrations, such as Quickbooks Online and Xero , don't support syncing invoices from HubSpot. However, you can export your invoice records and upload them to your accounting system. You can subscribe to updates about new invoice integration features, such as invoice sync, by filling out this form . Invoices",https://knowledge.hubspot.com/invoices/manage-invoices
843,Report on goals,"When you've created your Sales , Service , Marketing or Custom goals, you can report on their performance. Goals data can be used in the single object report builder, or a sales goal reference line can be added to reports to measure impact over time. View goal-specific performance reports View individual goal performance from within the goals tool. Analyze the total progress your goal has made, and user performance. In your HubSpot account, navigate to Reporting > Goals . Click the name of a goal. At the top of the performance page, view the Goal template used, the Pipelines , Duration , Start date , End date and who the goal was Created by . In the Summary tab, click the Date range dropdown menu to select a date range. View the below in the Summary tab: Total progress: the overall progress that the goal has made. Actual versus user goals: shows the goal target versus the actual progress of the goal. This report can be saved and added to a dashboard by clicking Actions in the top right of the report, then select Save report . Leaderboard: ranks users and the progress they've made in meeting a goal. This report can be saved and added to a dashboard by clicking Actions in the top right of the report, then select Save report . User goals in progress: the number of goals with a status of In progess that were created by the same user that created the current goal. This report can be saved and added to a dashboard by clicking Actions in the top right of the report, then select Save report . User goals achieved: the number of goals achieved that created by the same user that created the current goal. This report can be saved and added to a dashboard by clicking Actions in the top right of the report, then select Save report . User goals missed: the number of goals that were missed by the same user that created the current goal. This report can be saved and added to a dashboard by clicking Actions in the top right of the report, then select Save report . Navigate to the User performance tab. Use the filters at the top of the table to filter the data by Total progress breakdown , Teams , and Users . Create a goal report from an existing goal You can create a goal report from an existing goal instead of creating reports and goals separately. In your HubSpot account, navigate to Reporting > Goals . Hover over a goal , then click the Actions dropdown menu. Click Report . In the View and filter report dialog box, use the filters at the top to refine your reporting data. Click the About and Data Quality tabs on the right to learn about report measures and data quality insights. Click Save report . The report will now appear in your dashboard . Create a goal report in the single object report builder Create goal-based single object reports through the single object builder, and save the report to your report library or dashboard. Learn more about creating reports with the single object report builder . Please note: the Kpi unit type filter is set to Currency . To view goals that have a different unit, for example number , you can edit Kpi unit type filter. In your HubSpot account, navigate to Reporting > Reports . In the top right, click Create report . In the Create reports from scratch section, select Single object . Select Goals . Then, click Next . At the top, click your report's name to edit it. In the left panel, click Add Goals Property to browse and select the properties you want to report on. After selecting these properties, in the left panel, drag and drop properties to reorder the columns in the table on the right. To remove a property, click the x next to its name. In the upper left, click Filters to segment the records that appear in your report. You must add at least one filter to your report for data to appear. Click + Add filter and browse or search for the property you want to use to filter your report, then set the criteria. This report uses AND logic to filter records, so all filters must be true for the object to appear in the report. The Kpi unit type filter is set to Currency by default. To edit the currency displayed in the report, add the filter Goal Target Currency and select a currency. Navigate to the Visualization tab to customize the appearance of your report. In the left panel, select a chart type . In the Configure chart section, drag and drop properties into the Displaying section to add them to your chart. You must select a date property or a property that gives a specific count to plot your data. In the above chart shows the progress made towards the target goals. This is done by using the measures KPI value and Target amount . If you've selected a line or area chart with a date property as a report measure, you can compare the current data set with a previous time period. In the upper right, click the Display options dropdown menu. Click the Comparison dropdown menu and select the date range you'd like to compare the current data to. To receive a file with your report's data, click Export in the upper right. In the dialog box, select the File type , and click Export . Please note: the export will only include the properties that have been added to the Selected properties section of the Data tab. When you're done with your report, click Save to add it to your list of saved reports. Add deal based goal data to deal-based reports Use sales goal data in deal-based reports. Goal data can be used in Bar , Column , Line , and Area charts. Please note: goals will display in the dropdown menu for reports built in the single object report builder and that are created using one property only. In your HubSpot account, navigate to Reporting > Dashboards . In the top right of a deal-based report, click the filter View & filter icon . In the Filters tab, click the Goal dropdown menu and select a goal . The Goal dropdown menu will only display goals that use the same date property and frequency of the report. The report will update to display the goal target data. Please note: A shorter frequency goal can be viewed in a longer frequency report, for example, a weekly goal will be displayed as a monthly goal if the report frequency is set to Monthly . However, the opposite is not true. A monthly goal cannot be viewed as a weekly goal. The date range for the goal must be within the date range for the report. Add additional required filters in the right panel. If the report filters are edited after the goal has been selected, the goal will be removed from the report and will need to be selected again. To customize your report further, click Customize in the bottom left. If a report has goals data represented on the chart, this option will be disabled as the report cannot be customized further. To enable the customize option, remove Goals from the report. Click Save . Add quota-based goal data to deal-based reports A quota-based goal is a user or team specific sales goal that must be created using a Forecasted Revenue template to appear on deal-based reports. In your HubSpot account, navigate to Reporting > Reports . Hover over the deal-based report , then click the verticalMenu Actions dropdown menu, and select Set Quotas . On the Goals page, click Create goal . Click Create from template , then select Forecasted revenue template. Write the goal name , contributors , year , and pipelines this goal applies to . Click Next . On the What are your targets? screen, set the goals and pipelines for each user or team selected. Click Next . On the What settings would you like to add? screen, set the notifications by selecting the different checkboxes you want to apply. Click Done . Once completed, the quota amount that that you see on your deal-based report will show the sum of the user or team goals you have set. Add a sales goal reference line in the report builder You can create single-object deal reports that track revenue goals to measure your impact over time. HubSpot provides a set of standard reports in the report library , and Professional or Enterprise users can customize these reports or create a custom report . To create reports with the custom report builder, the user must have Create/own and Edit report permissions . This type of report should be used for vizualisation purposes and does not add sales goal data to the report. When creating a revenue goal report, keep the following in mind: You can add revenue goals to a report by adjusting the Display options in the report builder. The report must be a single-object deal report that includes a date property. The report must also use the Line or Area chart type. When using revenue goals in custom single-object reports, it's recommended to include a filter for a specific pipeline associated with the goal. Otherwise, all pipelines will be factored into the report. Revenue goal is calculated as follows: (goal revenue / total number of days in the selected date range) x number of days so far in the selected date range. For example, if the date range in your report is set to This month , the calculation would be: (goal revenue / total number of days in the month) x number of days in the month so far. You can manually add goals to reports created with the advanced custom report builder . A monthly goal can be added in the custom report builder for the following chart types: Vertical bar , Line , and Area charts with a date property on the X-axis. Horizontal bar charts with a date property on the Y-axis. If your report meets one the above criteria, you can add a monthly goal to the report by clicking Chart Settings in the Configure tab of the report builder. Please note: it's not possible to add a sales goal reference line for team goals. Goals",https://knowledge.hubspot.com/goals/report-on-goals
844,HubSpot Sales prompts login every time Outlook on desktop is opened,"If you've found that you need to log into HubSpot Sales every time you open Outlook on Windows desktop, you'll need to make changes to your internet configuration in your desktop settings. Please note: these steps apply to the HubSpot Sales Outlook desktop add-in. If you have the HubSpot Sales Office 365 add-in, follow the troubleshooting steps for that add-in instead. Open the Control panel on your Windows device, then use the search bar to look up and select Internet Options . In the Internet Options dialog box, click the Security tab. Select the Trusted Sites icon. Click the Sites button. Add each of the following URLs to the Add this website to the zone field, one at a time. Click Add after entering each one: https://dl.getsidekick.com https://app.getsidekick.com https://app.hubspot.com Once you've added all three URLs, click Close . In the Security level for this zone section, set the security setting to Low . Next, click on the Privacy tab and click Advanced . Select the Accept radio button for both First-party and Third-party cookies (if the options are grayed out, select the Override automatic cookie handling checkbox). Select the Always allow session cookies checkbox. Click OK . Click Apply . Try logging into the Outlook desktop add-in again. Connected Email",https://knowledge.hubspot.com/connected-email/hubspot-sales-prompts-login-every-time-outlook-on-desktop-is-opened
