id,titulo,conteudo,link
657,Importe arquivos CSV para criar conjuntos de dados,"Importe arquivos CSV para criar um conjunto de dados . Um conjunto de dados pode ser criado com o arquivo CSV como fonte de dados ou pode ser adicionado a qualquer objeto HubSpot ou dados de evento. Antes de começar Antes de começar a trabalhar com esse recurso, certifique-se de compreender totalmente quais etapas devem ser executadas com antecedência, bem como as limitações do recurso e as possíveis consequências de usá-lo. Compreenda os requisitos Verifique se você tem permissões de Importação . Configure os arquivos de importação e confirme se você tem todos os campos necessários. O arquivo de importação deve: Seja um arquivo .csv. Ter apenas uma planilha. Inclua uma linha de cabeçalho na qual cada cabeçalho de coluna represente uma coluna no conjunto de dados. Os cabeçalhos de colunas podem ser organizados em qualquer ordem sem afetar a importação. Para mapear os dados CSV para um objeto ou evento HubSpot, uma das colunas do arquivo deve corresponder a uma propriedade HubSpot para o objeto ou evento de destino. Não é possível incluir dados confidenciais Contêm menos de 100 colunas. Ser codificado em UTF-8 se os caracteres de idiomas estrangeiros estiverem incluídos. Contém células em formato numérico ao importar propriedades de data e hora. Certifique-se de que todos os valores de células que contêm vírgulas estejam entre aspas. Contém apenas dados de moeda formatados para USD usando decimais (por exemplo, 123,45). Entenda as limitações e considerações Os arquivos CSV carregados estarão disponíveis para todos os usuários do conjunto de dados na conta. Os dados confidenciais são definidos no nível da propriedade, portanto, nenhum dado sensível deve ser incluído nas importações de CSV usadas para criar conjuntos de dados. Configurar corretamente seus arquivos ajuda a evitar erros de importação. Você pode consultar arquivos de importação de exemplo para ajudá-lo a começar. As importações têm as seguintes limitações técnicas: Importe arquivos de até 512 MB. Importe até 10.000.000 linhas por dia, com um limite de 1.048.576 linhas por arquivo. Estes limites aplicam-se a um período contínuo de 24 horas e não são reinicializados a uma hora específica do dia. Importe um arquivo CSV como fonte de dados Na sua conta da HubSpot, navegue até Gerenciamento de dados > Conjuntos de dados . Navegue até o Fontes de dados CSV aba. Clique Carregar CSV . Na página Upload , selecione o arquivo de Origens de Dados e o idioma dos cabeçalhos de coluna no arquivo: Para carregar o arquivo de Fontes de Dados , clique em escolher um arquivo . Para selecionar o idioma dos cabeçalhos de coluna no arquivo, clique no menu suspenso e selecione um idioma . Clique em Próximo . Na página Mapear , selecione o tipo de dados e mapeie as colunas: Para selecionar o tipo de dados, clique no menu suspenso Tipo de dados e selecione o tipo de dados para cada um dos cabeçalhos de coluna. Os tipos de dados incluem booleano, texto , data, Saiba mais sobre tipos de dados. Mapeie suas colunas para seus tipos de dados e clique em Próximo . Na página Detalhes , digite um nome de Importação . Clique em Finalizar importação . Use o arquivo CSV importado no construtor de conjunto de dados Na sua conta da HubSpot, navegue até Gerenciamento de dados > Conjuntos de dados . Clique na guia Fontes de dados CSV . Passe o cursor do mouse sobre o nome do upload do conjunto de dados e clique em Usar para criar conjunto de dados. No Construtor de conjuntos de dados , confirme sua fonte de dados principal, una-a a outra fonte de dados e visualize seus dados. Na barra lateral esquerda, confirme sua fonte de dados principal. Por padrão, seu arquivo CSV importado será selecionado. Para alterar a fonte de dados principal: Clique no botão delete ícone deletar para remover a origem de dados principal. Clique em + Adicionar fonte de dados primária . Na caixa de diálogo Selecionar sua fonte de dados primária , selecione sua fonte de dados primária. Para unir outra origem de dados: Clique em Unir outra origem de dados . Na caixa de diálogo Visualizar seu join , selecione como unir os dados do arquivo CSV importados aos dados do HubSpot. Saiba mais sobre como usar junções de dados no conjuntos de dados . Uma coluna em seu arquivo CSV deve ser mapeada para uma propriedade no objeto HubSpot selecionado. Por exemplo, selecione um identificador exclusivo para vincular ambas as fontes de dados. Um identificador exclusivo pode ser o endereço de email de um contato porque ele é exclusivo do objeto de contato. Continue criando seu conjunto de dados . Observação: não é possível ingressar em várias fontes de dados CSV. Data Management",https://knowledge.hubspot.com/pt/data-management/import-csv-files-to-create-datasets
658,Criar URLs de rastreamento,"As URLs de rastreamento ajudam a medir a eficácia das suas campanhas de marketing . Um URL de rastreamento é um URL normal com parâmetros anexados. Quando os visitantes acessam seu site de um URL de rastreamento, o HubSpot salva as informações nesses parâmetros. Saiba como analisar dados de tráfego de URLs de rastreamento na ferramenta de análise de tráfego . Por exemplo, você pode rastrear o tráfego a partir de links em seus e-mails de marketing, campanhas PPC ou anúncios de banner para páginas específicas com o código de rastreamento do HubSpot instalado. Você também pode criar URLs de acompanhamento usando o URL das páginas de agendamento . Crie uma URL de rastreamento Para criar um URL de rastreamento, você deve ter permissões de Relatório de marketing. Na sua conta HubSpot, clique no ícone de configurações settings icon na barra de navegação superior. No menu da barra lateral esquerda, acesse Rastreamento e análises > URLs de rastreamento . No canto superior direito, clique em Criar URL de rastreamento . No painel direito, configure a URL de rastreamento. Insira uma URL válida para sua página e selecione o protocolo apropriado (http://ou https://). Este pode ser o URL de qualquer página com o código de rastreamento HubSpot instalado. Clique no menu suspenso Campanha de UTM e selecione a campanha à qual você deseja que as visitas a este URL de rastreamento sejam agrupadas em suas ferramentas de análise. Você pode revisar o valor de UTM da campanha gerado automaticamente na página de detalhes da campanha . Observação: é obrigatório informar um nome de campanha ao criar o rastreamento de uma URL, pois esse nome será usado em vários relatórios no HubSpot. As visitas à URL de rastreamento serão atribuídas a essa campanha no relatório de fontes e serão contabilizadas para as análises da campanha na ferramenta de campanhas. Clique no menu suspenso Fonte e selecione a fonte da URL de rastreamento. Isso afetará como a visita será categorizada nas análises, incluindo a ferramenta de análise de tráfego . Marketing por e-mail: selecione esta opção se estiver usando o link em um e-mail de marketing. Pesquisa paga: selecione esta opção se estiver usando o link em uma campanha de pesquisa paga. Social orgânico: selecione esta opção se estiver usando o link em um post de mídias sociais. Social pago: selecione esta opção se estiver usando o link em uma campanha de mídias sociais paga. Outras campanhas: selecione e insira uma Fonte de UTM personalizada . Essa opção é melhor utilizada se quiser uma fonte personalizada (por exemplo, FB_Campaign_1 ). O campo Mídia de UTM é opcional. Insira o nome do seu anúncio de banner, post social, e-mail, etc. Para fontes agrupadas em Outras campanhas , a mídia fica visível quando você detalha uma campanha específica. Normalmente, esse é o último parâmetro visível nos URLs de rastreamento que você cria no HubSpot. O campo Termo do UTM é opcional. Ele pode ser usado em sistemas como o AdWords e o Google Analytics para rastrear as palavras-chave em um anúncio pago por clique. O campo Conteúdo do UTM é opcional. Insira um nome para um anúncio se tiver vários em sua página e quiser que entre eles possam ser diferenciados. Clique em Criar . Se quiser criar outra URL de rastreamento imediatamente depois disso, clique Criar e adicionar outra . Adicione uma URL de rastreamento ao seu conteúdo Na sua conta HubSpot, clique no ícone de configurações settings icon na barra de navegação superior. No menu da barra lateral esquerda, acesse Rastreamento e análises > URLs de rastreamento . Passe o cursor do mouse sobre a URL de rastreamento, clique no menu suspenso Ações e selecione Copiar o URL de rastreamento . Você também pode copiar o link encurtado clicando em Copiar URL curta . Adicione a URL ao seu conteúdo. Observação: devido às recentes alterações nos anúncios do AdWords , se você usa URLs de rastreamento do HubSpot nos anúncios do Google AdWords, use o link completo, não o link encurtado. Insira o link completo no URL de rastreamento completo do HubSpot no campo de Destino final em anúncios do AdWords. O campo Destino final deve conter o mesmo domínio que o URL da landing page. Por exemplo, se sua landing page for http://offers.yoursite.com/demo , o campo Destino final deverá conter yoursite.com . Reports",https://knowledge.hubspot.com/pt/reports/track-google-ads-in-hubspot-without-the-ads-tool
659,HubSpot language offerings,"HubSpot offers software, services, and support in the following languages. Software The following languages are available in the HubSpot interface. However, these languages may not be immediately available for all features, such as call transcription or when searching within HubSpot. Language Software Marketing Hub Sales Hub Service Hub CRM CMS Chinese (traditional) Yes Yes Yes Yes Yes Danish Yes Yes Yes Yes Yes Dutch Yes Yes Yes Yes Yes English Yes Yes Yes Yes Yes Finnish Yes Yes Yes Yes Yes French Yes Yes Yes Yes Yes German Yes Yes Yes Yes Yes Italian Yes Yes Yes Yes Yes Japanese Yes Yes Yes Yes Yes Korean Yes Yes Yes Yes Yes Norwegian ( Bokmål) Yes Yes Yes Yes Yes Polish Yes Yes Yes Yes Yes Portuguese (Brazil) Yes Yes Yes Yes Yes Chinese (simplified) Yes Yes Yes Yes Yes Spanish Yes Yes Yes Yes Yes Swedish Yes Yes Yes Yes Yes Thai Yes Yes Yes Yes Yes Services & support The depth of services and support depends on the product and tier you purchase. Offerings are subject to change based on language availability. Learn how to change your language and region settings . Language Services & Support Onboarding Account Management Support Academy Community Knowledge Base Chinese (traditional) No Limited No No No Yes Danish No Limited No No No Yes Dutch No Limited No No No Yes English Yes Yes Yes Yes Yes Yes Finnish No Limited No No No Yes French Yes Yes Yes Limited Yes Yes German Yes Yes Yes Limited Yes Yes Italian No Limited No No No Yes Japanese Yes Yes Yes Limited Yes Yes Korean No No No No No Yes Norwegian (Bokmål) No Limited No No No Yes Polish No Limited No No No Yes Portuguese (Brazil) Yes Yes Yes Limited Yes Yes Chinese (simplified) No No No No No Yes Spanish Yes Yes Yes Limited Yes Yes Swedish No Limited No No No Yes Thai No No No No No Yes Default content creation languages HubSpot also offers pre-written translations for email notifications, form error messages, quote templates, scheduling pages, chatflows, and more. While you can create content in any language, the system-generated content will default to English if you don't use one of the following default content creation languages listed below. You can also manually create content in these languages and more using the blog, landing page, email, and CMS tools. Learn more about managing multi-language content . Afrikaans Arabic (Egypt, Modern Standard) Bengali Bulgarian Catalan Chinese (Hong Kong) Chinese (Simplified) Chinese (Traditional) Croatian Czech Danish Dutch English (UK) English (US) Finnish French French (Canada) German Greek Hebrew Hungarian Italian Indonesian (Bahasa Indonesia) Japanese Korean Lithuanian Malay Norwegian Polish Portuguese (Brazil) Portuguese (Portugal) Romanian Russian Slovak Slovenian Spanish (Mexico) Spanish (Spain) Swedish Tagalog Thai Turkish Ukrainian Vietnamese Help & Resources",https://knowledge.hubspot.com/help-and-resources/hubspot-language-offerings
660,Erro de carregamento de arquivo: 'Houve um erro ao carregar seu arquivo',"Esta mensagem é exibida quando o upload do arquivo falha. Antes de carregar um arquivo, revise os tipos e tamanhos de arquivo suportados pela ferramenta de arquivos . Se seu arquivo atender a esses requisitos, mas seus carregamentos ainda estiverem encontrando o erro, revise os possíveis motivos abaixo. Tamanho do upload e velocidade de upload do ISP: o tamanho do arquivo pode afetar o tempo que leva para concluir o processo, especialmente se o seu Provedor de Serviços de Internet (ISP) oferecer velocidades de upload limitadas. Arquivos maiores e velocidades de upload mais lentas do ISP levarão mais tempo para serem carregados e podem resultar neste erro. Para resolver isso, tente reduzir o tamanho do arquivo ou carregar o arquivo em uma rede diferente. Carregamento em uma rede móvel: se você carregar seus arquivos usando uma rede móvel, o desempenho da Internet pode ser variável. As redes móveis podem experimentar mudanças na velocidade e confiabilidade, e certos planos móveis podem diminuir as velocidades de upload após você usar um certo valor de dados. É recomendável tentar carregar o arquivo enquanto estiver conectado a uma rede com fio ou wifi. Usando uma VPN: se você estiver usando uma Rede Virtual Privada (VPN), seus dados provavelmente estão sendo criptografados e enviados por um servidor em outro local. As etapas adicionais no envio dos dados podem reduzir a velocidade de upload e fazer com que o upload atinja o tempo limite, resultando nesse erro. Para resolver isso, tente desativar a VPN e carregar o arquivo novamente. Usando um firewall de empresas : as redes da empresa geralmente usam firewalls para interromper transferências de dados não autorizadas e manter a rede segura. Esses firewalls podem bloquear tipos de arquivos específicos ou limitar o tamanho dos arquivos que podem ser carregados. Se o upload falhar, verifique com o departamento de TI se o tipo e o tamanho do arquivo são permitidos pelo firewall da sua empresa. Files",https://knowledge.hubspot.com/pt/files/file-upload-error
661,"Erro de instalação do HubSpot Sales para Outlook: ""Ocorreu um erro ao tentar instalar o HubSpot Sales no Outlook","Poderá encontrar a seguinte mensagem de erro ao tentar instalar o suplemento de desktop HubSpot Sales Outlook : ""'Ocorreu um erro ao tentar instalar o HubSpot Sales no Outlook"" Observação: essas etapas se aplicam ao complemento do HubSpot Sales Outlook desktop. Se tiver o suplemento do HubSpot Sales Office 365, siga estes passos de resolução de problemas em . Para resolver esse erro: Cole o URL que aparece na mensagem de erro no Internet Explorer para reiniciar o download ou baixe o instalador do complemento do HubSpot Sales Outlook desktop aqui. Se a nova instalação não resolver o problema, adicione app.hubspot.com , dl.getsidekick.com , e app.getsidekick.com aos seus sites de confiança: Abra o Painel de controle no seu dispositivo Windows, use a barra de busca para procurar e selecione Opções da Internet . Na caixa de diálogo Opções da Internet , clique na guia Segurança . Selecione o ícone de Sites confiáveis . Clique no botão Sites . Adicione cada uma das URLs a seguir ao campo Adicionar esse site à zona , uma por vez. Clique em Adicionar após inserir cada um: https://dl.getsidekick.com https://app.getsidekick.com https://app.hubspot.com Depois de adicionar todas as três URLs, clique em Fechar . Se o problema persistir, limpe a cache da aplicação ClickOnce: No Windows, procure e execute a aplicação Command Prompt . Na aplicação, introduzir o seguinte: rundll32 dfshim CleanOnlineAppCache Prima Enter para executar o comando. Tente instalar o suplemento novamente. Se o problema persistir após a limpeza da cache, reponha as definições do Internet Explorer . Se o problema persistir, a instalação ainda está sendo bloqueada. Desative quaisquer programas antivírus e execute o instalador novamente. Como alternativa, entre em contato com o administrador da rede para verificar se há algum outro programa que possa estar bloqueando o download do HubSpot Sales. Depois de processar novamente a instalação, o HubSpot Sales deve instalar corretamente e aparecer no Outlook. Connected Email",https://knowledge.hubspot.com/pt/connected-email/an-error-occurred-attempting-to-install-hubspot-sales-in-outlook
