id,titulo,conteudo,link
758,Connect HubSpot and Docusign,"Connect HubSpot and Docusign to create, customize, send, and track Docusign envelopes from a contact, company, or deal record in your HubSpot account. You can add custom text fields to the envelope that populate the record’s property values. For example, you can auto-populate the contact's first and last name in the Docusign envelope when you send it from the contact record. Please note: you can use HubSpot property values in Docusign envelopes, however, this is not a data sync app that syncs full record details to Docusign. Before you get started To connect HubSpot and Docusign, you must Be a Super Admin or have App Marketplace permissions in your HubSpot account. Have a paid Docusign plan . Connect the app To connect Docusign to HubSpot: In your HubSpot account, click the Marketplace icon marketplace in the top navigation bar, then select App Marketplace . Use the search bar to locate and select the Docusign app. In the upper right, click Install app . In the dialog box, enter your login credentials . Click Install . You'll be redirected to your Connected apps page. Please note: Docusign is a user-level app. This means each HubSpot user must connect their Docusign user. Learn more about connecting your user . Manage your Docusign settings As a HubSpot Super Admin, you can discover the Docusign app's features, add an HMAC security key from Docusign, and manage your connected users and account. You can also configure field mappings. This means HubSpot contact, company, or deal properties that can be used within Docusign envelopes. In your HubSpot account, click the settings settings icon in the top navigation bar. In the left sidebar menu, navigate to Integrations > Connected Apps . Click Docusign . To add a HMAC security key from Docusign: In the top right, click Actions > Add HMAC security key . In the pop-up window, enter your HMAC key and click Save changes . To change your Docusign account connected to HubSpot: In the top right, click Actions > Change connected account . In the pop-up window, click the Choose an account dropdown menu to select a different connected account. Click Change account . To reconnect your admin user: In the upper right, click Actions > Reconnect user . In the pop-up window, enter your login credentials and click Login in . Please note: if you are a user in multiple Docusign accounts, all accounts will be connected to HubSpot. Manage connected users You can view a table of your Docusign connected users and delete them. HubSpot users that did not install the Docusign app can connect their Docusign user. To view and manage connected users: Click the Connected users tab. The table shows all connected HubSpot and Docusign users , the connected status, and connection date. To delete a user, click Actions > Delete in the table next to the user you want to delete. To connect your user to the already installed Docusign app: In your HubSpot account, click the settings settings icon in the top navigation bar. In the left sidebar menu, navigate to Integrations > Connected Apps . Click Docusign . Click Reconnect user . In the pop-up window, enter your login credentials , and click Log in . Configure property mappings You can create a link between HubSpot properties and Docusign envelope fields using property mappings. For example, you want the contact’s first name to be automatically filled in on the Docusign envelope. You can configure the mapping so that Docusign’s HS Contact First Name field and HubSpot’s First name properties are connected. This means if you use the Docusign field HS Contact First Name in an envelope, Docusign will suggest the HubSpot contact's First name value. If a property isn't mapped, its value won't be suggested in the envelope. For example, if First name is not mapped, you'll need to manually enter the desired value when you create the envelope. To review property mappings between Docusign and HubSpot contacts, companies, or deals: Click the Property Mappings tab. To review mappings between HubSpot properties and Docusign fields, click an object tab. To add a custom field mapping: Click Add new mapping . Use the dropdown menus to select the Docusign field and HubSpot property you want to map. Click Save . To delete a mapping, hover over a mapping and click Actions > Delete . Please note: To map a custom Docusign field, it should have a unique tooltip and a text field type . Custom property mapping is only available for Docusign eSignature Business Pro or higher plans. Use the Docusign app With the Docusign app, you can import historical envelopes to HubSpot, create and send Docusign envelopes from HubSpot, and use Docusign events to trigger HubSpot workflow actions. Import Docusign envelopes If you have Import permissions in HubSpot, you can import historical envelopes to HubSpot. To import Docusign envelopes: In your HubSpot account, navigate to CRM > Contacts . In the upper right, click Import . Click Import a file . Select Objects from an app . Select Docusign records , then click Next. Select Envelopes , then click Next . On the Confirm screen, review the number of envelopes you’ are importing into HubSpot. To filter for specific envelopes, click Add filter . In the right panel, click the Select a filter dropdown menu and select a filter. Select the property operators . Click Apply filter . Click Begin import . You'll be redirected back to the Imports screen. When your import is complete, it will appear in the import table. Create Docusign documents If you've added the Docusign card to the middle column of your record, you can create new envelopes. You can also review which envelopes have been sent to a record, the status, the recipients, the sender, and the create and last updated dates. To create a new envelope: In your HubSpot account, navigate to your contact, company, or deal records. In your HubSpot account, navigate to CRM > Contacts . In your HubSpot account, navigate to CRM > Companies . In your HubSpot account, navigate to CRM > Deals . Click the name of a record. In the middle column, navigate to the Docusign integration card. Click Create new . In the right panel, click the Docusign account dropdown menu and select the Docusign account . To select an existing template, click the Use a template dropdown menu and select a template. You can also select Without template . Click Create envelope . On the Documents tab, review the attached documents. You can also upload documents from your computer, existing files within HubSpot, or attachments from the record. On the Recipients tab, choose recipients to receive the envelope. Select which company and deal records you want to use the data from on the envelope. In the Basic information section, review the recipient's details such as their name, email, recipient type, and identity verification. Recipient details will be auto-populated when creating envelopes from a contact or deal record. If there is more than one contact associated with the deal, the recipient details will be prefilled in the order that contact data is received from Docusign. To add other recipients, click Add new recipient and add their details. In the Document fields section, review any HubSpot suggested values. On the Message tab, write a message for your recipients. Toggle the C ustom email and language switch on to choose the language and customize the message the recipients receive. Click the L anguage dropdown menu and select a language. Enter the E mail subject and Email body . On the Review tab, review the Docusign envelope. Click Send an envelope to send the document. Please note: if the Docusign app does not load in HubSpot, please reach out to your Docusign admin to ensure you have the relevant permissions. Manage or send existing Docusign envelopes If you've added the Docusign card to the middle column of your record, you can add existing envelopes from Docusign to the record. You can also edit the envelope, view the history, download the PDF, and remove the envelope from HubSpot. To manage existing Docusign envelopes: In your HubSpot account, navigate to your contact, company, or deal records. In your HubSpot account, navigate to CRM > Contacts . In your HubSpot account, navigate to CRM > Companies . In your HubSpot account, navigate to CRM > Deals . Click the name of a record. In the middle column, navigate to the Docusign integration card. To add an existing envelope: Click Add from Docusign . In the right panel, select the envelope and click Add . You can also search an envelope by name or date range. To edit an existing envelope: Hover over the envelope and click Actions . Click Edit . Navigate through the document editor. Learn more about the editor . Click Send an envelope to send the document. To view the envelope history: Hover over the envelope and click Actions . Click View history . For example, you can see the timestamp for when the envelope was sent. To remove the envelope from HubSpot: Hover over the envelope and click Actions . Click Remove from HubSpot . Click Remove envelope in the pop-up box. This will not remove the envelope from Docusign. Use HubSpot properties in your Docusign template You can insert HubSpot data, such as information from your contact, company, or deal records, directly into your Docusign template. Fields added directly in the HubSpot document editor will not be auto-populated. The predefined fields can be found in your Docusign settings. To use your HubSpot properties in Docusign: Log in to your Docusign account. Create a template in your Docusign account . Select a HubSpot field and add it to your template. All HubSpot properties begin with HS and you can find them in the Custom Fields section. Save your template. Navigate to your HubSpot account and use your template. Please note: data will only be populated for the record that the template is being created from. For example, if you're creating a template from the deal record, only deal properties will be populated. Use Docusign events to trigger workflow actions ( Marketing Hub, Sales Hub , Operations Hub , and Service Hub Professional and Enterprise ) You can trigger workflow actions from Docusign events in contact, company, and deal-based workflows. In your HubSpot account, navigate to Automations > Workflows . Click Create workflow . Select Contact-based , Company-based , or Deal-based and click Next . Click Set up triggers . In the right panel, select When filter criteria is met , then Docusign: Contact timeline event template properties . Once your enrollment triggers have been set, you can add actions . To send a Docusign envelope, select Send Docusign envelope in the workflow actions list. Select the User and Template . When your workflow is turned on you may encounter some error messages: Error How to resolve The Docusign workflow template does not have any placeholders or recipients. This error relates to only contact s or deals . Ensure you have the correct number of placeholders or recipients added to your Docusign template. The Docusign workflow template does not have any recipients. This error relates to only contact s or deals . Ensure you have the correct number of recipients added to your Docusign template. The Docusign workflow template does not have any documents attached. Ensure you have the correct documents added to the template. The number of deal contacts is more than placeholders in template. Ensure the template has enough placeholders for the number of contacts you wish to send the envelope to. For example, if you have three contacts and only two placeholders on the template, only the first two contacts will be added to the envelope and receive it. Auto-population for deal contacts was limited to the number of placeholders in your template. Your contact wasn't auto-populated as a new recipient because the template contains the same email. If the recipient email is equal to the contact email, HubSpot will skip auto-populating contacts from the HubSpot record. Uninstall the Docusign app In your HubSpot account, click the settings settings icon in the top navigation bar. In the left sidebar menu, navigate to Integrations > Connected Apps . Hover over the Docusign app and click Actions > Uninstall . In the pop-up window, type the required text and click Uninstall . Integrations",https://knowledge.hubspot.com/integrations/use-hubspots-integration-with-docusign
759,Use goals in contact-based workflows,"When creating a contact-based workflow , you can set a workflow goal to focus the objective of your workflow and measure the success of your workflow in nurturing contacts. Similar to suppression lists , all contacts that meet the workflow goal will be automatically unenrolled. However, goal conversion rates will only be available in Marketing Hub Professional and Enterprise accounts. If you are trying to unenroll or exclude objects in company-based, deal-based, quote-based, or ticket-based workflows, learn how to set unenrollment triggers instead . Please note: Because of changes related to Apple's recently announced iOS 15 privacy features , your email opens may appear higher than usual. You can consider using clicks or replies instead of email opens for your workflow goals instead. Learn more about how to navigate these changes in HubSpot . Clearing all goal criteria will reset the number of contacts that have met the current goal and will reset the workflow's conversion rate to zero. Updating goal criteria or adding new filters will not reset the workflow's goal data. Before you get started A workflow goal is the ultimate objective of your contact-based workflow. When an enrolled contact meets the workflow goal criteria, they are automatically unenrolled from the workflow before the next action executes. Common workflow goals include: Moving contacts to a new lifecycle stage (e.g., the contact's Lifecycle stage changes to Customer ). Contacts taking actions that indicate engagement (e.g., the contact submits a specific form, clicks a specific call-to-action, etc.). Contacts reaching a number of interactions with your marketing content (e.g., the contact reaches a certain number of page views, form submissions, email clicks, etc.). When using goals, please also take note of the following: When a contact is first enrolled in a workflow, HubSpot checks if the contact meets the goal criteria. If they do, they will not be enrolled in the workflow and will not count towards the workflow's goal conversion rate . When a contact is active in a workflow and meets the goal criteria, they'll be automatically unenrolled from the workflow. You can identify active contacts that were unenrolled from a workflow as a result of meeting the goal criteria in the workflow details page . Only contacts that have also been sent a marketing email in the workflow will count towards the workflow's goal conversion rate . While workflow goals and suppression lists both unenroll contacts from workflows, they serve different purposes: Goal: used to measure the success of your workflow in nurturing contacts. For example, your goal criteria might include contacts who become a customer or submit a specific form while enrolled in the workflow. When a contact meets your workflow goal and was sent a marketing email in the workflow, they will count towards the workflow's goal conversion rate . A contact can meet a workflow goal while currently enrolled or any time after completing the workflow. It's recommended to use goals only when the workflow contains a marketing email send. Suppression list: used to suppress contacts you don't want to enroll in the workflow. For example, your suppression list might include your competitors, contacts who are already customers, or current employees. It's recommended to use suppression lists instead of goals when the workflow does not contain a marketing email send. Set a workflow goal in your contact-based workflow In your HubSpot account, navigate to Automations > Workflows . Click the name of your contact-based workflow. In the top left, click Edit > Edit goal . In the left panel, select the Contacts meet a goal checkbox. In the dialog box, select and set the goal criteria . Then, click Save . To add multiple criteria to the goal, click AND or OR . Learn more about AND vs OR logic . After setting up your goal, click Save . View your goal performance ( Marketing Hub Professional and Enterprise only) After setting your workflow goals, you can view your goal conversion rate and contact trends. In your HubSpot account, navigate to Automations > Workflows . Hover over your workflow and click More . Then, select View details . The goal conversion rate will display in the Top metrics report. Use goals in workflow enrollment criteria Enroll contacts in a workflow based on whether they met a workflow's goal criteria. For workflows that use goal criteria and send marketing emails: In your HubSpot account, navigate to Automations > Workflows . Click the name of your contact-based workflow. In the workflow editor, click Set up triggers . Learn more about setting enrollment triggers in workflows . In the left panel, select When an event occurs . Under Workflows , select Achieved workflow goal . This will enroll any contacts who count toward the workflow's goal conversion rate . Since the filter enrolls based on goal conversion rate, this method won't work if the workflow doesn't send marketing emails. Click + Add criteria. In the right Add trigger panel, click Workflow and search for and select the name of the workflow you want to use. At the top, click Save . Use goals in filters Use goals as filters in contact-based lists or any other filter criteria. When using goals as filters, only contacts that have met the selected workflow's goal criteria and have been sent a marketing email from the same workflow will be included. Set up the filter in your tool. In the HubSpot asset membership and enrollment section, click Workflow enrollment . Select the workflow that you'd like to filter by. Click the Workflow status dropdown menu and select Contact has met the goal or Contact hasn't met the goal . Workflows",https://knowledge.hubspot.com/workflows/use-goals-in-contact-based-workflows
760,Gerar linhas de assunto para e-mails de marketing usando a HubSpot IA,"Você pode gerar uma linha de assunto eficaz e envolvente para o seu e-mail de marketing usando a HubSpot IA. Assim, você pode concentrar seu tempo em refinar e otimizar o conteúdo da própria campanha de e-mail. Observação: evite compartilhar informações confidenciais nas entradas de dados habilitadas para recursos de IA, incluindo avisos. Os administradores podem configurar recursos de IA generativos nas configurações de gerenciamento de conta. Para obter informações sobre como o Hubspot ia usa seus dados para fornecer IA confiável, com você no controle de seus dados, você pode consultar nossas Perguntas Frequentes sobre Confiança do Hubspot ia . Entenda as práticas recomendadas de conteúdo gerado por IA Revise e edite o conteúdo gerado por IA antes de publicá-lo. Edite o conteúdo gerado por IA para manter a voz e o estilo da sua marca. Encontre um equilíbrio entre o conteúdo gerado por IA e o conteúdo criado por pessoas. Embora o HubSpot tenha medidas de segurança em vigor, o gerador de conteúdo pode ocasionalmente gerar informações incorretas, tendenciosas, ofensivas ou enganosas. Verifique a precisão do conteúdo gerado, especialmente quanto a dados estatísticos ou fatos. O grande modelo linguístico que possibilita o gerador de conteúdo tende a produzir resultados inconsistentes em línguas não inglesas. A HubSpot está trabalhando para oferecer um melhor suporte a esses idiomas nos próximos meses. Por enquanto, tenha cuidado especial ao revisar conteúdo em idiomas que não sejam o inglês, garantindo sua precisão e clareza. Gerenciar a definição do assistente de assunto de e-mail para todos os usuários Por padrão, o assistente de assunto de e-mail estará disponível para todos os usuários na sua conta. Você pode desativar esta definição nas configurações da sua conta: Na sua conta HubSpot, clique no ícone de configurações settings icon na barra de navegação superior. No menu da barra lateral esquerda, no Gerenciamento de contas seção, navegue até IA . No Acesso aba das suas configurações de IA, clique para alternar o Dê aos usuários acesso a ferramentas e recursos de IA generativa ligar. Gerar linhas de assunto usando a HubSpot IA Para gerar uma linha de assunto para o seu e-mail de marketing: Na sua conta da HubSpot, navegue até Marketing > E-mail . Clique no nome de um rascunho de e-mail de marketing. Clique na guia Configurações . Em Linha de assunto , clique em Gerar . Em instantes, três linhas de assunto serão geradas para você escolher: Para usar uma das linhas de assunto geradas, clique em Inserir . Se você quiser melhorar uma das linhas específicas, clique em Mais como esta para gerar três novas linhas de assunto semelhantes. Se nenhuma das linhas geradas originalmente se encaixar no tom, tema ou e-mail, você pode clicar em Gerar novas ideias para gerar novas linhas de assunto. Ao gerar possíveis linhas de assunto, você pode clicar nos ícones de seta para a esquerda e para a direita no canto inferior direito da caixa de diálogo para revisar as opções que foram criadas até agora. Você também pode gerar linhas de assunto para seus e-mails de marketing usando o Aplicativo móvel HubSpot .  Saiba mais sobre como crie e edite e-mails no aplicativo móvel . Observação: Após gerar seu primeiro conjunto de linhas de assunto sugeridas, você somente poderá gerar novas ideias mais cinco vezes para um único e-mail. As linhas de assunto geradas estarão no idioma que você definido nas configurações do seu e-mail de marketing . Email AI Tools",https://knowledge.hubspot.com/pt/marketing-email/generate-subject-lines-for-marketing-emails-with-hubspot-ai
761,Restrições de tipo de arquivo e tamanho para a ferramenta de documentos.,"A ferramenta de documentos no HubSpot é compatível com arquivos de tipo e tamanho específicos. Além disso, dependendo da sua assinatura, há um limite de uso para o número de documentos que podem ser carregados. Tipos de arquivo Os tipos de arquivo a seguir podem ser carregados como documentos rastreáveis no HubSpot: pdf (.pdf) PowerPoint (.ptx) Valores separados por vírgula (.csv) Documento do Word (.docx) Excel (.xlsx) Quaisquer vídeos, .gifs e hiperlinks incluídos no seu arquivo não funcionarão quando o arquivo for carregado na ferramenta de documentos. Tamanho do arquivo e quantidade O limite de tamanho do arquivo para documentos é 250 MB . Apenas os usuários do HubSpot CRM podem acessar cinco documentos por usuário. S e um usuário for adicionado a uma conta onde cinco ou mais documentos já tiverem sido carregados, esse usuário gratuito poderá visualizar e usar apenas os cinco primeiros documentos que foram carregados nessa conta. Se você ou um membro da sua equipe precisar de acesso a mais de cinco documentos, faça upgrade para o HubSpot Sales Hub Starter , Professional ou Enterprise ou adicione o usuário a uma equipe existente do HubSpot S ales Hub Starter, Professional ou Enterprise , onde cada conta pode ter até 1.000 documentos. Observação: O HubSpot não é compatível com o gerenciamento de informações confidenciais. Para obter mais informações, consulte nossos Termos de Serviço . Documents",https://knowledge.hubspot.com/pt/documents/what-file-type-and-size-restrictions-exist-for-the-documents-tool
