id,titulo,conteudo,link
2195,Understand different chart types in HubSpot reports,"When you customize reports or analyze data in your analytics tools , you can select a style or type of chart to display your data. There are eight styles you can use, depending on the data in your report: bar, column, line, area, doughnut, pie, summary, and table. Bar Use a bar graph when you want to highlight how multiple metrics compare to each other. For example, you can compare how multiple ebooks performed against each other. In the custom report builder , this type of chart is called a horizontal bar chart. This chart can be viewed using percentages; click Chart Settings (Custom Report Builder) or Display Options (Single Object Report Builder), then, click the Stacked dropdown menu and select Percent . Column Use a column graph when you want to highlight how multiple metrics compare to each other. For example, you can see how many contacts you generated from different marketing channels. If you have a large amount of data, a column chart may be a better option than a bar chart. In the custom report builder , this type of chart is called a vertical bar chart. This chart can be viewed using percentages; click Chart Settings (Custom Report Builder) or Display Options (Single Object Report Builder), then, click the Stacked dropdown menu and select Percent . Line Use a line graph when you want to show the growth of a metric over time. For example, use a line graph to display the growth of your contacts over time. This chart can be viewed using percentages; click Chart Settings (Custom Report Builder) or Display Options (Single Object Report Builder), then, click the Stacked dropdown menu and select Percent . Area Use an area graph when you want to show multiple data sets and their relative growth over time in comparison to each other. You can see how each data set grew individually, but also how they added to your metrics as a whole. This chart can be viewed using percentages; click Chart Settings (Custom Report Builder) or Display Options (Single Object Report Builder), then, click the Stacked dropdown menu and select Percent . Donut Use a donut chart to display a breakdown of a metric. For example, use a donut chart to see a breakdown of your total contacts by lifecycle stage. Pie Similar to donut charts, pie charts are used to display a breakdown of a metric. For example, use a pie chart to see a breakdown of your total contacts by lifecycle stage. A pie chart will display a maximum of 25 sections at a time. Summary This visual will give you a quick snapshot of your data by displaying exact metrics. For example, if you want to keep track of how many calls, emails, or meetings your sales reps have placed during a given time period, you can set up an engagements report using count of engagements and type. Table Use a table to display your data when it is important to see exact numbers for multiple metrics together, and not just general trends. For example, use a table to see the number of deals by deal owner, along with the average days to close. Please note: the custom report builder does not support summarized data view for table charts. Combination Use a combination chart to compare different metrics in the same visualization. A combination chart consists of two Y-axes visualized with a bar chart and a superimposed line chart. For example, use a combination chart to compare website sessions and average session length. Pivot table In the custom report builder, use pivot tables to group, compare, and summarize larger sets of data. When using pivot tables you can have up to four properties in both the rows and columns sections. For example, use a pivot table to compare count of page views and count of deals by lifecycle stage of contacts who became leads starting from January 2020. To view subtotals in your report, click Chart settings , then select the Show subtotals checkbox. Scatter plot In the custom report builder, you can select scatter plot as a chart type. While chart types such as bar and line graphs enable you to measure data on X and Y-axes, scatter plots can be useful for viewing relationships between data across multiple variables. Scatter plots can highlight trends, clusters, patterns, and relationships between numeric data. For example, you could create a scatter plot to report on whether or not providing a larger discount leads to great profit. In scatter plot charts, you can only add measures and date-based fields to the X- and Y-axes. Any field you add to these axes will be converted to a measure automatically. Learn more about dimensions versus measures . KPI In the custom report builder, you can select KPI as a chart type. Use the KPI chart type to report on your business' KPIs. For example, you can report on how many contacts were created each month. You can also, use the KPI chart type to compare percentage change. You can configure this by navigating to the Chart settings in the custom report builder. When a KPI chart is using the Compare by option, the filter period selected will determine what two values are compared. For example, if you want to know how many more contacts you generated this year compared to last year, broken down by quarters, each quarter will show a comparison to the same quarter in the previous year. Gauge In the custom report builder, you can select to display your data in a gauge visualization. This allows you to measure the performance of your data when compared against a range of values. When selecting your color palette, it is recommended to use the Alert - Green to Red and Alert - Red to Green color palettes for gauge visualization reports. Use colored bands to visually indicate a set of values in your gauge visualization. For example, you can have yellow for performing well, orange for average performance, and red for not performing. Multiple metrics When using XY visualizations and reporting on measures that are broken down by the same dimension, you can add up to ten metrics to the same report. You can also customize the name of the y-axis label to include all metrics being reported on. Dashboards",https://knowledge.hubspot.com/reports/understand-different-chart-styles-in-your-hubspot-reports
2196,Os contatos não estão recebendo seus e-mails de marketing,"Se os seus contactos elegíveis não estiverem a receber E-mails de marketing enviados da sua conta da HubSpot, existem alguns passos que podem seguir para garantir que os seus E-mails de marketing são entregues na sua caixa de entrada. Adicione o endereço de e-mail de origem ao catálogo de endereços do cliente de e-mail. Isso informa a caixa de entrada que ela deve esperar receber e-mails desse endereço. Cada cliente de e-mail tem um processo diferente para adicionar endereços de e-mail, que pode ser encontrado na respectiva documentação de ajuda. Solicitar que a equipa de TI/E-mail adicione o domínio de envio de e-mail à lista de permissões. Isso informa ao servidor de e-mail que ele deve esperar receber e-mails de qualquer endereço que contenha seu domínio (por exemplo, hubspot.com). Solicite à equipa de TI/E-mail que adicione os seus endereços IP de envio do HubSpot à lista de permissões. Abrir e clicar nos links em e-mails de marketing que eles recebem de você. Isso informa a caixa de entrada para confiar em e-mails recebidos do seu endereço e domínio de envio de e-mail. Um cliente de e-mail sempre está aprendendo. Se seus contatos continuarem a abrir e clicar em seus e-mails, o cliente de e-mail aprenderá a aceitar esses e-mails no futuro. Mova os e-mails de marketing localizados na pasta SPAM/lixo eletrônico de volta para a caixa de entrada. Isso informa a caixa de entrada na qual colocar esse e-mail no futuro e melhora a reputação de remetente do seu domínio. Atenção: se o seu e-mail contiver links encurtados, como youtu.be/xyz , em vez de youtube.com/xyz , ele terá uma maior probabilidade de ser enviado para a pasta de SPAM da sua caixa de entrada de destinatários. Adicionar endereços IP de envio de e-mails de marketing a uma lista de permissões Adicione os endereços IP de envio da HubSpot à sua lista de permissões no nível da rede para garantir que todas as comunicações no aplicativo da HubSpot sejam entregues pelo servidor da sua empresa. Para encontrar os Endereços IP de envio, terá de os adicionar: Na sua conta da HubSpot, navegue até Marketing > E-mail . No canto superior direito, clique em Ferramentas de e-mail e, em seguida, seleccione Gerir lista de permissões . Na caixa de diálogo, clique em Copiar para a área de transferência . Isto copia todos os Endereços de e-mail usados pela HubSpot para enviar E-mails de marketing, bem como E-mails de notificação de outras ferramentas na sua conta. Estes endereços IP podem incluir endereços IP únicos (por exemplo, 167.89.43.234) e intervalos de endereços IP (por exemplo, 192.254.127.96/27). Certifique-se de que fornece a lista completa de endereços IP à sua equipa de TI ou de administradores de correio eletrónico, incluindo os endereços individuais e os intervalos de endereços. Observação: um intervalo de endereços IP, como 54.174.52.0/24, inclui todos os endereços IP dentro do intervalo, de 54.174.52.0 a 54.174.52.255. Para adicionar domínios de envio de e-mail a uma lista de permissões em vez de endereços IP, adicione shared.hubspot.com e hubspotemail.net à sua lista de permissões ao nível da rede. Saiba mais sobre como manter as suas listas de contactos actualizadas para melhorar a capacidade de entrega de correio eletrónico. Marketing Email",https://knowledge.hubspot.com/pt/marketing-email/contacts-not-receiving-your-marketing-emails
2197,Adicionar mais nomes de domínio a um registro de empresa,"O HubSpot usa o valor da principal propriedade do nome de domínio da Empresa para diferenciar entre registros de empresas e para associar contatos e empresas quando a associação automática está habilitada . Se você trabalha com uma empresa que tem vários nomes de domínio, é possível adicionar todos os nomes de domínio a um registro de empresa. Quando um registro de empresa tem vários domínios, as atividades dos contatos associados a todos os domínios incluídos aparecem na mesma linha do tempo do registro de empresa. Por exemplo, se um registro de empresa tiver tanto hubspot.com quanto inbound.org como seus nomes de domínio Empresa , todos os e-mails registrados de qualquer um dos domínio de e-mail serão registrados no mesmo registro de empresa, e os contatos com qualquer um dos domínios de e-mail serão associados ao mesmo registro de empresa quando a associação automática estiver habilitada . Você também pode criar associações pai-empresa afiliada . No entanto, as associações de empresa matriz-afiliada não são transferidas ou compartilham dados (por exemplo, atividades) entre os registros. Adicionar outros nomes de domínio de empresas Você pode adicionar nomes de domínio adicionais individualmente em um registro de empresa CRM na Saiba mais sobre como adicionar domínios de empresas adicionais através da API. Observação: se você adicionar mais um nome de domínio a um registro de empresa, e já existir um registro com esse nome de domínio, isso não mesclará os registros ou extrairá as atividades nos dois registros de empresa. Os nomes de domínio da empresa adicionais só se aplicam desse momento em diante. Saiba como fundir empresas . Adicionar domínios em um registro de empresa Para adicionar mais um nome de domínio a um registro de empresa: Na sua conta HubSpot, acesse CRM > Empresas . Clique no nome do registro da empresa ao qual você deseja adicionar o nome de domínio. Na seção Sobre , passe o mouse sobre Nome de domínio da empresa e clique no botão edit ícone de lápis . Na caixa de diálogo, clique em + Adicionar domínio . No campo exibido, insira o domínio adicional e clique em Aplicar . No canto inferior esquerdo, clique em Salvar . Quando uma empresa tiver vários nomes de domínio, você poderá exportar suas empresas para exibir todos os domínios. Importar para adicionar vários domínios em massa Você também pode importar para adicionar domínios a uma ou várias empresas. Você não pode importar para definir o domínio principal de uma empresa, mas pode atualizar manualmente o domínio principal . Para importar domínios adicionais: Configure o arquivo de importação . Inclua uma coluna Domínios adicionais contendo os domínios que você deseja adicionar. Se você estiver incluindo vários domínios para uma empresa, separe-os com ponto-e-vírgula. Importe o arquivo . Na tela Mapear colunas do arquivo para propriedades da empresa , na coluna propriedade HubSpot, selecione DomíniosAdicionais. Conclua a importação. Uma vez importado, quando você visualizar o registro da empresa, o domínio adicional será incluído no nome de domínio Empresa propriedade. Remover ou definir um domínio secundário como principal Se uma empresa tiver vários domínios, você poderá excluir os domínios secundários ou atualizar um domínio secundário para se tornar o domínio primário da empresa. Quando você define um domínio como o domínio principal, ele aparece primeiro no registro e é usado para desduplicar registros de empresas. Para remover ou definir um domínio como principal: Na sua conta HubSpot, acesse CRM > Empresas . Localize e clique no nome do registro de empresa. Na seção Sobre, passe o mouse sobre Nome de domínio da Empresa  ícone de lápis. Para remover um domínio, clique em Ações Excluir ao lado do domínio. Clique em Salvar na parte inferior esquerda para confirmar. Para tornar um domínio secundário principal, clique em Ações > Tornar principal ao lado do domínio secundário. No canto inferior esquerdo, clique em Salvar . records",https://knowledge.hubspot.com/pt/records/add-multiple-domain-names-to-a-company-record
2198,Gerar um arquivo de importação de exemplo,"Para ajudar a garantir a importação dos dados necessários, você pode gerar e baixar um modelo de arquivo de importação com base nos objetos selecionados durante o processo de importação . Os arquivos de exemplo incluem somente as propriedades necessárias para criar novos registros, mas você pode adicionar mais colunas conforme necessário para importar dados adicionais. Por exemplo, se você optou por importar contatos, empresas, chamadas e reuniões, seu arquivo de exemplo personalizado conterá todas as colunas necessárias para cada objeto. CRM CRM migração de dados Se você é novo no HubSpot e deseja migrar seus arquivos Saiba mais sobre como configurar seus arquivos de importação , incluindo como formatar valores de propriedade em cada coluna. Para revisar arquivos de exemplo com colunas adicionais e dados de exemplo, veja outros arquivos de exemplo . Para baixar um arquivo de exemplo: Clique em Importar na parte superior direita de qualquer página de índice de objeto . Na página Importações , clique em Iniciar uma importação . Selecione Importar arquivo do computador e clique em Próximo . Selecione os objetos e as atividades que deseja importar e clique em Próximo . Clique em Baixar arquivo de exemplo . Se você estiver importando objetos em dois arquivos, poderá baixar um arquivo de exemplo para cada objeto. No arquivo baixado: As colunas são criadas para as propriedades necessárias de cada objeto. Em alguns casos, talvez seja necessário importar apenas uma das propriedades necessárias (por exemplo, incluir E-mail ou Nome ou Sobrenome para criar contatos ), o que será explicado nas observações do arquivo . Cada coluna terá <[OBJECT] [property internal name]> para indicar o objeto ao qual a propriedade deve ser mapeada (por exemplo, <COMPANY domain> para propriedades de empresa de Nome do domínio da empresa ). Isso não deve ser removido, pois mapeará suas colunas automaticamente durante o processo de importação. Há linhas contendo informações para ajudá-lo a importar os dados corretamente. Por exemplo, seu arquivo pode ter instruções explicando que você somente precisa de uma das propriedades necessárias para criar um registro. Você deve excluir essas linhas antes de importar. Observação: para evitar duplicatas ou importar vários objetos e associar seus registros, verifique se você incluiu valores de identificador exclusivos. Saiba mais sobre os requisitos de desduplicação e associação para importações . Adicione valores para as propriedades necessárias e adicione outras colunas conforme necessário. Carregue o arquivo e conclua a importação. Saiba mais sobre importando registros e atividades . CRM records Import & Export",https://knowledge.hubspot.com/pt/import-and-export/download-example-import-file
2199,Integrar o Google Analytics com o conteúdo do HubSpot,"Quando você integra o Google Analytics ao HubSpot, sua conta do Google Analytics coleta dados sobre os visitantes do seu site da HubSpot. Há duas formas de integrar o Google Analytics com o HubSpot: Você pode integrar com o conteúdo hospedado pela HubSpot adicionando um ID de medição do Google Analytics às suas configurações do HubSpot. Usuários com um Centro de Marketing Iniciante assinatura e não Centro de conteúdo assinatura pode apenas integrar usando um ID de medição . Você pode adicionar um snippet de código de rastreamento do Google Analytics ao HTML do cabeçalho do site para o seu domínio. Você também pode usar este método para rastrear apenas um blog ou página específica. Observação: a partir de 1º de julho de 2023, o Google substituirá o Universal Analytics pelo Google Analytics 4. Para não perder os dados sincronizados com o HubSpot, será necessário mudar para o Google Analytics 4 antes da alteração. Integrar o Google Analytics usando um ID de medição Você pode adicionar um ID de rastreamento diretamente nas suas configurações do HubSpot para rastrear os visitantes no Google Analytics. Você pode integrar o Google Analytics a domínios individuais, ou integrá-lo a todos os domínios. Integrar o Google Analytics com esse método também adiciona automaticamente o rastreamento à página de checkout de pagamento, o que facilita os pagamentos para links de pagamento e orçamentos. Você pode desativar esse rastreamento nas configurações de pagamentos . Observe: se você estiver usando recursos de privacidade de dados ou um banner de consentimento de cookies que exige a aceitação do visitante, o script do Google Analytics só será executado para os visitantes que optarem por ser rastreados. Se um visitante cancelar a adesão, o script do Google Analytics não será executado e os dados do visitante não serão rastreados. Para integrar o Google Analytics a um ou a todos os domínios hospedados no HubSpot: Na sua conta HubSpot, clique no ícone de configurações settings icon na barra de navegação superior. No menu da barra lateral esquerda, navegue até Conteúdo > Páginas . Clique no menu suspenso Escolha um domínio para editar suas configurações e selecione um domínio. Para aplicar o mesmo código a todo o conteúdo hospedado pela HubSpot, selecione Configurações padrão para todos os domínios . Se houver um conflito, as configurações específicas de um domínio terão prioridade sobre as configurações gerais padrão. Clique na guia Integrações . Na seção Integrações de rastreamento , marque a caixa de seleção Integrar com o Google Analytics 4 . Para desconectar a integração, desmarque a caixa de seleção. No campo, digite um r a ID de medição do Google Analytics . Você também pode adicionar o código de rastreamento do Google Analytics ao HTML do cabeçalho do seu site . No canto inferior esquerdo, clique em Salvar . Se seus dados não estiverem sendo preenchidos no Google Analytics, verifique se o ID de Medida em sua conta do Google Analytics corresponde ao ID de Medida inserido em suas configurações de HubSpot. Adicionar o código de rastreamento do Google Analytics a um domínio, blog ou ao HTML do cabeçalho de uma página ou blog Aplicar o Google Analytics ao HTML do cabeçalho do site de um domínio (somente Marketing Hub Professional e Enterprise ) Você pode adicionar o código de rastreamento do Google Analytics ao HTML do cabeçalho dos seus domínios nas configurações. Isso também é recomendado se você estiver usando um script personalizado do Google Analytics. Integrar o Google Analytics com esse método também adiciona automaticamente o rastreamento à página de checkout de pagamento, o que facilita os pagamentos para links de pagamento e orçamentos. Você pode desativar esse rastreamento nas configurações de pagamentos . Observe: um código de acompanhamento do Google Analytics adicionado por meio do cabeçalho HTML não pode ser controlado pelo Banner de consentimento do HubSpot. Por padrão, ele registrará dados sobre os visitantes, independentemente de seu status de adesão. Você pode personalizar esse comportamento no Google usando a documentação do desenvolvedor . Suas equipes jurídica e de desenvolvimento podem orientá-lo melhor para garantir que o uso do script do Google Analytics no seu site esteja em conformidade com as leis de privacidade. Na sua conta HubSpot, clique no ícone de configurações settings icon na barra de navegação superior. No menu da barra lateral esquerda, navegue até Conteúdo > Páginas . Clique no menu suspenso Escolha um domínio para editar suas configurações e selecione um domínio. Para adicionar o código de rastreamento a todos os domínios hospedados pela HubSpot, selecione Configurações padrão para todos os domínios . Se houver um conflito, as configurações específicas de um domínio terão prioridade sobre as configurações gerais padrão. No campo HTML do cabeçalho do site , insira seu código de rastreamento do Google Analytics . Saiba mais sobre como encontrar o seu código de rastreamento do Google Analytics no Google. No canto inferior esquerdo, clique em Salvar . Aplicar o Google Analytics a um blog Se você adicionou um ID de medição ou o código de rastreamento do Google Analytics a um domínio, qualquer blog hospedado nesse domínio será rastreado automaticamente. Para rastrear um único blog, em vez de todo o conteúdo de um domínio, você pode adicionar o código de rastreamento do Google Analytics ao HTML do cabeçalho do blog. Na sua conta HubSpot, clique no ícone de configurações settings icon na barra de navegação superior. No menu da barra lateral esquerda, navegue até Conteúdo > Blog . Clique no menu suspenso Selecione um blog para modificar e selecione um blog . Clique na guia Modelos . No campo HTML do cabeçalho das páginas de listagem de blog , insira seu código de rastreamento do Google Analytics . Saiba mais sobre como encontrar o seu código de rastreamento do Google Analytics no Google. Por padrão, o código de rastreamento será aplicado tanto à página de listagem quanto aos posts do blog. Você também pode rastrear apenas a página de listagem ou apenas os posts: Para apenas adicionar o código de rastreamento ao modelo de post do blog, clique em Usar HTML do cabeçalho personalizado para posts do blog . Em seguida, insira o código de rastreamento do Google Analytics no campo HTML do cabeçalho do post de blog . Para apenas adicionar o código de rastreamento ao modelo de página de listagem do blog, clique em Usar HTML de cabeçalho personalizado para posts do blog , mas deixe o campo HTML do cabeçalho do post de blog em branco. Clique em Salvar no canto inferior esquerdo. Aplicar o Google Analytics a uma página específica Se você adicionou um ID de medição ou o código de rastreamento do Google Analytics a um domínio, qualquer página hospedada nesse domínio será rastreada automaticamente. Para rastrear uma única página, em vez de todo o conteúdo de um domínio, você pode adicionar o código de rastreamento do Google Analytics ao HTML do cabeçalho da página. Este recurso está disponível apenas em Centro de Marketing Profissional e Empreendimento e Centro de conteúdo contas. Acesse seu conteúdo: Páginas do site : Na sua conta da HubSpot, acesse Conteúdo > Páginas do site . Landing pages : Na sua conta da HubSpot, acesse Conteúdo > Landing pages . Clique no nome da página. No editor de conteúdo, clique no menu Configurações e selecione Avançado . Na seção Snippets de código adicionais na caixa de diálogo, digite o código de rastreamento do Google Analytics no campo HTML do cabeçalho . Saiba mais sobre como encontrar o seu código de rastreamento do Google Analytics no Google. Para aplicar suas alterações, clique em Publicar ou Atualizar no canto superior direito. Blog Website Pages Account Management",https://knowledge.hubspot.com/pt/website-pages/integrate-google-analytics-with-hubspot-content
