id,titulo,conteudo,link
1283,Understand HubSpot's website migration process,"To recreate or refresh your existing website content in HubSpot, you can request a website migration performed by HubSpot's Replatforming Team. A migration may be a good option for: Customers who want to move their content to HubSpot and keep their current design. Customers who want to update their design using a theme from HubSpot's Template Marketplace . If you’re looking to significantly redesign your website or want customized templates and modules, you may want to consider partnering with your developer or a HubSpot Solutions Partner instead. Please note: Content Hub Starter accounts may be eligible for migrations under certain circumstances. To learn more, reach out to your account representative. Understand HubSpot migrations The migration service includes: The migration of your existing site content and styling using a theme created by HubSpot, called Migrations Base , which includes modules and drag and drop templates that you can edit in the content editor . OR The migration of your existing site content using a theme of your choice from HubSpot’s Template Marketplace . For either option, HubSpot's Replatforming Team will build your new site on a child theme of your chosen theme. Migration requirements and limitations Please take note of the following requirements and service limitations before requesting a migration: Migrations do not include email templates. Most migrations are completed within 2-4 weeks; however, larger projects may take longer. Your migration agreement will provide an estimate. Your current website must remain live throughout the migration. Any changes made to your website after the migration has been approved will not be reflected in the migrated content. You will need access to your domain hosting (DNS) provider to be able to launch the site following migration. The following website features are not expected to migrate, but you’ll receive more detailed information when purchasing a migration: Please note: a list of website features that won't be included in your website migration will be available in your CMS Migration Agreement. Database-driven content, such as real estate listings, knowledge bases, extensive product catalogs, and postal code/location-based search. Gated content, such as logins, member access, password protection, and pages that are only accessible by form submission. E-commerce, such as shopping carts, storefronts, and payment processing. Advanced forms, such as progressive or multi-step forms, calculators collecting submissions, and forms requesting Personally Identifiable Information. User-generated content, such as forums, ratings, comments, and profiles. Third-party applications, such as live chat, accessibility widgets, commenting engines, and job boards. Custom responsive design, stylesheets, and mobile websites. Request a migration To start the migration process, reach out to your account representative, who will then reach out to HubSpot's Replatforming Team internally . If you are unsure how to reach your account representative, contact HubSpot Support to get connected with the right person. You can also submit this website migration form . HubSpot's Replatforming Team will evaluate your website to see if a migration will meet your needs. If your project is a fit for the process, your account representative will provide you with a link to your migration agreement. This agreement will outline the terms of the migration, including: How many pages will be migrated An estimate of how long the migration will take How specific assets like forms may change during the migration process If you agree to the terms, your account representative will send you a link to complete the payment process. Learn more about migration pricing. Following purchase, a R eplatforming Specialist will send an introductory email and work with you to retrieve required assets for your migration plan. When the assets are confirmed, your Replatforming Specialist will enter your migration into the team's queue. While the team is working on your migration, you can check on the status of the project in your HubSpot account: In your HubSpot account, click your account name in the top right corner, then click Account & Billing . Click the Migrations tab. Review the migration's status on the timeline: Migration confirmed: the migration has been purchased and the Replatforming Specialist is collecting information necessary to begin the migration. Migration in-progress: the Hubspot Replatforming Team is in the process of migrating your website. Migration completed: your website content has been successfully migrated into HubSpot. You have 60 days from the date listed here to report design issues. When the migration is completed, you will receive an email notification from your Replatforming Specialist with steps to review. Review a migration When you receive an email notification that your migration is finished, you can review your content in your HubSpot account. To review a migrated website: In your HubSpot account, navigate to Content > Website Pages . Hover over your home page, then click the More dropdown menu and select View . To review migrated blog posts and listing pages: In your HubSpot account, navigate to Content > Blog . To view blog listing pages, click the Blog posts dropdown menu in the top left and select Blog listing pages To review migrated templates: In your HubSpot account, click the settings settings icon in the top navigation bar. In the left sidebar menu, navigate to Content > Themes . Hover over the [CompanyName_Date] theme and click View theme . For example, if your company name was Example Company , and you completed a website migration in September 2023, you would look for the ExampleCompany_Sept2023 theme. Note that your theme is built as a child theme, either of the marketplace theme of your choice, or of the base theme built by the HubSpot Replatforming Team called Migrations Base . Previously, this base theme may have been named Matter or Nixon . In the theme editor, click the View on dropdown menu in the top left, and select a page or post to use for previewing the theme. In the top right, click Preview to preview your content on any device type. Please note: you have 60 days from the migration's completion date to report missing or broken content. For issues with how your content was migrated, reach out directly to your Replatforming Specialist. They will typically respond within 2 business days. To learn more about using HubSpot's editing tools, contact HubSpot Support . Understand your next steps After your migration is complete, you'll need to review any other migrated content and customize your settings in HubSpot: Review your migrated forms and manage your form options in HubSpot. Set up your blog settings before publishing your blog content. Apply system templates to all domains in your account, or to a particular domain. Upload your favicon and apply it to your content. Integrate Google Analytics with HubSpot to track your HubSpot-hosted pages in Google Analytics. Exclude internal traffic from HubSpot's traffic analytics to get the most accurate data. Review SEO recommendations in HubSpot. Bulk upload URL redirects for any URL changes to avoid broken links. When your website is ready to go live, connect your domain and update your DNS records . You may need to partner with your developer or IT team to complete these steps. Learn more about working with HubSpot's content tools . Blog Website Pages",https://knowledge.hubspot.com/website-pages/understand-hubspot-s-website-migration-process
1284,Create A/B tests for pages with AI (BETA),"You can use Breeze , HubSpot's AI, to generate copy suggestions for your landing pages, then run A/B tests to see which versions perform best. With A/B testing, you can learn about what works best for your audience to create the most effective content. For example, you can experiment with content length to see if your audience responds better to in-depth content or concise content. Learn more about running A/B tests in HubSpot . In your HubSpot account, navigate to Content > Landing Pages . Click the name of a landing page. In the content editor, click the test Test icon in the left sidebar. Select Run A/B Test with AI . In the left column, select a recommendation . The text for the new variation will appear under Suggested Content , while the original text will be labeled Original Content . In the top right, click Create variant . Review the content of the new variant, then click Publish in the top right. At any point during the test, review the tests results . BETA",https://knowledge.hubspot.com/website-and-landing-pages/create-a-b-tests-for-pages-with-ai
1285,Use today's date in the CRM,"To track data compared to the current day, you can use today's date and other relative measures of time in your CRM. For example, if you create a Renewal date property, you can set the property to display time from today (e.g., Renewal date is 10/28/2024, 12 days from today) and filter records based on their Renewal date values (e.g., Renewal date is this month). In this article, learn more about the ways you can use today's date and relative time in HubSpot: Show relative time from today when viewing a date picker or date and time picker property . Set up filters and enrollment criteria based on today's date or other relative time periods in object index pages , lists , reports , workflows , and datasets . Create calculation properties to track the time since or time until a date and use the properties in filters ( Professional and Enterprise only). Display property values with relative time from today For date picker and date and time picker properties, you can choose to display their values including the number of days from the current date. This option is available for both default and custom properties. In your HubSpot account, click the settings settings icon in the top navigation bar. In the left sidebar menu, navigate to Properties . Create a property or edit an existing property . Navigate to the Field Type tab. The field type must be either Date picker or Date and time picker . Select Show [date/date and time] with relative time . Displaying relative time doesn't affect the property's values. Finishing setting up or editing the property, then click Create or Save . When viewing the property value on a record, the number of days ago or from today will be displayed. Please note: relative time is not supported when viewing the property's values in forms, reports, or the mobile app. Use today's date or relative time in filters You can set up filters based on today's date or relative time from today in HubSpot tools to segment records, trigger automation, and report on data. Below are the supported tools and example use cases. If you've created Time since or Time until calculation properties ( Professional and Enterprise only) and want to filter by those instead, learn how to use the properties . Object index pages When filtering records on an object index page, you can set criteria for date and date and time properties using relative time measures. This includes default options such as Today or Last quarter , and custom measures such as more than 10 days ago or less than 45 days from now. Navigate to your records and select a date/date and time property by which to filter the records . Set your criteria using today's date or the relative time from today. For example: To view deals with a Close date today or another default option, using quick filters, click Close date , then select an option . If using the Advanced filters panel, select Close date > is > [option] . To view deals with a Close date within a custom amount of time (e.g., 45 days or less from the current day), in the Advanced filters panel, select Close date > is [less/more] than > [number] > days [ago/from now] . To save the filters as a view , click the saveEditableView Save icon . Learn more about filtering records . Lists When filtering records to include in a list, you can set criteria for date and date and time properties using the relative time from today. For example, Last activity date is more than 10 days ago or Close date is less than 45 days from now. You can also filter based on how recently a value was updated or if a value is before or after another property's value. In your HubSpot account, navigate to CRM > Lists . Create a list or edit an existing active list . In the left panel, click + Add filter . Set your list criteria using relative time from today with [Object] properties as the filter category. For example: To include contacts who engaged with your team today, select Contact properties > Last engagement date > is less than > 1 > day ago . To include contacts with a Renewal date within a custom amount of time (e.g., the next six months), select Contact properties > Renewal date > is [less/more] than > [number] > days [ago/from now] . Continue setting up or editing your list, then click Save list . Learn more about how to create lists and determine your list criteria . Reports When creating or editing a report, you can set date ranges and filters based on today's date and relative time. This applies to default reports from the report library or custom reports created in the custom report builder ( Professional and Enterprise only). In your HubSpot account, navigate to Reporting > Reports . Click Create report or edit an existing report . You can select a template or if your account has a Professional or Enterprise subscription, use the custom report builder . If using a report template, in the right panel, you can select default options or set custom relative time measures for the report's Date range and Filters when using date/date and time properties. If using the custom report builder ( Professional and Enterprise only), you can select default options or set custom relative time measures for when filtering date/date and time fields. Continue setting up or editing your report, then click Save . Workflows ( Professional and Enterprise only) You can use today's date or other relative time measures in workflow enrollment triggers and branches. For example, create a workflow that sends you a notification when a deal's Close Date is today. In your HubSpot account, navigate to Automations > Workflows . Click Create workflow . Add an enrollment trigger or branch . Select [Object] properties as the filter category. Select a date/date and time property . To set criteria based on today's date, use the options less than or more than to specify the number of days from the current date. In the example below, if the workflow runs every day, a deal will be enrolled in the workflow if its Close date is today. Click Save . Add actions as needed. For example, you could send a notification to the deal owner when the Close date is today. Publish and turn on the workflow. Datasets ( Operations Hub Enterprise only) In datasets, you can use date/date and time properties and date functions in filters and formulas to calculate relative time. Learn more about creating custom datasets . For example: To calculate the time until a contact's birthday, use DATEDIFF(""DAY"",[Birthday], NOW()) . To show deals whose Last activity date value is more than 30 days from today's date, you could use IF(DATEDIFF(""DAY"",[Last activity date], NOW()) > 30, "" More than 30"", ""Less than 30"") . View and use time since and time until calculation properties ( Professional and Enterprise only) You can create calculation properties that track the amount of time since or until a date. For example, you can create a Time since open property to track how long a deal has been open in your pipeline. Learn how to create time since and time until calculation properties . You can view the property's value on a record if the selected start or end date property has a value. For example, at this time, the following deal is set to close in 45 days. You can also filter records by the properties on object index pages or in lists, workflows, and single-object reports. Time since and time until properties can be used with the following operators : is less than is greater than is known is unknown For example: View deals for which Time since open is more than 10 days, but there hasn't been any recent activity. Create a list of contacts for which Time until renewal is less than 30 days , so you can send them a renewal reminder email. Enroll contacts in a workflow if they have a specific role and were created more than 2 days ago . Please note: t ime since and time until properties are not supported in the following: Datasets . Filters in the custom report builder . Inputs in calculation and rollup properties . Custom data sync field mappings . properties CRM records",https://knowledge.hubspot.com/properties/use-todays-date-in-the-crm
1286,Export your records,"You can export your records (e.g., contact records) in your HubSpot account. You can also view a list of your account's past exports . Activities on records, such as notes or emails, cannot be exported. To retrieve activities, you can export certain activity reports or use the engagements API . Export records Navigate to your records: Calls: In your HubSpot account, navigate to CRM > Calls . Contacts: In your HubSpot account, navigate to CRM > Contacts . Companies: In your HubSpot account, navigate to CRM > Companies . Deals: In your HubSpot account, navigate to CRM > Deals . Payments : In your HubSpot account, navigate to Commerce > Payments . Tickets: In your HubSpot account, navigate to CRM > Tickets . Custom objects: In your HubSpot account, navigate to CRM , then select the custom object . To open the view you want to export: In listView list view, click the view's tab , or click + Add view then select the view from the dropdown menu. To export all records of that object, open the All [records] view. In grid board view (deals, tickets, or custom objects only), click pipeline dropdown menu and select the pipeline with the view you want to export, then click the view dropdown menu and select the view . To export all records in the pipeline, open the All [records] view. To export the records: In listView list view, in the top right of the table, click Export. In grid board view, in the top right of the board, click Board options , then select Export view. In the dialog box, to choose the format of your exported file, click the File format dropdown menu and select the format . To choose the language for the column headers in the exported file, click the Language of column headers dropdown menu, then select the language . By default, the dropdown menu will show the default language you've selected in your settings. The column headers of default properties will be translated, but the property values within each column will not be translated to the selected language. By default, only the properties and associations in the view will be included in the file, and for associations, this will include up to one thousand associated records per association column . To edit which properties and associations are included, click Customize , then select from the following options: Contacts with multiple email addresses : select the Include all email addresses checkbox to include all email addresses for contacts with multiple emails in the export file. Companies with multiple domains : select the Include all domains checkbox to include all domain names for companies with multiple domains in the export file. Properties included in export : options include Properties and associations in your view (default), All properties on records (i.e. no associations), or All properties and associations on records. The order of the columns in the export file depends on the option you select: If you export only properties in the view, the columns are displayed in the same property order set for the view. If you export all properties, the columns are displayed in alphabetical order, with the exception of Record ID which will be the first column in the file. If you export all properties and associations, associations are included at the end. Associations included in export : options include Up to 1,000 associated records (default), or All associated records (CSV files only). Click Export . You'll receive an email with a download link to your export file. Download links to export files will expire after 30 days. If the records you export have associated records, each associated object will have its own column within the file. Depending on the object you're exporting, you can export information about associated contacts, companies, deals, tickets, custom object records, line items, subscriptions, or payments. For each associated object, the exported file contains the following headers and information: Associated [Object] IDs: the IDs of the associated records. Multiple ID values are separated by semi-colons. Associated [Object]: the associated record's name (e.g., contact name, company name, etc.). Multiple record names are separated by semi-colons. Set up a large export warning notification If you're a super admin , you can set up a large export warning notification to know when users are taking record data out of your account. Each super admin can customize their notification to their own needs. In your HubSpot account, click the settings settings icon in the top navigation bar. In the left sidebar menu, navigate to Import & Export . Under Export , type or use the arrows to adjust the number. Any record exports equal to or greater than the number specified will cause you to receive a notification. Technical limits The following is expected when completing record exports: You can complete up to 300 exports within a rolling 24 hour window, and up to three exports at the same time. Any additional exports will be queued until one of the three concurrent exports is completed. If you're completing a large export, it may take a few hours to complete the export and you may receive multiple files delivered in a zip file. Multiple files are expected when exporting CSV or XLSX files with more than 1,000,000 rows and XLS files with more than 65,535 rows. An exported CSV file will be automatically zipped if the resulting file is greater than 2MB. For XLS and XLSX files, there's a limit to the number of columns that can be exported (256 for XLS and 16,384 for XLSX). If your export contains more columns than the limit, the additional columns won't be included in the file. For exports with a large number of columns, it's recommended to export CSV files which won't have a column limit. CRM records Import & Export",https://knowledge.hubspot.com/import-and-export/export-records
