id,titulo,conteudo,link
2408,Criar um pedido de vendas no NetSuite no HubSpot,"Depois de conectar o HubSpot e o NetSuite , saiba como criar um pedido de vendas do NetSuite no HubSpot diretamente de um registro de negócio ou usando um fluxo de trabalho baseado em negócios. Antes de começar Antes de criar pedidos de vendas do NetSuite no HubSpot, os produtos na biblioteca de produtos do HubSpot devem corresponder aos itens do NetSuite. Existem duas maneiras de fazer isso: usando a sincronização de produtos ou mapeando manualmente o nome/número do item do NetSuite ao SKU do produto do HubSpot. Observação: A moeda da empresa na sua conta HubSpot deve corresponder à moeda base definida na sua conta NetSuite. Ao criar um pedido de vendas no HubSpot, você deve adicionar todos os campos obrigatórios de um pedido de vendas do NetSuite. Para identificar esses campos, crie um pedido de vendas no NetSuite e anote os campos obrigatórios. Configurar sincronização do produto Na sua conta HubSpot, clique no ícone de < configurações< < settings icon< na barra de navegação superior. No menu da barra lateral esquerda, acesse < Integrações< > < Apps conectados< . Clique em NetSuite . Clique em Sincronizar mais dados . Selecione Sincronização do produto . Escolha qual objeto sincronizar com os produtos da HubSpot. Você pode sincronizar Itens de montagem, Itens de inventário, Itens de kit, Itens de venda sem inventário e Itens de venda de serviço. Defina uma sincronização uni ou bidirecional para os seus dados e personalize as suas configurações de sincronização . Ative a sincronização. Mapear os itens do NetSuite aos produtos do HubSpot Para sincronizar os itens do NetSuite, como vales-presente ou itens de envio direto com os produtos do HubSpot, adicione o nome/número do item do NetSuite ao campo de SKU do produto do HubSpot. Em sua conta da HubSpot, acesse Vendas > Produtos . Clique no produto que deseja mapear ao item do NetSuite. No campo SKU, insira o NetSuite ItemID (Nome/número do item) . O item deve estar ativo no NetSuite. Itens inativos não podem ser adicionados aos pedidos de vendas. Clique em Salvar . Ativar funcionalidades adicionais Na sua conta HubSpot, clique no ícone de < configurações< < settings icon< na barra de navegação superior. No menu da barra lateral esquerda, acesse < Integrações< > < Apps conectados< . Em Aplicativos conectados , clique em NetSuite . Clique na guia Descoberta de recursos . No banner Enable extra features , clique em Enable . Na secção Criar encomendas de vendas do NetSuite a partir do HubSpot , clique em Instalar ação de fluxo de trabalho . Crie pedidos de vendas do NetSuite usando fluxos de trabalho baseados em negócios ( Sales Hub Professional ou Enterprise ) Use fluxos de trabalho baseados em negócios para criar automaticamente pedidos de vendas do NetSuite quando o fluxo de trabalho for acionado. Ao definir as configurações de sincronização da integração , os Clientes da empresa ou os Clientes individuais devem ser selecionados. Depois de instalar o aplicativo no HubSpot, a ação de integração deve ser autenticada na página de configurações do aplicativo NetSuite: Na seção Crie pedidos de vendas do NetSuite a partir da HubSpot , clique em Instalar ação de fluxo de trabalho . Na sua conta HubSpot, acesse Automações > Fluxos de trabalho . Para editar um fluxo de trabalho existente, passe o cursor do mouse sobre o fluxo de trabalho e clique em Editar . Ou, saiba como criar um novo fluxo de trabalho baseado em negócios . No editor de fluxo de trabalho, clique no + ícone de adição para adicionar uma ação. No painel de ações, role para baixo e selecione Criar pedido de vendas do NetSuite . Configure seu pedido de vendas do NetSuite; os seguintes campos são obrigatórios, a menos que indicado: Conta do NetSuite: será exibida uma lista de contas do NetSuite conectadas; selecione uma conta para criar o pedido de vendas. Itens: defina os itens de linha associados ao negócio como os itens do pedido de vendas. Preço do item: selecione Usar preço do item de linha do HubSpot ou Usar preço do item de linha do NetSuite . Subsidiária: será exibida uma lista de subsidiárias associadas à conta NetSuite selecionada; selecione uma Subsidiária para criar o pedido de vendas. Cliente: selecione Usar primeiro contato associado da HubSpot ou Usar primeira empresa associada da HubSpot para definir o Cliente designado para o pedido de vendas. Incluir anexos (opcional): marque esta caixa de seleção para incluir todos os arquivos na seção Anexo de um registro de negócio do HubSpot no pedido do NetSuite. Pasta do NetSuite : selecione em qual pasta os anexos serão criados. Observação: para acessar anexos no NetSuite, a função do usuário da integração deve ter permissões para Documentos e arquivos na subguia Listas Para adicionar outro campo ao pedido de vendas, clique em Adicionar outro campo e selecione um campo . Apenas os campos padrão do NetSuite serão exibidos; os campos de referência não aparecerão. Para preencher o campo com valores de propriedade obtidas do registro de negócio inscrito, clique em Negócio neste fluxo de trabalho . Selecione uma propriedade . Para preencher o campo com base em outras ações no fluxo de trabalho, clique no nome da ação e selecione uma opção . Você pode preencher campos com base no resultado de uma ação ou nos resultados da ação. Para remover um campo do pedido de vendas, clique no ícone excluir delete ao lado do campo. Criar pedido de vendas do NetSuite a partir de um registro de negócio Você também pode criar manualmente um pedido de vendas do NetSuite a partir de um registro de negócio do HubSpot: Na sua conta HubSpot, acesse CRM > Negócios . No cartão Pedidos de vendas , clique em Adicionar > Criar um pedido de vendas do NetSuite . Na guia Conta , selecione a conta do NetSuite , a conta da subsidiária e o formulário personalizado para criar um pedido de vendas. Clique em Próximo . Na guia Cliente , selecione o cliente NetSuite para o qual deseja criar um pedido de vendas. Clique em Próximo . Na guia Pedido , adicione propriedades de pedidos de vendas com base no tipo de formulário personalizado escolhido. Na guia Revisão , revise o pedido de vendas e faça as edições necessárias. Clique em Criar pedido de vendas. Integrations",https://knowledge.hubspot.com/pt/integrations/create-a-netsuite-sales-order-in-hubspot
2409,Altere o domínio principal para seu conteúdo da HubSpot,"Um domínio primário é o host padrão para um tipo de conteúdo no Hubspot . Você pode alterar seu domínio principal para qualquer outro domínio conectado ao HubSpot, incluindo domínios de redirecionamento. Ao criar um domínio primário pela primeira vez, todo o conteúdo hospedado será transferido para esse domínio. Por exemplo, se você tivesse páginas de um site hospedadas em um domínio do sistema e você cria um domínio principal para páginas do site, todos os tipos de conteúdo será transferido para seu novo domínio principal. Observe: contas com o Unidades de negócios O complemento só pode ter um único domínio principal para cada tipo de conteúdo na conta. Domínios adicionais para cada unidade de negócios precisarão ser configurados como domínios secundários. Para mover um tipo de conteúdo para um novo subdomínio primário ou domínio de nível superior: Na sua conta HubSpot, clique no ícone de configurações settings icon na barra de navegação superior. No menu da barra lateral esquerda, navegue até Contente > Domínios e URLs . Se o domínio que você deseja usar como domínio primário não estiver conectado, conectar o domínio como um domínio de redirecionamento. Depois que o novo domínio estiver conectado, você poderá usá-lo como domínio primário. No Domínios primários seção, clique no Editar menu suspenso para o tipo de conteúdo cujo domínio principal você está substituindo e selecione Substituir domínio primário . Na caixa de diálogo, clique no menu suspenso Selecionar um novo domínio primário , selecione domínio e clique em Substituir domínio primário . Observe: Quando você substitui um domínio primário, a criação ou não de redirecionamentos de URL depende da configuração do seu domínio: Se o domínio primário anterior não for mais usado como domínio primário ou secundário, ele se tornará um domínio de redirecionamento. Os redirecionamentos serão criados de URLs neste domínio para o novo domínio primário. Se o domínio primário anterior ainda for usado como domínio primário ou secundário para outro conteúdo, os redirecionamentos serão não Ser criado. Aprender mais sobre criando manualmente redirecionamentos de URL . Se você estiver mudando para um domínio principal que usa um novo domínio de marca, precisará substitua o domínio da sua marca antes de mudar o domínio da marca. Domains & URLs",https://knowledge.hubspot.com/pt/domains-and-urls/change-the-primary-domain-for-your-hubspot-content
2410,Create and manage saved content views,"You can manage your blog post, knowledge base article, landing page, and website page index pages by creating saved views. With saved views, you can filter your content by domain, publish status, and name, as well as other filters. Learn more about creating saved views for your CRM objects. You can also organize your content index pages by sorting them into folders. Create a saved view For each content type (website pages, landing pages, knowledge base articles, and blog posts), you can create saved views that use specific filters. Navigate to your content: Website Pages : In your HubSpot account, navigate to Content > Website Pages . Landing Pages : In your HubSpot account, navigate to Content > Landing Pages . Knowledge Base : In your HubSpot account, navigate to Content > Knowledge Base . Blog : In your HubSpot account, navigate to Content > Blog . In the top left, click Add view and select Create new view . You can also select a default view, such as Recently published. In the dialog box, enter a name for your view. Select from the following options : Private : only you can access this view. My team : any user on your team can access this view. This option is only available in accounts with teams features . Everyone : any user in your account can access this view. Click Confirm . To add filters to your view, click the dropdown menu at the top of the page and select the checkbox next to each option you want to include in your filter. For example, you can filter Publish status by Scheduled . To add additional filters: At the top of the page, click All filters . In the right panel, click the name of a filter. Set the filter's options, then click Apply filter . To add an additional filter, click AND , then repeat the process. In the top right of the content dashboard, click eVi Save view . In the pop-up box, click Save to update the existing view, or Save as new to save your filters in a new view. To reset the currently selected filters, click Reset . Edit a saved view Once you've saved a view, you can edit its name, filters, columns, sort order, and visibility settings. You can also delete a saved view. Only Super Admins or the user who created the view will be able to delete or save changes to the view. Navigate to your content: Website Pages : In your HubSpot account, navigate to Content > Website Pages . Landing Pages : In your HubSpot account, navigate to Content > Landing Pages . Knowledge Base : In your HubSpot account, navigate to Content > Knowledge Base . Blog : In your HubSpot account, navigate to Content > Blog . To edit a view's filters: Click the tab of the view you want to edit. If it doesn't appear as a tab, click a Add view , then select the view . Click the property dropdown menus or All filters , then edit the filters. Click ew Save view . To edit a view's sort order , click the column header you want to sort by. To edit a view's columns , click Edit columns . From the All views page, you can rename, manage sharing, clone, and delete views. In the top right, click All views : To edit a view’s name , hover over the view, then click More and select Rename . Enter a new name for the view, then click Confirm . To edit visibility settings , hover over the view, then click More and select Manage sharing . Select a new visibility setting , then click Save . To delete a view, hover over the view , then click More and select Delete . In the dialog box, click Delete to confirm. Organize landing pages with folders You can organize your landing pages by sorting your pages into folders. Folders are meant for internal organization and will not affect your live website. Create folders In your HubSpot account, navigate to Content > Landing Pages . In the top right, click the Actions dropdown menu and select View folders . In the top right, click Create folder . In the dialog box, enter a name for your folder, then click Create . Add pages to folders In your HubSpot account, navigate to Content > Landing Pages . Select the checkbox next to each page you want to add to a folder. At the top of the table, select Move to folder . In the dialog box, click the folder where you want to store your pages, then click Move . Blog Website & Landing Pages",https://knowledge.hubspot.com/website-and-landing-pages/create-an-manage-saved-content-views
2411,Exibir conexões de fluxo de trabalho,"Quando você faz referência a um fluxo de trabalho em outro ativo do HubSpot, como uma lista ou outro fluxo de trabalho, poderá visualizar essas conexões no painel de fluxos de trabalho e na página de revisão do fluxo de trabalho. Você também pode visualizar qualquer ativo usado pelo fluxo de trabalho, como listas e propriedades. Exibir conexões de fluxo de trabalho no painel Para exibir as conexões do fluxo de trabalho no painel: Na sua conta HubSpot, acesse Automações > Fluxos de trabalho . Passe o cursor do mouse sobre um fluxo de trabalho, clique em Ações e selecione Detalhes . No painel direito, clique na guia Conexões . Veja os ativos usados pelo fluxo de trabalho junto com as ferramentas que estão usando o fluxo de trabalho. Revisar as conexões antes de ativar um fluxo de trabalho Antes de ativar um fluxo de trabalho , você pode revisar quais ativos são usados pelo fluxo de trabalho e quais outros ativos estão usando o fluxo de trabalho. Enquanto estiver no construtor de fluxo de trabalho, clique em Revisão para revisar os detalhes do fluxo de trabalho. Na página de revisão, em Conexões , revise as conexões do fluxo de trabalho. Para exibir quais ativos específicos estão conectados ao fluxo de trabalho, clique no tipo de ativo . Você pode clicar no nome do ativo para exibi-lo. Workflows",https://knowledge.hubspot.com/pt/workflows/view-workflow-connections
2412,A guide to HubSpot's navigation,"T his article provides an overview of how the HubSpot navigation is organized. In HubSpot, tools are grouped together based on how they support your business processes. The menu items shown in your account depend on your user permissions and your HubSpot subscription. Learn more about which tools you have access to in the Product & Services catalog . Top navigation bar An overview of the items in the top navigation bar: sprocket Sprocket : click the sprocket icon to navigate to your default home page . search Search : the global search bar , used to search your entire HubSpot account for assets, tools, learning resources, and settings. + Quick Create: click the + Quick Create button to create a contact , company , deal , or ticket record. calling Calling : the calling tool. marketplace Marketplace : the HubSpot marketplaces, including the App Marketplace , Template Marketplace , Solutions Directory , and links to your existing connected apps. HubSpot Marketplace providers also have a Marketplace menu to access Listings, Provider Info, and Transactions. question Help : HubSpot support resources. When you click the help icon, a panel will appear with the support resources available for your account's subscription . settingsSetting Settings: all of your account and product settings are located in one place. Navigate to each of your settings using the left sidebar menu. When clicking Settings settin while in certain tools, you will be brought to that tool's specific settings. You can click Back to all settings in the upper left to see all settings. notification Notifications : a central place to view your user notifications . Copilot (BETA): click to access the AI-collaboration tool Copilot to ask questions about your HubSpot data and complete certain tasks using the provided prompts. Learn more about using Copilot . Account: click the dropdown menu to access options for account details and services. This menu includes Profile & Preferences, your account Hub ID, Account & Billing, HubSpot Academy , Pricing & Features, Product Updates, Projects , and Training & Services. At the bottom of the dropdown menu, you can also click to Sign out or view the Privacy policy. Navigation sidebar menu The left sidebar menu organizes your account's tools and resources into categories. Click a navigation menu item to view the tools in that category, then click the tool to navigate to it. By default, the sidebar is collapsed. To open the sidebar, hover over the menu icons . To keep the navigation menu open click the Keep navigation open icon in the bottom left. An overview of the items in the navigation sidebar, and the HubSpot tools included in each: Bookmarks: save your most frequently used menu items. You can save up to ten secondary menu items in the Bookmarks section: To add a bookmark to a menu item, hover over the secondary menu item and click the bookmark icon . To remove a bookmark, hover over the menu item and click the bookmark icon in the main menu or in the Bookmarks section. Workspaces : tools that organize specific daily tasks into one place, including the prospecting , the activity feed (found within the Prospecting workspace) , and Help Desk . CRM : home pages and tools related to records, interactions, and payments. Click this menu to navigate to records (contacts, companies, deals, tickets, custom objects), target accounts (found within the Companies page), lists , inbox , calls , and tasks . Marketing : tools for marketing content, conversions, and strategy. Click this menu to navigate to campaigns , marketing email , social , ads , forms , CTAs , and SMS . Content : tools for your web-hosted content. Click this menu to navigate to website pages , landing pages , blog , knowledge base , customer portal , SEO , HubDB , and the design manager . Commerce : tools related to commerce. Click this menu to navigate to quotes , payments , payment links , invoices , products , and subscriptions . Automations : tools to automate actions in your HubSpot account. Click this menu to navigate to workflows , sequences , chatflows , and feedback surveys . Reporting & Data : tools to report your data and to understand and manage the organization of data in your account. Click this menu to navigate to dashboards , reports , sales reporting (found within the Reports page) , forecasts , goals , integrations , custom events , the data quality command center , datasets , and the data model explorer . Library : includes your templates , meeting scheduling pages , files , documents , playbooks , snippets , and coaching playlists . Partners: HubSpot Partners have a Partner menu to access Directory Info and Resources . Breeze AI (BETA): AI tools to increase your efficiency. Click this menu to navigate to the Breeze AI overview page , prospecting agent, social agent, and content agent. Help & Resources",https://knowledge.hubspot.com/help-and-resources/a-guide-to-hubspots-navigation
