id,titulo,conteudo,link
665,"Center an image, CTA (legacy), or logo in an email or page","If you're using layout templates created in the design manager tool, center an image, CTA (legacy), or logo module on your page, blog, or email, by adding inline styling to your template. If you're using a template that includes a drag and drop area , you can center module alignment within the content editor. You can also center modules in the page editor using horizontal spacers. Please note: accounts created after March 17th, 2025, do not have access to the CTA (legacy) tool. Center an image, CTA (legacy), or logo with inline styling Centering an image with inline styling requires a basic understanding of HTML. If your page or template has an attached stylesheet or any additional styling added, there may be existing CSS affecting your image, CTA (legacy), or logo. HubSpot recommends working with a designer to identify the source of the styling and make the necessary changes to center your assets. To center an image, CTA (legacy), or logo in an email or page template: Navigate to your content: Website Pages : In your HubSpot account, navigate to Content > Website Pages . Landing Pages : In your HubSpot account, navigate to Content > Landing Pages . Blog : In your HubSpot account, navigate to Content > Blog . Email : In your HubSpot account, navigate to Marketing > Email . Hover over your content, then click Edit . In the editor, access your content's settings: For posts and pages, click the Settings menu and select Advanced . For emails, click the Settings tab, then click to expand the Advanced Options section. In the Template section, click Edit this template to open the template in the design manager. In the design manager, click the logo , call to action , or image module . In the right column, enter text-align: center; in the Inline styling field. In the upper right, click Publish changes to apply your changes to this template. Center an image, CTA (legacy), or logo from your module's styling options If you're using a template with a drag and drop area, in certain modules or sections, you can choose to set the alignment directly. Although, do note that this styling option may not be available on all templates or modules. To center page or post modules: Navigate to your content: Website Pages : In your HubSpot account, navigate to Content > Website Pages . Landing Pages : In your HubSpot account, navigate to Content > Landing Pages . Blog : In your HubSpot account, navigate to Content > Blog . Hover over your page or blog post, then click Edit . In the page editor, click on the module that you want to center. In the left panel, click the Styles tab, then click to expand the Alignment and spacing section. Under Alignment , select the Center alignment. To center your email modules: In your HubSpot account, navigate to Marketing > Email . Hover over your email, then click Edit . Click on the module that you want to center. In the left panel, click the Alignment dropdown menu and select Center . Center an image, CTA (legacy), or logo using horizontal spacers If the module you're using does not have alignment options, from the content editor, you can add horizontal spacers to your page to center modules instead. To center your module using a horizontal spacer: Navigate to your content: Website Pages : In your HubSpot account, navigate to Content > Website Pages . Landing Pages : In your HubSpot account, navigate to Content > Landing Pages . Blog : In your HubSpot account, navigate to Content > Blog . In the left column of the content editor, click + Add . In the search bar, search for horizontal spacer . Click and drag the horizontal spacers to each side of the module you want to center. Then, adjust the spacer's width to center your element. CTAs Marketing Email",https://knowledge.hubspot.com/marketing-email/how-do-i-center-an-image-cta-or-logo-in-an-email
666,Acompanhar as visitas ao site,"Os prospects são visitantes do site que ainda não foram convertidos em um formulário . A ferramenta de visitas ao site usa o código de rastreamento HubSpot para detectar o endereço IP de cada exibição de página. Em seguida, ela fornece informações disponíveis publicamente sobre a empresa associada ao endereço IP do visitante para que você possa saber mais sobre os visitantes do site. Por favor, note: as visitas de endereços IP que você exclui da análise ainda serão rastreadas pela ferramenta de visitas do site. Empresas e indivíduos menores podem não ter seus próprios endereços IP. Nesses casos, o prospect aparecerá como provedor de serviços de Internet (por exemplo, Comcast, Cox, Verizon). Por padrão, a ferramenta de visitas a sites filtrará esses clientes potenciais usando o provedor de serviços de Internet | é igual a | falso filtro. Você pode removê-lo clicando no x no filtro. O código de rastreamento da HubSpot é instalado automaticamente em suas páginas da HubSpot. Se estiver hospedando o site externamente, saiba como instalar o código de rastreamento da HubSpot no site . Para exibir seu relatório de visitas ao site: Na barra de pesquisa global da sua conta da HubSpot, digite Visitas ao site . Clique em Visitas ao site . Observe: o Número de visualizações de página e o Número de visitantesDados é limitado a 100.000. Visualizações adicionais ou números de visitantes não serão refletidos em sua conta depois que esse número for atingido. Gerenciar os prospects Depois de adicionar o código de rastreamento, os prospects aparecerão na ferramenta de prospects à medida que visitarem seu site. Para segmentar seus clientes potenciais, crie filtros ou use a barra de pesquisa para pesquisar clientes potenciais por palavras-chave, como estado ou país. Para ocultar um prospect, marque a caixa de seleção ao lado do prospect e clique em Ocultar na parte superior da tabela. Os clientes potenciais ocultos não aparecerão no email diário . Por favor, note: Para mostrar seus clientes potenciais, contato HubSpot Support . O suporte só pode exibir todos os prospects ocultos por usuário. Os prospects individuais não podem ser ocultados. Para adicionar um prospect como favorito, clique no favorite ícone de estrela ao lado do prospect. Isso adicionará o prospect ao seu filtro de Favoritos , que você pode usar para configurar notificações de prospects . Para adicionar um prospect como um registro de empresa ao banco de dados, clique no ícone de + mais à direita do prospect. Para adicionar clientes potenciais como registros de empresa em massa , marque as caixas de seleção à esquerda e clique em Adicionar ao banco de dados na parte superior da tabela. Para personalizar as colunas na ferramenta de visitas a sites: No canto superior direito, clique no menu suspenso Ações e selecione Editar colunas . Na caixa de diálogo, marque as caixas de seleção ao lado das propriedades que você deseja incluir na sua ferramenta de prospects e clique em Salvar . Para ver mais detalhes sobre um prospect, clique no nome da empresa . Para acessar o perfil do LinkedIn da empresa, clique em Exibir no LinkedIn . Para criar um registro para esta empresa, clique em Adicionar uma empresa . Para abrir o site da empresa em outra guia, no campo Domínio , clique no domínio . Para ver empresas semelhantes no setor, role até a seção Empresas relacionadas . Clique em um nome de empresa para acessar o site da empresa. Configurar notificações de visita ao site Com a ferramenta de visitas ao site, você e os membros da sua equipe podem receber notificações relacionadas à atividade do visitante do site. Saiba como gerenciar suas notificações de prospect em seu Preferências de & perfil . Há dois tipos de notificações para os prospects: E-mail diário: receba um e-mail de resumo diário das empresas nessa exibição quando elas acessarem seu site. Notificações de revisitação: receba uma notificação em seu feed de atividades quando uma empresa nesta exibição visitar seu site. Para ativar as notificações de visita ao site: Na barra de pesquisa da sua conta HubSpot, digite Visitas ao site . Clique em Visitas ao site . Suas notificações serão aplicadas ao filtro atualmente selecionado . Clique em Filtros salvos para selecionar um filtro existente ou clique em Adicionar filtro para criar um novo filtro. No canto superior direito, clique no menu suspenso Ações e selecione Gerenciar notificações . Na caixa de diálogo, clique para alternar o Daily Email e/ou Revisite notificações ativados para assinar essas notificações. Se você for um administrador , poderá inscrever os membros da sua equipe para receber notificações. Na caixa de diálogo, clique na guia Notificações de equipe . Para cada tipo de notificação, clique no menu suspenso Inscrever membros da equipe e selecione os membros da equipe . Clique em Salvar . Assim que seus clientes potenciais começarem a visitar seu site, você poderá revisar essas notificações no feed de atividades . Você também pode gerenciar as notificações de nova visita ao site nas configurações de notificações. Tracking Code",https://knowledge.hubspot.com/pt/prospects/use-prospects
667,Update the company details on your invoice and receipt,"Please note: if you are a HubSpot Solutions Partner , please contact your Partner Development Manager to update your company details. Before you begin Please take note of the following before updating your company details: It is not possible to update or change company details on invoices that have already been paid. Billing address is the address connected to your payment method. Shipping address is the physical address where you are using HubSpot, and what tax/VAT is calculated from. HubSpot refers to the shipping address as the Primary Company Address or Primary Address . Update your company details Review and update the company name and address that appear on your invoices and receipts from your Account & Billing settings. To find your company details: In your HubSpot account, click your account name in the top right corner, then click Account & Billing . Click the Company Info tab. Under Company Information , viewyour current company name and address. To update your company name: Click Edit name to the right of your company name. In the dialog box, enter your new company name in the New Company field. Click Agree and Update Company Name . To update your company address: Click Edit address . In the dialog box, enter the details of your company address. Click Submit . Your company name and address will be updated on all open and future invoices. All admins in your account will receive an email agreement about your name change. You can also find a PDF version of the email in the Documents tab of Account & Billing: In your HubSpot account, click your account name in the top right corner, then click Account & Billing . Click the Documents tab. The confirmation will have a title similar to NameChangeConfirmation-1234.pdf and will be listed as Name Change Confirmation in the Type column. Click the document name to download the PDF. billing",https://knowledge.hubspot.com/account/change-the-company-name-on-your-invoice-and-receipt
668,Ver o histórico de permissões do usuário,"Os superadministradores podem exibir o histórico de permissões de um usuário para auditar quem tinha permissões e quando. Isso pode ser útil ao solucionar problemas de permissões ou quando for necessário auditar permissões para conformidade de segurança. Para exibir o histórico de permissões de um usuário: Na sua conta HubSpot, clique no ícone de configurações settings icon na barra de navegação superior. No menu da barra lateral esquerda, acesse Usuários e equipes . Passe o mouse sobre o usuário do qual você deseja exibir o histórico de permissões e clique no menu suspenso Ações. Selecione Exibir histórico de permissões do usuário . Na tela histórico de permissões, exiba os detalhes do histórico de permissões, que inclui as seguintes colunas: Permissão : o nome da permissão. Ação: se a permissão foi adicionada ( Criar) ou removida ( Excluir ). Atualizado por: o usuário que fez a atualização. Data da alteração: data em que ocorreu a alteração. Account Management User Management",https://knowledge.hubspot.com/pt/user-management/view-user-permissions-history
669,Imposto sobre valor agregado (IVA) da Türkiye | Perguntas frequentes,"Observação: este artigo foi preparado apenas para fins informativos. Observação: este artigo foi preparado apenas para fins informativos. Ele não se destina a fornecer e não deve ser considerado como aconselhamento fiscal. Em caso de dúvidas, você deve consultar seus próprios consultores fiscais e/ou jurídicos. Se a sua empresa estiver localizada na Turquia, saiba como a HubSpot administra o IVA. Você também pode atualizar a HubSpot com suas informações relacionadas ao IVA. O que é o IVA? O IVA (imposto sobre valor agregado) é um imposto que é cobrado sobre a maioria dos bens e serviços consumidos na Nigéria. Por que o IVA está sendo cobrado? A HubSpot está registrada para IVA na Türkiye, pois fornece serviços eletrônicos aos clientes. Portanto, é obrigada a cobrar e recolher o IVA à taxa vigente para todos os clientes que não estão registrados para IVA. Como a HubSpot determina a quais clientes o IVA da Türkiye se aplica? Se o seu endereço de entrega principal estiver na Türkiye e sua empresa não estiver registrado para fins de IVA, o IVA será cobrado de você. Saiba como verificar como o endereço principal da sua empresa está definido na HubSpot . Quais serviços da HubSpot estão sujeitos ao IVA? Todos os serviços da HubSpot são considerados sujeitos ao IVA. Como faço para provar que sou um cliente comercial registrado com IVA? Todas as empresas registradas para fins de IVA devem adicionar esse número de IVA à sua conta de cobrança da HubSpot. Quando um número de IVA válido for adicionado à sua conta, a HubSpot deixará de adicionar uma cobrança de IVA à sua fatura. Observação: talvez você tenha que autoliquidar o IVA de acordo com o mecanismo de cobrança reversa. Sou registrado para fins de IVA na Türkiye, ainda serei cobrado? Se você adicionou um número de IVA válido à sua conta da HubSpot, o IVA não será cobrado da sua empresa. Você pode ser obrigado a contabilizar o IVA por conta própria por meio do mecanismo de cobrança reversa. Há isenções para instituições sob as quais o IVA não pode ser cobrado? Se sua empresa estiver isenta de cobrança de IVA, você precisará enviar à HubSpot um certificado de isenção válido e garantir que a sua empresa atenda a todos os critérios de isenção. Os certificados de isenção devem ser enviados para billing@hubspot.com para processamento. billing",https://knowledge.hubspot.com/pt/account/turkey-vat-frequently-asked-questions
670,Anexar um documento ao conteúdo,"Para adicionar um documento ao email, à página inicial, à página do site ou à postagem do blog, insira um link para o arquivo de documento em qualquer editor de rich text. Acesse seu conteúdo: Páginas do site : Na sua conta da HubSpot, acesse Conteúdo > Páginas do site . Landing pages : Na sua conta da HubSpot, acesse Conteúdo > Landing pages . Blog : Na sua conta da HubSpot, acesse Conteúdo > Blog . Central de conhecimento : Na sua conta da HubSpot, acesse Conteúdo > Central de Conhecimento . E-mail : Na sua conta da HubSpot, navegue até Marketing > E-mail . Passe o mouse sobre o conteúdo ao qual você deseja adicionar um link de documento e clique em Editar . No editor de rich text, realce o texto que você gostaria de vincular ao seu documento e clique no ícone do link link na barra de ferramentas rich text. Clique no menu suspenso Link to e selecione File . Clique em Selecionar um arquivo . No painel direito, localize o documento na ferramenta arquivos. Se você precisar carregar um novo arquivo, clique em Carregar arquivos . Clique no nome do arquivo. Na parte inferior esquerda, clique em Inserir. No canto superior direito, clique em Publicar , Atualizar ou em Agir quando terminar de editar seu conteúdo. Email Blog Documents Knowledge Base",https://knowledge.hubspot.com/pt/website-and-landing-pages/attach-a-document-to-content
671,Adicionar designs do Adobe Express ao conteúdo do HubSpot,"Use a integração do Adobe Express para criar gráficos e, em seguida, insira essas imagens no HubSpot ao criar um post social, anúncio, página ou e-mail. Você também pode usar o Adobe Express para atualizar imagens no conteúdo ou em arquivos de imagem na ferramenta de arquivos. Ao criar seu gráfico, você também pode editar imagens geradas por AI ou arquivos de imagem que foram carregados. Por exemplo, você pode cortar e editar a imagem, remover o plano de fundo e muito mais. Para saber mais sobre os princípios básicos do uso do Adobe Express, confira o guia Conheça o Adobe Express . Observação: para usar o Adobe Express com seu conteúdo do HubSpot, os cookies de terceiros não devem estar bloqueados no navegador. Você precisará ativar os cookies ou adicionar uma exceção para o HubSpot . Criar um novo design Para usar o Adobe Express para criar um novo design para o conteúdo do HubSpot: No editor de conteúdo do HubSpot, comece adicionando uma imagem ao seu post social, anúncio, página ou e-mail: Ao criar uma página , post de blog ou e-mail usando o editor de e-mail clássico , clique no ícone de imagem insertImage na parte superior do editor. Ao criar um e-mail usando o editor de arrastar e soltar , clique e arraste um elemento de imagem na guia Conteúdo no painel esquerdo ao editor de e-mail. Em seguida, clique em Selecionar imagem : Ao criar um post social , clique no ícone de imagem insertImage na parte inferior do compositor de post. Ao criar um anúncio de leads do Facebook ou anúncio de geração de leads do LinkedIn , clique em Selecionar imagem/vídeo na guia Anúncio do editor de anúncios. No painel direito, clique no ícone Carregar e selecione Criar com o Adobe Express . Se essa é a primeira vez que você usa o Adobe Express no HubSpot, você será solicitado a fazer login na sua conta do Adobe Express ou a configurar uma nova conta. Crie sua imagem no editor do Adobe Express. Ao criar seu design, alguns recursos podem exigir uma assinatura premium do Adobe Express . Esses recursos serão marcados com um ícone premium. Para salvar seu design no gerenciador de arquivos, no canto superior direito, clique em Salvar . Na caixa de diálogo, clique no menu suspenso Formato de arquivo e selecione um formato de arquivo . Você pode salvar seu design no formato png, jpg ou pdf. No painel direito, selecione sua nova imagem . Seu design do Adobe Express será inserido no seu conteúdo do HubSpot. Atualizar uma imagem existente Para usar o Adobe Express para atualizar uma imagem carregada existente ou uma imagem gerada por IA para o conteúdo do HubSpot: Para atualizar uma imagem existente no conteúdo: No editor de conteúdo do HubSpot, comece adicionando uma imagem ao seu post social, anúncio, página ou e-mail: Ao criar uma página , post de blog ou e-mail usando o editor de e-mail clássico , clique no ícone de imagem insertImage na parte superior do editor. Ao criar um e-mail usando o editor de arrastar e soltar , clique e arraste um elemento de imagem na guia Conteúdo no painel esquerdo ao editor de e-mail. Em seguida, clique em Selecionar imagem : Ao criar um post social , clique no ícone de imagem insertImage na parte inferior do compositor de post. Ao criar um anúncio de leads do Facebook ou anúncio de geração de leads do LinkedIn , clique em Selecionar imagem/vídeo na guia Anúncio do editor de anúncios. No painel direito, passe o mouse sobre a imagem e clique em Detalhes . Clique em Clonar e editar e selecione Editar com o Adobe Express . Para atualizar uma imagem existente na ferramenta de arquivos: Na sua conta HubSpot, acesse Biblioteca > Arquivos . Localize o arquivo que deseja compartilhar e clique no nome do arquivo. No painel direito, clique em Clonar e editar . Em seguida, selecione Editar com o Adobe Express . Se essa é a primeira vez que você usa o Adobe Express no HubSpot, você será solicitado a fazer login na sua conta do Adobe Express ou a configurar uma nova conta. Edite sua imagem no editor do Adobe Express. Ao criar seu design, alguns recursos podem exigir uma assinatura premium do Adobe Express . Esses recursos serão marcados com um ícone premium. Para salvar seu design no gerenciador de arquivos, no canto superior direito, clique em Salvar . Na caixa de diálogo, clique no menu suspenso Formato de arquivo e selecione um formato de arquivo . Você pode salvar seu design no formato png, jpg ou pdf. O arquivo editado será salvo como um novo arquivo de imagem. No painel direito, na parte inferior, clique em Selecionar para usar a imagem editada. Files",https://knowledge.hubspot.com/pt/files/add-adobe-express-designs-to-your-hubspot-content
672,Use a HubSpot Academy no app para dispositivos móveis da HubSpot,"Pode aceder a HubSpot Academy a partir da aplicação móvel da HubSpot e concluir a formação em movimento. Você também pode verificar o status das certificações da sua equipe e visualizar, baixar ou compartilhar suas certificações. Saiba mais sobre a HubSpot Academy Concluir um certificado, curso ou aula Abra o aplicativo HubSpot no dispositivo. Na parte inferior, toque em Menu . No painel esquerdo, toque em Ajuda . Depois, toque em HubSpot Academy . Na secção Em curso , reveja alguns cursos que iniciou ou toque em Ver tudo para rever todas as formações que iniciou. Na seção Recomendado para você , revise o treinamento recomendado. Na secção Popular [topic] Certifications , reveja e filtre todas as formações. Role para a direita e esquerda para ver todos os treinamentos. Toque no curso que pretende iniciar ou continuar. Verifique o status do seu certificado, curso ou aula Abra o aplicativo HubSpot no dispositivo. Na parte inferior, toque em Menu . No painel esquerdo, toque em Ajuda . Depois, toque em HubSpot Academy . Na parte superior do painel da Academia, toque em HubSpot Academy > Meu aprendizado . Para filtrar a sua formação por estado de conclusão, no canto superior esquerdo, toque no menu pendente . De seguida, toque em Em curso ou Concluído . Para filtrar mais a sua formação, no canto superior direito, toque em Filter . Para filtrar a sua formação por tipo de prémio, como cursos de certificação, toque em Tipo de prémio . Em seguida, toque nas caixas de verificação junto aos tipos que pretende incluir. Para filtrar a sua formação por tipo de conteúdo, como lições ou modelos, toque em Tipo de conteúdo . Em seguida, toque nas caixas de verificação junto aos tipos que pretende incluir. Para ordenar a sua formação, toque em Ordenar por . Em seguida, seleccione a caixa de verificação junto ao método que pretende ordenar. Se for selecionada mais do que uma caixa de verificação, os materiais de formação podem não ser ordenados corretamente. Para limpar todos os filtros, no canto superior direito, toque em Limpar tudo . Depois de selecionar os filtros e o método de ordenação, no canto superior direito, toque em Aplicar . Verificar o status das certificações de um usuário Abra o aplicativo HubSpot no dispositivo. Na parte inferior, toque em Menu . No painel esquerdo, toque em Ajuda . Depois, toque em HubSpot Academy . No topo do painel da Academy, toque no menu suspenso HubSpot Academy . Toque em Minha equipe . Cada usuário terá todas as certificações disponíveis ao lado do nome com o status. Saiba mais sobre cada estado. Exibir, compartilhar ou baixar suas certificações Abra o aplicativo HubSpot no dispositivo. Na parte inferior, toque em Menu . No painel esquerdo, toque em Ajuda . Depois, toque em HubSpot Academy . Na parte superior do painel da Academia, toque em menu suspenso da HubSpot Academy > Meu aprendizado . No canto superior esquerdo, toque no menu pendente . De seguida, toque em Concluído . No canto superior direito, toque em Filter . Toque em Tipo de prémio . Em seguida, seleccione a caixa de verificação à esquerda de Mostrar apenas cursos de certificado. No canto superior direito, toque em Aplicar . Para ver uma certificação, clique em Ver certificação . Na janela pop-up, visualize sua pontuação para a certificação. Pode selecionar uma opção para partilhar, descarregar ou incorporar o seu emblema de certificação: Para compartilhar sua certificação em uma rede social ou como um link, clique em Compartilhar sua conquista . Ativar o botão para consentir a partilha de informações pessoais através da partilha da realização Para descarregar ou imprimir o seu certificado, clique em Baixe o certificado . Para incorporar o emblema no seu site, ative o botão para consentir o compartilhamento de informações pessoais, em seguida, clique em Copiar para copiar o código incorporado. Para adicionar o certificado ao seu perfil do Upwork, siga as etapas na seção Upwork . Esta opção aparecerá apenas nas certificações qualificadas. Saiba mais sobre adicionar a sua certificação ao seu perfil Upwork . Help & Resources",https://knowledge.hubspot.com/pt/help-and-resources/use-the-hubspot-academy-in-the-hubspot-mobile-app
