id,titulo,conteudo,link
2181,Limitar logons a endereços IP confiáveis,"Os superadministradores podem limitar o acesso da conta HubSpot a endereços IP confiáveis. Isso permite que você bloqueie logons de VPNs ou de fora da rede e restrinja o acesso não autorizado de computadores pessoais ou públicos e de redes WiFi não seguras. Todos os atores inválidos que estiverem fazendo login de fora do intervalo de IPs permitidos serão bloqueados, mesmo que tenham credenciais de login adequadas. Saiba mais sobre como o HubSpot ajuda você a proteger sua conta . Limitar logons a endereços IP confiáveis Se esta for a primeira vez que você configura suas configurações de login, aprenda como usar o assistente de configurações de login para restringir quais métodos de login os usuários podem usar para acessar a conta. Para limitar os logons a endereços IP confiáveis: Na sua conta HubSpot, clique no ícone de configurações settings icon na barra de navegação superior. No menu da barra lateral esquerda, em Gerenciamento de conta , clique em Segurança . Na parte superior, clique na guia Configurações & Atividade guia. Na seção Limit Logins to Allowed IPs (Limitar logons a IPs permitidos) , clique para ativar a opção Limit Logins to Allowed IPs (Limitar logons a IPs permitidos) . A caixa de texto Endereços IP permitidos será exibida. Digite os endereços IP na caixa de texto, usando vírgulas para separar endereços IP diferentes, ou traços para representar um intervalo de endereços IP. Para isentar certos usuários de logons limitados em IPs permitidos, clique no menu suspenso Isentar usuários e marque as caixas de seleção ao lado dos usuários que você deseja isentar. No canto inferior esquerdo, clique em Salvar . Mais recursos Para obter mais informações sobre a segurança da conta da HubSpot, confira os recursos abaixo: Saiba mais sobre as práticas de segurança do HubSpot . Saiba mais sobre como manter seus dados online seguros , no HubSpot e em outras plataformas. Account Security",https://knowledge.hubspot.com/pt/account-security/limit-logins-to-trusted-ip-addresses
2182,Associado páginas de sítios Web externos a uma campanha,"Se o seu site não estiver alojado no HubSpot, pode ainda adicionar páginas de site externas a uma campanha a partir da página de detalhes da campanha . Também é possível adicionar páginas de sítios Web externos como um passo da campanha num modelo de campanha. Em seguida, pode gerir e apresentar relatórios sobre a campanha com os activos da HubSpot e as suas páginas externas. Depois de associar a página do seu sítio Web externo a uma campanha, os contactos que visualizaram a página do sítio Web externo serão atribuídos à campanha como um contacto influenciado. Associar páginas de sítios Web externos a uma campanha Antes de associar as páginas externas do seu site, é altamente recomendável instalar o Código de rastreamento da HubSpot na página externa para rastrear análises. Para associar uma página de um sítio Web externo a uma campanha: Na sua conta da HubSpot, navegue até Marketing > Campanhas . Clique em uma campanha . No canto superior esquerdo, clique em Adicionar ativos . No menu da barra lateral esquerda, clicar em Páginas externas do sítio Web . No canto superior direito, clique em Adicionar à fila de tarefas uma página de um sítio Web externo . No campo Website URL , introduza o URL do seu sítio Web . Em seguida, clicar em Salvar ou Salvar e adicionar outro . A página do sítio Web externo será automaticamente selecionada e adicionada à campanha. Saiba mais sobre a gestão dos activos da sua campanha . Depois de criar a página do sítio Web externo, na caixa de diálogo Adicionar activos : Para editar o URL da página do sítio Web externo, passe o rato sobre a página e clique em Editar . No painel direito, actualize o URL do sítio Web e, em seguida, clique em Editar . Quaisquer actualizações feitas ao URL afectarão todas as campanhas associadas. Para eliminar a página do sítio Web externo, passe o rato sobre a página e clique em Eliminar . Esta ação elimina permanentemente a página do sítio Web externo de todas as campanhas associadas. Depois de criar ou editar os activos da página do seu site externo: Para fechar a caixa de diálogo, clique em X no canto superior direito. Para adicionar outra página de um sítio Web externo existente à campanha, seleccione a caixa de seleção junto à página e, em seguida, clique em Salvar . Cada página de um sítio Web externo pode ser associada a várias campanhas. Observe: quando clonar uma campanha , quaisquer activos de páginas de sítios Web externos existentes serão também associados com a campanha clonada. Ao rever o ativo da página do site externo, o ativo apresentará uma mensagem Este URL faz parte da campanha [número de campanhas] . Rever o desempenho das páginas externas do seu sítio Web Ao analisar o desempenho das páginas externas do seu sítio Web: Para rastrear as análises das suas páginas externas na ferramenta de campanhas, o seu Código de rastreamento da HubSpot deve ser instalado na página externa. A métrica page views incluirá dados históricos anteriores à associação com a campanha. Esta métrica está não ligada à data e hora em que a página do sítio Web externo foi associada à campanha. Para aplicar intervalos de datas específicos aos seus dados, pode utilizar o filtro Intervalo de datas na parte superior do separador Desempenho . Geralmente, a métrica de Exibições de páginas da campanha e o Google Analytics, ou qualquer outro sistema que não seja o HubSpot, não corresponderão exatamente. Saiba mais sobre as possíveis razões para esta discrepância . Saiba como analisar campanhas individuais em o separador Desempenho da campanha . Também pode rever métricas adicionais para páginas de sítios Web externos na ferramenta de análise de tráfego . Campaigns",https://knowledge.hubspot.com/pt/campaigns/associate-external-pages-campaigns
2183,Adicionar comentários a um fluxo de trabalho,"Adicione comentários ao seu fluxo de trabalho e acções de fluxo de trabalho para colaborar com a sua equipa e pedir feedback. Os comentários podem ser adicionados a todas as ações de fluxo de trabalho, incluindo ramificações se/então. Você pode editar ou excluir um comentário após adicioná-lo. Por exemplo, pode comentar sobre um atraso para pedir a um colega que confirme o calendário de um fluxo de trabalho. Adicionar um comentário a uma acção de fluxo de trabalho Para acrescentar um comentário a uma acção num fluxo de trabalho: Na sua conta HubSpot, acesse Automações > Fluxos de trabalho . Clique no nome do fluxo de trabalho. Passe o cursor do mouse sobre a ação na qual deseja comentar. Na parte inferior direita da acção, clicar no ícone de comentários . No campo de comentários , digite seu comentário. Utilize a barra de ferramentas de texto rico para formatar o seu texto. Para notificar um colega de equipa do seu comentário, escreva o símbolo @ , depois introduza o nome do utilizador . Para salvar o comentário, clique em Salvar ou pressione enter . Assim que um comentário for adicionado a uma ação, o ícone de comentário será exibido para que os outros saibam que a ação foi comentada. Os comentários sobre acções de fluxo de trabalho não aparecerão na barra lateral de colaboração, aparecerão apenas na própria acção. Para editar ou apagar o seu comentário, clique no ícone comments CCComment , depois clique em Actions e seleccione Edit or Delete . Só pode editar ou apagar os seus próprios comentários. Adicionar comentários com a barra lateral de colaboração ""arrastar e largar"" Utilize a versão arrastar e largar da barra lateral de colaboração na sua ferramenta de fluxos de trabalho para adicionar comentários e trabalhar com a sua equipa. Saiba mais sobre como adicionar comentários aos seus bens HubSpot . Utilizar a barra lateral de colaboração de arrastar e largar: Na sua conta HubSpot, acesse Automações > Fluxos de trabalho . Clique no nome do fluxo de trabalho. Clique e arraste a barra lateral de colaboração para a reposicionar. Para comentar a barra lateral de colaboração, clique no ícone de comentário de comentários . Por defeito, o modo de comentários será activado. Neste modo, pode adicionar comentários às suas acções de fluxo de trabalho . Para sair do modo de comentários, no canto superior direito, clicar no ícone X . Para voltar a entrar no modo de comentários, no painel direito, clicar em Modo de comentários . Para esconder os seus comentários, clique em Mais > Esconder comentários no ecrã . Isto irá ocultar comentários sobre acções de fluxo de trabalho. Para acrescentar um comentário geral No campo de comentários , digite seu comentário. Utilize a barra de ferramentas de texto rico para formatar o seu texto. Para notificar um colega de equipa do seu comentário, escreva o símbolo @, depois introduza o nome do utilizador. Para guardar o seu comentário, clique Comentar . Para editar ou apagar um comentário: Passe o cursor sobre o comentário que pretende editar ou apagar. No canto superior direito do comentário, clicar em Acções e seleccionar Editar ou Eliminar . Você somente pode editar ou excluir seus próprios comentários. Para sair da barra lateral de colaboração por arrastar e largar, na parte superior do painel direito, clique no ícone X . Workflows",https://knowledge.hubspot.com/pt/workflows/add-comments-to-a-workflow
2184,Impostos indiretos do Canadá | Perguntas frequentes,"Observação: este artigo foi preparado apenas para fins informativos. Ele não se destina a fornecer e não deve ser considerado como aconselhamento fiscal. Em caso de dúvidas, você deve consultar seus próprios consultores tributários e/ou jurídicos. Se você for cliente da HubSpot no Canadá, saiba como a HubSpot lida com impostos indiretos por província e território, e como você pode atualizar o HubSpot com suas informações fiscais. Quais impostos indiretos a HubSpot coleta de clientes do Canadá? Dependendo da sua província ou território, a HubSpot pode precisar coletar imposto sobre os produtos e serviços (GST), imposto harmonizado sobre vendas (HST), imposto sobre vendas provinciais (PST) ou imposto sobre vendas em Quebec (QST). Imposto sobre bens e serviços: a partir de 1 de julho de 2021 , o HubSpot começou a cobrar GST. Esse imposto geralmente se aplica a produtos e/ou serviços vendidos e fornecidos no Canadá. Isso inclui propriedades pessoais intangíveis, como marcas registradas, direitos de uso de uma patente e produtos digitalizados. O GST é um imposto separado e adicional ao imposto sobre vendas de nível provincial (PST), aplicado a maioria dos produtos e serviços que são comprados e vendidos para uso ou consumo no Canadá. Geralmente, o GST é faturado pelo fornecedor de produtos ou serviços, coletado do cliente e reenviado para as autoridades fiscais. Saiba mais sobre o GST . Imposto sobre Vendas Harmonizado: a partir de 1 de Julho de 2021 , o HubSpot começou a cobrar HST. Esse imposto inclui o GST federal e qualquer imposto sobre vendas provinciais adicional que tenha sido combinado com o GST federal. O HST se aplica apenas às províncias participantes no Canadá. Geralmente, o HST se aplica à mesma base de propriedade (ou seja, tangível e intangível) e serviços que o GST, no entanto, a uma taxa diferente. A taxa do HST pode variar de uma província participante para outra. Saiba mais sobre a HST . Imposto sobre vendas provinciais: a partir de 1º de julho de 2021 , a HubSpot começará a cobrar o PST. Esse imposto geralmente é devido quando produtos e/ou serviços são vendidos e fornecidos em British Columbia e Saskatchewan. O PST é um imposto separado e adicional ao GST. Geralmente, o PST é faturado pelo fornecedor de produtos ou serviços, coletado do cliente e reenviado para as autoridades fiscais. O PST aplicado pela Colúmbia Britânica e Saskatchewan não é um imposto recuperável. Mais informações sobre o PST para British Columbia e Saskatchewan . Quebec Imposto sobre Vendas: a partir de 1 de julho de 2021 , HubSpot começou a cobrar QST. Esse imposto geralmente se aplica a produtos e/ou serviços vendidos e fornecidos em Quebec. Isso inclui propriedades pessoais intangíveis, como marcas registradas, direitos de uso de uma patente e produtos digitalizados. O QST é um imposto separado e adicional ao imposto sobre produtos e serviços (GST), aplicado a maioria dos produtos e serviços que são comprados e vendidos para uso ou consumo em Quebec. Geralmente, o QST é faturado pelo fornecedor de produtos ou serviços, coletado do cliente e reenviado para as autoridades fiscais. Saiba mais sobre o QST . O GST/HST e o QST são impostos a restituir, aplicados pelo Canadá. Os inscritos no GST/HST e QST geralmente podem reivindicar um crédito fiscal a montante (ITC) sobre os impostos incorridos no curso de uma atividade comercial. Ou seja, o GST/HST e QST geralmente não são um custo líquido para empresas registradas. Para obter mais detalhes sobre a capacidade de recuperação do GST/HST e QST cobrado pelo HubSpot, fale com o seu consultor tributário. Quem é responsável pelo pagamento do GST/HST/PST/QST no Canadá? A HubSpot coletará impostos indiretos de todos os clientes cujo endereço de envio esteja localizado no Canadá. Saiba como verificar qual é o endereço principal da sua empresa definido no HubSpot . Algumas isenções podem ser aplicáveis, como a venda para indivíduos ou grupos do First National. Não há isenções disponíveis de impostos indiretos aplicáveis a instituições de caridade. No entanto, dependendo de seu status, as instituições de caridade podem pedir ao governo a restituição de uma parte do GST/ HST pago sobre suas despesas. Algumas isenções para PST podem ser aplicáveis, como a venda para revenda. Nota: Se tiver adquirido a HubSpot antes de 1 de julho de 2021 e atualizar a sua conta após essa data, ser-lhe-á cobrado um imposto sobre o montante proporcional. Por exemplo, se adquiriu uma subscrição Sales Starter de um ano a 1 de junho de 2021 e comprou um lugar adicional Sales Starter a 1 de novembro de 2021, ser-lhe-á cobrado imposto tanto para o Sales Starter como para o lugar adicional de 1 de novembro de 2021 a 31 de maio de 2022. Por que há uma cobrança do GST/HST/PST/QST na minha fatura da HubSpot? A HubSpot é obrigada a coletar e enviar o GST/HST/PST/QST para clientes que estão localizados no Canadá. E se eu tiver uma isenção de GST/HST/PST/QST e esquecer de fornecê-la? Geralmente, o GST/HST/PST/QST será aplicado a todas as faturas em que a isenção não tenha sido fornecida em tempo hábil. Se puder apresentar uma isenção válida que abranja o período de serviço, envie os documentos comprovativos adequados para billing@hubspot.com . Os prazos para fornecer a documentação de comprovação são os seguintes: Isenções do GST/HST/QST: envie suas informações em até 30 dias a partir da data de emissão da fatura. Isenções do PST: envie sua ID do PST ou certificado de isenção dentro de 180 dias (British Columbia) ou 30 dias (Saskatchewan) da data de emissão da fatura. Quais são os números da conta canadense de impostos indiretos da HubSpot? GST/HST: 793763004RT0001 QST: 1228655623 TQ 001 BC PST: PST-1458-1309 Como cliente, tenho alguma obrigação de GST/HST ou QST? Não. Se você deseja reivindicar um crédito fiscal a montante para o GST/HST pago à HubSpot, certifique-se de manter uma cópia da fatura da HubSpot para seus registros. Por que a seção ID do PST está em branco na minha fatura? A seção ID do PST terá um valor somente se você for um cliente isento de imposto. Se você não for um cliente isente de imposto, você não precisa fornecer a HubSpot com uma ID do PST e você pode desconsiderar essa seção. billing",https://knowledge.hubspot.com/pt/account/canadian-indirect-taxes-faq
2185,Manage reports in your reports list,"You can create new reports and manage any existing reports you have in your account using your reports list. If you want to analyze your dashboard reports instead, learn how to filter reports on your dashboard and how to filter your dashboard . Filter the reports list In your HubSpot account, navigate to Reporting > Reports . Reports are grouped by different statuses. To filter your reports by status, select one of the following characteristics in the left sidebar. My reports: displays all reports. Marketing (BETA) Advanced reporting > Attribution (BETA) Channel performance Ads Forms Web traffic analysis Sources Pages UTM Parameters Device type Countries Browsers CRM insights > Contacts Sales Coach reps & teams Call outcomes Chats Completed activies Deal created Lead funnel Lead response time Meeting outcomes Prospecting activities Tasks completed Team activity timeline Time spent in deal stage Forecasts & pipelines Deal change history Deal funnel Deal pipeline waterfall Deal push rate Forecast category Historical snapshots Quota attainment Weighted forecast category Weighted pipeline forcast Sales outcomes Average deal size Deal loss reasons Deal revenue by source Deal velocity Deals won & lost Revenue (BETA) Sales velocity Service Customer satisfaction > Customer satisfaction score (CSAT) Team performance Average time to close ticket Chat wait time Support volume Time in ticket pipeline status Manage existing reports Manage your reports by cloning, deleting, favoriting, and more. In your HubSpot account, navigate to Reporting > Reports . Click My reports to view all your reports. To filter your reports further, click Custom reports or Favorites Custom reports: displays only custom reports . Favorites: displays only your favorited reports. To filter your reports by dashboard, owner, last updated, or business unit, click the filter dropdown menus. To manage an individual report, hover over the report , then click the Actions dropdown menu and select one of the following: Customize: edit the report using the report builder . This is only available for subscriptions with custom reports , and is also not available for certain reports (e.g., Top Emails , Top Documents ). Rename: give the report a new name. Clone: make a copy of the report. Export: export the report as a CSV, CLS, or SLSX file. Share to Slack: if you've integrated Slack with your HubSpot account, send a link to the report to the selected Slack channel along with an optional message. Manage access: set which users can access the report. This can only be edited on reports that are not on dashboards. Learn more about managing report access below. Change owner: reassign a report to a different owner. Set business unit: assign the report to a specific business unit. Available with the Business Units add-on . Add to dashboard: add the report to a dashboard. Because dashboards have their own level of access, adding a report to a dashboard may change who has access to it. Delete: delete the report from your reports list and any dashboard it's been added to. To restore a deleted report, in the top right of your dashboard, click the Actions dropdown and select Restore deleted reports . Reports must be restored within 14 days of deletion. To manage reports in bulk, select the checkboxes next to the reports, then select an action from the header row: Delete: delete the selected reports from your report list and any dashboards they've been added to. Change Owner: reassign the selected reports to a different owner. Manage Access: set which users can access the selected reports. Learn more about managing report access below. Add to dashboard: add the selected reports to a dashboard. Because dashboards have their own level of access, adding reports to a dashboard may change who can access them. Set business unit: assign the selected reports to a business unit. Available with the Business Units add-on . To favorite a report, click the favorite star icon next to the report in your reports list. The report will then be added to the Favorite Reports category in the left sidebar menu. You can add up to 10 favorite reports. Manage report access Reports that are added to your dashboards will be controlled by the dashboard's access settings. For reports that haven't been added to a dashboard, you can manage its access. Please note: Super Admins and users with the Reports and dashboards permission can view all assets, including private assets. In your HubSpot account, navigate to Reporting > Reports . To change a report's owner, hover over the report , click the Actions dropdown menu, and select Change owner . To manage access to a report that has not been added to a dashboard, hover over the report , click the Actions dropdown menu, and select Manage access . In the right panel, select one of the following options and click Save : Private to owner: allow only the report owner and admins to view and edit the report. Everyone: allow all users in your HubSpot account to view the report. Select View and edit to allow all users to view and edit the report. Select View only to allow all users to view, but not edit, the report. Only specific users and teams ( Enterprise only): allow specific users and teams in your HubSpot account to view the report. Select View and edit to allow specific users to view and edit the report. Click Next in the bottom right and select the users and teams that will have view and edit access to the report. Select View only to allow specific users to view, but not edit, the report. Click Next in the bottom right and select the users and teams that will have view access to the report. Create a new report To create a standard report from the reports library, click Create report in the upper right. Learn how to search and save reports from the reports library . To create a new custom report , click Create custom report in the upper right. Available for Professional and Enterprise . Reports",https://knowledge.hubspot.com/reports/manage-reports-in-your-reports-list
2186,Analyze blog subscription email performance,"You can see previews and performance data for any previous version of a blog subscription email within the email tool. You can also see when blog subscription emails weren't sent due to a lack of new content. In your HubSpot account, navigate to Marketing > Email . To filter for blog subscription emails, click the Type dropdown and select Blog . Click the name of your blog subscription email. On the email details page, the Blog history section will display each past send of your blog subscription email. To filter the emails shown, click the Time range fields and select a date range . To hide emails that weren't sent due to a lack of new content, clear the Show skipped emails checkbox. To change the data shown for each email, click Manage columns. In the dialog box, select the checkbox next to each column option you want to display. Click Save to save your changes and return to the email details page. To view the preview of a past send, click the thumbnail preview of the email. To view the performance details of a past send, click the name of the email. Email Blog",https://knowledge.hubspot.com/blog/analyze-blog-subscription-email-performance
