id,titulo,conteudo,link
2401,Criar artigos da Central de Conhecimento em vários idiomas,"No HubSpot, você pode criar artigos da base de conhecimento em vários idiomas e organizá-los em grupos multilíngues. Saiba mais sobre como trabalhar com conteúdo multilíngue em blogs e páginas . Observe que em contas sem um profissional ou um profissional da Content hub , os artigos da base de conhecimento multilíngue estão limitados a 3 variações por artigo. Ative artigos multilíngues nas configurações da sua base de conhecimento Na sua conta HubSpot, clique no ícone de configurações settings icon na barra de navegação superior. No menu da barra lateral esquerda, navegue até Contente > Base de conhecimento . Na parte superior da página, clique no segundo menu suspenso e, em seguida, clique em Adicionar/editar variações multilíngues. Em contas com o complemento de unidades de negócios , este será o terceiro menu suspenso. No painel direito, clique em Adicionar variação multilíngue e selecione um idioma . Repita esta etapa para todos os idiomas adicionais. Para excluir um idioma, clique no botão delete ícone excluir ao lado desse idioma. Para alterar o idioma principal do seu central de conhecimento, clique no menu suspenso Principal e selecione um idioma . Clique no X no canto superior direito para retornar às configurações de central de conhecimento. Traduza seu modelo e categorias de base de conhecimento Antes de criar uma variação multilíngue de um artigo da base de conhecimento, é recomendável traduzir o modelo e as categorias da base de conhecimento. Isso ajudará os visitantes a navegar em sua base de conhecimento traduzida. Traduza seu modelo Na sua conta da HubSpot, acesse Conteúdo > Central de Conhecimento . No canto superior direito, clique em Personalizar modelo . No editor de conteúdo, clique em Editar no Multi Idiomas seção do editor da barra lateral. No canto superior esquerdo, clique em [X] de [X] ao lado de Filtrar idiomas . Desmarque a caixa de seleção ao lado de qualquer idioma que você não deseja exibir e clique em Aplicar . Personalize seu modelo de base de conhecimento . Você poderá adicionar uma tradução a cada seção do modelo para cada um dos idiomas da sua base de conhecimento. Quando terminar de adicionar suas traduções, clique em Publicar tradução no canto superior direito. No canto superior direito, clique em Atualizar modelo . Traduzir suas categorias Na sua conta da HubSpot, acesse Conteúdo > Central de Conhecimento . No canto superior direito, clique em Organizar categorias . Na parte superior, clique no filtro de idioma e selecione um linguagem . A Precisa de tradução o rótulo aparecerá em qualquer categoria que atualmente não tenha uma tradução nesse idioma. No editor da barra lateral esquerda, selecione um categoria , então clique Editar no canto superior direito. Introduzir um C nome da categoria , Descrição da categoria , e Nome da subcategoria (se aplicável) para cada idioma. No canto superior direito, clique em Publicar . Aprender mais sobre organizando e gerenciando suas categorias de base de conhecimento . Crie uma variação multilíngue de um artigo da base de conhecimento Quando as configurações, o modelo e as categorias da base de conhecimento forem configurados e traduzidos, você poderá criar variações em vários idiomas de seus artigos existentes. Na sua conta da HubSpot, acesse Conteúdo > Central de Conhecimento . No canto superior esquerdo, clique no Artigos aba. Passe o mouse sobre um artigo e clique no Mais menu suspenso e selecione Crie variação multilíngue . Na caixa de diálogo, clique no Linguagem de variação menu suspenso e selecione um linguagem ou clique em Adicione um idioma nas configurações para adicionar um novo idioma. Clique em Salvar . No editor de artigos, adicione conteúdo traduzido para o idioma selecionado à nova variação em branco. Para alternar entre variações multilíngues, clique no botão Linguagem menu suspenso na parte superior da página e selecione um variação . Para editar o idioma desta página: Clique no Linguagem menu suspenso e clique em Editar idioma . Na caixa de diálogo, clique no Alterar idioma para menu suspenso e selecione um linguagem . Clique Salvar alterações . Isso atualizará automaticamente o slug de idioma no URL. Para transformar uma variação de idioma em um artigo separado: Clique no Linguagem menu suspenso e clique em Desconecte a variação do primário . Na caixa de diálogo, clique em desconectar . Para criar uma variação em um idioma adicional: Clique no Linguagem menu suspenso e clique em Crie variação multilíngue . Clique no Linguagem de variação menu suspenso e selecione um linguagem . Somente idiomas que já foram adicionado nas configurações da sua base de conhecimento vai aparecer. Para adicionar um novo idioma, clique em Adicionar idioma nas configurações . Quando sua tradução estiver concluída, clique em Publicar no canto superior direito para publicar o artigo traduzido. Adicionar um artigo existente a um grupo multilíngue Se você já criou artigos separados para traduções, poderá adicionar os artigos a um grupo multilíngue. Na sua conta da HubSpot, acesse Conteúdo > Central de Conhecimento . Clique nas caixas de seleção à esquerda dos artigos que deseja adicionar ao seu grupo. Na parte superior da tabela, clique em Adicionar ao grupo de idiomas . Na caixa de diálogo, clique no menu suspenso Selecionar um artigo de conhecimento principal e selecione um artigo . Clique em Salvar . Knowledge Base",https://knowledge.hubspot.com/pt/knowledge-base/create-knowledge-base-articles-in-multiple-languages
2402,Gerenciar propriedades da campanha,"Crie propriedades de campanha personalizadas para armazenar informações e gerenciar suas campanhas da maneira mais adequada para sua equipe. Você também pode usar as propriedades de campanha para organizar, agrupar e gerar relatórios sobre os dados da campanha . Observação: você deve ter permissões para Editar as configurações de propriedade para criar ou editar propriedades de campanha. Criar ou editar propriedades da campanha Para criar uma propriedade de campanha: Na sua conta HubSpot, clique no ícone de configurações settings icon na barra de navegação superior. No menu da barra lateral esquerda, vá para Propriedades . Clique no menu suspenso Selecionar um objeto e selecione Propriedades da campanha . Para criar uma propriedade, no canto superior direito, clique em Criar propriedade . Para editar uma propriedade existente, clique no nome de uma propriedade na tabela . No painel direito, configure os detalhes das propriedades da campanha: Agrupar: clique no menu suspenso e selecione Informações da campanha . Rótulo: insira um nome exclusivo para a propriedade. Este é o nome da propriedade que aparece no seu CRM da HubSpot, como na ferramenta de campanhas e nos relatórios. Nome interno : clique no code ícone de código para definir ou visualizar o nome interno da propriedade. Assim que a propriedade for criada, o nome interno não poderá ser editado. Descrição: insira um texto para descrever a propriedade. Isso não é necessário para criar uma propriedade. Depois de configurar os detalhes das propriedades da campanha, clique em Próximo . Para definir ou editar o tipo de campo da propriedade, clique no menu suspenso Tipo de campo , depois selecione um tipo de campo para a propriedade. Se você selecionou Várias caixas de seleção , Seleção suspensa ou Seleção de botões de opção , configure as opções de propriedades da campanha : Insira ou edite as diferentes opções para a propriedade: Rótulo: insira o nome da opção. O valor interno da opção é gerado automaticamente com base no rótulo. + Adicionar uma opção: clique para adicionar uma nova opção. Carregar opções: clique para carregar várias opções de uma só vez. Você pode selecionar um conjunto padrão de opções, como País e Fuso horário , colar um texto para criar opções em massa ou copiar as opções de uma propriedade existente. Limpar tudo: clique para remover todas as opções existentes. Para excluir as opções em massa: Marque as caixas de seleção ao lado das opções. No canto superior da tabela, clique em Excluir . Para reordenar as opções manualmente, clique e arraste a dragHandle alça . Para classificar as opções em ordem alfabética, clique no menu suspenso Classificar e selecione Alfabética . Depois de configurar o tipo de campo da sua campanha, clique em Criar . Usar propriedades de campanha ao criar uma campanha Depois de criar uma propriedade de campanha, você pode adicioná-la ao formulário de campanha para coletar informações quando os usuários criarem ou editarem uma campanha. Você também pode definir as propriedades como Obrigatórias para garantir que todas as informações necessárias sejam coletadas. Para usar uma propriedade de campanha ao criar uma campanha: Na sua conta da HubSpot, navegue até Marketing > Campanhas . No canto superior direito, clique em Criar Campanha > Começar do zero . No painel direito, clique em Editar este formulário . No painel esquerdo, marque as caixas de seleção ao lado das propriedades de campanha que deseja adicionar como um campo no formulário da campanha. No painel direito, reordene, defina uma propriedade de campanha conforme necessário ou exclua a propriedade do formulário da campanha: Para reordenar os campos de formulário, clique e arraste dragHandle a alça ao lado da propriedade. Para definir uma propriedade conforme necessário, clique na caixa de seleção Obrigatória . Se o campo não for preenchido, o usuário não poderá criar a campanha. Para remover uma propriedade do formulário, clique no delete ícone de exclusão . Gerenciar as propriedades de campanha na tabela de campanhas Você pode selecionar quais propriedades serão exibidas como colunas e filtrar ainda mais a tabela de campanhas usando essas propriedades . Depois, você pode salvar a tabela configurada como uma exibição e exportar os detalhes da campanha especificados . Saiba mais sobre como exibir e filtrar registros . Para exibir uma propriedade de campanha como uma coluna na tabela de campanhas: Na sua conta da HubSpot, navegue até Marketing > Campanhas . No canto superior direito, clique em Ações > Editar colunas . Na caixa de diálogo, marque as caixas de seleção ao lado das propriedades que deseja incluir na tabela. Para reordenar as colunas na tabela, clique e arraste dragHandle a alça ao lado da propriedade. Para remover todas as colunas exibidas, clique em Remover todas as colunas . Todas as colunas, exceto a coluna Nome da campanha , serão removidas. Para restaurar as colunas padrão, clique em Redefinir exibição padrão . Depois de configurar as colunas, clique em Salvar . Campaigns",https://knowledge.hubspot.com/pt/campaigns/campaign-properties
2403,Attach your content to a topic,"In the Optimize section of the content editor, you can attach a piece of content to a pillar page as a topic or subtopic . Linking your content to a pillar page helps establish its authority in search engine results . Learn more about the role of topics and subtopics in content strategy . Please note: creating topic clusters in HubSpot does not affect your website's SEO directly. Navigate to your content: Website Pages : In your HubSpot account, navigate to Content > Website Pages . Landing Pages : In your HubSpot account, navigate to Content > Landing Pages . Blog : In your HubSpot account, navigate to Content > Blog . Hover over a page or post, then click Edit . In the content editor, click the gauge Optimize icon in the left sidebar. Attach the content to a topic: To add an existing topic, click the Topic dropdown menu and select a topic for your page. To create a new topic, click the Topic dropdown menu and select Add core topic . In the dialog box, enter the topic , then click Save To attach the page to a subtopic keyword: Select the Is this supporting content? checkbox. To add an existing keyword, click the Subtopic keyword dropdown menu and select a subtopic keyword To create a new keyword, click the Subtopic keyword dropdown menu and click Add subtopic keyword . In the dialog box, enter the subtopic keyword , then click Save . SEO Landing Pages Blog Website Pages",https://knowledge.hubspot.com/seo/attach-your-content-to-a-topic
2404,Map Salesforce record types to HubSpot,"If your Salesforce organization uses record types for leads, contacts, accounts, and/or opportunities, you can map them to HubSpot as custom properties. This allows you to use the record type for segmentation in HubSpot. You can map Salesforce record types to HubSpot custom properties with one of two field types : single-line text and dropdown select. Map Salesforce record types to a custom HubSpot single-line text property (Beginner) Map Salesforce record types to a custom HubSpot dropdown select property (Advanced) Map Salesforce record types to a custom HubSpot single-line text property (Beginner) Please note: this method will only map the Record Type ID value to HubSpot, and not the Record Type Label value. If you want to map the Record Type Label value to HubSpot as well, map Salesforce record types to a HubSpot dropdown select custom property . In your HubSpot account, click the settings settings icon in the top navigation bar. In the left sidebar menu, navigate to Properties . To map Salesforce lead/contact record types, click the Contact properties tab. To map Salesforce account record types, click the Company properties tab. To map Salesforce opportunity record types, click the Deal properties tab. In the upper right, click Create a property . In the right panel, enter a Label for the custom HubSpot property. In the Field type dropdown menu, ensure Single-line text is selected. In the bottom left, click Create . Next, map this new custom property to Salesforce: In your HubSpot account, click the settings settings icon in the top navigation bar. In the left sidebar menu, navigate to Integrations > Connected Apps . Click Salesforce . Navigate to the Contacts , Companies , or Deals tabs In the Property Mappings section , click Add new field mapping . In the dialog box: Under What HubSpot property would you like to map? , select Choose Existing HubSpot Property . Click the Select a property dropdown menu and select the newly-created custom property . Under What Salesforce field would you like to map it to? , click the Select a field dropdown menu and select R ecord Type ID . Under W hen should HubSpot data update the corresponding Salesforce field? , select Use Salesforce value, I only want Salesforce data to update the HubSpot property . Click Save Mapping . After the mapping is created, resync existing HubSpot contacts to populate the custom property with the Salesforce record type data. If not, the custom property will only be updated the next time the record is updated in HubSpot or Salesforce. Map Salesforce record types to a custom HubSpot dropdown select property (Advanced) If you have a more advanced understanding of HubSpot and Salesforce, you can map a Salesforce record type to a custom HubSpot dropdown select property. This method allows the Salesforce Record Type Label value to be mapped along with the corresponding Salesforce Record Type ID value. In your HubSpot account, click the settings settings icon in the top navigation bar. In the left sidebar menu, navigate to Properties . To map Salesforce lead/contact record types, click the Select an object dropdown menu and select Contact properties . To map Salesforce account record types, click the Select an object dropdown menu and select Company properties . To map Salesforce opportunity record types, click the Select an object dropdown menu and select Deal properties . In the upper right, click Create a property . Enter a Property label , select a business unit (if using the business units add-on ), select a group , and enter a description for the custom HubSpot property. Click Field type in the left sidebar menu. Click the Field type dropdown menu and select Dropdown select . In the Label field, enter a Salesforce record type's Record Type Label value. Click + Add option and enter another Salesforce record type's Record Type Label value. Repeat this step for each record type. Enter the corresponding Salesforce Record Type ID value for each Record Type Label value in the Internal name field. Learn how to find the ID of a Salesforce record type . Click Rules in the left sidebar menu and clear the Show property in forms checkbox if you don't want the property to display in forms. Click Manage access in the left sidebar menu and customize the level of access users and teams have to the property. Click Preview in the left sidebar menu to see a preview of the custom property. In the top right, click Create . In the list of properties, click the name of the newly-created custom property. In the bottom left, click Save . Next, map this new custom property to Salesforce: In your HubSpot account, click the settings settings icon in the top navigation bar. In the left sidebar menu, navigate to Integrations > Connected Apps . Click Salesforce . Navigate to the Contacts , Companies , or Deals tabs In the Property Mappings section, click Add new field mapping . In the dialog box: Under What HubSpot property would you like to map? , select Choose Existing HubSpot Property . Click the Select a property dropdown menu and select the newly-created custom property . Under What Salesforce field would you like to map it to? , click the Select a field dropdown menu and select R ecord Type ID . Under W hen should HubSpot data update the corresponding Salesforce field? , select Use Salesforce value, I only want Salesforce data to update the HubSpot property . Click Save Mapping . After the mapping is created, resync existing HubSpot contacts to populate the custom property with the Salesforce record type data. If not, the custom property will only be updated the next time the record is updated in HubSpot or Salesforce. Please note: if new record types are added to Salesforce, the custom HubSpot property must be manually updated with the new Record Type Label and Record Type ID value pairs. Integrations",https://knowledge.hubspot.com/salesforce/how-do-i-map-salesforce-record-type-to-hubspot
2405,Create custom funnel reports (BETA),"Analyze conversion rates between stages with custom funnel reports. You can choose between lifecycle stages or deal pipelines. Please note: the following functionality is currently in beta. To access the beta a super admin in the account needs to navigate to the funnel builder and click Get early access to the new funnel builder in the bottom left. Learn more about opting into betas . Contacts, deals, or company funnel You can create a funnel report to view how contacts, companies, or deals are moving through lifecycle or deal stages over time. To create a contacts, deals, or company funnel report: In your HubSpot account, navigate to Reporting > Reports . In the top right, click Create report . Select Funnels . Select a data source: Contacts: measures how contacts are moving through their respective lifecycle stages. Companies: measures how companies are moving through their respective lifecycle stages. Deals: measures how deals are moving through their respective deal stages. In the left panel, click and drag Steps to the Stage [X] section. Hover over the stage to view a description. You can add up to fifteen stages that lead up to a goal or conversion point. To make a step optional, hover over the step, and select Mark stage as optional . A contact, company, or deal will not have to go through that specific stage in order to continue along the funnel report. If a contact, company, or deal makes it to the last stage, they will be included in the total conversion rate. The first and last stage cannot be made optional. When you have finished configuring your stage, in the top right, click Run report to display your data in the right panel. Use the filters at the top to filter your data: Contacts (Contacts data source): view all contacts or filter by contact lists and properties. Companies (Company data source): view all companies or filter by company lists and properties. Deals (Deals data source): view all deals or filter by deal lists and properties. Date range: the dates the activities occurred. Please note: the date range filter will filter data in the report by the date of the activity (touchpoints or events) not the date when the contact or deal was created. For example, if a funnel report has Stage 1: Discovery , Stage 2 : Closed won and the date range is l ast 90 days , a deal that was created 6 months ago would appear in the funnel report if it went through both of these stages in the past 90 days. Reports BETA",https://knowledge.hubspot.com/reports/create-new-custom-funnel-reports
