id,titulo,conteudo,link
2176,Criar e publicar posts nas redes sociais do LinkedIn,"Depois de usar o compositor de post social em tela cheia da HubSpot para redigir seu post, você pode personalizar ainda mais as publicações individuais do LinkedIn. Ao criar posts no LinkedIn, você também pode criar outros tipos de publicações, como documentos PDF ou enquetes do LinkedIn. Depois de publicar seu post de mídia, documento ou enquete do LinkedIn, você pode analisar o desempenho dele nos seus relatórios sociais . Para criar e publicar um post no LinkedIn: Na sua conta da HubSpot, navegue até Marketing > Social . No canto superior direito, clique em Criar post social . No painel esquerdo, na guia Rascunho , clique no menu suspenso Selecionar contas e selecione pelo menos uma conta do LinkedIn . Se uma conta padrão do LinkedIn já tiver sido definida, ela será selecionada automaticamente. Para selecionar todas as contas do LinkedIn conectadas, clique na caixa de verificação LinkedIn . Na parte superior, clique na guia LinkedIn . Na seção Tipo de post , selecione Mídia , Enquete ou Documento . Mídia: crie um post padrão no LinkedIn. Ao criar um post do LinkedIn, você pode escolher se deseja ou não adicionar mídia. Adicionar mídia: adicione imagens ou um vídeo ao seu post do LinkedIn. Isso é opcional. Enquete: crie uma enquete no LinkedIn para coletar ideias e opiniões. Ao criar uma enquete, personalize os seguintes detalhes: Sua pergunta: insira a pergunta para sua enquete. Opção: insira as opções para sua enquete. Para adicionar outra opção, clique em + Adicionar opção . Por padrão, a enquete deve ter no mínimo 2 e no máximo 4 opções. Duração da enquete: defina um período de tempo para sua enquete. Você pode selecionar 1 dia , 3 dias , 1 semana ou 2 semanas . Documento: crie um post de documento do LinkedIn para adicionar um documento PDF rolável ao seu post. Ao criar um post de documento, adicione o seu arquivo e personalize o título do documento: Adicionar documento: adicione um documento PDF. Ao adicionar um documento PDF utilizando a ferramenta de arquivos, apenas arquivos com visibilidade pública podem ser usados. Para alterar o documento, passe o mouse sobre ele e clique no ícone de arquivo file . Para remover o documento, passe o cursor sobre ele e clique no ícone excluir delete . Não é possível remover ou personalizar a imagem para um post de documento do LinkedIn. Por padrão, a primeira página do documento será exibida como a imagem do post. Título do documento: por padrão, o nome do arquivo será usado. Você pode editar ainda mais o título do seu documento. Para todos os tipos de post do LinkedIn, você precisará personalizar os outros detalhes do post: O que você deseja compartilhar com sua rede: na caixa de texto, introduza o conteúdo do seu post do LinkedIn. Você pode @mencionar páginas de empresa e perfis pessoais do LinkedIn no conteúdo do seu post. Para isso, o uso de dados de aplicativos de terceiros deve ser autorizado para o HubSpot. Ao mencionar perfis pessoais do LinkedIn, o usuário deve atender aos requisitos a seguir. Caso contrário, o perfil do usuário não aparecerá e não poderá ser mencionado. O usuário deve ter visibilidade de perfil público ativada. O usuário deve seguir a sua página do LinkedIn. O usuário deve ter um Nome , Sobrenome e Título . O idioma padrão do perfil do usuário deve ser definido como inglês . Opções de publicação: configure o horário de publicação; você pode escolher entre as seguintes opções: Publicar agora: publique o post do LinkedIn imediatamente. Agendar para mais tarde: selecione uma data e hora específicas para publicar o post social. Você também pode selecionar uma hora padrão da sua agenda de publicação social . Campanha: associe o post do LinkedIn a uma campanha. Você pode selecionar uma campanha existente ou criar uma nova campanha . Para excluir o post, no canto superior direito, clique no ícone excluir delete . Para duplicar o post para outra conta do LinkedIn, no canto superior direito, clique no ícone de adição add ao lado do nome da conta social. Depois de criar seu post do LinkedIn, na parte superior, clique na guia Revisar . Você pode revisar uma lista de visualização dos seus posts. Para revisar a aparência do post, no canto superior esquerdo, clique em Visualizar . Depois de personalizar seus posts do LinkedIn, no canto superior direito, clique em Publicar agora ou em Agendar . Como alternativa, continue editando os posts para outras redes sociais. Social",https://knowledge.hubspot.com/pt/social/create-and-publish-linkedin-posts
2177,Visão geral da autenticação de e-mail,"Para garantir que seus e-mails de marketing enviados por meio do HubSpot estejam em conformidade com os padrões de autenticação e as políticas de envio aplicadas pelos principais provedores de caixa de entrada de e-mail (por exemplo, Gmail e Yahoo Mail), conecte seu domínio de envio de e-mail ao HubSpot. O processo de conexão de domínio envolve a configuração de três tipos de registros DNS separados nas configurações do seu provedor de DNS: DKIM, SPF e DMARC. Este artigo fornece uma visão geral do que são esses registros e como funcionam os protocolos de autenticação associados a eles. Quando você estiver pronto para autenticar seu domínio de envio de e-mail, inicie o processo de configuração de DNS ou revise seu status de autenticação atual no HubSpot. Observação: seu gerente de conta ou membros de suporte da HubSpot podem ajudá-lo a entender as práticas recomendadas e como usar as ferramentas da HubSpot para configurar a autenticação, mas eles não podem tomar essas decisões por você, nem podem gerenciar suas configurações de DNS. Você terá que trabalhar com a sua equipe de TI ou com o seu administrador de e-mail para configurar a autenticação de e-mail. Você também pode entrar em contato com um terceiro que forneça serviços de consultoria ou de relatórios de DMARC para obter assistência adicional. Entender o impacto dos e-mails autenticados Impacto na sua conta da HubSpot Embora DKIM, SPF e DMARC não sejam estritamente obrigatórios para enviar e-mails por meio do HubSpot, você somente poderá enviar e-mails com seu domínio no endereço de origem (por exemplo, employee@example.com ) depois de conectar esse domínio ao HubSpot configurando o DKIM. Isso também aumentará a entregabilidade dos e-mails para esse domínio. Os domínios não conectados como um domínio de envio de e-mail na sua conta serão modificados para um domínio variável hospedado pela HubSpot. Saiba mais sobre e-mails não autenticados neste artigo . Impacto no desempenho do e-mail A maioria dos provedores de serviços de caixa de entrada prefere e-mails autenticados por DKIM. Os e-mails enviados sem autenticação DKIM têm maior probabilidade de serem rejeitados, colocados em quarentena ou classificados como spam. Os e-mails em quarentena aparecerão como entregues no HubSpot, mas não ficarão visíveis para a maioria dos destinatários; por isso, é altamente recomendado configurar o DKIM para melhorar a entregabilidade. Observação: alguns provedores de caixa de entrada, como o Google e o Yahoo , exigirão que o DMARC, o DKIM e o SPF sejam configurados em todos os domínios que enviam e-mails em massa para seus usuários. Se você não cumprir esses requisitos, os e-mails do seu domínio serão rejeitados. Essas rejeições serão classificadas como DMARC ou Política . Guia para DKIM O DKIM (DomainKeys Identified Mail) é um método de autenticação de e-mail destinado a evitar a falsificação de e-mail, que é uma técnica usada por agentes maliciosos para enviar e-mails com endereços de remetente falsificados. Para configurar o DKIM no HubSpot, você será orientado a configurar o DKIM usando dois registros CNAME no seu provedor de DNS. Depois de configurar seus registros DKIM no provedor de DNS usando uma chave pública fornecida pela HubSpot, um servidor de e-mail de recebimento (por exemplo, Gmail) poderá verificar a assinatura do e-mail enviado associado ao seu domínio. Saiba como adicionar estes registros seguindo as instruções deste artigo . Depois de adicionar esses registros DNS e eles serem verificados pela HubSpot e pelo seu provedor de DNS, a assinatura DKIM será incluída nos cabeçalhos dos e-mails enviados, de acordo com as entradas CNAME associadas que você configurou. Guia para SPF O SPF (Sender Policy Framework) é um padrão de autenticação de e-mail usado para verificar se o servidor de e-mail de envio está autorizado a enviar e-mails em nome de um domínio específico. O SPF é tradicionalmente necessário para o domínio do caminho de retorno do envelope, que é o endereço para o qual os e-mails rejeitados serão enviados. Isso já está configurado para e-mails de marketing enviados através de seus servidores compartilhados. Todos os clientes de IP dedicados são obrigados a configurar o SPF em seu domínio de caminho de retorno do envelope como parte de sua configuração inicial de IP. Também é altamente recomendado adicionar o registro SPF da HubSpot ao seu domínio de endereço de origem. Isso será configurado como um registro TXT no seu provedor de DNS, usando o valor fornecido nas configurações de domínio da HubSpot. Esse registro fornecerá uma lista atualizada regularmente de endereços IP que a HubSpot usará para enviar e-mails de marketing do seu domínio de endereço de origem. Você pode seguir este guia para adicionar a HubSpot ao seu registro SPF. Depois de adicionar o registro SPF e concluir o processo de verificação, quando um servidor de e-mail processar um dos seus e-mails enviados, ele poderá validar se a HubSpot está na lista de permissões de remetentes válidos do seu domínio. Guia para DMARC O DMARC (Domain-based Message Authentication, Reporting and Conformance) é um protocolo de autenticação de e-mail que protege ainda mais os proprietários de domínios de e-mail contra falsificação de e-mail e outros usos não autorizados de seus domínios. Ao configurar um registro DMARC, os provedores de caixa de entrada podem confirmar como processar os e-mails enviados do seu domínio que não passam nas verificações de SPF e DKIM. Um DMARC também oferece um mecanismo de relatório para os proprietários saberem com que frequência os servidores destinatários em todo o mundo recebem e-mails enviados de seus domínios e qual percentual destes está devidamente autenticada. Saiba mais sobre os valores de política disponíveis e veja alguns exemplos de políticas nas seções abaixo. Quando estiver pronto para configurar seu registro DMARC, consulte as instruções neste artigo . Valores da política Uma política DMARC pode ser definida adicionando um registro TXT nas configurações do provedor DNS, com um valor que pode incluir as seguintes propriedades separadas por ponto e vírgula: v: a versão DMARC. p: o tipo de política que determina como processar e-mails que não passam. A política pode ser definida para um dos seguintes tipos: none: usado para coletar feedback e obter visibilidade quanto aos fluxos de e-mail sem afetar os fluxos existentes. quarantine: filtra e-mails que não passam na autenticação para a quarentena do destinatário. reject: e-mails rejeitados que não passam na autenticação. sp: usado para aplicar uma política a um subdomínio do registro DMARC. pct: a porcentagem do total de envios exclusivos que falharam na autenticação aos quais aplicar esta política. Por exemplo, se o seu registro DMARC incluir p=reject; pct=25 e 100 e-mails falharem na autenticação, apenas 25 deles serão rejeitados, enquanto que os outros 75 serão entregues aos destinatários. Definir essa propriedade pode ajudar a aplicar gradualmente sua política de autenticação para garantir que esteja funcionando como esperado. Observe que esse parâmetro às vezes é ignorado por certos provedores de serviços de caixa de entrada. ruf & rua: dois parâmetros opcionais que especificam um endereço de e-mail aos quais enviar dados de relatórios DMARC. Estes devem ser fornecidos no formato URI mailto (por exemplo, mailto:reporting@example.com ). Os dados de relatórios enviados diferem com base no parâmetro: rua: um relatório agregado de todo o tráfego do seu domínio. ruf: dados de relatórios de falhas que incluem cópias redigidas de mensagens individuais que falharam na autenticação. adkim & aspf: especifica o modo de alinhamento de DKIM e SPF. Ambos devem ser definidos como r (ou seja, um alinhamento relaxado ). Um alinhamento relaxado deve ser a configuração padrão de DMARC para serviços DNS. Depois de adicionar e verificar o registro DMARC no seu provedor de DNS, todos os servidores de e-mail de recebimento poderão autenticar os e-mails recebidos do seu domínio e lidar com quaisquer falhas de acordo com a política especificada. Exemplos de políticas Você pode personalizar sua política DMARC para atender às necessidades da sua empresa. Veja alguns exemplos: Política neutra v=DMARC1; p=none; Este é um exemplo de uma política DMARC neutra, sem parâmetros adicionais. Uma política neutra é útil para remetentes que estão apenas começando a se familiarizar com o DMARC. Esta é a configuração mínima necessária para que o DMARC funcione. Política rigorosa com relatórios agregados v=DMARC1; p=reject; rua=mailto:reporting@example.com; O exemplo acima define uma política DMARC rigorosa para rejeitar todos os e-mails que falharem na autenticação e fornece um endereço de e-mail para enviar dados agregados de relatórios. Política de quarentena com relatório de falhas v=DMARC1; p=quarantine; pct=25; ruf=mailto:reporting@example.com; Este exemplo define uma política que colocará em quarentena 25% dos e-mails que falharem na autenticação; os 75% restantes serão permitidos para entrega. A política também fornece um endereço de relatório para o qual um e-mail de notificação individual poderá ser enviado para cada e-mail que falhar na autenticação. Definir um valor para a propriedade pct pode ajudar a testar uma amostra aleatória de mensagens que falharam no DMARC para verificar se os e-mails legítimos são entregues corretamente. Observação: o suporte da HubSpot não pode ajudar na configuração do registro DMARC. A política DMARC que você configurou é exclusiva para as necessidades da sua empresa e do seu provedor de DNS. Você deve consultar seu administrador de TI ou o responsável por gerenciar suas configurações de DNS para obter ajuda na configuração do DMARC. Você também pode entrar em contato com um terceiro que forneça serviços de consultoria ou de relatórios de DMARC para obter assistência adicional. Marketing Email",https://knowledge.hubspot.com/pt/marketing-email/overview-of-email-authentication
2178,"Use deal, ticket, and lead stage calculated properties","To better understand how deals, tickets, and leads are progressing, stage calculated properties show the amount of time deals, tickets, and leads spend in each of your stages. You can use stage calculated properties in other HubSpot tools (e.g., views, reports, workflows) to prioritize your work, assess performance, and automate actions on specific deals, tickets, and leads. Understand stage calculated properties The following default properties provide information about how your deals, tickets, and leads are moving through pipeline stages. The properties automatically update based on a deal, ticket, or lead's current and historical stage values. Each deal, ticket, and lead stage in your pipelines has its own set of these properties. If you've upgraded to a Professional or Enterprise account, the values for the properties will be populated retroactively based on existing deal, ticket, or lead data. Date entered [stage ID] : the date and time the deal, ticket, or lead entered the stage. Date exited [stage ID] : the date and time the deal, ticket, or lead exited the stage. Latest time in [stage ID] : the total time spent by the deal, ticket, or lead in the stage since it last entered the stage. This is calculated based on the Date entered and Date exited properties. When a deal, ticket, or lead is currently in a stage, it will have no value for this property, unless it had previously been in that stage. In that case, its value will refer to the previous time in the stage and will not update until the deal, ticket, or lead leaves the stage. Cumulative time in [stage ID] : the cumulative time spent by the deal, ticket, or lead in the stage. This is helpful if deal, ticket, or lead re-enter a stage multiple times and you want to track their total time in the stage. When a deal, ticket, or lead is currently in a stage, it will have no value for this property, unless it had previously been in that stage. In that case, its value will include the previous time in the stage and will not update until the deal, ticket, or lead leaves the stage. For deals, there are also properties based on the current stage a deal is in. Each deal record will have these properties, and as a deal moves through a pipeline, the values will be automatically updated. Date entered current stage : the date the deal entered its current pipeline stage. Time in current stage : the time the deal has spent in the current pipeline stage. Learn more about HubSpot's default deal properties , default ticket properties , default lead properties , and lifecycle stage calculated properties . Use stage calculated properties in HubSpot tools You can use deal, ticket, or lead stage calculated properties to segment and automate actions with deal, ticket, or lead in views, lists, workflows, and reports. Please note: records will not be enrolled in workflows based on the Cumulative time and Latest time in [stage] properties if the record is currently in that stage (e.g., Latest time in Contract Sent if that deal is currently in the Contract Sent stage). To enroll these records, your trigger criteria should use the Date entered current stage or Time in current stage properties. For example, you can: Create a saved view to identify deals that have spent more than two weeks in a given stage. Create a filter using the Advanced filters in the prospecting workspace to identify leads that have spent more than two weeks in a given stage. Create a report that shows the total amount of time spent in all stages using the Cumulative time in [stage] properties. Create a workflow that triggers a task for a deal owner to follow up when the deal's Date entered Contract Sent is more than 7 days ago. You can use similar triggers in a lead-based workflow. properties CRM records",https://knowledge.hubspot.com/properties/stage-calculated-properties
2179,O contato não recebeu um e-mail mesmo que as estatísticas de e-mail mostram que foi entregue,"Depois de enviar um email de marketing da HubSpot, você pode ver a página de desempenho pós-envio para ver quais contatos receberam seu email. Em alguns casos, um contato que aparece na guia Entregue pode avisar que não recebeu o e-mail na caixa de entrada como esperado. Há duas explicações comuns para isso: O e-mail está em uma pasta de spam ou lixo eletrônico na caixa de entrada do destinatário. O e-mail foi colocado em uma área em quarentena por um filtro de segurança. Neste cenário, o e-mail foi filtrado após ser recebido pelo servidor, mas antes de ser colocado na caixa de entrada pessoal do destinatário. Em ambos esses casos, o servidor da HubSpot recebe uma confirmação do servidor do destinatário que o e-mail foi entregue. Por isso, o contato aparece na guia Entregue nos detalhes de desempenho do e-mail. Confirme se o endereço do Remetente corresponde ao domínio de envio do e-mail (somente para Marketing Hub Starter, Professional, Enterprise e Sales Hub Professional, Enterprise ) Em sua própria conta, verifique se você conectou seu email enviando domínio e se o domínio corresponde ao endereço De para emails que você está enviando do HubSpot: Na sua conta da HubSpot, navegue até Marketing > E-mail . Na barra lateral esquerda, clique em Enviado . Clique no nome do e-mail que seu contato não recebeu. Clique em Ver detalhes para ver o Endereço do remetente no painel da barra lateral direita. Mover o e-mail da pasta de spam ou lixo eletrônico da caixa de entrada do destinatário Se o e-mail parar na pasta spam ou lixo eletrônico, o destinatário deve mover o e-mail da pasta de lixo eletrônico para sua caixa de entrada principal. Isso ensinará a caixa de entrada que ele deseja receber mensagens de você no futuro. Solucionar o porquê o e-mail está em uma área de quarentena do servidor de e-mail do contato Se o e-mail não for encontrado na pasta de lixo eletrônico ou spam, o contato pode ter um software de segurança de e-mail ou firewall que colocou o e-mail em quarentena antes de chegar à caixa de entrada. Peça ao contato ver com sua equipe de TI para verificar seu servidor de e-mail. Forneça ao seu contato a linha de assunto do e-mail, o endereço D E e a data e o registro de data e hora quando o e-mail foi entregue. Essas informações ajudarão o administrador de TI a localizar o e-mail e investigar por que ele foi colocado em quarentena. Verifique se o domínio de envio de email está configurado corretamente e se você implementou métodos de autenticação de email como DKIM, registros SPF e uma política DMARC. Para evitar que isso aconteça no futuro, você pode pedir para a equipe de TI do contato adicionar seus endereços IP de envio à lista de permissões. Você pode encontrar instruções sobre como localizar seus endereços IP aqui . Saiba mais sobre as etapas que seus contatos podem executar para melhorar a entrega de seus emails de marketing . Email Marketing Email",https://knowledge.hubspot.com/pt/marketing-email/why-didn-t-my-contact-receive-an-email-even-though-the-email-statistics-indicate-that-it-was-delivered
2180,Adicione widgets HubSpot à sua casa no celular e tela de bloqueio,"Você pode adicionar widgets HubSpot à sua casa e telas de bloqueio móveis. Os widgets facilitam o acesso aos recursos do HubSpot a partir do seu dispositivo móvel sem navegar para o aplicativo HubSpot. Você pode adicionar widgets de chamadas à sua tela inicial em dispositivos iOs e Android e adicionar o aplicativo HubSpot à sua tela de bloqueio em um dispositivo iOs. Adicionar um widget à sua tela inicial Existem dois widgets de chamadas que você pode adicionar à sua tela inicial móvel: Contatos chamados recentemente : exiba uma lista de contatos chamados recentemente para que você possa chamá-los novamente rapidamente. Chamar tarefas : exiba uma lista de suas próximas tarefas que são chamadas para que você possa chamá-las e concluir suas tarefas a partir da tela inicial. Depois de adicionar um widget, você pode fazer chamadas diretamente do widget. iOs Na tela Início , toque e segure um widget ou uma área vazia até que os aplicativos chacoalhem. Toque em Editar no canto superior esquerdo. Toque em Adicionar Widget . Digite HubSpot na barra de pesquisa e selecione HubSpot . Passe o dedo para ver cada widget. Clique em + Adicionar widget abaixo do widget que deseja adicionar. Toque em Concluído no canto superior direito. Saiba mais sobre como adicionar widgets ao seu dispositivo iOs . Android Na tela Início , toque e segure um espaço vazio. Toque em Widgets . Localize o aplicativo HubSpot. Para verificar a lista de widgets disponíveis para Hubspot, toque no aplicativo HubSpot . Toque e segure o widget. Você obterá imagens de suas telas iniciais . Deslize o widget para onde você deseja. Levante o dedo. Saiba mais sobre como adicionar widgets ao seu dispositivo Android . Adicionar o widget HubSpot à tela de bloqueio (somente iOs) Se você estiver usando um dispositivo iOs, poderá adicionar o aplicativo HubSpot à sua tela de bloqueio. Pressione o botão lateral no dispositivo duas vezes para ir para a Tela de bloqueio. Toque e mantenha pressionada a tecla Lock Screen até que as teclas Customize e + apareçam na parte inferior da tela. Toque em Personalizar e em Bloquear Tela . Toque em + ADICIONAR WIDGETS . Role para localizar o ícone Hubspot. Toque no ícone HubSpot . Toque em X , depois toque em Concluído no canto superior direito. Saiba mais sobre como adicionar um widget à sua tela de bloqueio . Calling",https://knowledge.hubspot.com/pt/calling/add-a-hubspot-widget-to-your-mobile-home-and-lock-screen
