id,titulo,conteudo,link
561,"Definir o idioma de aviso e consentimento predefinido para formulários, formulários pop-up, documentos e reuniões compatíveis com a privacidade dos dados","Quando utiliza o grupo de campos privacidade de dados e consentimento em formulários ou formulários pop-up , a opção Ativar privacidade de dados em documentos , ou a opção Privacidade de dados e consentimento em páginas de agendamento , os visitantes do seu formulário, formulário pop-up, documento ou página de agendamento serão solicitados a dar o seu consentimento para receberem comunicações da sua parte e o seu consentimento para o processamento e armazenamento dos seus dados. Observação: embora esses recursos façam parte do HubSpot, sua equipe jurídica é o melhor recurso para fornecer orientação sobre conformidade para uma situação específica. Defina o idioma predefinido para estas opções nas suas definições: Na sua conta HubSpot, clique no ícone de configurações settings icon na barra de navegação superior. No menu da barra lateral esquerda, acesse Privacidade e consentimento . Clique no separador Opções de consentimento . Nesta página, pode ver uma pré-visualização do texto de privacidade e consentimento que os visitantes dos seus formulários e páginas de agendamento activados para a privacidade dos dados verão. Você pode personalizar o conteúdo e o idioma de cada seção. Use o menu suspenso Escolher idioma para definir os padrões para selecionar um idioma. Em seguida, edite as secções abaixo para cada língua: Interesse legítimo: informe aos visitantes que eles podem cancelar a assinatura de suas comunicações a qualquer momento, se não estiverem mais interessados em recebê-las e coloque um link para informações sobre o cancelamento da assinatura e suas práticas de privacidade, se aplicável. Clique em Editar conteúdo para efetuar alterações. Na caixa de diálogo que aparece, edite o texto que aparece na caixa de texto e, em seguida, clique em Guardar . Política de privacidade: fornece aos seus visitantes informações sobre as suas políticas e práticas de privacidade e oferece uma ligação para mais informações, se aplicável. Clique em Editar conteúdo para efetuar alterações. Na caixa de diálogo que aparece, edite o texto que aparece na caixa de texto e, em seguida, clique em Guardar . Consentimento para se comunicar: forneça aos seus visitantes informações sobre como e por que você deseja entrar em contato com eles e também que oferece uma opção de consentimento com essa comunicação. Clique em Editar conteúdo para efetuar alterações. Na caixa de diálogo que aparece, edite o texto que aparece na caixa de texto e, em seguida, clique em Guardar . Tipo de assinatura : clique em Editar tipo de assinatura e consentimento da caixa de verificação para personalizar o idioma que acompanha cada tipo de assinatura. Na caixa de diálogo exibida, use o menu suspenso para selecionar um tipo de assinatura e use a caixa de texto abaixo para personalizar o idioma que aparecerá ao lado da caixa de seleção de assinatura. Clique em Salvar . Consentimento para processar dados: dependendo das configurações escolhidas nos seus formulários individuais ou páginas de agendamento, os visitantes verão o consentimento explícito ou implícito para processar a linguagem de dados. Pode personalizar o idioma predefinido para qualquer uma das opções alternando entre os separadores Explicit e Implicit e clicando em Edit acima do conteúdo que pretende personalizar. Para a opção de consentimento explícito, informe os visitantes de que precisam marcar a caixa para consentir com o armazenamento e o processamento de seus dados pessoais. Para a opção de consentimento implícito, informe os visitantes de que, ao enviar suas informações, eles estão consentindo no armazenamento e no processamento de seus dados pessoais. Observação: As alterações efectuadas aqui aplicar-se-ão a todos os novos formulários, formulários pop-up e páginas de agendamento com privacidade de dados criados, a menos que tenha personalizado a linguagem de aviso e consentimento no próprio formulário, formulário pop-up ou páginas de agendamento. Qualquer personalização feita a formulários individuais, formulários pop-up, e páginas de agendamento sobrepor-se-á a estas configurações padrão. Se alterar o texto predefinido, os formulários existentes e os formulários pop-up não serão actualizados automaticamente. Para atualizar um formulário existente, elimine o campo de opções de privacidade de dados atual do formulário e volte a adicioná-lo para incluir o texto atualizado. Saiba como pode enviar informação de consentimento para o HubSpot utilizando o API de formulários HubSpot Forms . GDPR Privacy & Consent",https://knowledge.hubspot.com/pt/privacy-and-consent/set-default-notice-and-consent-language-for-gdpr-enabled-forms-pop-up-forms-documents-and-meetings
562,Export contact data,"If a contact inquires about the personal data your business stores, or you want to export all information about one specific contact, you can export data from a contact record in HubSpot. When you complete a contact data export, you'll receive a file with the default contact properties and their historical values. You can also choose to include custom contact properties and historical values, as well as contact associations and activities. This article outlines how to export all data from an individual contact record. If you want to export multiple records, other objects, or filter which properties are exported, learn how to export records. Understand contact personal data requests According to the General Data Protection Regulation (GDPR) and other data privacy laws, contacts in your account have the right to request their personal data held by your business. Typically, these requests should be attended to within 30 days. The right to a data download or export is not absolute and can depend on the context of the request, so it doesn't always apply. If you've received a data privacy request from a contact to export their contact data, you can export their data directly from the Data Request Manager. If a contact requests you delete their data, learn how to permanently delete the contact and send proof of deletion. Necessary disclosure: contact data exports display information about a contact and includes personal data. Due to its sensitive nature, the export file should only be shared with contacts for its intended purpose. Export contact data Users must have Super Admin or CRM export permissions to export a contact's data. You can export contact data directly on a contact record, or if you've received a data privacy request from a contact to export their contact data, you can export their data directly from the Data Request Manager. To complete a contact data export from a contact record: In your HubSpot account, navigate to CRM > Contacts . Click the name of the contact for which you want to export data. In the top left, click the Actions dropdown menu, then select Export contact data . By default, all current and historical default property data will be exported. In the dialog box, you can choose to export additional data: To export custom contact properties and their historical values, select the Custom contact properties and history checkbox. To export all activities associated with the contact (e.g., emails, notes), select the Contact activities checkbox. To export association data, including the contact's associated records , select the Associations checkbox. Click Export . You'll receive an email with a link to download the export file. This will be sent to your email that receives HubSpot system and notification emails. In your inbox, open the email , then click Download . If you chose to export custom contact properties and history, activities, or associations, separate files for each will be downloaded in addition to the HubSpot default properties file. In the files, values may be redacted if they contain information that's sensitive in nature or if the data is stored somewhere other than the contact's record (e.g., synced from an associated record). If the contact requests you delete their data, you can permanently delete the contact and send proof of deletion. CRM records Import & Export",https://knowledge.hubspot.com/import-and-export/export-contact-data
563,Use the post narration module,"With Breeze , HubSpot's AI, you can use the post narration module to create audio versions of your blog posts. In order to create post narrations, you must first add the module's HubL snippet to your blog template Please note: Please avoid sharing any sensitive information in your enabled data inputs for AI features, including your prompts. Admins can configure generative AI features in account management settings. For information on how HubSpot AI uses your data to provide trustworthy AI, with you in control of your data, you can refer to our HubSpot AI Trust FAQs . Add the post narration module to your blog template In your HubSpot account, navigate to Content > Blog . Click the name of a blog post. In the content editor, click the Settings menu and select Post narration . In the alert banner, click design manager . You will be redirected to your blog post template in the design manager. In your blog post template, paste the following HubL snippet where you want the audio player to appear: {% module ""blog_post_audio"" path=""@hubspot/blog_audio"", overrideable=False %} To change the color of the player, you can add the styles parameter. For example: {% module ""narration"" path=""@hubspot/blog_audio"", overrideable=False, styles={ groupColors: { override: 'custom', background: { color: '#0091ae' }, text: { color: '#ffbcac' }, hover: { color: '#7fded2' }, }, } %} In the top right, click Publish changes . Use post narration in blog posts In your HubSpot account, navigate to Content > Blog . Hover over a blog post, then click Edit . In the content editor, click the Settings menu and select Post narration . In the dialog box, click Generate with AI . In the right panel, customize the text of your blog post in the Narration transcript field. Click the AI Voice dropdown menu and select a voice . Click Generate . An audio player will appear when the narration is ready to preview. Click the playerPlayfds play icon in the audio player to preview the narration. Click Add to blog post to finalize the narration, or click Generate to generate the narration again. AI Tools",https://knowledge.hubspot.com/blog/use-the-post-narration-module
564,Informações sobre privacidade e consentimento ao usar anúncios do HubSpot,"As funcionalidades da ferramenta de anúncios da HubSpot ajudam-no a interagir melhor com os seus contactos, mantendo a sua privacidade. Nota: Embora estas funcionalidades estejam no HubSpot, a sua equipa jurídica é o melhor recurso para lhe dar conselhos de conformidade para a sua situação específica. Apresentar a faixa da política de privacidade antes dos disparos de pixéis Quando instala um pixel usando o HubSpot , ele será adicionado a todas as páginas com o código de rastreamento do HubSpot instalado. Se tiver configurado um banner de política de privacidade , os visitantes destas páginas serão também convidados a confirmar que aceitam as suas definições de privacidade e consentimento. Se exigir que os visitantes aceitem o rastreio de cookies, os pixéis não utilizarão cookies até que o visitante confirme o seu consentimento. Se quiser permitir que os usuários editem ou enviem consentimentos, você precisará trabalhar com um desenvolvedor para implementar essa funcionalidade usando a API do código de rastreamento da HubSpot. Saiba mais sobre a implementação das funções adicionais consent status e cookie removal na documentação dos programadores. Observação: você só pode instalar um pixel por rede de anúncios através do HubSpot. Se precisar de instalar vários pixéis por rede, pode utilizar o Google Tag Manager . Os Pixels instalados através do Gerenciador de tags do Google não exibirão automaticamente o banner da política de privacidade. Sincronizar os públicos da lista de contatos com o Google, o Facebook e o LinkedIn (somente Marketing Hub Starter , Professional e Enterprise ) Quando você cria públicos de lista de contatos no HubSpot , os contatos das suas listas são sincronizados periodicamente com a rede de anúncios correspondente. A rede de anúncios tenta corresponder esses contatos aos seus usuários. Criptografar os dados enviados ao Google, Facebook e LinkedIn Cada rede de anúncios exige dados diferentes para corresponder um contato do HubSpot a um usuário em sua rede. A HubSpot criptografa e envia propriedades de contato para a rede de anúncios associada, mas as redes de anúncios só podem usar propriedades de contato criptografadas para fins de correspondência. As redes de anúncios não podem usar os dados enviados pelo HubSpot para aumentar as informações que elas têm sobre o usuário correspondente em sua rede. A HubSpot criptografa e envia diferentes propriedades de contato com base nos requisitos de cada rede. Facebook : A HubSpot encripta e envia as seguintes propriedades de contacto: E-mail (se um contato tiver vários endereços de e-mail, o HubSpot enviará para todos os endereços) Nome Sobrenome Nome Cidade Estado País CEP Anúncios do Google: A HubSpot envia as seguintes propriedades de contacto. Todos os campos, exceto para CEP e Código do país serão criptografados. E-mail (se um contato tiver vários endereços de e-mail, o HubSpot enviará para todos os endereços) Nome Sobrenome Nome Cidade Estado CEP Código do país LinkedIn : A HubSpot encripta e envia as seguintes propriedades de contacto: E-mail (se um contato tiver vários endereços de e-mail, o HubSpot enviará para todos os endereços) Nome Sobrenome Nome da empresa Cargo País Sincronizar públicos de lista de empresas com o LinkedIn ( Marketing Hub Starter , Professional e Enterprise somente) Quando você cria um público de lista de empresas , o HubSpot sincronizará automaticamente as empresas das suas contas-alvo ou uma camada de perfil de empresa específica com o público correspondente no LinkedIn. A HubSpot criptografa e envia as seguintes propriedades de empresa para o LinkedIn: Nome da empresa Domínio do site da empresa URL da página da empresa Setor Nome Cidade Estado Código do estado País Código do país CEP De acordo com os requisitos do LinkedIn, o HubSpot sincronizará com o LinkedIn apenas empresas que tenham um nome ou um domínio de site. Tratamento de solicitações de exclusão do GDPR e do CCPA Quando executa uma eliminação permanente de um contacto , o HubSpot também elimina esse contacto de qualquer público da lista de contactos de sincronização. A HubSpot também envia uma solicitação para excluir esse contato de qualquer público de lista de contatos de sincronização na própria rede de anúncios. A conclusão da exclusão depende da capacidade da rede de anúncios de ligar as informações de contato criptografadas a um usuário no respectivo público. Uma vez que este processo garante que as suas campanhas publicitárias não visam contactos permanentemente eliminados, também garantirá que se mantém em conformidade com a CCPA . Sincronizar o consentimento para o campo de contacto dos seus anúncios de geração de leads para o HubSpot Pode adicionar um campo de consentimento para contacto aos seus anúncios de geração de leads do Facebook e do LinkedIn. Todos os campos de consentimento dos seus anúncios serão sincronizados com o HubSpot como uma nova propriedade de contato. Estas propriedades serão identificadas com [Rede de anúncios] Consentimento antes do nome da propriedade. Pode utilizar estas propriedades para criar uma lista de contactos que deram o seu consentimento para serem contactados. Observação: os usuários que marcarem uma caixa de seleção de consentimento para seu anúncio de lead não serão inscritos automaticamente nos seus e-mails. Depois que esses usuários enviarem o formulário de anúncios de lead, você precisará criar um fluxo de trabalho no HubSpot que usa a nova propriedade de contato para definir o status de assinatura do contato . Adicionar um campo de consentimento ao criar um anúncio de geração de leads no HubSpot Para adicionar um campo de consentimento ao criar um novo formulário do Facebook ou formulário de geração de leads do LinkedIn no HubSpot: Na sua conta da HubSpot, navegue para Marketing > Anúncios . Clique em Criar campanha publicitária e, em seguida, seleccione Geração de leads . Facebook: selecionar socialBlockFacebook Geração de leads . LinkedIn: selecionar socialBlockLinkedin Geração de leads . Criar um novo formulário: Facebook : em Formulário do Facebook , clique no menu pendente Selecionar um formulário do Facebook e, em seguida, clique em Criar um novo formulário do Facebook . LinkedIn: em Formulário de geração de leads do LinkedIn , clique no menu suspenso Selecionar um formulário do LinkedIn e em Criar um novo formulário do LinkedIn . No painel Criar formulário , em Aviso e consentimento , clique no menu pendente e seleccione Pedir consentimento para comunicar; submeter para consentimento para processar , Pedir consentimento para comunicar e processar , Interesse legítimo , ou Personalizado . Saiba mais sobre as diferentes opções de aviso e consentimento . Adicionar um campo de consentimento a um novo formulário no Facebook Pode adicionar um campo de consentimento ao criar o anúncio de leads no Facebook no passo Criar formulário : Clique em Política de privacidade . Marque a caixa de seleção Adicionar advertência personalizada e digite um título e uma mensagem de advertência . Na pergunta: O consentimento é obrigatório? , selecione o botão de opção Sim . Adicionar um campo de consentimento a um novo formulário no LinkedIn É possível adicionar um campo de consentimento ao criar um formulário de lead no LinkedIn na etapa Detalhes do lead e perguntas personalizadas : Clique em Adicionar caixa de verificação personalizada e, em seguida, introduza termos e condições para solicitar o consentimento dos utilizadores. Seleccione a caixa de verificação Required . Assim que o campo de consentimento for adicionado a um formulário do Facebook ou do LinkedIn, este campo começará a ser sincronizado para todos os formulários de anúncios de leads. Se já tiver criado um anúncio de geração de leads antes de adicionar o campo de consentimento e ele já estiver sendo sincronizado com a HubSpot, todos os novos leads recebidos por meio desse anúncio sincronizarão o campo de consentimento com a HubSpot. No entanto, os leads criados antes da adição do campo de consentimento aos seus anúncios de leads não terão esse campo sincronizado. ads",https://knowledge.hubspot.com/pt/ads/hubspot-ads-privacy-features
565,Sync Salesforce accounts to HubSpot,"Learn more about how the Salesforce integration syncs accounts in Salesforce with companies in HubSpot. Turn on company sync To begin syncing companies and accounts, turn on the Sync Companies setting. In your HubSpot account, click the settings settings icon in the top navigation bar. In the left sidebar menu, navigate to Integrations > Connected Apps . Click Salesforce , then click the Companies tab. Click to toggle the Sync Companies switch on. Please note: the sync setting must be enabled before importing Salesforce accounts, otherwise company records will not be created in HubSpot. How Salesforce accounts sync to HubSpot After the Sync Companies setting is turned on, any new accounts in Salesforce will automatically be created in HubSpot as companies. Any existing accounts will be synced to HubSpot in two ways: When they are manually imported to HubSpot. When edits are made to the account in Salesforce, depending on your sync rules and field mappings . Please note: when bulk resyncing company/account field mappings, HubSpot cannot sync more than 200,000 companies at the same time. This can result in a We couldn't sync all your updates for this mapping error. A Salesforce account does not require an associated contact to create a company in HubSpot. How HubSpot companies sync to Salesforce When a company is created in HubSpot, the integration will automatically create a Salesforce account if any of the following criteria is met: The company was auto-created via the Automatically create and associate companies with contacts setting and the default object created in Salesforce is set to Contact . The company was created and associated with a HubSpot contact that is syncing with a private contact (a contact with no account) in Salesforce. A HubSpot contact associated with the company qualifies for your Salesforce inclusion list . The integration will not create a Salesforce account if any of the following criteria is met: The company is not associated with any HubSpot contacts. All of the company’s associated HubSpot contacts are syncing with Salesforce leads. None of the company’s associated HubSpot contacts qualify for your Salesforce inclusion list . Please note: if you're syncing HubSpot companies with Salesforce accounts, changes to the HubSpot contact's lifecycle stage will sync to the company's lifecycle stage. Manually create accounts in Salesforce You can also manually create new accounts in Salesforce from company records in HubSpot. In your HubSpot account, navigate to CRM > Companies . Click the name of your record. In the right panel, locate the Salesforce sync section. Click Actions > Resync . Learn how HubSpot deduplicates Salesforce accounts . Integrations",https://knowledge.hubspot.com/salesforce/sync-salesforce-accounts-to-hubspot
