id,titulo,conteudo,link
851,Anúncios do Target LinkedIn usando o público do HubSpot,"Depois de criar públicos no LinkedIn Ads no HubSpot , você pode usá-los para direcionar campanhas publicitárias novas e já existentes. Selecione um público do HubSpot para novas campanhas no LinkedIn Faça login no seu gestor de campanha do LinkedIn Ads. Clique no separador Campanhas . Clique em Criar campanha . Selecione o objetivo da campanha . Na seção Audiências , em Quem é seu público alvo? , selecione Audiências Para selecionar um público do site HubSpot, clique em Retargeting e, em seguida, clique em Website . Para seleccionar uma lista de contactos HubSpot ou o público da empresa , clique em ""Third party"" (Terceiros) , depois clique em "" Third party contact"" (Terceiros) ou "" Third party company"" (Terceiros ). Seleccione o seu público de entre as opções disponíveis. Uma vez publicada a campanha, ela será dirigida ao público selecionado. Selecione um público HubSpot para as campanhas existentes no LinkedIn Faça login no seu gestor de campanha do LinkedIn Ads. Clique no separador Campanhas . Passe o mouse sobre a campanha que você deseja editar e depois clique em Gerenciar . Vá até a seção de audiências do editor da campanha. Em Quem é o seu público alvo? clique em Audiências Para selecionar um público do site HubSpot, clique em Retargeting e, em seguida, clique em Website . Para seleccionar uma lista de contactos HubSpot ou o público da empresa , clique em ""Third party"" (Terceiros) , depois clique em "" Third party contact"" (Terceiros) ou "" Third party company"" (Terceiros ). Seleccione o seu público de entre as opções disponíveis. Uma vez atualizada a campanha, ela será dirigida ao público selecionado. ads",https://knowledge.hubspot.com/pt/ads/target-linkedin-ads-using-hubspot-audiences
852,Criar e gerenciar clientes potenciais usando o aplicativo móvel HubSpot,"Os usuários com um assento de Sales hub atribuído podem gerenciar de forma rápida e eficiente seus leads de contato e empresa usando o aplicativo móvel HubSpot. Isso inclui analisar leads, movê-los pelas fases de lead e realizar atividades de prospecção, como fazer chamadas e enviar e-mails. Gerenciar leads Para gerenciar seus leads usando o aplicativo HubSpot: Abra o aplicativo HubSpot no dispositivo móvel. Toque em Menu e em Leads na barra lateral esquerda. Se você selecionou Vendas como Experiência selecionada , poderá clicar no ícone Leads na parte superior do aplicativo. Para mudar de vista e ver seus leads, toque no ícone do tabuleiro no canto superior direito. Role para a esquerda para revisar seus clientes potenciais categorizados por status do lead. Para voltar ao modo de exibição de lista, toque no ícone de lista no canto superior direito. Para ver outro lead, toque em Pipeline no canto superior direito. Em seguida, toque na pipeline que você gostaria de ver ou toque em Todos os pipelines para ver tudo. Para adicionar exibições, toque em Adicionar Exibições na parte superior. Marque as caixas de seleção ao lado das exibições que deseja adicionar. Em seguida, toque em Done no canto superior direito. Para alterar as exibições, posicione a exibição na parte superior da lista. Por padrão, você exibirá Todos os clientes potenciais . Passe o dedo para a direita para percorrer as opções. Para classificar seus clientes potenciais, quando estiver em um modo de exibição, clique em Classificado por X. Em seguida, toque na propriedade de lead que deseja classificar ou toque em GerenciarExibir todas as propriedades de lead  para selecionar entre todas as propriedades de lead. Depois de selecionar uma propriedade, clique em Aplicar . (Apenas para Android) Se você é um toque de Superadministrador Lead proprietário no topo, selecione os proprietários de lead  cujos leads você gostaria de ver. Selecione não atribuído para exibir clientes potenciais não atribuídos. Para criar um lead, toque em + Lead na parte inferior direita. Em seguida, insira as informações do lead e clique em Salvar . Também é possível adicionar leads na guia associações . Ou, para adicionar um a partir da tela inicial do aplicativo móvel, clique em + Criar na parte inferior direita . Para exibir ou executar uma ação em um lead individual, toque no nome do cliente potencial. Na página Visão geral do lead , revise todos os detalhes do lead. Para navegar até a atividade, associações ou informações do cliente potencial, toque na seta no canto superior direito. Na guia Atividade , revise suas atividades com o lead. Toque no menu suspenso Filtrar atividade para filtrar as atividades. Você também pode tocar no ícone associado para adicionar uma observação, criar uma tarefa ou registrar uma atividade. Toque na guia Associações para exibir objetos associados e leads. Para adicionar uma associação, toque no ícone Adicionar add , toque na associação, depois toque em Concluído . Toque na guia Sobre para revisar as propriedades do lead. Toque em Editar para editar as propriedades. Toque em Salvar para salvar as alterações feitas na propriedade. Para excluir um lead, toque em Editar e, na parte inferior, toque em Excluir . Use os ícones de ação executar ações, como fazer uma chamada ou inscrever o lead em uma sequência. Para acessar todas as ações disponíveis, toque em Mais . O HubSpot atualizará automaticamente a fase do lead ao executar ações. Por exemplo, se você enviar um e-mail a um lead na fase Novo , a fase dele será atualizada automaticamente para a fase Tentativa . Saiba mais sobre a configuração das etapas de pipeline de lead . Para atualizar a fase do lead, toque no menu suspenso Fase e depois toque na nova Fase . Suas opções dependerão dos estágios configurados em suas configurações de pipeline de lead . Ao definir um lead como um estágio Qualificado que requer criação de negócio , você será solicitado a criar um negócio. O negócio será associado automaticamente ao contato e à empresa associada, se aplicável. Ao definir um lead como um estágio Desqualificado , você será solicitado a inserir detalhes de desqualificação, dependendo de suas configurações de desqualificação . Por padrão, você precisará inserir um motivo de desqualificação e poderá adicionar uma observação opcional. Toque em Salvar para salvar as alterações. Para atualizar o proprietário do lead, toque no menu suspenso Proprietário de lead , depois toque no novo Proprietário. Para atualizar o tipo de lead, toque no menu suspenso Tipo de lead , depois toque no novo Tipo . Na seção Comunicações recentes , você pode revisar as atividades de comunicação associadas ao lead, como chamadas feitas, atividade de sequência, e-mails e mensagens SMS enviadas e recebidas e reuniões agendadas. Para exibir mais detalhes sobre uma atividade ou executar uma ação, toque na atividade . Prospecting leads",https://knowledge.hubspot.com/pt/prospecting/manage-leads-using-the-hubspot-mobile-app
853,Excluir registros do HubSpot em massa no Salesforce,"Observe: este artigo se aplica ao módulo Visualforce herdado do HubSpot no Salesforce, que está sendo preterido. É recomendável desinstalar o pacote gerenciado do HubSpot no Salesforce e usar HubSpot Embed  avançando. Para excluir em massa os registros do HubSpot (registros do HubSpot Intelligence, registros do HubSpot, mensagens de registro do HubSpot, atividades do HubSpot) do Salesforce, você precisa: Gerar uma lista dos IDs de registro do HubSpot a serem excluídos Usar Carregador de Dados para excluir em massa os registros de HubSpot Observe o seguinte: Com efeitos a partir de Em 6 de agosto de 2018, a HubSpot não cria mais objetos HubSpots Intelligence no Salesforce. Os registros ou mensagens de registro do HubSpot podem ser excluídos a qualquer momento, pois são destinados para fins de solução de problemas. Entretanto, se os erros de sincronização continuarem ocorrendo ativamente, as mensagens de registro do HubSpot continuarão sendo criadas. Por exemplo, para excluir registros órfãos do HubSpot: Navegue até sua conta do Salesforce. Clique na guia Relatórios . Clique em Novo relatório... . Selecione HubSpot Intelligence . Ao lado de Filtros , clique na seta suspensa downCarat e selecione Filtro Cruzado . Criar filtros cruzados para: HubSpot Intelligence | sem | Contatos HubSpot Intelligence | sem | Leads No menu da barra lateral esquerda, clique no campo HubSpot Intelligence: ID e arraste-o e solte-o na tabela. Clique em Salvar . Na caixa de diálogo, insira um Nome de relatório e clique em Salvar . Clique em Executar relatório . Clique em Exportar detalhes . Verifique se a ID do registro está incluída, pois ela é necessária para a exclusão. O relatório será exportado para seu dispositivo como um arquivo CSV. No Carregador de Dados , carregue o arquivo CSV e execute a função de exclusão. Os registros do HubSpot Intelligence no relatório serão excluídos do ambiente do Salesforce. Este processo pode ser modificado para a exclusão em massa qualquer tipo de registro do HubSpot vindo do Salesforce. Integrations",https://knowledge.hubspot.com/pt/salesforce/delete-hubspot-records-in-bulk-from-salesforce
854,Excluir formulário,"Configure a sua tabela de formulários e mantenha os seus formulários organizados utilizando pastas de formulários. Reveja as acções disponíveis que pode tomar nos seus formulários. Pode eliminar e clonar os seus formulários, bem como exportar dados de formulários. No entanto, atualmente não é possível cancelar a publicação de um formulário . Se um envio de formulário tiver sido assinalado como spam, será categorizado separadamente nos envios de spam do formulário . Segmentar os seus formulários Para segmentar os seus formulários, pode aplicar filtros com base nos detalhes do formulário à sua tabela de formulários. Este conjunto de filtros pode ser guardado como uma vista que pode aceder sempre que desejar uma visão geral dos formulários que satisfazem os critérios definidos. Saiba mais sobre a criação, personalização e gestão de vistas guardadas . Na sua conta HubSpot, acesse Marketing > Formulários . No topo da tabela, clique no menu suspenso Add view . Pode criar uma vista do zero ou utilizar uma vista existente para criar uma nova vista: Para criar uma vista do zero: Seleccionar Criar nova vista . Na caixa de diálogo, introduza um nome para a sua vista e seleccione que utilizadores podem aceder à vista guardada. Clique em Salvar . A nova exibição aparecerá como outra guia na parte superior da tabela. Para utilizar uma vista existente para criar uma nova vista, seleccione uma vista existente. Seleccione e aplique os seus filtros: Unidade de negócio ( apenas unidades de negócio add-on ) : formulários de filtragem por unidades de negócio associadas. Equipas: filtrar por equipas com acesso ao formulário. Tipo de formulário: filtrar formulários por tipo de formulário, tais como formulários não-HubSpot , formulários regulares, formulários pop-up, ou formulários de comentários em blogues. Todos os filtros: filtrar por eventos de formulário adicionais e informações de formulário, tais como vistas de página, estado, e mais. No painel direito, clicar AND para adicionar mais critérios de filtragem. Para remover os critérios de filtragem existentes, passe o cursor sobre os critérios e clique no delete ícone de apagar . Uma vez terminado, clique no ícone X para fechar o painel. Para actualizar as colunas apresentadas numa vista: No topo da tabela, clicar em Acções > Editar colunas . À esquerda, seleccione as caixas de verificação ao lado dos eventos ou informações do formulário que deseja que apareçam na tabela. À direita, clicar e arrastar as propriedades para as reorganizar na tabela. Para remover uma coluna da tabela, clique no x ao lado do nome da coluna. Para repor a tabela de formulários para a vista por defeito, clique em Repor vista por defeito . Para limpar todas as colunas da tabela, clique em Remover todas as colunas . Isto irá remover todas as colunas excepto a coluna Nome . Clique em Salvar . A exibição das colunas actualizadas dependerá se está a actualizar uma visualização por defeito ou uma visualização personalizada: Se estiver a actualizar o padrão Todos os formulários e vistas publicadas , isto apenas actualizará as colunas apresentadas para estas vistas na sua conta de utilizador. Se estiver a actualizar uma vista personalizada, isto irá actualizar as colunas apresentadas para a vista personalizada para todos os utilizadores com acesso à vista. Uma vez concluída a configuração da sua vista, na parte superior direita da tabela de formulários, clique em Guardar vista . Se criou uma nova vista do zero ou se está a actualizar uma vista existente, clique em Guardar . Se estiver a utilizar uma vista existente para criar uma nova vista, clique em Guardar como novo . Depois de criar e guardar a sua vista personalizada, para gerir as suas vistas, clique em Todas as vistas . Aprenda a editar, clonar, ou apagar as suas vistas personalizadas . Organizar formulários com pastas Segmentar e organizar os seus formulários com pastas de formulários. Pode criar novas pastas e depois mover formulários individualmente ou em massa para essas pastas: Na sua conta HubSpot, acesse Marketing > Formulários . No canto superior direito, clicar em Folders . Para criar uma nova pasta: No painel da esquerda, clicar em Criar pasta . Na caixa de diálogo, introduza o nome da sua pasta . Clique em Criar . A sua nova pasta aparecerá no painel da esquerda da página. Para renomear ou apagar uma pasta: No painel da esquerda, clicar no nome da pasta . Todos os formulários adicionados à pasta serão exibidos na tabela. Para renomear uma pasta, no canto superior esquerdo, clicar em Acções > Renomear pasta . Para apagar uma pasta, no canto superior esquerdo, clique em Acções > Apagar pasta . Para mover formulários individuais para uma pasta: Passe o cursor sobre o formulário para se mover. Depois, clique e arraste o dragHandle para arrastar o formulário para uma pasta existente. Em alternativa, clique em Actions > Move to folder . Depois, seleccione uma pasta e clique em Mover . Para mover múltiplos formulários para uma pasta: Seleccione as caixas de verificação ao lado dos formulários a mover. Depois, clique e arraste o dragHandle para arrastar os formulários para uma pasta existente. Todos os formulários seleccionados serão movidos para a pasta. Formar acções A partir do painel de instrumentos dos formulários, pode tomar medidas nos seus formulários: Na sua conta HubSpot, acesse Marketing > Formulários . Passe o ponteiro do mouse sobre um formulário e clique no menu suspenso Ações para: Visualização: teste e visualize o formulário como uma página independente. Detalhes: visualize a página de detalhes do formulário. Compartilhar: visualize e copie o código incorporado do formulário e o link direto. Saiba mais sobre a partilha de um formulário num site externo . Visualizar envios: obtenha uma visão geral dos envios de formulário . Exportação de submissões: exportar todas as submissões no formulário num ficheiro CSV, XLS, ou XLSX. Ver carregamentos de ficheiros: aceder a todos os ficheiros submetidos através de um campo de carregamento de ficheiros no formulário. Esta opção não aparecerá se nenhum arquivo foi carregado nos envios de formulário. Criar uma lista de contactos ( apenas Marketing Hub Starter , Basic , Professional , ou Enterprise ) : criar uma lista de contactos que submeteram o formulário Criar tradução: criar uma versão traduzida do formulário . Comparar formulários: compare o formulário com os outros formulários na ferramenta de comparação de formulários. Gerir o Acesso ( Centro de Marketing Apenas empresas ) : seleccionar quais os utilizadores e equipas que têm acesso a este conteúdo Mover para pasta: mova o formulário para uma pasta. Eliminar: eliminar o formulário seleccionado . Para editar um formulário, passe o cursor sobre o nome do formulário e clique em Editar . Saiba mais sobre a eliminação de um formulário . Para clonar um formulário, passe por cima do nome do formulário e clique em Clone . Saiba mais sobre a clonagem de uma forma . Excluir formulário Se já não precisar de um formulário, aprenda a eliminar o seu formulário. Se o formulário for actualmente utilizado em qualquer página do HubSpot, não pode ser apagado e a opção Apagar formulário será apagada a cinzento. Remova o formulário de qualquer página da HubSpot para exclui-lo. Pode ver que páginas estão actualmente a utilizar o formulário, clicando no número da coluna Aparecer na coluna. Assim que um formulário HubSpot for eliminado, por favor note o seguinte: O formulário não será mais carregado em nenhuma página externa ao vivo. O formulário não estará disponível para uso em listas, fluxos de trabalho e relatórios. Os dados de envio anteriores não podem ser exportados, mas permanecerão nos registros de contato relevantes. Não serão aceitos novos envios para um formulário excluído usando a API de formulários do HubSpot . Para excluir formulário: Na sua conta HubSpot, acesse Marketing > Formulários . Para apagar um formulário individual: Passe o cursor sobre o formulário que pretende apagar, depois clique em Actions > Delete . Na caixa de diálogo, clicar em Apagar formulário . Para apagar os seus formulários em massa: Seleccione as caixas de verificação ao lado dos formulários que pretende eliminar. No canto superior da tabela, clique em Excluir . Na caixa de diálogo, clicar em Eliminar . Clonar formulário Pode clonar um formulário HubSpot como ponto de partida para um novo formulário ou utilizar o formulário clonado com uma campanha diferente. Ao clonar os seus formulários, por favor note o seguinte: Se tiver o Complemento de unidades de negócio : Se for selecionada uma unidade de negócio diferente durante a clonagem, as opções de privacidade de dados e os e-mails de acompanhamento não serão adicionados. Pode adicionar manualmente estas opções à forma clonada. Se for selecionada a mesma unidade de negócio, as opções de privacidade de dados e os e-mails de acompanhamento serão clonados e corresponderão ao formulário original. Se estiver a utilizar contactos de marketing e a opção Definir contactos criados como contactos de marketing estiver activada, apenas os utilizadores com acesso a Contactos de marketing poderão clonar o formulário. Para clonar uma forma: Na sua conta HubSpot, acesse Marketing > Formulários . Passe o ponteiro do mouse sobre o formulário que você deseja. Clique em Clone . Na caixa de diálogo, introduza o nome do seu novo formulário . Se tiver o suplemento Unidades de negócio, seleccione uma unidade de negócio para o formulário clonado. Clique em Clone . Será direcionado para o editor do formulário clonado. Dados do formulário de exportação Após configurar os seus formulários, se for um super administrador ou tiver permissões de exportação , pode exportar uma folha de cálculo dos dados do seu formulário com os filtros do seu painel de instrumentos actual, para partilhar informações com intervenientes externos. Para exportar os dados do seu formulário: Na sua conta HubSpot, acesse Marketing > Formulários . Na parte superior direita da tabela, clicar em Acções > Exportar formulários . Configure o seu ficheiro de exportação: Nome: introduza um nome para a sua exportação. Formato: seleccione um formato para a sua exportação, pode exportar os detalhes da sua campanha num ficheiro csv, xls, ou xlsx. Enviar para: isto será definido para o seu e-mail de utilizador do HubSpot por defeito. Clique Exportar para receber um e-mail com um link para descarregar o ficheiro de exportação. Este link para download será válido por 90 dias. Também é possível rever e aceder à exportação de dados do formulário a partir das definições Importar e exportar . Forms",https://knowledge.hubspot.com/pt/forms/manage-your-forms
855,Gerencie e responda mensagens SMS de marketing na caixa de entrada de conversas,"Se você comprou o Complemento de acesso SMS e configurar mensagens no HubSpot , você poderá conectar seu número de SMS como um canal no caixa de entrada de conversas . Uma vez conectado, você pode revisar, organizar e responder mensagens SMS recebidas em sua caixa de entrada. Você também pode usar dados do canal SMS em fluxos de trabalho baseados em conversas e na ferramenta de relatórios. Conecte o SMS como um canal na sua caixa de entrada Para conectar um dos seus números de SMS como canal de caixa de entrada: Na sua conta HubSpot, clique no ícone de configurações settings icon na barra de navegação superior. No menu da barra lateral esquerda, navegue até SMS . Na guia Telefones , role para baixo até a seção Service (Serviço), passe o mouse sobre um dos números de telefone registrados e clique em ManageManage (Gerenciar). No painel direito, em Gerenciamento de respostas , clique em Conectar . Selecione uma caixa de entrada à qual conectar o número do SMS ou clique em Ir para configurações da caixa de entrada para criar uma nova caixa de entrada. Na parte inferior do painel, clique em Salvar . Seu número de SMS aparecerá na lista de caixas de entrada conectadas. Crie uma visualização de SMS na caixa de entrada de conversas Depois de conectar seu número SMS, as mensagens SMS recebidas aparecerão na lista de conversas associadas a qualquer um dos filtros de status na barra lateral esquerda (por exemplo, Tudo aberto , Tudo fechado , Enviado , etc.), mas você também pode criar uma visualização personalizada para filtrar mensagens específicas dos seus canais de SMS conectados. Para criar uma visualização personalizada para mensagens SMS: Na sua conta HubSpot, acesse CRM > Caixa de entrada . Na parte inferior esquerda, clique no menu suspenso Ações e selecione Criar uma exibição . No painel direito, digite SMS para o nome da visualização e clique em Próximo . Na seção Tipo de filtro , selecione Propriedades de conversas . Na barra de pesquisa, pesquise e selecione Origem . Clique no é qualquer um menu suspenso e, em seguida, pesquise e selecione SMS . Clique em Aplicar filtro e depois clique em Criar exibição . A nova visualização aparecerá abaixo dos outros filtros e visualizações padrão da caixa de entrada. Saiba mais sobre como criar e gerenciar visualizações personalizadas na caixa de entrada de conversas em Este artigo . Responder a mensagens SMS recebidas Quando um contato recebe uma mensagem SMS que você enviado ou agendado ou por meio de um fluxo de trabalho , eles poderão responder à mensagem. Todas as respostas enviadas aparecerão como uma nova conversa na sua caixa de entrada. Os agentes na sua caixa de entrada poderão revisar os dados do CRM associados ao contato e responder ao contato, desde que ainda estejam optou por receber mensagens SMS . Clique em um Conversa por SMS para ver o histórico da conversa e use o editor de respostas para compor uma resposta. Observe: As mensagens recebidas e enviadas da caixa de entrada são contabilizadas no uso mensal do segmento de SMS. Conforme aplicável, as mensagens MMS recebidas são contadas como 5 segmentos de mensagem. Revise as atividades de SMS na linha do tempo do contato Você pode revisar conversas por SMS diretamente na linha do tempo de contato do destinatário, juntamente com outros detalhes e atividades importantes do contato: Na sua conta HubSpot, acesse CRM > Contatos . Clique no nome de um contato ao qual você respondeu. Clique no Atividades aba. Clique no Filtrar por menu suspenso. Selecione os Selecionar tudo caixa de seleção para limpar quaisquer filtros de atividade existentes e selecione a opção SMS caixa de seleção. Uma resposta por SMS aparecerá como um Conversa por SMS na linha do tempo recorde. SMS",https://knowledge.hubspot.com/pt/sms/manage-and-reply-to-marketing-sms-messages-in-your-conversations-inbox
