id,titulo,conteudo,link
2187,Importar artigos da base de conhecimento,"Você pode importar artigos de um central de conhecimento externo hospedado no Freshdesk, Help Scout, Zendesk ou Intercom para o HubSpot. Você também pode importar a central de conhecimento de um arquivo CSV. Observe o seguinte: não é possível importar tabelas em um central de conhecimento. Importar seu central de conhecimento da URL da home page Na sua conta HubSpot, clique no ícone de configurações settings icon na barra de navegação superior. No menu da barra lateral esquerda, navegue até Contente > Base de conhecimento . Na seção Modo de exibição atual , clique no primeiro menu suspenso e selecione GerenciarImportar central de conhecimento . Em contas com o complemento unidades de negócios , este será o segundo menu suspenso. Selecione a opção Smart copy e clique em Avançar . Na caixa de diálogo, insira o URL externo existente da home page do Central de conhecimento . A URL da página inicial deve incluir os links dos artigos que você deseja importar. Note que apenas 400 artigos podem ser incluídos em uma única importação. Clique no menu suspenso HubSpot central de conhecimento e selecione um central de conhecimento . Selecione uma opção para importar seus artigos: Importar e publicar: os artigos importados serão imediatamente publicados ao vivo para os visitantes verem. Importar como rascunho: os artigos importados serão importados como rascunhos em seu central de conhecimento e só poderão ser vistos pelos visitantes depois que forem publicados manualmente. Clique em Importar para iniciar o processo de importação. Para verificar o andamento da importação: Na sua conta da HubSpot, acesse Conteúdo > Central de Conhecimento . Clique na guia Artigos . Na parte superior da página, exiba o andamento da importação. Importar sua central de conhecimento de um arquivo CSV Antes de começar Examine um arquivo CSV de exemplo para formatar o conteúdo do central de conhecimento para a importação. Observe que os seguintes campos em são obrigatórios: URL Título Categoria Corpo do Artigo Importar central de conhecimento Na sua conta HubSpot, clique no ícone de configurações settings icon na barra de navegação superior. No menu da barra lateral esquerda, navegue até Contente > Base de conhecimento . Na seção Modo de exibição atual , clique no primeiro menu suspenso e selecione GerenciarImportar central de conhecimento . Em contas com o complemento unidades de negócios , este será o segundo menu suspenso. Selecione a opção de carregamento de arquivo CSV e clique em Avançar . Clique no menu suspenso Qual plataforma de central de conhecimento você está usando no momento e selecione a plataforma onde você está hospedando seu central de conhecimento no momento. Clique no menu suspenso HubSpot central de conhecimento e selecione um central de conhecimento . Na seção Carregamento de arquivo CSV, clique em Selecionar um arquivo e carregue o arquivo CSV. Na parte inferior direita, clique em Copiar artigos . Mapear as colunas do arquivo de importação Em seguida, você mapeará as colunas do seu arquivo CSV para as propriedades correspondentes no seu novo central de conhecimento HubSpot. Saiba mais sobre as propriedades do artigo HubSpot abaixo. Para ver um exemplo de como formatar seu arquivo CSV e o conteúdo do artigo que você está importando, reveja o arquivo de importação CSV de exemplo . URL (obrigatório) : insira o URL de cada artigo nesta coluna. Título (obrigatório) : insira o título de cada artigo nesta coluna Categoria (obrigatório) : informe a categoria para cada artigo nesta coluna. Para definir o valor em HubSpot como Não categorizado, você pode deixar este campo em branco no seu arquivo. Subcategoria : informe a subcategoria para cada artigo nesta coluna. Corpo do Artigo (obrigatório) : nesta coluna, informe o código-fonte do conteúdo do artigo, incluindo URLs de imagens. Para obter um exemplo de como formatar o corpo do artigo, consulte o arquivo de importação CSV de exemplo . Palavras-chave : insira as palavras-chave de pesquisa para cada artigo, separadas por vírgulas, nesta coluna. Observe o seguinte: se alguma palavra-chave tiver um espaço após a vírgula separando-a da próxima palavra-chave, você receberá um erro informando que essas marcas não puderam ser importadas. Subtítulo : insira o subtítulo de cada artigo nesta coluna. Para mapear o conteúdo do artigo dos seus arquivos CSV para o seu novo central de conhecimento no HubSpot: Clique no menu suspenso para editar a propriedade de central de conhecimento HubSpot para a qual uma coluna deve mapear. Quando terminar, clique em Avançar na parte inferior direita. O processo de importação pode demorar alguns minutos para concluir. Clique em retornar ao painel para ver o status da importação. Concluir a importação Depois que os dados CSV forem importados, você poderá concluir a importação do central de conhecimento. No painel de controle, clique em Revisar resultados para revisar os dados do arquivo CSV. Clique em Excluir para excluir a importação. Na página de resultados, veja os artigos que estão prontos para serem importados. Você também pode clicar na guia Erros para visualizar quaisquer erros no seu arquivo de importação. Marque as caixas de seleção ao lado dos artigos que você deseja importar e clique em Importar no canto inferior direito. Na caixa pop-up, selecione uma opção para como os artigos são publicados: Importar todo o conteúdo como ""Rascunho"": os artigos importados serão importados como rascunhos em seu central de conhecimento e só poderão ser vistos pelos visitantes depois que forem publicados manualmente. Importar todo o conteúdo como ""Publicado"": os artigos importados serão imediatamente publicados ao vivo para os visitantes verem. Para substituir o conteúdo existente que tenha o mesmo URL de um artigo importado, marque a caixa de seleção para Substituir qualquer conteúdo existente pelo conteúdo importado. Clique em Salvar para finalizar a importação. No painel de importação, veja o progresso da importação. Depois de concluir, clique em Exibir artigos para visualizar os artigos importados. Knowledge Base",https://knowledge.hubspot.com/pt/knowledge-base/import-knowledge-base-articles
2188,Manage enumeration property options,"You can edit enumeration properties , such as dropdown select and multiple checkboxes, to add or remove options, copy options from other enumeration properties, and merge property options. You can also add colors to the options for a visual indicator. Add or remove property options manually To manually add a property option to a property: In your HubSpot account, click the settings settings icon in the top navigation bar. In the left sidebar menu, navigate to Properties . Hover over the property you want to edit, then click Edit . Click the Field type tab, click + Add option . Enter the label for your new property option. By default, the internal value will be the same as the label. To change the internal value of a new option, enter a new value into the internal value field. Once this is set, you won't be able to change this. To prevent the option from being used in forms, click to toggle the In forms switch off. If you want the option to appear in your forms, leave it toggled on. To save your changes, click Save . Once saved, your internal values will be set and cannot be updated. To remove property options, select the checkboxes next to the options, then click delete Delete at the top of the table. Please note: default properties, and their options, generally cannot be edited or deleted. Copy options from one property to another To copy options from one property to another: In your HubSpot account, click the settings settings icon in the top navigation bar. In the left sidebar menu, navigate to Properties . Hover over the property you want to edit, then click Edit . Click the Field type tab, click Load options. In the pop-up, you can select pre-defined options, paste your own options, or copy them from another property. Click Load options . All of the property options you selected or added will be copied into the target property. To apply your changes, click Save . After copying, the property will keep all its previous values, but will now contain all values from the copied property. You can merge property options to combine similar options. Merge property options Merging property options combines several options into one option. This updates any objects that had the previous option to the new option. For example, if you merged the option New into the option Brand new , all contacts that had the New option will now have Brand new . Before merging property options, keep the following in mind: Merging eliminates property options, which may impact integrations that rely on internal values. Merging will not update any lists, workflows, or filters that are using the value that was merged. You will need to manually update those lists, workflows, or filters manually to use the new value. To merge property options: In the property editor, select the checkboxes next to the property options you want to merge. Then, click merge Merge . In the dialog box, click the Select the option to be merged into dropdown menu to select the property value you want to keep. All the other selected options will be merged into the selected value. If any records currently have one of the selected options, you'll need to confirm your merge by entering the number of affected objects. To merge the property options, click Merge & Save property . Learn more about how to manage your properties . Add colors to property options You can add colors to property options to visually identify selected values on your records. For example, you can add red, yellow, and green dots to a custom status property. In the property editor under the Option display mode section, select a display option . You will see different options depending on the field type. In the table, select a color . Please note: you cannot apply colors to the following: Pipeline stage properties (e.g. deal pipeline stage or contact lifecycle stage ). Instead, you can use object tags to color records in your pipelines. Property sync field type properties ( Professional or Enterprise only). To view the color changes, navigate to your records . properties CRM",https://knowledge.hubspot.com/properties/manage-enumeration-property-options
2189,Excluir e restaurar fluxos de trabalho,"Saiba como excluir e restaurar fluxos de trabalho excluídos anteriormente no painel de fluxos de trabalho. Ao selecionar fluxos de trabalho para eliminar, pode rever os fluxos de trabalho não utilizados . É possível eliminar fluxos de trabalho individualmente ou em bloco. Quaisquer fluxos de trabalho eliminados podem ser restaurados no prazo de 90 dias após terem sido eliminados. Excluir fluxos de trabalho Para excluir um fluxo de trabalho individual: Na sua conta HubSpot, acesse Automações > Fluxos de trabalho . Na página de fluxos de trabalho, passe o rato sobre w orkflow . Em seguida, clique em Actions e seleccione Delete . Na caixa de diálogo, clique Excluir fluxo de trabalho . O fluxo de trabalho será eliminado e aparecerá a cinzento no seu painel de fluxos de trabalho até atualizar a página. Para excluir fluxos de trabalho em massa: Na sua conta HubSpot, acesse Automações > Fluxos de trabalho . Na tabela, seleccione as caixas de verificação junto aos fluxos de trabalho que pretende eliminar. Clique em Eliminar na linha do cabeçalho. Os fluxos de trabalho serão eliminados e aparecerão a cinzento no seu painel de fluxos de trabalho até atualizar a página. Restaurar fluxos de trabalho A partir do painel de controlo dos fluxos de trabalho, pode restaurar fluxos de trabalho que tenham sido eliminados nos últimos 90 dias . Quando você restaura um fluxo de trabalho excluído, o HubSpot cria o fluxo de trabalho como um novo fluxo de trabalho inativo. Atenção: restaurar um fluxo de trabalho não irá restaurar qualquer histórico ou dados do fluxo de trabalho. Para restaurar um fluxo de trabalho excluído: Na sua conta HubSpot, acesse Automações > Fluxos de trabalho . Na parte superior, clique no separador Deleted . Coloque o cursor do rato sobre o fluxo de trabalho que pretende restaurar e clique em Clone . Na caixa de diálogo, clique em Clone . O fluxo de trabalho restaurado será adicionado ao seu painel. Os fluxos de trabalho restaurados manterão o seu nome original, juntamente com um indicador de que o fluxo de trabalho foi restaurado, como Nome do fluxo de trabalho (Restaurado em 26/08/2019) . Workflows",https://knowledge.hubspot.com/pt/workflows/delete-and-restore-workflows
2190,"Visualize, baixe e pague sua fatura da HubSpot","Os contatos de cobrança receberão uma fatura em sua conta da HubSpot no início do ciclo de cobrança. Se seu contrato for estabelecido em termos de faturamento, um e-mail com as informações da fatura também será enviado. Após o pagamento, um recibo será enviado ao administrador de cobrança da sua conta. Exibir e baixar sua fatura da HubSpot Para exibir e baixar sua fatura da HubSpot: Na sua conta da HubSpot, clique no nome da conta no canto superior direito e em Conta e cobrança . Clique na guia Transações . Por padrão, todas as transações serão exibidas em uma tabela com a transação mais recente na parte superior. Use o menu à esquerda para navegar entre seus reembolsos, pagamentos, faturas e pedidos. Clique em Exibir em uma fatura para exibi-la em uma nova guia. Clique em Baixar para fazer download de um PDF. Pagar sua fatura da HubSpot Você precisa ser um administrador de cobrança para pagar a fatura da sua conta da HubSpot. Quando várias faturas estiverem em atraso, você verá um banner de atraso na parte superior da tela Conta e cobrança . Para pagar uma fatura: Na sua conta da HubSpot, clique no nome da conta no canto superior direito e em Conta e cobrança . Clique na guia Transações . Na parte superior, você verá o número de faturas vencidas juntamente com o valor total. Para pagar todas as faturas de uma só vez, clique em Pagar todas as faturas . Na guia Transações , você também pode adicionar, editar ou remover um número de pedido de compra de uma fatura. Para adicionar um número de compra a uma fatura aberta, clique em Adicionar número do pedido de compra na coluna Número da PO . Se você adicionou anteriormente um número de pedido de compra, poderá atualizá-lo ou removê-lo clicando em Editar ou Remover na coluna Número da PO . Para pagar apenas uma fatura, clique em Pagar agora ao lado da fatura mais antiga. No painel direito, selecione o método de pagamento: Para usar um método de pagamento existente, selecione o método de pagamento listado. Para adicionar um novo cartão de crédito, clique em Gerenciar métodos de pagamento . Saiba mais sobre como adicionar um novo método de pagamento . Clique em Pagar fatura para concluir sua transação. Exibir seu recibo da HubSpot Depois que sua fatura for paga, os recibos serão enviados ao administrador de cobrança da conta e também poderão ser acessados nas configurações da conta. Para baixar um recibo: Na sua conta da HubSpot, clique no nome da conta no canto superior direito e em Conta e cobrança . Clique na guia Transações . À esquerda, clique em Pagamentos . Clique em Exibir em um pagamento para exibir o recibo em uma nova guia. Clique em Baixar para fazer o download de um PDF do recibo. Perguntas frequentes Como altero minha frequência de cobrança? Para alterar a frequência de cobrança do seu contrato de mensal para anual, ou vice-versa, entre em contato com seu gerente de contratos. Se você não tiver as informações de contato do gerente de contratos, clique em Ajuda no canto inferior direito da sua conta da HubSpot para entrar em contato com o Suporte da HubSpot. Como altero meu contrato para termos de cartão de crédito automáticos? Para alterar o contrato para os termos de cartão de crédito automático, entre em contato com seu gerente de contratos. Se você não tiver as informações de contato do gerente de contratos, clique em Ajuda no canto inferior direito da sua conta da HubSpot para entrar em contato com o Suporte da HubSpot. Posso receber a fatura da minha conta da HubSpot antes da data da cobrança? Entre em contato com a equipe de cobrança pelo e-mail billing@hubspot.com para obter ajuda. Saiba mais sobre como gerenciar suas informações de cobrança . Como faço para trocar o usuário que recebe nossas faturas? Os seguintes usuários receberão notificações de fatura: contato principal da conta, contatos de cobrança e tomador de decisões. Para alterar o usuário: Na sua conta da HubSpot, clique no nome da conta no canto superior direito e em Conta e cobrança . Clique na guia Informações da empresa . Clique nos menus suspensos nas seções Contato principal da conta , Contatos de cobrança e Outros contatos e selecione o novo usuário que deverá receber as informações de cobrança e renovação da HubSpot. O que devo fazer se sou isento de impostos/IVA, mas foi cobrado imposto/IVA? De acordo com os Termos de serviço da HubSpot , se estiver localizado na União Europeia, todas as taxas são exclusivas de IVA e você declara que está registrado para efeitos de IVA no seu Estado-Membro. A pedido da HubSpot, você fornecerá seu número de registro em seu Estado-Membro para efeitos de IVA. Caso você não forneça um número de registro de IVA antes da finalização da compra, a HubSpot não emitirá reembolsos ou créditos para nenhum valor de IVA que tenha sido cobrado. Se você tiver um certificado de isenção de IVA, envie seu certificado de isenção de IVA para billing@hubspot.com para obter suporte. Para clientes localizados nos Estados Unidos, envie o formulário de Isenção de Imposto sobre Vendas por e-mail para billing@hubspot.com para obter suporte específico para isenção de imposto dos EUA. Posso adicionar um número de pedido de compra à minha fatura da HubSpot? Sim. Depois de receber um orçamento, você pode adicionar um número de PO na etapa Detalhes do pagamento durante a finalização da compra. Esse número aparecerá no primeiro conjunto de faturas relacionadas à compra. Posteriormente, você poderá atualizar ou remover esse número em faturas abertas na guia Transações . billing",https://knowledge.hubspot.com/pt/account/how-can-i-pay-my-invoice-with-my-credit-card
2191,Add a JavaScript file to HubSpot,"You can host and edit JavaScript files in the design manager. Learn how to create a JavaScript file and link it to a template or domain. Create a JavaScript file In your HubSpot account, navigate to Content > Design Manager . In the left sidebar menu, click File > New file . You may need to click the folder folder icon to expand the menu. In the dialog box, click the What would you like to build today? dropdown menu and select JavaScript . Click Next . In the File name field, enter a name for your JavaScript file. To update the file's location, in the File location section, click Change and select the folder to add the file to. Click Create . Type or paste your JavaScript into the code editor. If you've enabled ESLint , you can see any JavaScript warnings or errors by clicking to toggle the Show output switch on. In the upper right, click Publish changes to take your changes live. Attach a JavaScript file to a template In the finder on the left, click the template you want to update. In the inspector on the right, click the Edit tab. In the Linked JavaScript files section, click the Add dropdown menu and select your JavaScript file . In the upper right, click Publish changes to take your changes live. Include a JavaScript file on HubSpot pages You can include your JavaScript file on all the pages of a HubSpot-hosted domain, or on individual pages by using the public URL. To access the file's public URL: In the left sidebar menu, select your JavaScript file . Click Actions > Copy public URL . To add the file to all your HubSpot pages on a domain: In your HubSpot account, click the settings settings icon in the top navigation bar. In the left sidebar menu, navigate to Content > Pages . Click the Choose a domain to edit its settings dropdown menu and select the domain to add the JavaScript file to. You can select Default settings for all domains if you want the JavaScript file to apply to all connected domains. In the Site footer HTML section, paste the public URL as the value for the script tag’s source: <!-- start Main.js Do Not Remove --> <script src=' insert your file's public URL here '></script> <!---End Main.js--> Click Save . Or, to add the file to an individual page: Navigate to your content: Website Pages : In your HubSpot account, navigate to Content > Website Pages . Landing Pages : In your HubSpot account, navigate to Content > Landing Pages . Hover over the page that you want to edit, then click Edit . In the page editor, click the Settings menu and select Advanced . . In the Footer HTML section of the dialog box, paste the public URL as the value for the script tag's source: <!-- start Main.js Do Not Remove --> <script src=' insert your file's public URL here '></script> <!---End Main.js--> In the top right, click Publish or Update . Design Manager",https://knowledge.hubspot.com/design-manager/add-a-javascript-file-to-hubspot
