id,titulo,conteudo,link
1301,Optimize your marketing email for mobile devices,"If you're drafting a marketing email , you can hide specific sections for recipients on desktop or mobile email clients, as well as change the column configuration and overall layout to tailor to users reading your email on smaller devices. Tailoring your email to different devices can help boost engagement and enhance the overall user experience of your emails. Please note: this feature is only available when using the drag and drop email editor . Custom coded email templates will still require a developer to create media queries to account for differences in email client size and device type. Email client support Most major email providers support the mobile optimization settings that HubSpot provides in the marketing email editor, but the following email clients do not currently support mobile optimized emails: Yahoo! Mail on Android AOL Mail on Android Gmail IMAP (i.e., using the Gmail app with a non-Google account) Some versions of Samsung Mail, such as using an Outlook account connected to Samsung Mail. If using one of the clients listed above, HubSpot's mobile optimization features that insert media queries that are specific to desktop or mobile will not be applied. Sections set to be hidden for desktop or mobile will also be visible. Limitations You cannot set module settings to different values between desktop and mobile clients. For example, you can't configure the font size, padding, or module alignment to appear differently between client types. However, you can create a desktop-specific section that includes any modules you need, with each module configured to appear the way you need for recipients on their desktop, then ensure that it's hidden for mobile clients. Then, clone the section, customize the new section to be optimized for mobile clients, and set it to be hidden for desktop clients. Learn more about configuring the client-specific visibility settings in the sections below. Hide modules and sections on desktop or mobile To customize which modules or sections appear for desktop or mobile recipients: In your HubSpot account, navigate to Marketing > Email . Click the name of a drafted email, or click Create email in the top right to create a new email . Click the desktop desktop icon or mobile mobile icon at the top of the email editor to configure the settings for each client type. Hover over a module or section and click the hide hide icon to hide that module in the version of the email you're editing. To show all hidden modules for a version you're editing, click Show all hidden at the top of the email editor. You can click the view view icon to toggle a hidden module back to visible for that version of the email. In the left pane, you can select the Show as maximum width on mobile devices checkbox to ensure the module or section appears as full width for mobile recipients. Customize email layout for mobile or desktop To configure different layout settings between mobile and desktop clients: In the left pane, click the Content tab. To customize how an email section will appear between desktop and mobile: Click one of the email sections . Under the Visibility section, you can toggle the All devices switch off, then click Show or Hide under the respective Desktop and Mobile sections. In the Layout section, toggle the All devices switch off, then configure the column layout for Desktop and the stacking layout for mobile. You can then edit the section styling for either mobile or desktop clients. Edit the Body color , Border width and type , Background type , and Background color associated with mobile or desktop recipients. To customize how a template appears for desktop or mobile recipients: In the left pane, click Design . In the Template section, toggle the All devices switch off. You can then edit the template styling for either mobile or desktop clients. Edit the Body color , Border width and type , Background type , and Background color associated with mobile or desktop recipients. When you're done editing the visibility and layout settings for your email, you can preview how the email will appear in a number of common email clients. Marketing Email",https://knowledge.hubspot.com/marketing-email/optimize-marketing-email-for-mobile-devices
1302,Requisitos técnicos para conectar minha caixa de entrada à HubSpot usando IMAP,"Para ligar a sua caixa de entrada ao HubSpot , o seu servidor de e-mail deve suportar IMAP (Internet Message Access Protocol) e SMTP (Simple Mail Transfer Protocol). Veja a seguir os requisitos para conectar sua caixa de entrada usando IMAP. Este artigo tem recursos técnicos e definições para sua equipe de TI ou administrador de e-mail. Se o seu servidor de e-mail não estiver atualmente configurado para IMAP, trabalhe com seu administrador de TI para garantir que sua caixa de entrada seja configurada corretamente. Observação: a caixa de entrada de conversas não é compatível com uma conexão IMAP. Se estiver a tentar ligar uma conta de correio eletrónico à caixa de entrada de conversações , tem de ligar uma caixa de entrada que esteja alojada no Gmail ou no Office 365. Requisitos do servidor Ao conectar sua caixa de entrada ao HubSpot e enviar e-mails, o HubSpot se conectará ao seu servidor de e-mail usando o TLS (Transport Layer Security). Para acessar a caixa de entrada e enviar um e-mail, são utilizados IMAP e SMTP, respectivamente. Ambas as portas que executam estes protocolos devem estar abertas ao tráfego, ou pode adicionar os IPs que fazem estas ligações à sua lista de permissões. O HubSpot efectuará até cinco ligações simultâneas quando tiver uma caixa de entrada ligada com IMAP. Enquanto estiver ligado, existem duas ligações simultâneas permanentes para que o HubSpot possa sincronizar os e-mails da caixa de entrada e da pasta enviada. Existe ainda uma terceira ligação permanente efectuada se a sua caixa de entrada tiver pastas adicionais. Duas conexões simultâneas temporárias também ocorrem quando você envia um e-mail através da sua caixa de entrada conectada no HubSpot. A porta à qual o HubSpot se liga deve suportar a encriptação. O HubSpot suporta TLSv1.0, TLSv1.1, TLSv1.2, SSLv3 ou atualização STARTTLS para TLSv1.0, TLSv1.1, TLSv1.2, SSLv3 em todas as portas; TLSv2 não é suportado. O HubSpot não suporta uma conexão de caixa de entrada se seu servidor usar Courier-IMAP como o software IMAP. Isto acontece porque o HubSpot não consegue registar as respostas de e-mail no CRM quando as respostas são enviadas para uma caixa de entrada utilizando o software Courier-IMAP. O Nome comum (CN) para o certificado SSL instalado no servidor deve incluir o nome de domínio totalmente qualificado (FQDN) do servidor ao qual o HubSpot está se conectando. Por exemplo, se o seu servidor IMAP for imap.domain.com, o CN no certificado SSL deve incluir imap.domain.com. Configuração Sua configuração de e-mail pode afetar sua capacidade de conectar sua caixa de entrada via IMAP. O IMAP deve ser ativado para que o e-mail seja sincronizado. O HubSpot não suporta uma ligação com o ActiveSync, mas se utilizar o ActiveSync no seu cliente de e-mail, ligue a sua conta utilizando a ligação HubSpot-Exchange . Certificado de segurança No caso de seus certificados SSL não serem assinados por uma Autoridade de Certificação, há uma opção para permitir um certificado não seguro ao iniciar a conexão. Você precisará do nome de usuário e senha apropriados para acessar seu servidor, bem como os nomes dos servidores IMAP e SMTP. Siga estas instruções para obter estas informações ou trabalhe com a sua equipa de TI para determinar as credenciais de início de sessão correctas a utilizar. Adicionar endereços IP à sua lista de permissões É possível que sua equipe de TI permita apenas que determinados endereços IP se conectem à sua caixa de entrada. Se este for o caso, a sua equipa de TI terá de adicionar os endereços IP que a HubSpot utiliza para ligar a sua caixa de entrada à sua lista de permissões. Como os métodos de autenticação, as configurações de segurança e os protocolos disponíveis podem diferir de um servidor de e-mail para outro, pode ser necessário trabalhar com sua equipe de TI para confirmar se seu servidor de e-mail atende aos requisitos acima. Se você tiver dificuldades durante o processo de conexão IMAP, converse com sua equipe de TI ou com o administrador antes de abrir um ticket junto ao Suporte da HubSpot, já que seu departamento de TI pode fornecer as informações específicas necessárias para solucionar problemas aos quais a HubSpot não tem acesso. Connected Email",https://knowledge.hubspot.com/pt/connected-email/technical-requirements-for-connecting-your-inbox-to-hubspot-with-imap
1303,"Create, edit, and attach CSS files to style your site","CSS (Cascading Style Sheets) files are coded files that select elements of your page and control their presentation. CSS files cannot be attached to emails or email templates. This article walks through creating, publishing, and attaching a CSS file in HubSpot. You can learn how to make simple design changes to a particular page . If you're using a theme template, learn how to edit your theme settings . Create a new CSS file In your HubSpot account, navigate to Content > Design Manager . Click the folder icon folder in the upper left-hand corner to expand the sidebar menu. Then click File > New file . In the dialog box, click CSS stylesheet . Then enter a name for your CSS stylesheet and click Create . Edit the CSS file Once you have created or opened an existing CSS file, make your edits in the code editor. In addition to standard CSS, the code editor supports HubL variables and macros to make maintaining your CSS easier. To preview how your HubL will render, click to toggle the Show output switch on at the top of the editor. A panel will open on the right with the rendered preview. To see a list of standard CSS selectors for HubSpot templates, check out Boilerplate CSS . Before publishing, check your code for HubL errors. There are three places to find HubL errors or warnings in a custom module or coded file: In the error console along the bottom of the code editor. In the error gutter along the left-hand side of the code editor. In the scroll bar on the right-hand side of the editor. Errors preventing you from publishing will be in red, while general warnings will be in yellow. At the bottom of the code editor, click Show details to see more information on the errors in the error console and Hide details to collapse the error console. In the error console, there will be links to wherever there are HubL errors or warnings in your code or custom module. Hover over the red error indicators on the left-hand side of the code editor to see the error or warning in your code. Clicking the error will cycle your cursor to all errors or warnings on that line. Clicking a scrollbar annotation will bring you to that part of the file. You can also click a line number within the code editor and have the URL of the file update accordingly. This allows you to share a link to your code with others and direct them to exactly where you're working within the file. After editing the file, click Publish changes in the upper right. If you'd like to call this stylesheet in another coded template, copy the sheet's URL by clicking Actions > Copy public URL in the left sidebar menu. Attach to template In HubSpot, you can attach stylesheets to your content in a few different ways. Below is the order in which attached stylesheets are linked on your site: public_common.css * : a stylesheet primarily used by HubSpot's app, but also for certain site features. Header HTML in settings under Website > Pages : link tags added to the global <head> of the site. Layout.css ** : default responsive CSS file attached to all drag-and-drop template layouts. Attached stylesheets in settings under Website > Pages : stylesheets attached to your entire site. Attached stylesheets in settings under Website > Blog : stylesheets attached to your blog (overrides site global sheets). Linked stylesheets *** : stylesheets attached in the template layout. Additional <head> markup in the template: link tags added to the <head> of a particular template layout. Page-specific stylesheets: stylesheets attached in a page's settings. Page head HTML: link tags added to the <head> of a particular page in the page's settings. * Required ** Required for drag and drop layouts *** Recommended method of stylesheet attachment for template layouts To attach stylesheets to a template, open the template in your design manager. In the right sidebar menu under Head and Body Options , select a file from the Add dropdown menu next to Linked stylesheets . You can edit or remove a stylesheet that's already attached by hovering over it and clicking Edit to make changes to it or the X to remove it. After adding a stylesheet, click Publish changes in the upper right-hand corner to apply your changes to the live pagess using the template. Attach or remove stylesheets on a specific page ( Marketing Hub Professional and Enterprise only) Please note: this option isn't available for theme templates. Learn how to edit your theme settings . To add or remove a page-specific stylesheet from the settings section of the page editor: Navigate to your content: Website Pages : In your HubSpot account, navigate to Content > Website Pages . Landing Pages : In your HubSpot account, navigate to Content > Landing Pages . Click the name of your page. In the content editor, click the Settings menu and select Advanced . In the Page Stylesheets section of the dialog box , click the Attach a stylesheet dropdown menu and select a stylesheet . To remove a stylesheet, click X next to that stylesheet. To turn off stylesheets that are inherited from the template or domain, click the dropdown menu next to the stylesheet and select Disabled . Attach or remove domain stylesheets ( Marketing Hub Professional and Enterprise only) Please note: theme templates must include the annotation enableDomainStylesheets: true in order to use domain-level stylesheets. Learn more about template annotations . To add or remove a stylesheet from all content on a domain: In your HubSpot account, click the settings settings icon in the top navigation bar. In the sidebar menu, click Website > Pages . Click the dropdown menu to select the domain you want to update settings for. On the Templates tab, scroll to CSS & Stylesheets . To add a stylesheet, click + Add style sheet . Click the X beside an attached stylesheet to remove it. Click Save . Please note: when downgrading to HubSpot’s Starter or free tools, attached domain-level stylesheets will remain active until you remove them. Once all stylesheets are removed, you can no longer attach stylesheets at the domain-level. Learn more about downgrading a subscription . Design Manager",https://knowledge.hubspot.com/design-manager/create-edit-and-attach-css-files-to-style-your-site
1304,Use the site speed dashboard,"With the site speed dashboard, you can use real user data to evaluate how well your website performs for visitors against key Web Vitals metrics. You can then use this data to optimize load times and improve user experience. Analyze domain or page performance In your HubSpot account, click your account name in the upper right. In the Account section, locate your account ID beneath your account name. Navigate to app.hubspot.com/site-speed/[account-id] and replace [ account-id] with your account's ID. To analyze a domain: Click the Select a domain dropdown menu at the top of the page and select a domain . Click Analyze . To analyze an individual page: Select Search URL at the top of the page. In the text field, enter a URL , then click Analyze . To set the date range: Click the first date picker at the top of the page. Select a rolling date range , such as Today or Last 30 days , or a custom start date . If you've selected a custom start date, click the second date picker and select a custom end date . Understand site speed reports On the site speed dashboard, you will see the following reports: Performance Overall: this report analyzes the overall performance of your page or domain. Core Web Vitals Trends: this report tracks core web vitals - the different key metrics that measure site speed. It's recommended to aim for Good core web vitals in 75% of visits. Sessions by country: this report tracks your core web vitals by the country associated with the visitor's IP address. Sessions by device type: this report tracks what percentage of your site visits are occurring on different devices. Largest Contentful Paint: this report measures the time it takes for the largest element on the page to render. For the best user experience, this element should appear within 2.5 seconds of the page starting to load for 75% of page visits. First Contentful Paint: this report FCP tracks how long it takes for the initial page ender to complete. It helps calculate consumers' initial visual impressions. Time to First Byte: this report measures the time it takes a user's browser to receive the first byte of a response from the server after making a request. Interaction to Next Paint: this report measures how long it takes for your site to react to the first thing a person does - for example, clicking a button. Cumulative Layout Shift: this report measures web page element stability. For example, buttons that change position before users can click them would contribute to a poor CLS score. Page Performance: this report shows core web vitals of individual pages. Render Strategy: this report measures to what degree your page visits are pre-rendered. Pre-rendered pages are static versions of pages that are stored locally to improve page loading speeds. Learn more about rendering in HubSpot's developer documentation. You can click into individual reports to learn more about how individual assets and pages are performing.",https://knowledge.hubspot.com/seo/use-the-site-speed-dashboard
1305,Set up your HubSpot account,"When setting up a new HubSpot account , learn how to create your account, invite your team, and customize your default settings. If you use any third-party apps, you might also want to connect them to your account to integrate your systems. Below is an overview of the account setup tasks you should complete as an admin. Within each section, you’ll find links to detailed instructions for each task. For in-depth video training, check out Setting Up Your HubSpot Account in the HubSpot Academy. Create your account There are multiple ways to create a HubSpot account. The most common method of signing up for HubSpot is with your name and email address. You can also sign up for HubSpot using your Google login or Apple ID. HubSpot’s account creation page Sign up for HubSpot using your Apple ID After creating your account, you'll automatically be logged in. Learn more about logging in to HubSpot and troubleshooting password issues . Secure your account To further secure your account and lower the risk of unauthorized access, you can set up two-factor authentication (2FA) or single sign-on (SSO) ( Enterprise only). If needed, you can also restrict HubSpot employees from accessing your account. Set up two-factor authentication for your HubSpot login Set up single sign-on (SSO) ( Enterprise only) Set up single sign-on using Active Directory Federation Services (AD FS) Prevent HubSpot employee access to your account Invite your team Invite your team members to the account to start collaborating in HubSpot. You can customize each user’s permissions to control which parts of HubSpot they can access. Once invited, they can log in and set up their profile and personal preferences. Add and remove HubSpot users HubSpot user permission guide Manage your user profile and preferences Create and manage teams ( Professional and Enterprise only) Customize account default settings While some settings apply only to individual users, such as user preferences, other settings are account-wide and impact all users. These settings include account time zone and language, default currencies, and security. While setting up your account defaults, you can also turn on data privacy-related features. Customize default language and region settings Add and edit your account currencies Set up your company branding in HubSpot Turn on data privacy settings in your HubSpot account Connect apps to your HubSpot account If you have contacts and other object records stored in a separate CRM, you can connect that CRM to HubSpot to sync over relevant information. You can also browse HubSpot’s App Marketplace to find and integrate tools you need for your business. Depending on your needs, you can connect integrations from the App Marketplace or build your own with HubSpot’s API endpoints. Connect apps to HubSpot Connect and use HubSpot data sync HubSpot’s App Marketplace HubSpot Developers documentation Get recommendations about setup and usage (BETA) If you have access to the Get more value out of your account with Insights and Recommendations beta , you can view insights to help you activate and better use your HubSpot account. Recommendations are reset at the start of each month. Recommendations can include: Highlighting workflows that aren't currently being used. How to organize your forms into folders to make it easier to find them. How to create workflows to automate your business processes. How to organize unfiled workflows into folders to make it easier to find them. How to resolve the alerts on your connected apps to avoid any disruptions. How to personalize your customer interactions with calling. To review and act upon recommendations: In your HubSpot account, click the settings settings icon in the top navigation bar. In the left sidebar menu, click Account Insights . On the Available tab, recommendations are shown with an explanation and call-to-action (CTA). To take action on the recommendation, click the CTA . Once you've completed a recommended action, it'll display on the Completed tab. Manage AI settings To use generative AI features in your HubSpot tools, you must turn on your AI settings. You can also manage AI's access to your data sources. Learn how to manage your AI settings . Manage your HubSpot subscription You can manage your current subscription from the Account & Billing section of your account. In this section, you can explore add-ons, update your current subscription, and view your billing documentation. Manage your HubSpot subscription HubSpot billing and payment | Frequently Asked Questions View and download your HubSpot invoices and receipts Update your payment method and billing contacts Get help with HubSpot If you're having any technical issues with setting up your HubSpot account, or want to speak to someone about your account, you can reach out to HubSpot Support or your account representative. Learn more about the support resources available to you. Join the HubSpot Community To engage with other users and get more out of your HubSpot tools, join the HubSpot Community. You can see examples from peers, get tips and advice from experts, learn how to troubleshoot common issues, and submit feedback to the Product team. Getting Started With the HubSpot Community Create your Community user account Introduce yourself on the Community welcome forum Get the latest updates from the Community newsletter",https://knowledge.hubspot.com/get-started/set-up-your-account
