id,titulo,conteudo,link
1812,Turn on live validation of form fields (BETA),"If you’ve set validation rules for a property , these rules will be applied when visitors submit a form. With live validation, visitors receive immediate feedback on their input, making it easier to correct errors and complete forms accurately. By default, live validation on forms is turned on. To turn on/off live validation on form fields: In your HubSpot account, click the settings settings icon in the top navigation bar. In the left sidebar menu, navigate to Marketing > Forms . Click the Submission Settings tab. Click to toggle the Enable live validation of form fields switch on/off. In the bottom left, click Save. When this setting is turned on, visitors will receive live feedback based on the validation rules set for the relevant property, and they must meet these requirements to submit the form. For example, if you've set a validation rule for the Order Number property to contain only numeric values, visitors will receive feedback to correct any non-numeric entries. Forms BETA",https://knowledge.hubspot.com/turn-on-live-validation-of-form-fields
1813,Can't connect calendar to the meetings tool,"If you've tried to connect your calendar to the meetings tool but are being redirected to your activity feed or receiving an error, make sure that your permissions and MX records have been set up correctly for your email account. Your may receive an error for one of the following reasons: Your email account doesn't have permission to connect to a third-party app like HubSpot. If you're connecting an Office 365 account, your domain may not be fully set up (normally indicated by an email address that looks like test@mydomain.onmicrosoft.com ). Your calendar may not be hosted by G Suite or Office 365 (can be verified in your email domain's MX records ). The email account for your calendar has already been connected as a team email address in the conversations inbox . In cases 1 to 3, your IT administrator will need to take action to change the setup of your email account in order to allow you to connect your calendar to the meetings tool in HubSpot. In case 4, you may consider removing the connection as a team email address, or using another calendar instead of the calendar associated to your team email. If you're able to connect your default personal calendar but don't see additional calendars to integrate in your meetings settings, ensure that you have access to other calendars or that you can create additional calendars in your email account. Meetings",https://knowledge.hubspot.com/meetings-tool/why-cant-i-connect-to-meetings-with-hubspot-sales
1814,"
	HubSpot Community - Adicione um botão ""Pin It"" do Pinterest à sua postagem do blog - HubSpot Community
","Isenção de responsabilidade de tradução : esse conteúdo foi traduzido para sua conveniência com o uso de software e pode não ter sido revisado por uma pessoa. O texto oficial é a versão em inglês e sempre será o texto mais atualizado. Para ver a versão em inglês, clique aqui .",https://knowledge.hubspot.com/pt/cos-pages-editor/how-do-i-add-a-pinterest-pin-it-button-to-my-blog-post
1815,Connect your personal email,"Connect a personal email account to HubSpot to send one-to-one emails from the CRM, log email replies to the CRM, send sequences emails , and install HubSpot Sales to access the sales tools in your inbox. This email account should be unique to your user and not used by anyone else on your team. It should be the email address you typically use to send emails to your contacts, such as your company email address. By connecting your personal email account, you give HubSpot permission to send emails to your contacts using your company’s email servers. Some HubSpot tools require a personal email connection. You can connect multiple personal emails to HubSpot that your user can use to send emails. A team email address is an email address that multiple users have access to and use to communicate with customers. You can connect a team email address to the conversations inbox or help desk so your team can view, manage, and reply to emails in one place. Please note: users with a View-Only seat cannot connect their personal emails to HubSpot. Learn more about managing seats . Before you get started Below find definitions for terms relevant to the email connection process. Term Definition Email account/address The email address that you use to log in to your email client and send emails to your contacts, such as your company email address (your.name@hubspot.com). Email client The application that you use to access your emails. In some cases, your email client can be the same as your email provider (i.e., Gmail is an email provider and an email client). Email provider The service, such as Gmail or Office 365, that lets you send and receive emails. Please note: HubSpot does not support a connection with ActiveSync, but if you use ActiveSync in your email client, connect your account using the HubSpot-Exchange connection . Connect your email You can connect your personal email in your account settings. Users must have the Personal email access permission to connect an email. In your HubSpot account, click the settings settings icon in the top navigation bar. In the left sidebar menu, navigate to General . Click the Email tab. Click Connect personal email . If you want to turn on inbox automation features when you connect, in the dialog box, select the Turn on inbox automation checkbox. Click Connect your inbox . In the text field, enter your email address . HubSpot will attempt to recommend which email provider you should connect with. Click Connect to [recommended provider] , then continue the steps below for your specific provider to finish connecting your personal email. If HubSpot cannot identify your email provider, select an option , then continue the steps below for your specific provider to finish connecting your personal email. Google/Gmail Microsoft Outlook Microsoft Exchange Other mail provider (IMAP) Gmail Please note: if you connect a Gmail inbox that has an alias set up, that alias will show up automatically in the From dropdown menu in the email composer. The alias must be set up in your Gmail account before you connect your inbox. If you have Google's Advanced Protection Program enabled in your Gmail account, you can't connect your inbox to HubSpot. Read through what to expect when you connect your Gmail inbox to HubSpot, then click Continue . Necessary disclosure: w hen you integrate your Google account with the HubSpot platform, you can connect a number of Google services to your HubSpot account. By doing so, HubSpot will be able to access data and information from your Google account. Those services and types of data are outlined below; Gmail: You can send and receive Gmail messages, schedule email sends, and modify email drafts in the HubSpot app. You will also be able to log and track emails sent in-app. HubSpot will have access to your Gmail data, like email headers, subject lines, and email bodies. We'll only use your Google data to power different parts of our product that connect with the Google Workspace tools you use every day. It's your data. We just want to help you grow better. You can remove the integration in the HubSpot app by navigating to Settings > Integrations > Email Integrations and clicking 'Disable'. You can also revoke HubSpot's access from within your Google account by following the instructions listed here . For more information on the Google integration and the types of data we can access, please see our Privacy Policy . You'll be prompted to log in to your Gmail account. Enter the email address of the Google account you want to use. If you're already logged into one or more of your Gmail accounts, choose the account you want to connect. Review the required permissions, then click Allow . You'll be redirected back to your settings, and a dialog box will appear to inform you that your Gmail inbox is now connected to HubSpot. Necessary disclosure: by using the Gmail email integration with HubSpot, you will grant HubSpot access to information associated with your account, including contacts, emails, calendar, distribution lists, subject lines, and URLs of tracked links from your email, if you use the email tracking functionality. In addition, HubSpot will be able to read, modify, create, and send emails from your connected Gmail account. HubSpot will scan the content of your emails to identify which emails you have elected to track in order to provide you with the notifications feature. HubSpot will store replies, outgoing mail, email headers, subject line, distribution lists, aliases, time sent, and email bodies. Your email may contain sensitive information, such as names of your contacts, your private communications, or financial or medical information. You understand that the correspondences you track will be visible to other users in your HubSpot account. If you connect your Gmail account via IMAP (or Generic Inbox Connection), the Subscription Service will have access only to email address, password, server information, email metadata, and message bodies. Additionally, connecting your Gmail account via IMAP does not require you to connect any other G Suite applications. Microsoft Outlook Please note: you cannot connect Office 365 shared mailboxes to HubSpot. Office 365 GCC High and DOD environments are also not supported by HubSpot. Read through what to expect when you connect your Office 365 inbox to HubSpot, then click Continue . You'll be prompted to log in to your Office 365 account. Enter the email address of the Office 365 account you want to use. If you're already logged into one or more of your email accounts, choose the account you want to connect. You'll be redirected back to your settings where the connection will be verified and completed. A dialog box will appear to inform you that your Office 365 inbox is now connected to HubSpot. Necessary disclosure: if you use the Outlook email integration with HubSpot, HubSpot will have access to information associated with your account, including contacts, emails, calendar, distribution lists, subject lines, and URLs of tracked links from your email, if you use the email tracking functionality. HubSpot will scan the content of your emails to identify which emails you have elected to track in order to provide you with the notifications tool. HubSpot will store replies, outgoing mail, email headers, subject line, distribution lists, aliases, time sent, and message bodies. Correspondences you track will be visible to other users on your HubSpot account. Microsoft Exchange Please note: Microsoft is deprecating Basic Authentication for Exchange Online in October 2022 and requiring Modern Authentication . HubSpot's Exchange integration uses Basic Authentication but is designed for Exchange On-Premises instances, which are not affected by this change and will continue to function with Basic Authentication after October. If you are an Exchange Online user, you can connect to HubSpot's Outlook integration instead. It is compatible with cloud-hosted Exchange and uses OAuth, a form of Modern Authentication. You can reconnect your inbox using the Outlook integration at any time. Before connecting your Exchange inbox, confirm with your IT team that your Exchange server is running Exchange 2010 SP2 and above . Your Exchange email address and password are required in order to connect your inbox, but depending on your Exchange server’s configuration, HubSpot may require additional information to connect. Refer to the table below before connecting your inbox to make sure you have all of the necessary information. Information (*required) Example values Email address* jdoe@hubspot.com Password* HubSpot123 Username jdoe Exchange URL https://email.hubspot.com/ews/exchange.asmx Exchange version Exchange 2010 SP2 and above Please note: If your email inbox uses two-factor authentication, you'll need to enter a third-party app password. Review documentation from Microsoft to learn how to generate a third-party app password . If you're using Exchange Online , connect your inbox to HubSpot with modern authentication using the Outlook integration . Learn more about Microsoft's deprecation of basic authentication in this HubSpot Community post . Read through what to expect when you connect your inbox to HubSpot, then click Continue . You can also review the HubSpot Sales privacy overview before connecting. In the dialog box, enter the following information: Email address: your exchange email address. Pa ssword: your Exchange password. You can also click Show optional fields to enter your Exchange username and Exchange URL. By default, HubSpot will perform Autodiscover, which is an Exchange feature that attempts to identify the Exchange URL based on your domain's DNS. If the Autodiscover process fails, you must provide your username and Exchange URL manually: Username: enter your username. Typically, this is what is listed before the @ symbol in the email address, or your user ID. Exchange URL: enter the URL used to access your Exchange server. Please note: the Exchange URL of your Exchange server will most likely be formatted as https://mail.domain.com/ews/exchange.asmx . If you're not sure what to enter, log into your Exchange mailbox from a web browser, then copy the URL and paste it into the Exchange URL field. HubSpot will be able to detect and recommend the correct Exchange URL. Click Connect inbox . Your connection will be verified and completed, and a dialog box will inform you that your Exchange inbox is now connected to HubSpot. If you encounter an error when connecting your Exchange account, learn more about troubleshooting account connection issues . Necessary disclosure: if you connect your email account via Exchange, HubSpot has access to your email address, password, server information, email metadata, and message bodies. These credentials give HubSpot access to other information associated with your account, such as calendar, contacts, and distribution groups. Other mail provider (IMAP) Before connecting your inbox via IMAP, review the technical requirements with your IT team. You must meet all of the technical requirements before you can connect. You can also review the HubSpot Sales privacy overview before connecting. Please note: if you are trying to connect an email account to the conversations inbox , you need to connect an inbox that is hosted with either Gmail or Office 365. Conversations does not support an IMAP connection. HubSpot does not support Amazon SES and Amazon WorkMail . If you experience issues with your connected email and use either of these email providers to host your email, HubSpot recommends switching email providers to Gmail or Office 365. To connect your inbox using IMAP: Read through what to expect when you connect your inbox to HubSpot, then click Continue . Next, enter the Email address and Password used to log into your email account. In most cases, HubSpot will be able to detect your server's IMAP and SMTP settings after you enter your email address and password. Or, if an admin in your account has already configured your domain's IMAP settings , your IMAP and SMTP server information will populate automatically. Please note: if your email inbox uses two-factor authentication , you'll need to enter a third-party app password. Review documentation from your email provider (e.g., Yahoo Mail or iCloud ) for instructions on how to generate a third-party app password. Learn more about connecting your inbox with two-factor authentication on the Community . If HubSpot does not detect your server's IMAP and SMTP settings, click to expand the Advanced Options . If your outgoing mail (SMTP) does not use the same credentials as incoming mail (IMAP), clear the Outgoing mail uses the same credentials as incoming checkbox, then enter credentials for both outgoing and incoming mail servers. Otherwise, enter your server's username , IMAP server and port , and SMTP server and port in the corresponding fields. You can also select the checkbox beside Trust any certificate if necessary. Learn how to find this server information in your email client . Click Connect inbox . Your connection will be verified and completed, and a dialog box will appear to inform you that your inbox is now connected to HubSpot. Necessary disclosure: if you connect your email account via IMAP (or Generic Inbox Connection), HubSpot will have access only to email address, password, server information, email metadata, and message bodies. Additionally, connecting your Outlook account via IMAP does not require you to connect any other Microsoft applications. Connected Email",https://knowledge.hubspot.com/connected-email/connect-your-inbox-to-hubspot
1816,Crie registros com fluxos de trabalho,"Use um fluxo de trabalho para automatizar o processo de criação de um novo registro no HubSpot e reduza os processos administrativos para você e sua equipe. Usando o Criar registro ação, você pode criar registros para os seguintes tipos de objetos: Contatos Empresas Negócios Tickets (somente Service Hub Professional e Enterprise ) Leads (somente Sales Hub Professional e Enterprise ) Objetos personalizados (somente Enterprise ) Antes de começar Ao criar registros com fluxos de trabalho, lembre-se do seguinte: Ao criar registros do mesmo tipo do fluxo de trabalho, certifique-se de que o registro recém-criado não atenda aos gatilhos de inscrição do fluxo de trabalho. Caso contrário, você pode criar um loop infinito em que registros recém-criados criam novos registros infinitamente. Um endereço de e-mail é obrigatório para criar registros de contato com um fluxo de trabalho. É recomendável usar um token de personalização para inserir um valor do registro inscrito. Por exemplo, se você tiver um formulário de referência no seu site, use o valor da propriedade de referência para criar um novo registro de contato. Para criar registros de objetos personalizados com um fluxo de trabalho, o objeto personalizado deve ser associado ao tipo de objeto do fluxo de trabalho. Por exemplo, se seu objeto personalizado não estiver associado ao objeto de contato, você não poderá criar registros de objetos personalizados em fluxos de trabalho baseados em contato. Saiba mais sobre definindo objetos personalizados . Crie registros com um fluxo de trabalho Na sua conta HubSpot, acesse Automações > Fluxos de trabalho . Clique no nome de um fluxo de trabalho existente, ou criar um novo fluxo de trabalho . Clique no ícone de adição plus para adicionar uma ação do fluxo de trabalho. No painel esquerdo, clique para expandir CRM . Em seguida, selecione Criar registro . Clique no Tipo de registro a ser criado menu suspenso e, em seguida, selecione o Tipo de objeto . As propriedades exibidas em cada Criar registro ação depende do tipo de objeto selecionado: Negócio: os campos obrigatórios são Nome do negócio e Pipeline de negócios e status. Também é recomendável definir o Data de encerramento e Quantia . Saiba mais sobre propriedades de acordo padrão . Bilhete: os campos obrigatórios são Nome do bilhete e Pipeline e status do ticket . Também é recomendável definir o ticket Fonte e Descrição do bilhete . Saiba mais sobre propriedades de tíquete padrão . Contato: o campo obrigatório é E-mail . Também é recomendável definir o contato Primeiro nome e Sobrenome . Saiba mais sobre propriedades de contato padrão . Empresa: o campo obrigatório é Nome de domínio da empresa ou Nome da empresa . Saiba mais sobre propriedades padrão da empresa . Liderar: não há campos obrigatórios ao usar o Criar registro ação com leads, mas geralmente é recomendado preencher o Etiqueta de chumbo e Estágio do pipeline de chumbo. Observe: não é possível usar tokens de personalização em campos numéricos. Para definir a atribuição de registros recém-criados, clique em Atribuir a menu suspenso. Em seguida, selecione entre as seguintes opções: Proprietário existente de [Objeto] : atribuir o novo registro ao proprietário existente do registro registrado. Por padrão, novos registros de negócios, tickets e empresas serão definidos para esta opção. Se o registro inscrito não for atribuído, o novo negócio não será atribuído a ninguém. Para selecionar uma propriedade de proprietário personalizada, clique no menu suspenso Qual proprietário e selecione a propriedade do proprietário . Usuário específico: atribuir o registro a um usuário específico. Para selecionar o usuário, clique no menu suspenso Qual proprietário e selecione o usuário . Ninguém : o registro não será atribuído a ninguém. Por padrão, novos registros de contato não serão atribuídos a nenhum usuário. Se você quiser atribuir um registro de contato: Clique Definir outra propriedade de contato . Clique no Definir outra propriedade de contato menu suspenso e selecione Contate o Proprietário . Defina a atribuição de contato em Atribuir a menu suspenso. Para definir propriedades adicionais para seus novos registros, clique em Defina outra propriedade [objeto] . Para copiar uma propriedade do objeto atual para uma propriedade no seu novo registro, clique em Copiar uma propriedade para uma propriedade [objeto] . Observe: as propriedades de origem e destino devem ser compatíveis tipos de campo para ser copiado. Propriedades incompatíveis irão não aparecem como opções na propriedade de destino na sua ação de fluxo de trabalho. Saiba mais sobre propriedades de origem e destino compatíveis para copiar valores de propriedade em fluxos de trabalho . Configure suas novas associações de registros: Por padrão, os registros criados por um fluxo de trabalho serão associados ao registro que foi inscrito no fluxo de trabalho. Para copiar todas as atividades da linha do tempo do registro registrado para o novo registro: Selecione o Adicionar atividade de linha do tempo do [objeto] registrado ao [novo tipo de objeto] caixa de seleção. Por padrão, quando esta opção é selecionada, os últimos 30 dias de atividade serão copiados. Para selecionar um intervalo de datas diferente, clique em intervalo de datas menu suspenso e selecione um diferente faixa. Para associar o novo registro a outros tipos de registro: Clique + Adicionar outra associação . Clique no Associado menu suspenso. Em seguida, selecione seu tipo de registro . Para adicionar um rótulo de associação, clique em E aplique o rótulo menu suspenso. Em seguida, selecione um rótulo de associação . Para copiar todas as atividades da linha do tempo do registro associado para o novo registro, selecione Adicionar atividade de linha do tempo do [objeto] ao [novo tipo de objeto] . Para selecionar um intervalo de datas diferente, clique em intervalo de datas menu suspenso e selecione um diferente faixa. Se estiver criando um registro de negócio, você poderá associar os negócios recém-criados aos itens de linha: Clique no Adicionar um item de linha menu suspenso para associar um produto ao criar um registro de negócio. Para adicionar outro item de linha, clique em +Adicionar item de linha . Para excluir um item de linha, clique em ícone de lata de lixo à direita do item de linha. Depois de configurar seu Criar registro ação, no topo, clique Salvar . Observe: as cotações só podem ser associadas a um negócio por vez. Associar um novo acordo a cotações existentes removerá as cotações de seus acordos atuais Workflows",https://knowledge.hubspot.com/pt/workflows/create-records-with-workflows
