id,titulo,conteudo,link
651,Transfer certifications to another email address,"If you change your email address in HubSpot, you can transfer completed and in progress certifications associated with your original email address to your new email address. Please note : To transfer certifications to a new email address, that email address must be associated with a user in a HubSpot account. Learn more about creating users in your HubSpot account . Expired certifications will not be transferred. Depending on your HubSpot subscription , some certifications will not be transferred. For example, if you're a user in a Solutions Partner account , partner-specific certifications will not be transferred to a non-partner account. To transfer your certifications: In your HubSpot account, click your account name in the top right corner, then click HubSpot Academy . Click the My team tab, where you can view the certification status of all users in the account. Locate your existing email address. Click the Manage certificates dropdown menu under the email address, then select Transfer certificates to a new email address . In the dialog box, enter the New email address to transfer your certificates to , then click Transfer . Review and confirm the certificates that will be transferred to the new email address, then click Yes, transfer . You'll be redirected back to the My team tab with an in-app message: ""We've sent an email with a link to [new email address] . Click on the link in the email to confirm your address and finish the transfer."" Navigate to your new email address inbox and open the email with the subject Transferring your awards . If the email does not appear in your inbox, check any Promotions or SPAM/Junk folders. In the email body, click Confirm email address . You'll be redirected to the My team tab in the HubSpot Academy, where the certificates will now be associated with the user with the new email address. Help & Resources",https://knowledge.hubspot.com/help-and-resources/transfer-certifications-to-another-email-address
652,Import your website structure and navigation,"To begin transitioning your website into HubSpot, you can import the URL slug, title, and meta description for each of your external pages, as well as your website navigation. Please note: page content can not currently be imported. Website page imports will only import a page's title, URL, and meta description. Set up your content import In your HubSpot account, click the settings settings icon in the top navigation bar. In the left sidebar menu, navigate to Content > Blog . In the Current view section, click the first dropdown menu and select Import blog . On the content import screen, click Start new import > Website pages . Enter the URL of your website's main page, then click I mport pages . Depending on the size of your site, it can take up to six hours for your pages to be scanned. Finish your content import After the scan is finished, your content import status will change to Ready for import . You can now review and finalize your import: Please note: only 400 pages can be included in a single import. You can repeat the following process multiple times for the same website scan. In your HubSpot account, click the settings settings icon in the top navigation bar. In the left sidebar menu, navigate to Content > Blog . In the upper right, click Import blog . Next to the Page URL whose pages you want to import, click Review results . All navigation elements that the import tool was able to scan will be displayed. How links will be imported depends on the link type: Internal URL: URLs hosted on the scanned domain will link to a new page created during the import process. External URL: URLs hosted externally (e.g. social media pages) will stay the same. No URL : navigation items without a URL will create a non-linking element URL not valid for import: URLs that are not importable or not included in the import will create a non-linking element. By default, all navigation elements will be imported. To not include a menu item in the import, clear the checkbox next to that menu item. Once you've reviewed all navigation menus, click Next . There will be a listing of all pages hosted on the URL you specified in the initial import steps. Click Preview to see a preview of a page's content, as well as values for its URL, title, and meta description. If a page is missing its title or meta description, that value will display as Unable to identify . If there is an issue with a page's URL, you may see one of these errors . Please note: a title is required in order for a page to be eligible for import. A meta description is recommended, but optional. To select all pages for import, click Select all [x] pages at the top of the table To select an individual page, select the checkbox next to its title. To select the template a page will use, click the dropdown menu in the Template column and select a template . By default, pages will be set to Set template later To view only selected or unselected pages, click the Selection dropdown menu and select an option . To view only specific types of pages - blog posts, landing pages, or website pages - click the Page type dropdown menu and select the checkbox next to each page type you want to display. Once you have selected pages to import, click Import in the bottom right. You can also click Export selected pages to a CSV file at the bottom of the page to view page data in a spreadsheet. In the dialog box, click the Select domain dropdown menu and select the domain these pages will use. This option will only appear if more than one domain is available for publishing. Select a p ublishing status for your imported pages. Imported pages can be created as drafts or published pages. Please note: It's strongly recommended to import pages as drafts. Page content will not be imported, so imported pages will be blank and not have an assigned template unless one is selected during the import process. To prioritize imported pages when URL conflicts occur, select the Overwrite any existing content with imported content checkbox. Click Save . Your content import's status will update to Import in progress . Once the import is complete, the status will update to Import completed. To import additional pages from the same scanned website, click the More dropdown menu and select Back to import review. This will return you to the listing of scanned pages from that website. Website Pages",https://knowledge.hubspot.com/website-pages/import-your-website-structure-into-hubspot
653,Registrar chamadas do Microsoft Teams nos registros do HubSpot,"Aprenda como fazer login Ligações telefônicas de equipes para registros do HubSpot. Isso pode ser feito depois que você estiver conectado HubSpot e Microsoft Teams . Antes de começar Você deve se conectar ao Versão de instalação completa do aplicativo Microsoft Teams. Se você conectou a versão de instalação limitada, desinstale o aplicativo e instale a versão de instalação completa. Usuários deve ser mapeado entre o HubSpot e o Microsoft Teams para chamadas para registrar nos registros do HubSpot. Ativar registro automático para chamadas do Teams Na sua conta HubSpot, clique no ícone de < configurações< < settings icon< na barra de navegação superior. No menu da barra lateral esquerda, acesse < Integrações< > < Apps conectados< . Clique Equipes da Microsoft . Clique no Equipes Telefone aba. Selecione as caixas de seleção das chamadas que você deseja registrar automaticamente: Para chamadas de saída e Para chamadas de entrada .  O tipo de chamada selecionado será registrado automaticamente no registro de contato, no registro principal da empresa associada e em quaisquer registros de negócios associados. Depois que a chamada for adicionada ao registro de contato, a pessoa que fez a chamada receberá uma mensagem no Teams do bot do HubSpot informando que a chamada foi gravada. Os usuários também poderão editar detalhes da chamada registrada na notificação. Observe: devido a latência em chamadas do Teams , leva em média 15 minutos e até 60 minutos para que a chamada seja registrada. Funcionalidade adicional Você deve configurar as configurações fora do HubSpot para a funcionalidade clique para ligar ou roteamento de chamadas de entrada. Ativar clique para ligar A funcionalidade clique para ligar está disponível apenas para usuários do Windows. Depois de configurado, você pode iniciar uma chamada telefônica do Teams a partir de uma página de registro do HubSpot clicando em externalLink ícone ao lado do número de telefone. Se você tem o Windows 10: Clique no Começar botão e selecione Aplicativos padrão . Clique Escolha os aplicativos padrão por protocolo . Clique TEL e selecione Equipes da Microsoft . Se você tem o Windows 11: Clique no Começar botão e selecione Aplicativos padrão . Clique Escolha padrões por tipo de link . No TEL seção, selecione Equipes da Microsoft . Abrir registros de contato do HubSpot ao aceitar chamadas de entrada de Equipes Navegue até o seu Centro de administração do Microsoft Teams. Na barra de navegação à esquerda, navegue até Voz > Políticas de chamada . Para ativar o roteamento de chamadas de entrada para o HubSpot para todos os usuários, clique em Política global Para ativar o roteamento de chamadas de entrada para o HubSpot para usuários específicos, crie uma nova política e atribua-a aos usuários específicos Na política, clique para alternar o Abra aplicativos no navegador para chamadas PSTN recebidas ligar. Cole a seguinte URL: https://app.hubspot.com/msteams-integration-ui/{Seu HubID}/chamando/redirecionando/{telefone} Substituir {Seu HubID} com o Hub ID da sua conta. {telefone} não deve ser substituído na URL. Navegue até as configurações do Microsoft Teams e clique em Chamadas . Clique para alternar o Permitir que aplicativos de terceiros abram automaticamente em uma nova janela do navegador para chamadas PTSN recebidas ligar. Uma vez configurado, ao aceitar uma chamada recebida em Equipes de um contato, o registro HubSpot será aberto automaticamente. Integrations",https://knowledge.hubspot.com/pt/integrations/log-microsoft-teams-calls-to-hubspot-records
654,Adicionar conteúdo entre campos de formulário,"Saiba como personalizar o layout e a estrutura de seus formulários . Você pode adicionar conteúdo e personalizar a ordem dos campos de formulário. Adicionar conteúdo entre campos de formulário Você pode adicionar texto, links e imagens entre campos no formulário HubSpot inserindo um elemento de área rich text. Na sua conta HubSpot, acesse Marketing > Formulários . Passe o mouse sobre o formulário e clique em Editar ou crie um novo formulário . Se você estiver usando o editor de formulários atualizado : Na parte superior esquerda, clique no + ícone adicionar . No painel esquerdo, clique em Outro . Clique e arraste o tipo de campo Parágrafo (RichText) para a visualização de formulário à direita para incluí-lo no formulário. No painel esquerdo, clique em Editar na exibição expandida : Use a barra de ferramentas para personalizar o conteúdo, formatando o texto ou adicionando links e imagens. Quando terminar, clique em Voltar para o formulário . No canto superior direito, clique em Revisar e atualizar para publicar as atualizações do formulário. Se você estiver usando um formulário herdado: Clique na guia Criar nova no painel esquerdo. Na guia Criar novo do painel esquerdo, clique e arraste o elemento Parágrafo (RichText) entre os campos de formulário desejados. No painel direito, clique no elemento área Rich text . No painel esquerdo, edite o texto: Use a barra de ferramentas para personalizar o conteúdo, formatando o texto ou adicionando links e imagens. Para vincular ou desvincular o rich text de campos existentes, clique em Desanexar rich text do campo de entrada . No canto superior direito, clique em Atualizar para publicar suas atualizações de formulário. Alterar a ordem de opções em um campo de formulário Se você estiver usando um campo de formulário com várias opções, como uma propriedade de seleção suspensa, poderá reordenar as opções. Saiba mais sobre as opções disponíveis . Na sua conta HubSpot, acesse Marketing > Formulários . Passe o mouse sobre o formulário e clique em Editar , ou crie um novo formulário. No painel direito, clique no campo para alterar a ordem de suas opções. No painel esquerdo, na seção Opções de campo , clique no dragHandle linhas pontilhadas à esquerda de uma opção de campo, clique e arraste a opção para a posição desejada. Para classificar as opções em ordem alfabética, clique em sortAlpAsc Classificar . No canto superior direito, clique em Revisar e atualizar para publicar as atualizações do formulário. Organize campos de formulário lado a lado Você pode colocar um lado máximo de três campos lado a lado em um formulário. Na sua conta HubSpot, acesse Marketing > Formulários . Passe o mouse sobre o formulário e clique em Editar ou crie um novo formulário . Se você estiver usando o editor de formulários atualizado , clique e arraste o campo de formulário para ver as opções de posicionamento. Se você estiver usando o editor de formulários herdados , clique e mantenha pressionadas as linhas pontilhadas à esquerda de um campo para ver as opções de posicionamento. Para colocá-lo próximo a um campo em uma linha, arraste-o para um dos espaços disponíveis nessa linha. No canto superior direito, clique em Revisar e atualizar para publicar as atualizações do formulário. Observe : os campos progressivos ( Marketing hub ProfissionalPrivado ou EnterpriseOnly) não podem ser aplicados a um campo de formulário individual em uma linha. Quando você torna um campo individual progressivo, todos os outros campos na mesma linha se tornam progressivos automaticamente. Forms",https://knowledge.hubspot.com/pt/forms/customize-the-layout-of-your-form-fields
655,Use a integração da HubSpot com o Zapier,"O Zapier conecta o HubSpot a mais de 1.400 aplicativos usando disparadores e ações para automatizar o trabalho entre o HubSpot e os outros aplicativos. Por exemplo, quando houver um novo contato no HubSpot (disparador), você pode adicionar o contato a uma planilha do Google (ação) usando o Zapier. Você pode usar ações Zapier para vários objetos do HubSpot, como contatos, empresas, negócios e objetos personalizados. A integração do Zapier no HubSpot é gratuita para todos os clientes da HubSpot. A integração requer uma conta Zapier, e certos aplicativos integrados ao Zapier podem exigir uma assinatura paga do Zapier. Análise Página de preços do Zapier Para maiores informações. Observe: os valores de data e hora enviados através do Zapier para o HubSpot serão arredondados para meia-noite UTC. Isso pode resultar em discrepâncias de datas entre aplicativos externos e o HubSpot. Conecte HubSpot e Zapier Você deve ser um Superadministrador para conectar o Zapier ao HubSpot. Para instalar o aplicativo Zapier em sua conta HubSpot: Na sua conta HubSpot, clique no ícone do Marketplace marketplace na barra de navegação superior e selecione App Marketplace . Use a barra de pesquisa para procurar e selecionar Zapier . Clique em Instalar aplicativo . Clique Conecte-se para fazer login em sua conta Zapier existente ou Inscrever-se para criar uma nova conta Zapier. Para concluir a configuração da integração, crie seu primeiro HubSpot Zap . Criação Rápida de Conta do Zapier Uma vez que você tenha conectado o aplicativo Zapier em sua conta HubSpot, os usuários em sua conta poderão usar a Criação Rápida de Conta do Zapier para criar uma nova conta do Zapier diretamente de dentro do HubSpot e começar a construir Zaps. Na sua conta HubSpot, clique no ícone de < configurações< < settings icon< na barra de navegação superior. No menu da barra lateral esquerda, acesse < Integrações< > < Apps conectados< . Procure e selecione Zapier . Na seção incorporada do Zapier, clique em Inscrever para criar uma nova conta do Zapier ou Efetue login para entrar em sua conta existente do Zapier. Uma janela pop-up será exibida, permitindo que você crie uma conta do Zapier via email ou entrada social ou entre na sua conta do Zapier. Crie um zap Na sua conta HubSpot, clique no ícone de < configurações< < settings icon< na barra de navegação superior. No menu da barra lateral esquerda, acesse < Integrações< > < Apps conectados< . Clique Zapier . Clique Abrir Zaps para revisar seus fluxos de trabalho existentes. Para configurar um novo Zap, selecione a qual aplicativo você deseja conectar o HubSpot. Você será redirecionado para uma janela pop-up para continuar configurando o Zap. No Conta guia, selecione a conta do aplicativo na qual deseja que a ação ocorra. No Ação guia, configure a ação. No Teste aba, clique Etapa de teste para testar o Zap. Clique Publicar para levar seu Zap ao vivo. Saiba mais sobre a configuração do Zap . Zaps populares para HubSpot Adicionar novos contatos do HubSpot a uma planilha do Google Receba um alerta de e-mail para novos contatos do HubSpot Receba um alerta de chamada telefônica ou SMS para novos contatos do HubSpot Enviar leads de um formulário Woofoo para o HubSpot Enviar leads de uma landing page com Cancelamento de rejeição para o HubSpot Envie leads de um formulário Gravity Forms para o HubSpot Envie inscritos da Eventbrite para o HubSpot Criar contato do HubSpot de novos contatos do HubSpot Adicione novos contatos do HubSpot a uma lista do MailChimp Explore outros modelos de Zap do HubSpot . Integrations",https://knowledge.hubspot.com/pt/integrations/how-to-use-zapier-and-hubspot
656,Gerenciar registros e notificações no Microsoft Teams,"Aprenda a criar e gerenciar seus registros e notificações após conectando HubSpot e Microsoft Teams . Receba notificações do HubSpot no Microsoft Teams Depois de conectar o aplicativo Microsoft Teams ao HubSpot e conectar sua conta de usuário, você poderá receber notificações do HubSpot no bot do HubSpot no Microsoft Teams. Para desativar o envio de todas as notificações, de um tipo de notificação ou de notificações específicas para o Microsoft Teams: Na sua conta HubSpot, clique no ícone de configurações settings icon na barra de navegação superior. No menu da barra lateral esquerda, acesse Notificações . Clique na guia Outros aplicativos . Para desativar todas as notificações do HubSpot no Microsoft Teams, clique para desativar o botão Microsoft Teams . Para desativar tipos de notificações específicas, na seção Sobre o que ser notificado , clique para expandir o tópico de notificação e desmarque as caixas de seleção ao lado das notificações que você não quer receber. Observe: as notificações podem sofrer atrasos de até cinco minutos. Associar empresas e negócios do HubSpot aos canais do Microsoft Teams Para associar um registro de empresa ou negócio a um canal do Microsoft Teams: Navegue até o registro de empresa ou negócio: Na sua conta HubSpot, acesse CRM > Empresas . Na sua conta HubSpot, acesse CRM > Negócios . Na barra lateral direita, no cartão do Microsoft Teams , clique em Associar canal do Microsoft Teams . Na caixa pop-up, clique no menu suspenso Selecionar uma equipe e selecione uma equipe para associar ao registro do HubSpot. Clique no menu suspenso Selecionar um canal e selecione um canal existente do Microsoft Teams para associar ao registro do HubSpot, ou clique em Criar novo canal do MS Teams para criar um novo canal. Marque as caixas de seleção de tipos de atividade para sincronizar esses alertas com o canal do Microsoft Teams. Você pode sincronizar observações, chamadas, e-mails, tarefas e reuniões. Observação: alertas de atividade para e-mails só serão sincronizados se os e-mails forem enviados de um registro ou se estiverem conectados a um registro no CRM. Por exemplo, emails enviados usando a extensão de vendas HubSpot não serão sincronizados. Clique em Associar canal . Uma vez associado, você receberá alertas de atividade relevantes para o canal associado do Microsoft Teams. Você pode associar vários registros a um canal. Usar as ações de fluxo de trabalho do Microsoft Teams (somente Professional e Enterprise ) Depois de conectar o Microsoft Teams ao HubSpot, você poderá utilizar as seguintes ações de fluxo de trabalho: Criar canal do Microsoft Teams: crie um novo canal do Microsoft Teams em um fluxo de trabalho baseado em empresa ou em negócio. Enviar notificações do Microsoft Teams: envie uma notificação ao proprietário do HubSpot e a um canal do Teams. Disponível em todos os tipos de fluxo de trabalho, excepto objetos personalizados e fluxos de trabalho baseados em metas. Observação: não é possível enviar notificações a canais privados no Microsoft Teams . Para usar as ações de fluxo de trabalho do Microsoft Teams: Em sua conta HubSpot, acesse Automatização > Fluxos de trabalho . Clique no nome do fluxo de trabalho. Clique no + ícone de mais . No painel direito, selecione uma ação do Microsoft Teams: Para criar um canal, selecione Criar canal do Microsoft Teams . Para selecionar a equipe em que pretende criar o canal, clique no menu suspenso Equipe . Digite o nome do canal no campo Canal . Para selecionar as configurações de privacidade para o canal, clique no menu suspenso Privacidade . Clique em Salvar . Para enviar notificações, selecione Enviar notificações do Microsoft Teams . Para selecionar usuários específicos aos quais enviar a notificação, clique no menu suspenso Usuários . Você também pode digitar o nome do usuário e ele aparecerá para seleção. Para selecionar para qual equipe você deseja enviar a notificação, clique no menu suspenso Equipe . Para selecionar para qual canal você deseja enviar a notificação, clique no menu suspenso Canal . Digite a mensagem no campo Mensagem . Você pode formatar a mensagem utilizando asteriscos para texto em negrito, sublinhados para itálico e o botão Enter para adicionar uma nova linha. Para marcar alguém na notificação digitando @ seguido por seus Endereço de e-mail do Microsoft Teams . Para incluir um hiperlink na notificação, adicione o texto do hiperlink entre colchetes, seguido do URL entre parênteses. Por exemplo: [HubSpot](www.hubspot.com) . Clique no menu suspenso Selecionar ações para incluir na mensagem e selecione ações para incluir na notificação. Clique em Salvar . A notificação será enviada para o canal do Microsoft Teams especificado na ação do fluxo de trabalho. O usuário que recebe a notificação pode clicar em qualquer um dos botões para executar a ação. O canal também será automaticamente associado ao registro do negócio ou contato e poderá ser configurado a partir do registro. Responder às conversas do HubSpot no Microsoft Teams Observação: esta funcionalidade somente estará disponível se você tiver selecionado Instalação completa ao instalar a integração. Depois de conectar o HubSpot e o Microsoft Teams, você pode enviar e receber HubSpot Bate-papo ao vivo , Facebook Mensageiro , Whatsapp , envios de formulários, e mensagens na caixa de entrada diretamente nos canais do Microsoft Teams. Para isso, um usuário com Acesso à conta ou Superadministrador permissões precisará atualizar a equipe para usá-lo nas conversas do HubSpot. É necessário fazer upgrade das equipes para usar esta funcionalidade. Para atualizar uma equipe da Microsoft: Na sua conta HubSpot, clique no ícone de < configurações< < settings icon< na barra de navegação superior. No menu da barra lateral esquerda, acesse < Integrações< > < Apps conectados< . Clique Equipes da Microsoft . Clique no Configurações gerais guia e navegue até o Configurações globais aba. Clique Atualizar ao lado da Equipe Microsoft. Para selecionar a equipe a utilizar na caixa de entrada de conversas: Na página de integração do Microsoft Teams no HubSpot, clique na guia Caixa de entrada de conversas , que lista todas as caixas de entrada de conversas que você criou na sua conta da HubSpot. Ao lado da caixa de entrada de conversas, clique para ativar o botão Ativar/Desativar para enviar e receber mensagens da caixa de entrada de conversas diretamente nos canais do Microsoft Teams. Clique no menu suspenso Equipe para selecionar a equipe que receberá as mensagens. Clique no menu suspenso Canal para selecionar o canal do Microsoft Teams que receberá as mensagens. Depois de conectar a caixa de entrada, você será notificado automaticamente no Microsoft Teams quando tiver uma nova mensagem na sua caixa de entrada do HubSpot. Você também poderá responder diretamente do Microsoft Teams, exceto para canais de envio por e-mail e formulário. Integrations",https://knowledge.hubspot.com/pt/integrations/manage-records-and-notifications-in-microsoft-teams
