id,titulo,conteudo,link
976,Unable to delete list,"When a list can't be deleted, the Delete option will be grayed out. There are two reasons why you may be unable to delete a list : The list is used in a HubSpot tool; or the list is a default list. To identify if the list is used in another HubSpot tool: In your HubSpot account, navigate to CRM > Lists . Hover over the list you want to delete and click Details . In the right panel, view where the list is being used. From this, you can determine your next actions based on the tools the list is used in: If the list is used as a criteria in other lists, delete those lists or change their criteria to exclude this list. If the list is used in workflows , d elete the workflows or remove the list from their enrollment triggers . If the list is used in saved views , delete the saved views or remove the list from its criteria. If the list is used in audience access , remove the list from the page's access. If the list is used in a report , edit the report to remove any reference to the list. Delete the list . If the list still can't be deleted, it is likely a default list. These include persona lists, blog subscription lists , and partner lead registration lists if you're a HubSpot Partner. Lists",https://knowledge.hubspot.com/lists/why-can-t-i-delete-a-list
977,Porte um número para HubSpot,"A portabilidade é o processo em que um número de telefone é transferido de uma operadora para outra. Portar um número existente para HubSpot Os usuários podem portar seus números existentes de sua operadora de chamadas atual para o HubSpot. A transferência pode levar de 2 a 4 semanas para ser concluída. Para portar um número de telefone dos EUA, você precisará da seguinte documentação, que você pode obter de sua operadora de chamadas atual: Registro do Serviço de Atendimento ao Consumidor (que contém seu número de conta e pin) Fatura do utilitário Observação: você pode portar até 100 números de telefone dos EUA para cada envio. A portabilidade gratuita não está disponível no momento. Para portar seu número para o HubSpot: Na sua conta HubSpot, clique no ícone de configurações settings icon na barra de navegação superior. No menu da barra lateral esquerda, acesse Chamadas > Configuração da chamada . Clique em Port a number (Porta). Leia os requisitos e clique em Continue (Continuar) . Leia os agradecimentos. Em seguida, marque as caixas de seleção para concordar com cada confirmação. Clique em Continuar . Digite o número de telefone que você deseja portar. Para adicionar vários números, clique em + Adicionar um número . Clique em Continuar . Leia e reúna as informações necessárias e os documentos de apoio. Clique em Continuar . Na página Endereço de cobrança do Cliente, digite suas informações de cobrança. Clique em Continuar . Na página Carregar documentos de suporte , carregue uma cópia da sua conta telefônica mais recente. Clique em Continuar . Na página Informações da conta , insira suas informações. Número da conta : o número da conta da operadora de chamada atual. PIN : o PIN da operadora de chamadas atual. Número de Telefone : o número de telefone associado à sua conta com a operadora de chamadas atual. Nome e Sobrenome : o nome e o sobrenome da pessoa listada com a transportadora da chamada atual que está autorizada a fazer alterações na conta. E-mail : o endereço de e-mail da pessoa que assinará a carta de autorização para a porta em questão. Clique em Enviar . Dentro de 15 minutos após o envio de sua solicitação, você receberá um e-mail do Twilio (através do Dropbox) com uma carta de autorização (LOA). No seu e-mail, clique em Revisar & sinal para concluir a LOA. Exibir seu número portado Assim que a LOA for aprovada e a operadora de chamada atual aprovar a solicitação de porta, o Twilio concluirá a porta e você será notificado em suas configurações de chamada. Para exibir seu número portado e atribuir a um usuário, caixa de entrada ou chamadas do helpdesk ou usar IVR : Na sua conta HubSpot, clique no ícone de configurações settings icon na barra de navegação superior. No menu da barra lateral esquerda, acesse Chamadas > Configuração da chamada . Porte um número fora de HubSpot Você pode transferir um número HubSpot que possui em sua conta para uma nova operadora de chamadas. Isso pode ser útil se você estiver mudando para uma nova solução de chamadas, mas quiser manter os números de telefone que você tem usado no HubSpot. Entre em contato com o novo provedor de chamadas para o qual você deseja transferir seu número de telefone da HubSpot. Solicite a portabilidade dos seus números de telefone da HubSpot. O novo provedor de chamadas deve enviar um pedido de portabilidade à operadora da HubSpot, o Twilio . Depois que a solicitação for aprovada, o novo provedor de chamadas deverá se comunicar diretamente com você sobre a aprovação da portabilidade e as próximas etapas. Todas as comunicações futuras sobre a data da portabilidade, o uso do número e muito mais devem ser direcionadas ao novo provedor de chamadas. Depois que a portabilidade for concluída, seu número de telefone da HubSpot não estará mais disponível para uso em sua conta. Os números de telefone da sua conta serão redefinidos. Por exemplo, se você tiver cinco números de telefone HubSpot disponíveis com sua assinatura e transferir três números de telefone HubSpot, você terá três números disponíveis para você configurar um novo número de telefone HubSpot . Calling",https://knowledge.hubspot.com/pt/calling/port-out-a-hubspot-phone-number
978,Configurar e gerenciar pipelines de objetos,"Os pipelines ajudam a visualizar os processos ao longo das fases, que são etapas que sinalizam onde um registro está em um processo. Por exemplo, você pode criar pipelines de negócio para rastrear receita, pipelines de ticket para rastrear problemas do cliente ou pipelines de listagem para rastrear propriedades de venda. Se você tiver acesso para Editar configurações de propriedade , você poderá criar e editar pipelines ou fases para melhor atender às necessidades das suas equipes. Os seguintes objetos têm pipelines: Leads ( Sales Hub Professional e Enterprise ) Negócios Tickets Compromissos (se ativado ) Cursos (se ativado ) Listagens (se ativado ) Serviços (se ativado ) Pedidos Objetos personalizados ( Enterprise apenas) Depois de configurar pipelines, saiba como gerenciar seus registros em exibições de quadro . Criar um novo pipeline (somente Starter , Professional e Enterprise ) Se sua conta tiver mais de um processo exclusivo, você poderá criar pipelines adicionais. Pipelines separados somente são recomendados se seus processos tiverem fases exclusivas que exijam pipelines diferentes. Caso contrário, você poderá usar o mesmo pipeline para vários usuários e equipes e gerenciar o acesso por meio de permissões de usuário. Por exemplo: Sua empresa tem um processo de vendas online direto ao consumidor com algumas fases, como No carrinho , Fechado e Perdido . Você também tem um processo de vendas por atacado que requer mais fases, como agendamento de compromissos e negociação de contratos. Nesse cenário, você deve criar pipelines separados. Sua empresa vende várias marcas e sua conta da HubSpot tem uma equipe para cada marca. O processo de venda de produtos para cada marca é o mesmo e você pode usar as mesmas fases para todas as vendas. Nesse cenário, não é recomendado criar pipelines separados. Em vez disso, você pode usar o mesmo pipeline e definir permissões de usuário Apenas equipe , para que cada equipe possa acessar apenas os negócios de sua marca (somente Professional e Enterprise ). Observação: a criação de um novo pipeline está em versão BETA para leads. Se você for um superadministrador , saiba como incluir sua conta na versão BETA . Os leads em um pipeline personalizado não estão qualificados para a automação da fase do lead padrão. Somente contas Starter , Professional ou Enterprise podem criar pipelines adicionais. Os pipelines de lead estão disponíveis apenas para contas Sales Hub Professional ou Enterprise . Saiba mais sobre o número máximo de pipelines que você pode criar, dependendo da sua assinatura. Para criar um novo pipeline: Na sua conta HubSpot, clique no ícone de configurações settings icon na barra de navegação superior. No menu da barra lateral esquerda, acesse Objetos e selecione o objeto para o qual deseja criar um pipeline. Clique na guia Pipelines . Clique no menu suspenso Selecionar um pipeline e selecione Criar pipeline . Na caixa de diálogo, insira um nome de Pipeline e clique em Criar . Depois de adicionar registros ao pipeline, saiba como editá-los . Editar ou excluir pipelines Você também pode renomear, reordenar, gerenciar o acesso ou excluir pipelines. Observação: se você conectar uma integração de comércio eletrônico ao HubSpot, um pipeline de negócios será adicionado automaticamente à sua conta e ele não poderá ser modificado. Na sua conta HubSpot, clique no ícone de configurações settings icon na barra de navegação superior. No menu da barra lateral esquerda, acesse Objetos e selecione o objeto para o qual deseja editar os pipelines. Clique na guia Pipelines . Clique no menu suspenso Selecionar um pipeline e selecione um pipeline . Clique no ícone de código code para ver o nome interno do pipeline. O nome interno é usado pelas integrações e APIs . À direita, clique em Ações e selecione uma das seguintes opções: Renomear este pipeline : alterar o nome do pipeline. Na caixa de diálogo, insira o novo nome e clique em Renomear . Reordenar pipelines : alterar a ordem dos seus pipelines. Na caixa pop-up, arraste os pipelines para movê-los para uma nova posição e clique em Salvar . Gerenciar acesso : gerencie quais usuários podem visualizar e editar o pipeline. Excluir este pipeline : exclua o pipeline. Na caixa de diálogo, clique em Excluir pipeline para confirmar. Você não pode excluir um pipeline se ele contiver registros ou for usado em outras ferramentas ou integrações do HubSpot. Antes de excluir, você precisará excluir ou mover os registros para outro pipeline e remover as referências aos pipeline de outras ferramentas. Para selecionar as propriedades que são exibidas no quadro e nos cartões para o pipeline, clique em Personalizar visualização de quadro e cartão . Para personalizar as configurações de automação de um pipeline de negócio , ticket , lead ou objeto personalizado , clique na guia Automatizar . Para criar e gerenciar rótulos codificados por cores que categorizam registros, clique em Personalizar tags de [objeto] (somente Starter , Professional e Enterprise ). Para configurar regras para um pipeline de negócio, ticket, lead ou objeto personalizado, clique na guia Regras de pipeline . Gerenciar fases em um pipeline Use fases para categorizar e acompanhar o progresso dos seus registros por meio de pipelines. Fases de pipeline padrão Dependendo do objeto, há um pipeline padrão com fases padrão: Leads : um pipeline de lead padrão com cinco fases: Novo, Tentativa, Conectado, Qualificado, Desqualificado. Negócios : um pipeline de vendas padrão para o qual cada fase tem uma probabilidade associada que indica a probabilidade de o negócio ser fechado nessa fase. A probabilidade do estágio é usada para determinar o valor ponderado mostrado na exibição de quadro, que é calculado multiplicando o valor total em cada estágio pela probabilidade do estágio. O pipeline padrão tem sete fases de negócio: Compromisso agendado (20%), Qualificado para comprar (40%), Apresentação agendada (60%), Tomador de decisão envolvido (80%), Contrato enviado (90%), Fechado (100%, ganho) e Perdido (0%, perdido). Tickets : um Pipeline de suporte padrão com quatro status de ticket: Novo, Aguardando contato, Aguardando por nós e Fechado. Observação: para tickets, as fases do pipeline são chamadas de status por padrão, mas são iguais às outras fases de objetos. Compromissos : um pipeline de compromisso padrão com cinco fases: Programado, Em andamento, Concluído, Cancelado, Reagendado. Cursos : um pipeline padrão do curso com uma fase aberta e uma fase fechada. Listagens : um pipeline de listagem padrão com uma fase aberta e uma fase fechada. Serviços : um pipeline de serviço padrão com três fases: Novo, Em Andamento, Fechado. Pedidos : um pipeline padrão de Novo pedido com duas fases: Em andamento, Contrato assinado. Adicionar, editar ou excluir fases de pipeline Você também pode adicionar suas próprias fases ou editar e excluir fases existentes. Para personalizar as fases de um pipeline: Na sua conta HubSpot, clique no ícone de configurações settings icon na barra de navegação superior. No menu da barra lateral esquerda, acesse Objetos e selecione o objeto para o qual deseja editar as fases. Clique na guia Pipelines . Clique no menu suspenso Selecionar um pipeline , em seguida, selecione o pipeline para editar. Para adicionar uma nova fase: Nas fases existentes, clique em + Adicionar fase . Insira um nome de fase . Para todos os objetos, exceto negócios, selecione se a fase será Aberta ou Fechada . Para negócios, clique no menu suspenso Probabilidade do negócio e selecione uma probabilidade . Para usar uma probabilidade personalizada, insira um valor , clique em Adicionar opção e selecione a nova probabilidade . Negócio fechado e Negócio perdido são fases fechadas. Observação: para negócios, para garantir que todos os relatórios de vendas, relatórios de negócios ou de receita personalizados e ferramentas de análise de vendas processem seus negócios corretamente, você deve incluir fases de negócios para Fechado e Perdido na Probabilidade do negócio. Para alterar o nome de uma fase existente, clique no nome da fase e insira um novo nome na caixa de texto. Para reordenar as fases, clique na fase e arraste-a para uma nova posição. Para ver o nome interno de uma fase, passe o cursor do mouse sobre a fase e clique no ícone de código code . O nome interno é usado pelas integrações e APIs . Para excluir um estágio, passe o cursor do mouse sobre ele e clique em Excluir . Você não poderá excluir uma fase se houver registros nela ou se a fase tiver propriedades condicionais em uso. Antes de excluir, você precisará mover os registros existentes para outra fase (por exemplo, edite a Propriedade de fase de [objeto] em massa ) e remover a lógica de propriedade de fase condicional . Para editar as propriedades mostradas quando um negócio avança para uma determinada fase , passe o cursor sobre a coluna Propriedades de fase condicional e clique em Editar propriedades . Para editar regras de pipeline para negócios, tickets ou objetos personalizados, passe o mouse sobre a guia Regras de pipeline e clique em Editar . Após concluir a edição, clique em Salvar na parte inferior esquerda. Configurar propriedades de fase condicional Você pode definir a lógica de fase condicional para mostrar determinadas propriedades quando os usuários criarem manualmente um registro ou moverem um registro para uma fase específica. Você pode incluir propriedades de fase condicional como sugestões ou exigir que os usuários adicionem valores para as propriedades. Os usuários devem ter permissões para editar as configurações das propriedades para personalizar as propriedades de fase. Na sua conta HubSpot, clique no ícone de configurações settings icon na barra de navegação superior. No menu da barra lateral esquerda, acesse Objetos e selecione o objeto para o qual deseja editar as propriedades de fase. Clique na guia Pipelines . Clique no menu suspenso Selecionar um pipeline , em seguida, selecione o pipeline para editar. Na linha de uma fase, passe o cursor do mouse sobre a coluna Propriedades de fase condicional e clique em Editar propriedades . No painel esquerdo, clique em + Adicionar propriedade dependente . Clique no menu suspenso Escolher uma propriedade e selecione a propriedade que você quer que apareça. Observação: as propriedades com valores somente leitura (ou seja, que não são definidas pelos usuários, como as propriedades de pontuação ou cálculo) não podem ser usadas como propriedades de status e não aparecerão como opções para seleção. Saiba como incluir essas propriedades na seção Propriedades em um registro . Para exigir um valor para uma propriedade, marque a caixa de seleção na coluna Obrigatório (somente Starter , Professional ou Enterprise ). Quando uma propriedade é necessária, os usuários não poderão criar um registro ou mover um registro para essa fase, a menos que insiram um valor para a propriedade. Para reordenar as propriedades, clique e arraste uma propriedade para uma nova posição. Para remover uma propriedade selecionada, clique no ícone Excluir ao lado da propriedade. Depois de definir suas propriedades, no canto superior direito, clique em Aplicar lógica . As propriedades selecionadas aparecerão automaticamente ao criar um novo registro nessa fase seguindo o processo manual ou ao mover um registro existente para essa fase. Para finalizar as alterações, clique em Salvar no canto inferior esquerdo. Saiba mais sobre a configuração de lógica condicional para propriedades de enumeração . CRM Object Settings",https://knowledge.hubspot.com/pt/object-settings/set-up-and-customize-pipelines
979,Exibir um resumo de registro da empresa,"Para acessar rapidamente uma visão geral dos principais detalhes de uma empresa, você pode adicionar o cartão de Resumo da empresa às guias da coluna central dos registros de empresa. O resumo inclui dados sobre as atividades da empresa, partes interessadas, fase do ciclo de vida e informações associadas sobre negócios, produtos e tickets. Isso permite obter contextos importantes sobre suas empresas sem precisar navegar para várias áreas do registro. Há um cartão de resumo padrão da empresa que pode ser adicionado às exibições de registros, mas você também pode criar cartões de resumo da empresa personalizados para exibir informações específicas. Adicionar um cartão de resumo a uma exibição de registro Os usuários devem ter permissões para Personalizar o layout da página de registro ou de Superadministrador para personalizar uma visualização de registro . Você pode adicionar cartões de resumo da empresa apenas em registros da empresa. Se você nunca personalizou as exibições de registros da sua empresa, o cartão padrão de resumo da empresa será adicionado por padrão. Se você personalizou uma exibição anteriormente, precisará adicionar manualmente cartões de resumo. Para adicionar um cartão de resumo de empresas: Navegue até o editor de exibição de registro para empresas. Na coluna do meio, navegue até a guia na qual deseja que o cartão esteja (ou seja, Visão geral ou uma guia personalizada) e clique em Adicionar cartões . Marque a caixa de seleção do cartão de Resumo da Empresa ou de um cartão de resumo de empresa personalizado . Para alterar a ordem em que o cartão aparece no registro, clique e arraste o cartão para a posição desejada. No canto superior direito, clique em Salvar e sair para aplicar suas alterações. Saiba mais sobre personalização de registros . Criar um cartão de resumo de empresas personalizado Você pode criar cartões de resumo de empresas personalizados para selecionar quais detalhes exibir e filtrar os tíquetes incluídos. Crie um cartão de resumo de Empresas . Por padrão, todas as seções do resumo estão incluídas no cartão. Para ocultar uma seção, desative o interruptor . Para a seção Tickets principais , por padrão, os tickets criados mais recentemente são exibidos. Para personalizar quais tickets são exibidos: Para definir critérios que decidam quais tickets devem ser exibidos, clique em Gerenciar filtros . Adicione seus critérios e clique no X para fechar o painel filtros. Para definir como os tickets são classificados, selecione a propriedade pela qual classificar e, em seguida, selecione a ordem de classificação sortAmtAsc ascendente ou sortAmtDesc descendente . Clique em Salvar para adicionar o cartão. No canto superior direito, clique em Salvar e sair para aplicar suas alterações. Saiba mais sobre criação de cartões personalizados . Exibir um resumo de empresa Depois de adicionar um cartão de resumo de empresa aos registros da empresa, para exibir o resumo: Na sua conta HubSpot, acesse CRM > Empresas . Clique no nome de uma empresa. Na coluna do meio, navegue até o cartão padrão Resumo da empresa ou um cartão de resumo personalizado. As seções a seguir estão incluídas no cartão padrão Resumo de empresa e também podem ser incluídas em cartões personalizados: Contexto rápido : uma propriedade de texto que você pode usar para adicionar observações sobre a empresa. Clique no campo , insira o texto no editor e clique em Concluído . Você também pode visualizar e editar o texto através da propriedade Contexto rápido . Contatos frequentes : os contatos associados com os quais você se comunica com mais frequência. Para visualizar um contato, passe o mouse sobre o nome do contato e clique no view ícone de visualização . Para exibir o registro do contato, clique no nome do contato. Perfil da empresa : fase do ciclo de vida da empresa, valor total de negócios fechados e a data de fechamento mais recente para negócios associados. Para exibir o histórico de alterações na fase do ciclo de vida, clique em Detalhes do histórico . Produtos : os produtos que uma empresa comprou através de um negócio fechado (fechado nos últimos 365 dias) ou manifestou interesse em comprar através de um negócio aberto (criado nos últimos 365 dias). Para ver todos os produtos incluídos nos negócios associados, clique em Exibir todos os produtos (x) . Tickets principais : por padrão, os tickets abertos criados mais recentemente. Se você criar um cartão de resumo personalizado da empresa , poderá filtrar quais tickets devem aparecer. Para visualizar um ticket, passe o cursor do mouse sobre o nome do ticket e clique em Visualizar . Para visualizar o registro do ticket, clique no nome do ticket. Para exibir todos os tickets associados, clique em Exibir uma lista completa de tickets . Saiba mais sobre como usar cartões em registros ou resumos de atividades (BETA) gerados por IA . CRM Object Settings",https://knowledge.hubspot.com/pt/records/view-a-company-record-summary
