id,titulo,conteudo,link
826,Structure and customize template layouts,"Learn how to set up and customize your existing drag and drop template , and work with modules, groups, and columns as the building blocks of your template. Structure your template By using the layout editor in the design manager, you can quickly build your content layout without having to write any HTML. In your HubSpot account, navigate to Content > Design Manager . In the finder, click a template to edit it. Add and drag modules To add a module to a layout, click + Add at the top of the layout inspector. Search for or select a module , then drag it to the location you want the module to render in the layout. Dragging modules on top of other modules will either create columns or group the modules. Change column widths To change the width of a column, hover between the modules and click and drag horizontally. Group modules Module groups are units of modules that make up different sections of a page. To group two modules, click the first module , then press and hold the Control/Command key and select the second module . Repeat this step if you are grouping more than two modules. Next, click the group icon groupModule in the module inspector. Please note: modules groups cannot cross a section separator or contain a partially selected group of modules. Split modules horizontally Splitting a module breaks the module in half, creating two modules. To split a module, click the module , then click the split module icon splitModule in the module inspector. Alternatively, you can right-click the module in the layout and select Split module . Center modules With horizontal spacers, you can center modules and groups on the page, or add blank space on either side of them. To add a horizontal spacer, click + Add at the top of the layout inspector. Locate Horizontal Spacer , then drag and drop it into the template. To change the size of a horizontal spacer, change the width of the column separating it from other modules. To center a module or group, add horizontal spacers on each side. Add a flexible column Flexible columns are designed to make content management at the page-level easier for content creators. When a flexible column is added to a HubSpot page template, users will be given the option to add, remove, and re-order modules within the individual page editor. This feature allows designers to create fewer templates, while still allowing marketers the flexibility to customize each page to fit their needs. To add a flexible column, click + Add at the top of the layout inspector. Locate Flexible Column , then drag and drop it into the template. Please note: Flexible columns can only be added to page templates, and cannot be added to email or blog templates. Modules added to flexible columns cannot have CSS classes, inline styling, or the wrapping HTML associated with them. Styling options need to be added to the flexible column itself. Customize your template Once you've structured the general layout of your template, you can swap out modules and make other template customizations. Edit module options You can edit a module's options by clicking the module in the layout editor. In the module inspector on the right, you'll see the module's editable options. These options generally include styling, default content, and editor options, and may differ depending on the specific type of module. Learn more about editing module CSS and default content and settings . Swap module After you've added a module to your template, you can choose to swap it out for another module. Right-click the module in the layout editor, then click Swap module . In the dropdown menu that appears, select the module to replace the original module with. Convert to global module You can convert a module in your template to a global module , which can be used in multiple templates. This is useful when you've styled the module in a certain way, and/or have default content in the module that you'd like to reuse in other templates. Click the module in the layout editor. In the module inspector, click the More dropdown menu and select Convert to global module . In the dialog box, enter the global module name , then click Create . Delete module To delete a module, click the module in the layout editor, then click the trash can icon delete in the module inspector. Alternatively, you can right-click the module and select Delete module . Manage your template in the finder In addition to your module options, there are several actions you can take specific to your template. In the upper right of the template, click the folder icon folder . Right-click the name of the template. In the dropdown menu, you can customize the following options: Copy to portals : copy the template to another portal where you are also a user. Templates purchased from the Marketplace will not be able to be copied to other portals. Clone template : this creates an exact duplicate of your template, and is useful when you want to create a variation of an existing template. Clone to HTML : this creates a separate HTML version of your template. This is helpful if you need more control over your markup, or you want to learn more about how templates are coded. View template source : view the template's source code HTML. Unlike the Clone to HTML option, this does not create a separate HTML version of your template. Rename template : edit your template's internal name. Show dependents : view all pages, emails, or blogs currently using the template. Show revision history : view your template's revision history and choose to revert your template to a previously published version. Create email/page : create an email or landing page/website page directly from the template. Delete template : this deletes the template. Once deleted, a template will remain available for 30 days, after which it will be permanently deleted. To restore the template, you will need to contact customer support . These options can also be accessed from the File and Actions dropdown menus above. Design Manager",https://knowledge.hubspot.com/design-manager/structure-and-customize-template-layouts
827,"Organizar, excluir e exportar propriedades","CRM Para ajudar a manter os dados de qualidade em seu Você pode separar as propriedades em grupos ou arquivar e excluir propriedades não utilizadas. Para exibir informações de propriedade de vários objetos , você também pode exportar todas as propriedades ou dados históricos de uma única propriedade. Se desejar criar propriedades novas ou atualizar propriedades existentes, aprenda como criar e editar propriedades . Para obter orientação sobre como atualizar os valores de propriedade de um registro, aprenda como editar um valor de propriedade em um registro ou em massa. Criar e editar grupos de propriedades Os grupos de propriedades podem ajudá-lo a identificar propriedades relacionadas em um objeto . Existem grupos de propriedades padrão, mas você também pode criar grupos personalizados. Esses grupos são usados apenas nas configurações das propriedades. Para agrupar propriedades em um registro, use as barras laterais do registro. Para criar um novo grupo ou editar um grupo existente: Na sua conta HubSpot, clique no ícone de configurações settings icon na barra de navegação superior. No menu da barra lateral esquerda, vá para Propriedades . Clique no menu suspenso Selecionar um objeto e, em seguida, selecione as Propriedades de [objeto] para o objeto cujos grupos você deseja editar. Clique na guia Grupos . Para criar um novo grupo, no canto superior direito, clique em Criar grupo . Para editar um grupo existente, passe o mouse sobre o grupo e clique em Editar. Na caixa de diálogo, insira o nome do grupo e clique em Salvar . Para exibir as propriedades de um grupo, passe o mouse sobre o grupo e clique em Exibir propriedades . Para excluir um grupo, passe o mouse sobre o grupo e clique em Excluir . Na caixa de diálogo, clique em Remover para confirmar. Adicionar propriedades a um grupo Os usuários devem ter permissões Editar configurações de propriedade para mover as propriedades para um grupo. Para adicionar uma propriedade a um grupo: Passe o mouse sobre a propriedade, clique no menu suspenso Mais e clique em Mover para o grupo . Na caixa de diálogo, selecione um grupo no menu suspenso e clique em Salvar . Para adicionar várias propriedades ao mesmo grupo: Marque as caixas de seleção ao lado das propriedades. Na parte superior da tabela, clique em + Adicionar ao grupo . Na caixa de diálogo, selecione um grupo no menu suspenso e clique em Salvar . Arquivar propriedades Os usuários devem ter permissões para Editar configurações de propriedade para arquivar propriedades. Uma vez arquivada, a propriedade será armazenada na guia Propriedades arquivadas e será excluída permanentemente após 90 dias. Você somente pode arquivar ou excluir propriedades se elas não estiverem em uso na sua conta da HubSpot (por exemplo, em uma lista ou fluxo de trabalho). Na sua conta HubSpot, clique no ícone de configurações settings icon na barra de navegação superior. No menu da barra lateral esquerda, vá para Propriedades . Clique no menu suspenso Selecione um objeto e selecione as Propriedades de [objeto] do objeto cujas propriedades você deseja arquivar. Para arquivar uma propriedade individual, passe o mouse sobre a propriedade, clique no menu suspenso Mais e clique em Arquivar . Para arquivar várias propriedades, marque as caixas de seleção ao lado das propriedades e clique em Arquivar na parte superior da tabela. No painel direito, revise onde as propriedades são usadas antes do arquivamento: Taxa de preenchimento para esta propriedade : a porcentagem de registros que têm um valor para a propriedade. Clique em Revisar [registros] para exibir registros com um valor. As propriedades podem ser arquivadas mesmo que os registros tenham valores. Ativos que impedem o arquivamento : ferramentas, como cartões de fluxos de trabalho ou propriedade, para as quais, se a propriedade for usada, não poderá ser arquivada até que seja removida. Clique em Revisar [ativos] para navegar até a ferramenta para exibir e atualizar onde a propriedade é usada. Por exemplo, você vê que um fluxo de trabalho impede um arquivo de propriedades. Navegue até o fluxo de trabalho e observe uma ação Editar registro que usa a propriedade. Exclua a ação para que a propriedade possa ser arquivada. Outros ativos que utilizem esta propriedade : ferramentas adicionais nas quais a propriedade é utilizada. As propriedades podem ser arquivadas se usadas por recursos nesta seção. Uma vez arquivada, a propriedade será removida do ativo (por exemplo, removida como uma coluna em uma exibição de página de índice). Clique em Arquivar propriedade para confirmar. Restaurar ou excluir permanentemente as propriedades arquivadas objeto Os usuários com permissões para Editar configurações de propriedade podem restaurar as propriedades arquivadas desse objeto. Os usuários com permissões de Superadministrador também podem excluir permanentemente propriedades arquivadas anteriormente. Quando você exclui uma propriedade, os valores existentes dos registros são limpos. Também permitirá recriar a propriedade excluída com uma configuração diferente. Esse processo de limpeza levará cerca de trinta minutos. Por exemplo, você criou uma propriedade baseada em texto de ID da conta personalizada e não exigiu valores exclusivos. Você pode arquivar a propriedade e excluí-la. Em seguida, você pode recriá-lo com o mesmo nome e tipo de campo e exigir apenas números e valores exclusivos . Observação: as propriedades arquivadas há 90 dias ou mais foram excluídas e não podem ser restauradas. Na sua conta HubSpot, clique no ícone de configurações settings icon na barra de navegação superior. No menu da barra lateral esquerda, vá para Propriedades . Clique no menu suspenso Selecionar um objeto e, em seguida, selecione as Propriedades de [objeto] para o objeto cuja propriedade você deseja restaurar ou excluir. Clique na guia Propriedades arquivadas . Localize as propriedades que deseja restaurar ou excluir permanentemente. Clique no menu suspenso Filtrar por e selecione o tipo de propriedade. Use os campos de data para filtrar as propriedades com base em quando foram arquivadas. Marque as caixas de seleção ao lado das propriedades que você deseja restaurar ou excluir permanentemente. Você pode marcar a caixa de seleção no canto superior esquerdo da tabela para selecionar todas as propriedades na lista. No canto superior da tabela, clique em Restaurar ou Excluir . Se estiver excluindo, na caixa de diálogo, digite o número de propriedades que você está excluindo e clique em Excluir para confirmar. Exportar todas as propriedades Os usuários com permissões de Exportação podem exportar uma lista de todas as propriedades em todos os objetos da conta. O arquivo exportado conterá informações básicas, incluindo o nome, o nome interno, o tipo, a descrição, o grupo e, se aplicável, as opções de cada propriedade. Não é possível exportar propriedades individuais. Para exibir valores de propriedade, você pode exportar o histórico de uma propriedade individual ou exibir dados históricos de uma propriedade em um registro. Na sua conta HubSpot, clique no ícone de configurações settings icon na barra de navegação superior. No menu da barra lateral esquerda, vá para Propriedades . No canto superior direito, clique em Exportar todas as propriedades . Na caixa de diálogo, clique no menu suspenso Formato do arquivo e selecione o formato em que você deseja exportar o arquivo. Clique em Exportar . Depois que a exportação for processada, você receberá um link de download por e-mail e em seu centro de notificação . Você também pode exportar o histórico de propriedades e usar dados históricos para restaurar valores anteriores. properties CRM records",https://knowledge.hubspot.com/pt/properties/organize-and-export-properties
828,Use the Microsoft Dynamics 365 integrations sync card,"After connecting the Microsoft Dynamics 365 integration , you can view the Dynamics 365 sync card on contact, company, deal, and invoice records to view sync information. This gives you a more accurate view of your record syncing status, including: Whether the record is currently syncing with Dynamics 365. The last time the record synced. Which Dynamics 365 record the HubSpot record is syncing with. Below, learn how to add and view the sync card on your CRM records. Or, learn how to embed HubSpot data into Dynamics 365 . Add the sync card If you did not customize the right sidebar of your records , the Dynamics 365 sync card will automatically be added to your records. If you customized the right sidebar of your records, add the Integration sync card to the right sidebar for each object type: In your HubSpot account, click the settings settings icon in the top navigation bar. In the left sidebar menu, navigate to Objects, then select the object for which you’d like to edit the right sidebar. Click the Record customization tab. Click Customize the right sidebar . In the right panel, click Edit default view . Click Add card > Integration sync . Click Save . If you have both NetSuite and Microsoft Dynamics 365 connected to your account, or multiple objects syncing to one object (for example, Dynamics 365 Leads and Contacts both syncing to HubSpot contacts), you will see an integration sync card for each sync type. View the sync card After the Integration sync card has been added to your records, you can view the following information on it: Syncing to: which Dynamics 365 record the HubSpot record is syncing with. Click the record name to open the record in Dynamics 365. Status: the status of the sync between HubSpot and Dynamics 365. Sync statuses include: Up to date: the record is syncing successfully. Sync not found: the integration is active, but currently the HubSpot record is not syncing with Dynamics 365. Sync off: the sync has been turned off in the integration settings page. Record not syncing: the record is not syncing due to an error. For more information, hover over the sync status, or click the sync status to navigate to the sync health page. Unknown sync: the record is syncing with Dynamics 365, but sync health information is not available. Record excluded: the record is part of an excluded bucket. For more information, hover over Sync status . Last updated: when the HubSpot and Dynamics 365 data was last synced. Integrations BETA",https://knowledge.hubspot.com/integrations/view-the-microsoft-dynamics-365-sync-card
