id,titulo,conteudo,link
1306,Use the NetSuite integrations sync card,"After connecting the NetSuite integration , you can view the NetSuite sync card on contact, company, deal, and invoice records to view sync information. This gives you a more accurate view of your record syncing status, including: Whether the record is currently syncing with NetSuite The last time the record synced Which NetSuite record the HubSpot record is syncing with Below, learn how to add and view the sync card on your CRM records. Or, learn how to embed HubSpot data into NetSuite . Enable additional features After connecting the NetSuite integration, you must authorize additional NetSuite features. In your HubSpot account, click the settings settings icon in the top navigation bar. In the left sidebar menu, navigate to Integrations > Connected Apps . Click NetSuite . Click the Feature discovery tab. In the Enable extra features banner, click Enable . Add the sync card If you did not customize the right sidebar of your records , the NetSuite sync card will automatically be added to your records. If you customized the right sidebar of your records, add the Integration sync card to the right sidebar for each object type: In your HubSpot account, click the settings settings icon in the top navigation bar. In the left sidebar menu, navigate to Objects, then select the object for which you’d like to edit the right sidebar. Click the Record customization tab. Click Customize the right sidebar . In the right panel, click Edit default view . Click Add card > Integration sync . Click Save . If you have both NetSuite and Microsoft Dynamics 365 connected to your account, or multiple objects syncing to one object (for example, NetSuite Individuals and NetSuite Contacts both syncing to HubSpot contacts), you will see an integration sync card for each sync type. View the sync card After the Integration sync card has been added to your records, you can view the following information on it: Syncing to: which NetSuite record the HubSpot record is syncing with. Click the record name to open the record in NetSuite. Status: the status of the sync between HubSpot and NetSuite. Sync statuses include: Up to date: the record is syncing successfully. Sync not found: the integration is active, but currently the HubSpot record is not syncing with NetSuite. Sync off: sync is turned off in the NetSuite settings page. Record not syncing: the record is not syncing due to an error. For more information, hover over the sync status, or click the sync status to navigate to the sync health page. Unknown sync: the record is syncing with NetSuite, but sync health information is not available. Record excluded: the record is part of an excluded bucket. For more information, hover over Sync status . Last updated: when the HubSpot and NetSuite data was last synced. Integrations Inteligencia Artificial BETA",https://knowledge.hubspot.com/integrations/view-the-netsuite-sync-card
1307,Clear your browser's cache,"Browsers keep local copies of website data to load those websites more quickly in the future - these are known as your browser's cache. When you experience an issue that is not occurring on other browsers or computers, the source of that issue may lie in your browser's cache. Clearing the cache will typically resolve these issues. The process for clearing a browser's cache is different for every browser. Learn how to clear your cache in the following browsers in their documentation: Google Chrome Safari Mozilla Firefox Internet Explorer Microsoft Edge Please note: after you've cleared your cache, completely restart your browser. This ensures that the cache is completely cleared. Blog Knowledge Base",https://knowledge.hubspot.com/website-and-landing-pages/clear-your-browser-cache
1308,Acessar o HTML de um e-mail enviado do HubSpot,"Pode ver e copiar o HTML de um e-mail enviado pelo HubSpot , seguindo as instruções abaixo. Na sua conta da HubSpot, navegue até Marketing > E-mail . Localizar e clicar no nome do e-mail enviado. Por baixo do seu nome de e-mail, passe o rato por e clique em Ver e-mail . Isto abrirá uma versão Web do seu correio eletrónico no seu browser. Para ver o HTML em bruto do seu e-mail, clique com o botão direito do rato na página e seleccione View Page Source . Para copiar o HTML do e-mail para a área de transferência, realce o conteúdo da página, clique com o botão direito do rato e seleccione Copiar . Email",https://knowledge.hubspot.com/pt/marketing-email/how-do-i-get-the-html-of-an-email-i-sent-from-hubspot
1309,Send emails to contacts that previously bounced,"Not all bounces are permanent. Depending on the nature of the bounce , you can try to resend email to a bounced email address, audit your bounced email addresses, or unbounce an email address. Please note: a common cause of email bounces is a recipient's inbox provider rejecting an email due to lack of email authentication. Learn more about setting up email authentication in HubSpot . How HubSpot handles bounced contacts HubSpot automatically does not send to contacts that have bounced previously for a permanent reason (e.g., invalid recipient, recipient not found, etc.) in the next send to protect your sender reputation. These contacts will appear on the Not Sent tab in the post-send screen of your email. There is no need to filter or delete these contacts to prevent sending to them. However, you may decide that these contacts are stale and/or bad addresses that are no longer relevant to keep in your database for future email sends. Because bounces are associated with email addresses and not the contact record, you can update your contact's email address. Any bounces associated with the old email address will not carry over to the new email address . Likewise, if you update a contact's email address to one that has hard bounced before, the contact will become ineligible for email. Audit bounced email addresses from a marketing email To see the contacts who bounced on an email, and the corresponding bounce reasons: In your HubSpot account, navigate to Marketing > Email . In the left sidebar menu, click Sent . Click the name of an email. In the email's post-send page, click the Recipients tab. In the left sidebar menu, click Bounced . Click > to expand a particular contact to view the bounce reason. To view bounce reasons in bulk, click the List actions dropdown menu and select Export recipients list . View all contacts whose emails have hard bounced You can filter your contacts in your contacts home based on whether the Email hard bounce reason property is known. Otherwise, you can create a list as well. Remove a hard bounce If you know that an email address is valid, a user with Email permission can unbounce the contact to restore marketing email eligibility. Please note: You should only unbounce a contact if you've confirmed that the contact's email address is valid. Sending to invalid email addresses will have a negative impact on your sender reputation and can prevent you from successfully delivering email to your engaged contacts. HubSpot enforces a monthly limit on the total number of unbounces you can perform each month. You can unbounce up to 2% of the total contacts in your HubSpot account, with a minimum of 10 and a maximum of 1,000 unbounces per month. An individual contact can only be unbounced once. To unbounce a contact: Make sure you have an email sending domain connected to HubSpot . Confirm that the contact's email address is valid (e.g., did the contact email you to let you know they want to receive your marketing emails?). If you're aware of an allowlist, network, or content issue that is indicated in the bounce reason, please verify that the issue has been resolved. Learn how your contacts can ensure deliverability of your marketing emails . Once you've verified that the contact's email address is valid and you've taken steps to prevent future bounces, navigate to the contact's record. In the left panel, click Unbounce . In the dialog box, review the information about the contact's bounce. Select the I can confirm that this email address is correct checkbox, then click Unbounce this contact . Please note: When a contact's email address bounces globally, you cannot unbounce them in your HubSpot account. If the email address is legitimate, contact HubSpot support to unbounce them. However, certain bounce types such as unknown addresses and full mailboxes cannot be unbounced because these inboxes are likely abandoned. HubSpot will refuse requests to audit and/or remove bounces from third-party lists, as purchased lists are prohibited in the acceptable use policy . Learn about what types of contact lists are OK to email using HubSpot. HubSpot does not provide list cleaning services as a permission-based sender. It's recommended to remove inactive subscribers, consider a re-engagement campaign, or engage a third-party service scanner to clean your list. Marketing Email",https://knowledge.hubspot.com/marketing-email/how-can-i-send-an-email-to-a-contact-that-has-previously-bounced
1310,Criar e enviar modelos de vendas,"Com modelos, você pode salvar um conteúdo de e-mail repetitivo como um modelo de e-mail. Antes de enviar um modelo, você pode personalizar e ajustar o conteúdo para seus destinatários . Você pode acessar modelos de vendas do CRM ou ao enviar um e-mail da sua caixa de entrada. Os modelos de vendas por e-mail são usados ao enviar e-mails individuais. Para e-mails em massa, saiba como salve modelos de e-mail de marketing. Observação: para criar e editar mais do que os primeiros três modelos, você deve atender a um dos seguintes critérios: Se você é um usuário em um Vendas ou Centro de serviços Profissional ou Empreendimento conta, você deve h tenho um atribuído Centro de vendas ou Centro de serviços S comer. Ser um usuário em uma conta do Sales ou do Service Hub Starter e ter uma Licença principal atribuída . A partir de 18 de setembro de 2024, o número de modelos que os usuários podem acessar dependerá da data de criação da conta. Os usuários que não têm acesso de Vendas podem criar e editar os primeiros três ou cinco modelos na conta. As contas criadas antes de 18 de setembro de 2024 podem editar, acessar e usar os primeiros cinco modelos na conta. Para contas criadas após 18 de setembro, o limite é de três modelos . Se não houver nenhum documentos na conta, o usuário poderá criar e editar até três ou cinco modelos no total, com base na data de criação da conta. Você pode exibir o número total de modelos que já foram criados em sua conta no canto superior direito do painel de modelos. Saiba mais sobre esses limites no Catálogo de produtos e serviços da HubSpot . Crie um modelo Você pode criar um modelo em sua conta HubSpot ou, se usar o Extensão HubSpot Sales para Chrome , você pode crie modelos na sua caixa de entrada do Gmail . Você também pode usar o assistente de IA da HubSpot para gerar modelos de vendas . Na sua conta HubSpot, acesse Biblioteca > Modelos . Clique em Novo modelo e, em seguida, selecione Do zero . Insira um nome e um assunto para o modelo. Observação: há um limite de 256 caracteres aplicados às linhas de assunto do modelo. Para garantir que seus destinatários possam ler toda a linha de assunto, é recomendado manter a linha de assunto abaixo de 45 caracteres. Saiba mais sobre as práticas recomendadas para linha de assunto de e-mail no Blog de usuários do HubSpot . Para tornar o modelo privado para que apenas você possa visualizá-lo e usá-lo, clique no menu suspenso Compartilhado com todos e selecione Privado . Você também pode alterar quem é o modelo é compartilhado com no painel de modelos. Para adicionar o modelo a uma pasta, clique no menu suspenso Selecionar uma pasta . Insira o corpo do e-mail. Use as opções de formatação na parte inferior da janela de edição para modificar o texto. Para editar o estilo de fonte e o tamanho, ou editar o alinhamento de texto, clique no menu suspenso Mais . Para adicionar texto com hiperlink, clique no ícone de link link. Para inserir uma imagem, clique no ícone de imagem insertImage. Incluir fichas de personalização no seu modelo de e-mail, clique no Personalização menu suspenso. Aprender mais sobre adicionando tokens de personalização aos seus modelos de e-mail de vendas . Para inserir um trechos , documento de vendas , link de agendamento , ou vídeo , Clique no Inserir menu suspenso. Observação: os modelos devem incluir texto. Os modelos que contêm somente imagens não poderão ser anexados ao e-mail no HubSpot ou em seu cliente de e-mail. Não é recomendável copiar e colar o conteúdo de outro editor de texto, pois isso pode causar problemas de formatação no editor de modelos do HubSpot. Se você precisar colar conteúdo, certifique-se de colar apenas o texto e não o estilo aplicado. Quando terminar de criar o modelo, clique em Salvar modelo . Você também pode gerar seu modelo de e-mail de vendas usando assistentes de IA. Saiba mais sobre como gerar modelos de e-mail de vendas usando a IA . Depois de criar o modelo, você pode enviar e-mails de modelo do CRM e da sua caixa de entrada de e-mail usando a extensão de vendas, ou adicionar e-mails de modelo às suas sequências. Observação: as chaves em modelos causam problemas com o serviço de renderização do modelo do HubSpot. Você pode usar um token de espaço reservado , em vez de solicitar que os usuários insiram as informações ausentes antes de enviar o e-mail . Enviar um modelo Depois de criar seu modelo de e-mail, você pode usá-lo para enviar e-mails do CRM. Acesse seus registros: Contatos: Na sua conta HubSpot, acesse CRM > Contatos . Empresas: Na sua conta HubSpot, acesse CRM > Empresas . Negócios: Na sua conta HubSpot, acesse CRM > Negócios . Tickets: Na sua conta HubSpot, acesse CRM > Tickets . Clique no nome de um registro. No painel esquerdo, clique no ícone de e-mail email. Na caixa pop-up, clique em Modelos . Na caixa de diálogo, posicione o ponteiro do mouse sobre o modelo que você deseja enviar e clique em Selecionar . Personalize o conteúdo e clique em Enviar . Se você usou qualquer token temporário no modelo, atualize o texto temporário antes de enviar. O e-mail será rastreado automaticamente e as informações serão adicionadas ao seu dados de relatório de modelo . Aprenda como enviar modelos da sua caixa de entrada usando o Extensão HubSpot Sales para Chrome , o Suplemento para área de trabalho do Outlook , ou o Suplemento do Office 365 . Divulgação necessária: se você optar por usar os modelos de e-mail de vendas da HubSpot, além de conectar seu e-mail à HubSpot, a HubSpot digitalizará o conteúdo dos e-mails enviados para identificar possíveis modelos para uso dos usuários na sua conta. Excluir modelos Na sua conta HubSpot, acesse Biblioteca > Modelos . Para excluir um modelo individual, passe o cursor do mouse sobre o modelo , clique em Ações e selecione Excluir . Para excluir vários modelos, marque as caixas de seleção ao lado dos modelos que deseja excluir e clique em Excluir no canto superior da tabela. Na caixa de diálogo, clique em Excluir modelo(s) . Observe: modelos privados só podem ser excluídos pelo usuário que os criou ou por um superadministrador com assento pago. Templates",https://knowledge.hubspot.com/pt/templates/create-and-send-templates
1311,Exibir e gerenciar o acesso do usuário aos registros,"Em cada registro, você pode revisar e gerenciar o proprietário do registro e todos os usuários com permissões de acesso. Você também pode ver o histórico de proprietários do registro, incluindo as propriedades padrão do proprietário do HubSpot e as propriedades personalizadas do usuário. Para gerenciar o acesso geral dos usuários aos registros, aprenda como atribuir o acesso do usuário a cada objeto . Os usuários devem ter permissões de Exibição para o registro selecionado para exibir o painel de acesso de registro. Acesse seus registros: Contatos: Na sua conta HubSpot, acesse CRM > Contatos . Empresas: Na sua conta HubSpot, acesse CRM > Empresas . Negócios: Na sua conta HubSpot, acesse CRM > Negócios . Tickets: Na sua conta HubSpot, acesse CRM > Tickets . Objetos personalizados: Na sua conta HubSpot, acesse CRM e selecione objeto personalizado . Clique no nome de um registro. Na barra lateral esquerda, clique em Ações e selecione Ver acesso ao registro . O proprietário do registro será exibido na parte superior do painel. Este é o usuário selecionado para a propriedade padrão Proprietário . Para alterar o proprietário do registro, clique em Alterar proprietário do [registro] . Você será direcionado para a propriedade registrada, onde poderá atualizar o valor . Na guia Usuários com acesso , veja quais usuários têm acesso ao registro, incluindo a equipe de cada usuário e seu nível de acesso com base nas permissões de usuário do objeto do CRM (por exemplo, Somente exibição, Exibir e editar). Para filtrar os usuários, clique em Equipes ou Acesso e selecione equipes ou permissões para incluir usuários que cumpram esses critérios na tabela. Para procurar um usuário específico, insira o nome ou e-mail do usuário na barra de pesquisa. Para ver mais informações sobre um usuário ou editar suas permissões, clique no nome dele. Você será encaminhado para as configurações do usuário . Para ver os proprietários adicionais do registro, navegue até a guia Proprietários . Essa guia inclui o proprietário do registro e os usuários selecionados para propriedades de usuário personalizadas . Para selecionar quais proprietários visualizar, clique no menu suspenso Escolher um tipo de propriedade e selecione Propriedades de usuário personalizadas ou Propriedades padrão do usuário . Para ver o histórico de proprietários do registro, navegue até a guia Histórico . Se o registro tiver vários proprietários nas propriedades do usuário, para selecionar o histórico de proprietários a exibir, clique no menu suspenso Escolher uma propriedade e, em seguida, selecione a propriedade do proprietário. Clique no X no canto superior direito para fechar o painel. Para entender melhor quem tem acesso a ferramentas e recursos na sua conta, você pode revisar todas as permissões de usuário . Você também pode ver o histórico de atividades da conta para resolver problemas e monitorar as ações do usuário. CRM records",https://knowledge.hubspot.com/pt/records/view-record-access
1312,Adicione um endereço de resposta personalizado ao seu e-mail de marketing,"Alguns e-mails de marketing são enviados por um presidente da empresa ou por um indivíduo da sua empresa . Se não quiser que todas as respostas sejam enviadas para a caixa de entrada pessoal dessa pessoa, pode especificar um endereço de correio eletrónico de resposta personalizado no seu correio eletrónico de marketing . Observação: as respostas de e-mail automatizadas (por exemplo, uma resposta de ausência temporária) ainda serão enviadas para o endereço original De da maioria dos provedores de e-mail. Na sua conta da HubSpot, navegue até Marketing > E-mail . Passe o cursor do rato sobre uma mensagem de correio eletrónico existente e clique em Editar , ou crie uma nova mensagem de correio eletrónico. Clique na guia Configurações . Clique no menu suspenso Endereço do remetente para selecionar um usuário na sua conta como o remetente. Desmarque a caixa de verificação Utilizar isto como o meu endereço de resposta . No campo Reply-to address , introduza o endereço de correio eletrónico que deve receber as respostas a esta mensagem de marketing. Observação: para rastrear respostas para o endereço de Resposta personalizado que você inseriu, conecte a caixa de entrada associada ao HubSpot. Saiba mais sobre como acompanhar as respostas aos seus e-mails de marketing . Email",https://knowledge.hubspot.com/pt/marketing-email/add-a-custom-reply-to-address-to-your-marketing-email
