id,titulo,conteudo,link
1701,Use HubSpot's integration with Dialpad Meetings,"The HubSpot and Dialpad Meetings integration allows you to schedule Dialpad Meetings meetings with your contacts from within HubSpot, and keep your meetings in sync with HubSpot. Install the Dialpad Meetings integration You must be either a super admin or have App Marketplace Access permissions to connect Dialpad Meetings to HubSpot. In your HubSpot account, click the Marketplace icon marketplace in the top navigation bar, then select App Marketplace . Use the search bar to locate and select the Dialpad Meetings integration. In the upper right, click Install app . Enter your Dialpad Meetings credentials and click Log In . Click Authorize to grant HubSpot access to your Dialpad Meetings account. Once you authorize access, you will be automatically redirected back to the Dialpad Meetings settings page in HubSpot. You can schedule new Dialpad Meetings meetings with your contacts within HubSpot. You can disable the integration at any time from the Dialpad Meetings settings screen within HubSpot. Schedule a Dialpad Meetings meeting When scheduling a meeting from the contact record, you can insert your Dialpad Meetings link. In your HubSpot account, navigate to CRM > Contacts . Click the name of the contact. In the left panel, click the meetings Meeting icon . In the pop-up box, set up your meeting. To add your Dialpad Meetings video link, click the Location dropdown menu, then s elect Dialpad Meetings . HubSpot will automatically add your conference link, along with a phone number and passcode to the invitation. To schedule the meeting, click Save . Once the meeting has been created, a success message will appear in the card. Your invitee will receive an email invitation directly from Dialpad Meetings, and the meeting will appear on the contact’s timeline. Any Dialpad Meetings you schedule with one of your HubSpot contacts will be automatically logged in HubSpot. Updates to meetings will be synced between Dialpad Meetings and HubSpot every 10 minutes. Add a Dialpad Meetings link to your meetings links You can add a Dialpad Meetings link to your meetings links to automatically create a Dialpad Meetings meeting when prospects book time with you. Learn more about setting up the meeting tool and creating meeting links . In your HubSpot account, navigate to Library > Meetings Scheduler . Hover over the scheduling page you want to add a Dialpad Meetings videoconference to and click Edit , or click Create scheduling page . On the Overview tab, click the Add videoconference link dropdown menu and select Dialpad Meetings . Click Save to confirm your changes, or Next to continue setting up your scheduling page. When a prospect books a meeting with you, a link to the videoconference will be automatically added to the calendar invite. If you are using the Google Calendar two-way integration with HubSpot , learn more about adding a videoconference link to a meeting scheduled from a record in the CRM . Integrations",https://knowledge.hubspot.com/integrations/how-to-connect-hubspot-crm-and-dialpad-meetings
1702,Set up and manage object pipelines,"Pipelines help visualize your processes through stages, which are steps that signal where a record is in a process. For example, you can create deal pipelines to track revenue, ticket pipelines to track customer issues, or listing pipelines to track for-sale properties. If you have Edit property settings access, you can create and edit pipelines or stages to best suit your teams’ needs. The following objects have pipelines: Leads ( Sales Hub Professional and Enterprise ) Deals Tickets Appointments (if activated ) Courses (if activated ) Listings (if activated ) Services (if activated ) Orders Custom objects ( Enterprise only) Once you’ve set up pipelines, learn how to manage your records in board view . Create a new pipeline ( Starter , Professional , and Enterprise only) If your account has more than one unique process, you can create additional pipelines. Separate pipelines are only recommended if your processes have unique stages that require different pipelines. Otherwise, you can use the same pipeline across multiple users and teams and manage access via user permissions. For example: Your business has an online direct to consumer sales process with a few stages, such as In cart , Closed Won , and Closed Lost . You also have a wholesale sales process that requires more stages, such as appointment scheduling and contract negotiation. In this scenario, you should create separate pipelines. Your business sells multiple brands and your HubSpot account has teams for each brand. The process to sell products for each brand is the same and you can use the same stages for all sales. In this scenario, it's not recommended to create separate pipelines. Instead, you can use the same pipeline and set Team only user permissions so each team can only access their brand's deals ( Professional and Enterprise only). Please note: Creating a new pipeline is in BETA for leads. If you're a Super Admin , learn how to opt your account into the BETA . Leads in a custom pipeline aren't eligible for default lead stage automation. Only Starter , Professional , or Enterprise accounts can create additional pipelines. Lead pipelines are only available for Sales Hub Professional or Enterprise accounts. Learn more about the maximum number of pipelines you can create depending on your subscription. To create a new pipeline: In your HubSpot account, click the settings settings icon in the top navigation bar. In the left sidebar menu, navigate to Objects , then select the object for which you want to create a pipeline. Click the Pipelines tab. Click the Select a pipeline dropdown menu, then select Create pipeline . In the dialog box, enter a Pipeline name and click Create . Once you've added records to your pipeline, learn how to edit the records in a pipeline . Edit or delete pipelines You can also rename, reorder, manage access to, or delete pipelines. Please note: if you connect an ecommerce integration to HubSpot, a deal pipeline will be automatically added to your account that you cannot modify. In your HubSpot account, click the settings settings icon in the top navigation bar. In the left sidebar menu, navigate to Objects , then select the object for which you want to edit pipelines. Click the Pipelines tab. Click the Select a pipeline dropdown menu and select a pipeline . Click the code code icon to view the pipeline's internal name. The internal name is used by integrations and APIs . On the right, click Actions , then select one of the following: Rename this pipeline : change the pipeline’s name. In the dialog box, enter the new name , then click Rename . Reorder pipelines : change the order of your pipelines. In the pop-up box, drag the pipelines to move them to a new position, then click Save . Manage access : manage which users can view and edit the pipeline. Delete this pipeline : delete the pipeline. In the dialog box, click Delete pipeline to confirm. You can't delete a pipeline if it contains records or is used in other HubSpot tools or integrations. Before deleting, you'll need to delete or move records to another pipeline and remove references to the pipeline from other tools. To select the properties that are displayed on the board and board cards for the pipeline, click Customize board and card view . To customize automation settings for a deal , ticket , lead , or custom object pipeline, click the Automate tab. To create and manage color-coded labels that categorize records, click Customize [object] tags ( Starter , Professional , and Enterprise only). To set up rules for a deal, ticket, lead, or custom object pipeline, click the Pipeline Rules tab. Manage stages in a pipeline Use stages to categorize and track the progress of your records through pipelines. Default pipeline stages Depending on the object, there is a default pipeline with default stages: Leads : a default Lead pipeline with five lead stages: New, Attempting, Connected, Qualified, Disqualified. Deals : a default Sales Pipeline for which each stage has an associated probability that indicates the likelihood of closing deals in that stage. Stage probability is used to determine the weighted amount shown in board view, which is calculated by multiplying the total amount in each stage by the stage probability. The default pipeline has seven deal stages: Appointment scheduled (20%), Qualified to buy (40%), Presentation scheduled (60%), Decision maker bought-in (80%), Contract sent (90%), Closed won (100%, Won), Closed lost (0%, Lost). Tickets : a default Support Pipeline with four ticket statuses: New, Waiting on contact, Waiting on us, and Closed. Please note: for tickets, pipeline stages are called statuses by default, but they are the same as other object stages. Appointments : a default Appointment Pipeline with five stages: Scheduled, In Progress, Completed, Canceled, Rescheduled. Courses : a default Course Pipeline with an Open Stage and a Closed Stage. Listings : a default Listing Pipeline with an Open Stage and a Closed Stage. Services : a default Service Pipeline with three stages: New, In Progress, Closed. Orders : a default New Order Pipeline with two stages: In Progress, Contract Signed. Add, edit, or delete pipeline stages You can also add your own stages or edit and delete existing stages. To customize the stages in a pipeline: In your HubSpot account, click the settings settings icon in the top navigation bar. In the left sidebar menu, navigate to Objects , then select the object for which you want to edit stages. Click the Pipelines tab. Click the Select a pipeline dropdown menu, then select the pipeline to edit. To add a new stage: Under the existing stages, click + Add stage . Enter a stage name . For all objects except deals, select whether the stage will be Open or Closed . For deals, click the Deal probability dropdown menu and select a probability . To use a custom probability, enter a custom value , then click Add option and select the new probability . Won and Lost are closed stages. Please note: for deals, to ensure all sales reports, custom deal or revenue reports, and sales analytics tools process your deals correctly, you must include stages for both Won and Lost under Deal probability. To change the name of an existing stage, click the stage's name , then enter a new name in the text box. To reorder stages, click the stage and drag it to a new position. To view the internal name for a stage, hover over the stage and click the code code icon . The internal name is used by integrations and APIs . To delete a stage, hover over a stage and click Delete . You won't be able to delete a stage if there are records in the stage or if the stage has conditional properties in use. Before deleting, you'll need to move existing records to another stage (e.g., edit the [Object] Stage property in bulk ) and remove conditional stage property logic . To edit the properties shown when a record moves to a certain stage , hover over the Conditional stage properties column and click Edit properties . To edit pipeline rules for deals, tickets, or custom objects, hover over the Pipeline Rules tab and click Edit . Once you're done editing, click Save in the bottom left. Set up conditional stage properties You can set conditional stage logic to show certain properties when users manually create a record in or move a record to a specific stage. You can include conditional stage properties as suggestions or require users to add values for the properties. Users must have Edit property settings permissions to customize stage properties. In your HubSpot account, click the settings settings icon in the top navigation bar. In the left sidebar menu, navigate to Objects , then select the object for which you want to edit stage properties. Click the Pipelines tab. Click the Select a pipeline dropdown menu, then select the pipeline to edit. In the row of a stage, hover over the Conditional stage properties column and click Edit properties . In the left panel, click + Add dependent property . Click the Choose a property dropdown menu and select the property you want to appear. Please note: properties with read-only values (i.e. that aren't set by users, such as score or calculation properties) cannot be used as stage properties, and will not appear as options to select. Learn how to include these properties in a properties section on a record instead . To require a value for a property, select the Required checkbox ( Starter , Professional or Enterprise only). When a property is required, users won’t be able to create a record in or move a record to that stage unless they enter a value for that property. To reorder the properties, click and drag the property to a new position. To remove a selected property, click the delete icon next to the property. Once you've set your properties, in the top right, click Apply logic . The properties you've selected will automatically appear when manually creating a new record in that stage or when moving an existing record to that stage. To finalize changes, click Save in the bottom left corner. Learn more about setting conditional logic for enumeration properties . CRM Object Settings",https://knowledge.hubspot.com/object-settings/set-up-and-customize-pipelines
1703,Create and manage POI confirmation links in your partner account,"As a HubSpot partner, you are required to confirm your involvement when selling or servicing HubSpot software to your customers. You can create a confirmation link in your partner account that will be automatically sent to your customer as part of their checkout experience when confirming their purchase. These confirmation links are also known as proof of involvement (POI). Automated confirmation links To save time and make the shared selling process more efficient, a POI is automatically generated and attached to the deal when a quote is created from a shared deal. There must be a HubSpot partner attached to the quote for the POI to generate automatically. Notifications will be sent to the HubSpot partner and HubSpot Partner Development Manager (PDM) when the POI is created, updated, and when it is rejected or confirmed by the customer. If the quote is updated, the POI will also be updated to reflect the changes made. To find your automatically generated POIs: In your HubSpot account, navigate to Partner > Dashboard . Navigate to the Confirmation Links tab. In some cases, you might need to manually create a POI. These cases include: If the automatically created link was rejected by the customer and you need create a new one. If the customer contacted you to change something on the quote, a new POI must be manually created. If there are any issues with the automatic generation. Manually create a confirmation link In your HubSpot account, navigate to Partner > Dashboard . Navigate to the Confirmation links tab. In the top right, click Create confirmation link . In the right sidebar, select the checkbox next to the product type then use the dropdown menu to select the onboarding type . Please note: all Professional and Enterprise products require onboarding. If you are providing onboarding, click to toggle the Providing onboarding switch on. Click the Estimated onboarding duration dropdown menu to select the estimated length of onboarding. Click Preview . Enter a name for your confirmation link. Click Create . If this confirmation link is to be used in a shared deal, you can attach it directly to the shared deal. Navigate to the shared deal in your portal. In the Proof of Involvement section, click Add . Select the confirmation link you want to add to the deal and click Add . Once the link has been added, your PDM will be able to view it on the shared deal. Once the confirmation link has been created, your Partner Development Manager will automatically be notified. To remove the confirmation link from a shared deal: In the Proof of Involvement section, click Actions . Click Remove from deal and click Delete . Any updates to the Proof of Involvement section will be reflect on the deal's activity timeline. For non-shared deals, reach out to your PDM and ask them to add the confirmation link to the appropriate deal. In either case above, the confirmation link will automatically be sent to your customer as part of their checkout experience when confirming their purchase If there is an issue with attaching the confirmation link to the checkout flow, click Copy to copy the link, then share the link with your client. When the client has confirmed or rejected the confirmation link, you will receive an email notification. When a confirmation link is confirmed, your PDM will automatically be notified. When a confirmation link is rejected, the email will include a rejection reason. You can also review confirmation link statuses in your partner dashboard. Review and manage your confirmation links Once you have created a confirmation link you can track and manage them from your confirmation links dashboard. Review your confirmation link status In your HubSpot account, navigate to Partner > Dashboard . Navigate to the Confirmation links tab. In the Client & status column, you can track your confirmation links by status: Pending: your client has not been assigned. Confirmed: your client has confirmed the confirmation link that was sent. Rejected: your client has rejected the confirmation link. A reason for rejection will be included. Manage your confirmation links In your HubSpot account, navigate to Partner > Dashboard . Navigate to the Confirmation links tab. Hover over an existing confirmation link and click the Actions dropdown menu to manage your confirmation link: Preview: preview your confirmation link. Edit: edit your Pending links. Confirmed and Rejected confirmation links cannot be edited. Clone: clone your confirmation link. Remove: permanently delete your pending confirmation link. Confirmed or rejected confirmation links cannot be deleted. Partner Tools",https://knowledge.hubspot.com/partners/create-and-manage-confirmation-links-in-your-partner-account
1704,Exibir resumos de atividades em registros (BETA),"Para acessar rapidamente uma visão geral das atividades -chave de um registro, você pode exibir o cartão Sumário de Atividades na guia de registros de contato, empresa, negócio e ticket. CRM O cartão de resumo de atividades padrão é exibido nos registros por padrão se você tiver ligado a opção . Para exibir mais informações sobre atividade ou registro, você também pode usar outros cartões de atividade padrão, criar cartões de atividade personalizados ou gerar um resumo completo de registro com o Breeze Copilot? Isso requer o Breeze Copilot ativado nas suas configurações de IA . Para acessar o resumo de atividades: Acesse seus registros: Contatos: Na sua conta HubSpot, acesse CRM > Contatos . Empresas: Na sua conta HubSpot, acesse CRM > Empresas . Negócios: Na sua conta HubSpot, acesse CRM > Negócios . Tickets: Na sua conta HubSpot, acesse CRM > Tickets . Clique no nome de um registro. Navegue até a guia Atividades . O cartão de resumo de atividades é exibido na parte superior da linha do tempo de atividades. Para exibir mais informações sobre a atividade, clique em Ver resumo detalhado . O bate-papo Copilot será aberto automaticamente para gerar um resumo de atividades mais detalhado. Para completar mais ações com o Copilot , clique em Fazer uma pergunta . O bate-papo do Copilot será aberto para que você possa inserir prompts adicionais. Saiba mais sobre atividades de registro e uso de cartões em registros . CRM records",https://knowledge.hubspot.com/pt/records/view-activity-summaries-on-records
