id,titulo,conteudo,link
601,Criar mensagens electrónicas programáveis (BETA),"Os e-mails programáveis permitem-lhe utilizar a sintaxe avançada do HubL para personalizar totalmente o conteúdo dos seus e-mails. Saiba mais sobre como criar módulos e renderizar dados do seu CRM em Documentação do desenvolvedor do HubSpot . Nota: deve testar exaustivamente quaisquer módulos ou modelos, juntamente com os seus dependentes associados, antes de executar uma campanha de correio eletrónico em direto. Fontes de dados disponíveis para mensagens electrónicas programáveis Os dados que pode utilizar num e-mail programável dependem da sua subscrição da HubSpot: Se tiver uma conta Marketing Hub Professional , pode processar dados de objectos CRM padrão, como contactos, empresas e produtos. Se tiver uma subscrição Marketing Hub Enterprise , pode incluir fontes de dados estruturadas, tais como tabelas HubDB e objectos personalizados em e-mails programáveis. Ativar o correio eletrónico programável para os seus módulos ou modelos Antes de começar a criar mensagens de correio eletrónico programáveis, é necessário ativar a funcionalidade para o módulo ou modelo codificado associado: Na sua conta da HubSpot, acesse Conteúdo > Design Manager . Para ativar o correio eletrónico programável para um módulo: Crie um novo módulo e seleccione a caixa de verificação Modelos de correio eletrónico ao escolher onde o módulo será utilizado. No inspetor à direita, active o interrutor Ativar módulo para e-mail beta programável . Na caixa de diálogo, verifique se o módulo tem algum dependente. Se o módulo tiver dependentes, reveja-os e, em seguida, seleccione a caixa de verificação I have reviewed the dependents .  Clique em Ativar . Para ativar o correio eletrónico programável para um modelo codificado personalizado: Criar um novo modelo e, em Tipo de modelo , selecionar E-mail . Adicione a anotação isEnabledForEmailV3Rendering: true ao topo do ficheiro de modelo. Quando terminar de editar o modelo, clique em Publicar alterações no canto superior direito. Na caixa de diálogo, verifique se o módulo tem algum dependente. Se o módulo tiver dependentes, reveja-os e, em seguida, seleccione a caixa de verificação I have reviewed the dependents .  Clique em Ativar . Para utilizar o correio eletrónico programável num modelo que esteja a criar no editor de arrastar e largar , arraste um módulo que já tenha ativado para correio eletrónico programável para o modelo. Se estiver a redigir uma mensagem de correio eletrónico no editor de correio eletrónico de arrastar e largar , pode utilizar um módulo programável que tenha criado arrastando o módulo para o corpo da mensagem de correio eletrónico. Email BETA",https://knowledge.hubspot.com/pt/marketing-email/create-programmable-emails
602,Set up single sign-on (SSO) using Active Directory Federation Services (AD FS),"If you have a HubSpot Enterprise account, you can set up single sign-on using Active Directory Federation Services (AD FS). To use AD FS to log in to your HubSpot account, you must meet the following requirements: All users in your Active Directory instance must have an email address attribute. You are using a HubSpot Enterprise account. You have a server running Windows Server 2008, 2012, or 2019. Please note: t his setup process should be done by an IT administrator with experience creating applications in your identity provider account. Learn more about setting up SSO with HubSpot . Before you begin Before you begin, take note of the following two values from your HubSpot account to set up SSO using Microsoft AD FS: Log in to your HubSpot account. In your HubSpot account, click the settings settings icon in the top navigation bar. On the left sidebar, click Account Defaults . Click the Security tab. Click Set up Single Sign-on . In the Set up Single sign-on slide-in panel, click Microsoft AD FS . Take note of both the Audience URI (Service Provider Entity ID) and Sign on URL, ACS, Recipient, or Redirect values as you will need to add them to Microsoft AD FS in the setup process. 1.Add a Relying Party Trust (RPT) Open your Active Directory Federation Services (AD FS) manager: In your AD FS manager, open the Relying Party Trusts (RPT) folder. In the right sidebar menu, select Add Relying Party Trust... . In the Add Relying Party Trust Wizard dialog box, click Start to add a new RPT. On the Select Data Source screen, select Enter data about the relying party manually . Click Next > . In the Display name field, enter a name for your trust - this is for internal purposes, so make sure you name it something that you can easily recognize. Click Next > . On the Configure Certificate screen, leave the default settings as they are, then click Next > . Select the Enable Support for the SAML 2.0 WebSSO protocol checkbox. In the Relying party SAML 2.0 SSO service URL field, enter the Sign on URL, ACS, Recipient or Redirect URL from your HubSpot account. Click Next > . In the Relying party trust identifier field: Enter the Audience URI (Service Provider Entity ID) value from your HubSpot account. Enter https://api.hubspot.com , then click Add . Click Next > . In the Choose an access control policy window, select Permit everyone , then click Next > . Review your settings, then click Next > . Click Close . 2. Create claims rules Before setting up your claims rule, make sure that your users' email addresses match their HubSpot user email addresses. You can use other identifiers, such as the User Principal Name (UPN), if your UPNs are in the form of an email address. In order for single sign-on with AD FS to work, the nameID needs to be in the form of an email address in order to match with a HubSpot user. In the Claims Rule window, click Add Rule . Click the Claim rule template dropdown menu and select Send LDAP Attributes as Claims . Click Next > . On the Configure Claim Rule screen: In the Claim rule name field, enter a rule name. Click the Attribute store dropdown menu and select Active Directory . In the Mapping of LDAP attributes table, map the following: In the LDAP Attribute column, click the dropdown menu and select Email Addresses . In the Outgoing ClaimType column, click the dropdown menu and select Email Address . Click Finish . Next, set up the Transform an Incoming Claim rule: Click Add Rule . Click the Claim rule template dropdown menu and select Transform an Incoming Claim . Click Next > . On the Configure Claim Rule screen: Enter a claim rule name . Click the Incoming claim type dropdown menu and select E-Mail Address . Click the Outgoing claim type dropdown menu and select Name ID . Click the Outgoing name ID format dropdown menu and select Email . Click Finish to add the new rule. Click OK to add both new rules. 3. Adjust the trust settings In the Replying Party Trusts folder, select Properties from the Actions sidebar menu. Click the Advanced tab and make sure SHA-256 is specified as the secure hash algorithm. Though both SHA-256 and SHA-1 are supported, SHA-256 is recommended. 4. Locate your PEM format x509 certificate To access your PEM format x509 certificate: Navigate to the AD FS management window. In the left sidebar menu, navigate to Services > Certificates . Locate the Token signing certificate. Right-click the certificate and select View Certificate . In the dialog box, click the Details tab. Click Copy to File . In the Certificate Export Window that opens, click Next . Select Base-64 encoded X.509 (.CER) , then click Next . Give your file export a name, then click Next . Click Finish to complete the export. Locate the file you just exported and open it using a text editor, such as Notepad. Copy the contents of the file. 5. Complete your set up in HubSpot Log in to your HubSpot account. In your HubSpot account, click the settings settings icon in the top navigation bar. On the left sidebar, click Account Defaults . Click the Security tab. Click Set up Single Sign-on . In the Set up Single sign-on slide-in panel, click Microsoft AD FS . Paste the contents of the file into the X.509 Certificate field. Return to your AD FS manager. In the left sidebar menu, select the Endpoints folder. Search for SSO service endpoint and the entity URL. The SSO service URL usually ends in “adfs/services/ls” and the entity URL ends in “adfs/services/trust”. Return to HubSpot. In the Identity provider Identifier or Issuer field, enter the entity URL. In the Identity Provider Single Sign-On URL field, enter the SSO service URL. Click Verify . Please note: if you receive an error when configuring single sign-on in HubSpot, check your event viewer logs on your device for the error message. If you are not able to troubleshoot the error message, contact HubSpot Support . Account Security",https://knowledge.hubspot.com/account-securitys/set-up-single-sign-on-sso-using-active-directory-federation-services-adfs
603,Criar empresas,"Pode salvar as organizações com as quais interage como registo de empresa no HubSpot. No registo da empresa, a sua equipa pode armazenar e rever informações sobre a organização . Isto ajuda os utilizadores na sua conta HubSpot a manterem-se actualizados. Depois de criar um registo de empresa, pode associar o registo a outros registos, tais como contactos , negócios , e bilhetes . Isto permite-lhe acompanhar as relações entre os seus objectos e permite ao HubSpot sincronizar actividades relevantes entre estes objectos associados . Para criar empresas manualmente: Observe: contas que tenham o Complemento de unidades de negócios podem criar registros de empresa para uma unidade de negócios específica selecionando-a na navegação principal e, em seguida, continuando o seguinte processo. Na sua conta HubSpot, acesse CRM > Empresas . No canto superior direito, clique em Criar empresa . No painel direito, introduza as propriedades da empresa. Depois de preencher o nome da empresa e/ou o nome de domínio, aparecem campos adicionais. Para personalizar as propriedades que aparecem , clique em Editar este formulário na parte superior. Na secção Associar empresa com , procurar e selecionar os registos com os quais a empresa está relacionada. Para personalizar as associações que aparecem , clique em Editar este formulário na parte superior. Depois de preencher a informação da empresa, clique em Criar no fundo. Se quiser criar outra empresa, clique em Criar e adicionar outra . Há formas adicionais de criar empresas no HubSpot: Se estiver a mudar de outro CRM com empresas existentes, pode importá-las para o HubSpot. Se estiver usando o Salesforce com o HubSpot, você pode importar contas como empresas por meio da integração do Salesforce . A HubSpot também pode criar automaticamente empresas com base nos endereços de correio eletrónico dos seus contactos e associar os registos . Uma vez criado o registo de uma empresa, é possível aceder-lhe a partir da página de índice de empresas . Pode ver o registo quando trabalha com essa organização e editar o registo para manter as informações da empresa actualizadas. CRM records",https://knowledge.hubspot.com/pt/records/create-companies
604,Salve seu e-mail de marketing como modelo,"Se você quiser reutilizar ou iterar no design de um e-mail criado usando o editor de arrastar e soltar , você pode salvá-lo como um modelo para e-mails futuros. Observação: você pode salvar apenas e-mails de marketing regulares como modelos. Para e-mails de blog e RSS, você pode clonar o e-mail. Para salvar um e-mail como um modelo: Na sua conta da HubSpot, navegue até Marketing > E-mail . Crie um novo email ou passe o mouse sobre um email existente que você deseja salvar como modelo, clique em Ações e selecione Depois de criar seu modelo de email e você estiver pronto para salvá-lo, clique em Arquivo no canto superior direito do editor de email e selecione Salvar email como modelo. Observação: somente os usuários com acesso a Ferramentas de design podem salvar um e-mail como modelo. Na caixa de diálogo, insira um nome de modelo . Clique em Salvar . Depois de salvar um e-mail como modelo, ele estará disponível para você selecionar ao criar um novo e-mail na seção Modelos salvos . Ao usar um modelo de e-mail salvo, você ainda precisará configurar todas as regras inteligentes, juntamente com outras configurações ou destinatários que deseja incluir no novo e-mail. Marketing Email",https://knowledge.hubspot.com/pt/marketing-email/save-your-marketing-email-as-a-template
605,Bulk update user email domains,"Using the bulk update email domain feature, Super Admins can update their users' email domains at the same time. Before you get started If you have single sign-on enabled, you'll need to disable it before making this change. If a user has the same domain across different HubSpot accounts, the domain will be updated across all their accounts where they use that domain. How to bulk update users email domains In your HubSpot account, click the settings settings icon in the top navigation bar. In the left sidebar menu, navigate to Users & Teams . Above the user table, in the upper right, click Actions , then select Change user email domains . Click the New email domain dropdown menu and select the new domain . If you haven't set up the new domain in your account, follow these steps to add it . Click Next . An email will be sent to your current and new domains, to make sure you have access to them. Once you have validated the new domain, the status will change from Not confirmed to Confirmed . A summary page will display, showing the users affected by the change. If there is one Super Admin on the account, click Change user email domain to confirm the changes. If there is more than one Super Admin on the account, a second Super Admin will need to review and approve the domain changes. Click Send for approval to send to the second Super Admin for review. Once approved, users will receive a confirmation email with their new domain to both their previous, and new domains. User Management",https://knowledge.hubspot.com/user-management/bulk-update-user-email-domains
606,Remove HubSpot users,"If you are a Super Admin who wants to remove a user from your HubSpot account, deactivation is the primary step in revoking a user's access. Once you deactivate a user, you can then fully remove a user from your account. The following explains the differences between user deactivation and complete user removal: Deactivate a user : The user will no longer be able to log in or access the account, but their user profile and associated data will remain for reporting and forecasting. The user can be reactivated later with their current assets. For example, the user will remain assigned to their records. The user will no longer receive notifications. The user will keep their paid seat, but the seat won't count against the account's seat total. The user will be unassigned from conversations and assets, as well as removed from reports. Learn more about what gets removed from the account when removing a user. Remove a user : The user must be deactivated before you can fully remove them from your account. The user will no longer be able to log in or access the account, and their user profile will be removed from the account. The user will be unassigned from conversations and assets, as well as removed from reports. Learn more about what gets removed from the account when removing a user. In addition, a user can remove themself from a HubSpot account or fully delete their user account after they've been removed from all HubSpot accounts. Deleting a user account will fully remove it from HubSpot systems. Deactivate a user Prerequisites before you deactivate a user Instead of removing a user, deactivating allows you to preserve the user’s historical activities without losing access to important data. When deactivated users are reactivated, their historical activities like property changes and content updates will still be available. Before deactivating a user, please note the following: If the user owns any assets or is included as criteria for a filter (e.g., workflows), you should manually remove them from those tools. If the user owns any scheduling pages , is included in any group or round-robin scheduling pages , or is part of a meeting rotation , you should delete or reassign them so they don't get booked for meetings. Please note: it is not possible to delete or transfer ownership of a user's default meeting link . In these cases, ask the user to turn off scheduling pages in their user settings before deactivation, or remove the user after deactivating them. Users in an Enterprise account can log in as another user to turn off scheduling pages. If a user-owned scheduling page isn't re-assigned or deleted, if the user is left as part of a group or round-robin scheduling page, or if they are left as part of a rotation, meetings will still be booked for the user. This means a contact will receive an invite for a meeting with the deactivated user. If a meeting is booked for a contact, either through the owned scheduling page of the deactivated user, through a group or round-robin scheduling page, or through a rotation, the meeting won't show on the contact's activity feed . If they booked through a scheduling page, the page view will show in the user activity feed. Meeting bookings won't go through workflow automation after deactivation. For example, if you have a workflow set to trigger after a meeting submission for the deactivated user, it won't trigger after deactivation. If a user is set as a point of contact in your Account & Billing settings, you'll need to remove them from the role . Deactivated users will be skipped when using the rotate record owner workflow action, and will be removed as options when setting the owner of a record. Once a user is deactivated, their personal emails will be disconnected. They'll be unable to log new emails to the CRM, including any scheduled sequence emails . Any team emails the user connected to the conversations inbox will remain connected. Deactivate a user in your account To deactivate a user: In your HubSpot account, click the settings settings icon in the top navigation bar. In the left sidebar menu, navigate to Users & Teams . Hover over the name of the user, then click Actions , and select Deactivate user . In the dialog box, review the advisory, then click Deactivate user . The user will receive an email indicating their profile has been deactivated. Reactivate a user To reactivate a user: In your HubSpot account, click the settings settings icon in the top navigation bar. In the left sidebar menu, navigate to Users & Teams . Click the name of the user. The user's status will show as Deactivated in the top left. In the top right, click Actions , then select Reactivate user . Any seats assigned to the user prior to deactivation that were not unassigned will be reactivated. Click the Access tab to see if the user is assigned to any seats. In the dialog box, click Reactivate user . The user will receive an email indicating their profile has been reactivated. Remove a user Prerequisites before you remove a user Before fully removing a user from your account, the user must be deactivated . Keep in mind that created content and owned records may be affected: If a user is set as a point of contact in your Account & Billing settings, you will need to remove them from the role before you can remove them as a user. When you remove a user, you can't restore the user. Instead, you must go through the user creation process again. Records that were once assigned to the removed user should be re-assigned once they are added back. When a user is removed from an account, HubSpot will not delete any assets or activities that they created. This includes assets such as blog posts, pages, lists, workflows, forms, and reports, as well as sales activities such as logged emails and notes. Assets will show Deactivated/Removed (user's email address) as the creator. Any scheduling pages created by the removed user will be deleted. Any social messages published by the removed user will remain published. However, if the removed user was the administrator for any social media accounts, you may need to reconnect those accounts . The user will remain as a blog author. Learn how to delete the blog author profile manually. Any marketing emails created by a removed user will remain, but all user information associated with the marketing email will disappear. For example, no name will be shown when you view who the marketing email was created by. Any sequences, templates, and documents created in your account will remain; however, the removed user must have shared their sales templates prior to removal for other users to access them. Any conversations that were assigned to the removed user will be unassigned. If you remove a user from your account, Deactivated/Removed (user's email address) will appear in the ownership property for any contacts, companies, deals, and tickets owned by that user. If your HubSpot account is synced with Salesforce and the removed user is still a Salesforce user, the user's name will appear as Name (Salesforce) , as it does for SFDC users who never had HubSpot access. If you remove a user who created a private app or remove their super admin permissions, any association calls in the private app will fail with the error: USER_DOES_NOT_HAVE_PERMISSIONS. If this happens, it is recommended to either: Re-create a new private app. Rotate the access token . Add the user back, with the same permissions used to create the app. After a user is removed from your account, they will no longer appear as an option in filters, such as in lists or dashboards. You can display removed users in your filters by selecting the Show inactive owners checkbox when filtering. Before removing a user, you should reassign any records owned by the user. Learn more about setting ownership of records in HubSpot . Remove user as a point of contact for Account & Billing If a user is set as a point of contact in your Account & Billing settings, you will need to remove them from the role before you can remove them as a user. In your HubSpot account, click your account name in the top right corner, then click Account & Billing . At the top, click the Company Info tab. In the Billing Contacts section, click the delete delete icon next to any roles that the user is set as. In the dialog box, click Yes, remove from role . If the user is set as the Primary contact , you will need to replace them with another user. Click the dropdown menu next to Primary contact , then select a different user . In the dialog box, click Yes, add user to role . You will now be able to remove the user from your account. Remove a user from your account To remove a user from your account: In your HubSpot account, click the settings settings icon in the top navigation bar. In the left sidebar menu, navigate to Users & Teams . Click the name of the user. The user's status should show as Deactivated in the top left. Learn how to deactivate a user . In the top right, click Actions , then select Remove from account . In the dialog box, review the advisory and take any actions necessary to reassign seats and assets. Click Continue , then click Confirm . Remove yourself from a HubSpot account You can also remove your user account from a specific HubSpot account. Before you remove your user account from a specific HubSpot account, click your account name in the top right of the main navigation bar to verify you are logged into the correct Hub. To remove your user account from a specific HubSpot account: In your HubSpot account, click the settings settings icon in the top navigation bar. In the left sidebar menu, navigate to General > Security . At the bottom, click Remove me from this account . If you are a part of other accounts, you will still have access to them. If you have not been removed as a point of contact in Account & Billing , this button will be grayed out. In the dialog box, type your email address, then click Delete . Delete your HubSpot user account When a user's access is removed from a HubSpot account, the user cannot access the account. However, the user associated with the email address will continue to exist. You can fully delete your user account once you're not the only Super Admin remaining while other users are still in the account. Please note: deleting your user will delete any Academy certifications associated with that email address. To maintain your certifications, you can transfer your certifications to a new email address before deleting your user. To permanently delete your user account: Log in to the user account you want to delete. Ensure it does not have access to any other HubSpot accounts. In your HubSpot account, click the settings settings icon in the top navigation bar. In the left sidebar menu, click General > Security . At the bottom, click Delete my user account . In the dialog box, enter your user email address , then click Delete user . Settings User Management",https://knowledge.hubspot.com/user-management/deactivate-hubspot-users
