id,titulo,conteudo,link
2751,Revisar insights de dados em exibições de negócios,"Para cada exibição de negócio, há um resumo das informações de valor, fase e duração que permite entender rapidamente os dados e o progresso dos negócios. Você pode navegar entre diferentes pipelines e exibições para analisar insights de dados para subconjuntos específicos de negócios. Esses dados podem ajudá-lo a identificar tendências e áreas de melhoria em seus processos, bem como a priorizar os negócios. Exibir insights de dados em uma exibição de negócio Na sua conta HubSpot, acesse CRM > Negócios . Navegue até o pipeline e a exibição para a qual você deseja analisar os insights de dados. Por padrão, os insights sobre os dados são mostradas automaticamente em todas as exibições de lista e quadro. Para ocultar o resumo, clique em Ocultar insights no canto superior direito. Para exibir o resumo, clique em Mostrar insights . As seguintes informações estão incluídas no cartão de insights de dados: Valor total do negócio: a soma dos valores de todos os negócios na exibição, incluindo negócios fechados. O valor médio por negócio também é exibido, e é calculado dividindo o valor total pelo número de negócios que incluem valores. Valor ponderado do negócio: a soma do valor ponderado de todos os negócios na exibição. O valor médio ponderado por negócio também é exibido, e é calculado dividindo o valor ponderado total pelo número de negócios que incluem valores, com exceção de negócios perdidos. Valor de negócios abertos: a soma dos valores dos negócios em fases abertas (ou seja, negócios não fechados nem perdidos). O valor médio por negócio aberto também é exibido, e é calculado dividindo o total pelo número de negócios que incluem valores em fases abertas. valor do negócio fechado: a soma das quantias de negociações em estágios fechados. O valor médio por negócio fechado também é exibido, e é calculado dividindo o total pelo número de negócios que incluem valores em fases fechadas. Valor de novos negócios: a soma dos valores dos negócios criados esta semana. A média também é exibida, e é calculada dividindo o valor total de novos negócios pelo número de novos negócios. Média da idade do negócio: o número médio de dias desde a criação do negócio até o fechamento. Para negócios abertos, inclui o número de dias desde a criação do negócio até o dia atual. Observe: em contas com múltiplas moedas , os insights de dados são baseados no Valor na moeda da empresa e Valor ponderado na moeda da empresa propriedades. Para agregar os dados de resumo, todos os negócios são convertidos para a moeda da empresa com base na taxa de câmbio definida na conta. Os insights de dados são atualizados em tempo real conforme você faz alterações nos negócios na exibição (por exemplo, cria, exclui ou edita o valor/estágio de um negócio) ou quando você atualiza os detalhes da exibição. filtros. Saiba mais sobre como gerenciar negócios em visualização de lista ou visão do quadro. Exportar ou usar insights de dados em outras ferramentas Você pode usar dados do cartão do insights em outras ferramentas, como listas e relatórios, ou exportar um arquivo com os dados do negócio. Na sua conta HubSpot, acesse CRM > Negócios . Navegue até o pipeline e a exibição para a qual você deseja analisar os insights de dados. Clique em um valor no cartão de insights. Na caixa de diálogo, você pode fazer o seguinte: Dados do grupo : selecione uma dimensão para agrupar os negócios. Por exemplo, exiba o valor total do negócio dividido pelas equipes responsáveis pelos negócios. Usar na lista : crie uma nova lista estática dos negócios incluídos no relatório ou adicione os negócios a uma lista estática existente. Exportar : exporte um arquivo com os negócios e seus valores. Salvar como relatório : salve o relatório e adicione-o à sua lista de relatórios e/ou painéis. Clique no X no canto superior direito para fechar o relatório. Ativar ou desativar as informações de dados para sua conta Se você é um usuário com Superadministrador permissões, você pode ativar ou desativar os insights do negócio nas configurações do negócio. Com os insights ativados, o cartão de insights de dados aparecerá em todas as exibições de negócios, mas um usuário poderá optar por mostrar ou ocultar isso sempre que acessar a exibição. Se estiver desativado, o cartão de insights de dados ficará oculto nas exibições de negócios para todos os usuários. Na sua conta HubSpot, clique no ícone de configurações settings icon na barra de navegação superior. No menu da barra lateral esquerda, acesse Objetos > Negócios . Clique no Personalização do índice aba. Por padrão, as informações sobre negócios estão ativadas. Para desativar o recurso, alterne o Mostrar Insights sobre negócios desligar. Para reativar o recurso, alterne o Mostrar Insights sobre negócios ligar. records",https://knowledge.hubspot.com/pt/records/review-data-insights-on-deal-views
2752,Add smart content to your calls-to-action (CTAs),"Add smart content to your calls-to-action (CTA) to display different versions of your CTA based on viewer category. For example, you can display text on your CTAs for visitors from a specific country or contact lifecycle stage. Please note: smart content in a CTA that's included in a marketing email is not currently supported. In your HubSpot account, navigate to Marketing > CTAs . In the top right, click Create . You can use smart content when creating a new CTA from scratch or from a template: To create a new CTA from a template, in the left panel, click HubSpot Templates . Then, select a template that matches your goals. To create a new CTA from scratch, in the left panel, click Start from scratch . Then, select a CTA type . In the left panel, from the Add tab, click and drag a new element directly into the right panel of the editor. Or, click an existing element on your CTA. In the Smart rules section, click + Add . In the right panel, click the Show different content based on dropdown menu and select a category . Learn more about smart rule categories . Under the rules section, add and manage your smart rules: To add a new smart rule in the same category, click + Add . Then, click the dropdown menu and select a rule . To delete the rule, click the delete delete icon to the right of the rule. After setting up your smart category and rules, at the bottom, click Save . In the left panel, click the Editing for dropdown menu to switch between default content and smart content for each rule. To add new rules or edit existing rules, click Manage . Continue setting up your CTA . CTAs",https://knowledge.hubspot.com/ctas/add-smart-content-to-your-ctas
2753,Connect HubSpot and Google Meet,"With the Google Meet integration, you can automatically send Google Meet meeting link and conference call details to your HubSpot contacts. Turn every meeting booked in your HubSpot Smart CRM into a Google Meet meeting. App requirements You must have App Marketplace permissions or be a super admin in your HubSpot account. Install the Google Meet app In your HubSpot account, click the Marketplace icon marketplace in the top navigation bar, then select App Marketplace . Use the search bar to locate and select the Google Meet integration. In the upper right, click Install app . In the dialog box, sign in to your Google account. Select the See, edit, share, and permanently delete all the calendars you can access using Google Calendar checkbox. Click Continue . You'll be redirected back to the Connected apps page. Please note: Google Meet is a user-level integration. This means each user must follow the steps above to install the integration in the HubSpot account. Use Google Meet with HubSpot meetings You can use the Google Meet integration to send meeting links to your contacts and record them in your HubSpot account. Configure your meeting settings Connect your calendar to HubSpot. In your HubSpot account, navigate to Library > Meetings Scheduler . Hover over the scheduling page you want to update, then click Edit . Under Location , click Add videoconference link , then select Google Meet . In the bottom left, click Save . Meeting links will be created in the default language set in your HubSpot account. Please note: this will add a Google Meet URL to the Location field of your Google meeting, but will not add the ""Join with Google Meet"" button. Add a Google Meet meeting link to your meetings In your HubSpot account, navigate to your contacts, companies, deals, or tickets . Click the name of the record. In the left panel, click meetings Schedule a meeting . In the window that opens at the bottom of the screen, set up your meeting . To input a Google Meet link, click the Select location dropdown menu. Click Google Meet . A Google Meet link will be generated for the meeting. Please note: to connect the Google Meet integration with your calendar, HubSpot creates a shadow calendar. The shadow calendar will not affect any functionality in your calendar. Integrations",https://knowledge.hubspot.com/integrations/use-hubspots-integration-with-google-meet
2754,Conecte o HubSpot e o AWS S3 (BETA),"Aprenda como conectar o HubSpot e o AWS S3 para sincronizar dados do HubSpot com seu bucket S3. Observe que o HubSpot não compartilha dados do HIPAA com o AWS S3. Antes de começar Antes de configurar a integração, você precisará optar por sua conta HubSpot nos dados de Acesso ao HubSpot no AWS S3 beta. Conecte o HubSpot e o AWS S3 Para conectar o HubSpot e o AWS S3, você deve seguir os passos abaixo na ordem: Configurar permissões de acesso para o bucket AWS S3 Criar uma política de IAM Crie a função IAM na AWS Conecte o HubSpot e o AWS S3 Conceda ao usuário do IAM permissões para acessar objetos do bucket S3 1. Configurar permissões de acesso para o bucket S3 O HubSpot precisa das seguintes permissões em um bucket e pasta do AWS S3 para acessar arquivos na pasta e subpastas: s3:ObterLocalizaçãoBucket s3:ObterObjeto s3:ObterVersãoDoObjeto s3:ListBucket s3:ColocarObjeto s3:ExcluirObjeto 2. Criar uma política de IAM Faça login no Console de gerenciamento da AWS . No painel inicial, clique em Serviços > Segurança, Identidade e Conformidade > EU SOU . Na barra lateral esquerda, clique em Configurações de Conta . No Serviço de Token de Segurança (STS) seção, procure a região da AWS que corresponde à região em que sua conta da AWS está localizada. Clique para alternar o interruptor sobre para ativar a região. No painel lateral esquerdo, clique em Políticas . Clique Criar política . No JSON aba, clique Adicionar nova declaração . Adicione o documento de política abaixo que dará ao HubSpot as permissões necessárias para carregar ou descarregar dados usando um único bucket e caminho de pasta. Você também pode limpar arquivos de dados usando a opção de cópia PURGE. Observação: Certifique-se de substituir <bucket> e <prefix> com o nome real do seu bucket e o prefixo do caminho da pasta. E Os nomes de recursos da Amazon (ARN) para buckets em regiões governamentais têm um arn:aws-us-gov:s3::: prefixo. Definindo o s3:prefix condição para [""*""] ou [""<path> /*""] concede acesso a todos os prefixos no bucket ou caminho especificado no bucket, respectivamente. { ""Version"": ""2012-10-17"", ""Statement"": [ { ""Effect"": ""Allow"", ""Action"": [ ""s3:PutObject"", ""s3:GetObject"", ""s3:GetObjectVersion"", ""s3:DeleteObject"", ""s3:DeleteObjectVersion"" ], ""Resource"": ""arn:aws:s3:::<bucket>/<prefix>/*"" }, { ""Effect"": ""Allow"", ""Action"": [ ""s3:ListBucket"", ""s3:GetBucketLocation"" ], ""Resource"": ""arn:aws:s3:::<bucket>"", ""Condition"": { ""StringLike"": { ""s3:prefix"": [ ""<prefix>/*"" ] } } } ] } Clique em Próximo . No Revisar e criar seção, adicione o Nome da política e um opcional descrição . Clique Criar política . 3. Crie a função IAM na AWS Para configurar permissões de acesso para o HubSpot no AWS Management Console: Faça login no Console de gerenciamento da AWS . No painel inicial, clique em Serviços > Segurança, Identidade e Conformidade > EU SOU . Na barra lateral esquerda, clique em Funções . Clique Criar função . No Tipo de entidade confiável seção, selecione Conta AWS . No Uma conta AWS seção, selecione Outra conta AWS e insira seu próprio ID de conta da AWS. Mais tarde, você alterará a relação de confiança para dar acesso ao HubSpot. Selecione Exigir ID externo e insira um ID de espaço reservado como 0000. Mais tarde, você alterará o relacionamento de confiança para sua função do IAM e especificará o ID externo para sua integração de armazenamento. Um ID externo é usado para conceder acesso aos seus recursos da AWS a um aplicativo de terceiros, como o HubSpot. Clique em Próximo . Selecione a política criada na Etapa 1 e clique em Próximo . No Detalhes da função seção, insira um Nome da função e Descrição para identificar a função. Clique Criar função . No Página de resumo da função , copie o ARN valor. Você usará esse valor na próxima etapa. 4. Conecte o HubSpot e o AWS S3 Antes de instalar a integração, certifique-se de que sua conta HubSpot esteja incluída nos dados do HubSpot de Acesso no AWS S3 beta . Na sua conta HubSpot, clique no ícone do Marketplace marketplace na barra de navegação superior e selecione App Marketplace . Procure e selecione AWS S3 . Você também pode navegar para a integração diretamente em sua conta usando esta URL . No canto superior direito, clique em Instalar aplicativo . Entre no Nome da função do IAM configurado na Etapa 3 e o Caminho da URL S3 para o bucket no qual você deseja que os dados sejam despejados. Clique Próximo . Revise e copie o Usuário do AWS IAM e ID externo da AWS valores, pois você precisará deles na próxima etapa. Então, clique Continuar para aplicativos conectados . 5. Conceda ao usuário do IAM permissões para acessar objetos do bucket Faça login no Console de gerenciamento da AWS . No painel inicial, clique em Serviços > Segurança, Identidade e Conformidade > EU SOU . Na barra lateral esquerda, clique em Funções . Selecione a função que você criou na Etapa 3. Selecione o Relações de confiança tab e clique Editar política de confiança . Modifique os documentos da política com os valores registrados na Etapa 3. { ""Version"": ""2012-10-17"", ""Statement"": [ { ""Sid"": """", ""Effect"": ""Allow"", ""Principal"": { ""AWS"": ""<hubspot_user_arn>"" }, ""Action"": ""sts:AssumeRole"", ""Condition"": { ""StringEquals"": { ""sts:ExternalId"": ""<hubspot_external_id>"" } } } ] } Na política acima, altere os dois campos a seguir para os valores registrados na Etapa 4: usuário_hubspot_arn para o ARMAZENAMENTO_AWS_IAM_USER_ARN valor ID_externo_do_hubspot para o ARMAZENAMENTO_AWS_EXTERNO_ID valor Após concluir as etapas acima, o HubSpot pode sincronizar dados no AWS S3. Formato de dados para sincronização entre HubSpot e AWS S3 Dados disponíveis para sincronização Você pode sincronizar os seguintes dados do HubSpot para o AWS S3: Objetos: objetos padrão e personalizados, como contatos, empresas, tickets ou produtos. Registros: registros de objetos individuais. Associações: todos os tipos de associação e registros associados. Eventos: dados de eventos para eventos padrão do HubSpot e eventos comportamentais personalizados. Listas: Listas de contatos e empresas do HubSpot. Proprietários: detentores de recordes. Tubulações: pipelines de negócios e tickets e estágios do pipeline. Propriedades: propriedades e seus valores nos registros de objetos, incluindo o histórico de propriedades. Dados de objetos de diferentes tipos são organizados e disponíveis de duas maneiras: Individual: e Cada tipo de objeto é armazenado em sua própria tabela e possui apenas registros do mesmo tipo de objeto. Por exemplo, objects_contacts contém apenas registros de contato. Combinado: a Todos os registros de todos os tipos de objetos são combinados em um único objeto de banco de dados. Portanto, ao consultar, você precisa especificar um filtro como “WHERE objectTypeId='0-1' O Objeto personalizado receberá uma ID no momento da criação e será identificado como 2-unique_ID . Por exemplo, 2-12345 . tabelas objects_x Cada tipo de objeto disponível, incluindo objetos personalizados, tem sua própria tabela específica. Essas tabelas são nomeadas seguindo o formato OBJECTS_<object type name> onde <object type name> é o plural do rótulo objecttype . (Observe que se o tipo de objeto não tiver forma plural, então <object type name> será o rótulo de forma singular do nome do tipo de objeto concatenado com “S”). Abaixo está uma lista completa dos tipos de objetos do HubSpot disponíveis, uma breve descrição dos dados que eles representam e suas tabelas correspondentes. Tipo de objeto HubSpot ObjectTypeId Descrição CONTATO 0-1 Informações sobre indivíduos que interagem com sua empresa EMPRESAS 0-2 Informações sobre empresas ou organizações individuais NEGÓCIO 0-3 Detalhes sobre oportunidades de receita com um contato ou empresa. ENGAJAMENTO 0-4 Armazena dados de ações de CRM, incluindo notas, tarefas, e-mails, reuniões e chamadas. TICKET 0-5 Representa as solicitações dos clientes por ajuda ou suporte. ORÇAMENTO 0-14 Usado para compartilhar informações de preços com potenciais compradores. FORM_SUBMISSION 0-15 Detalhes para envios individuais para um formulário HubSpot. ITEM_LINHA 0-8 Representa um subconjunto de produtos vendidos em uma transação. Quando um produto é anexado a um negócio, ele se torna um item de linha. CONVERSAÇÃO 0-11 Detalhes de mensagens recebidas de vários canais. LANDING_PAGE 0-25 Detalhes de suas páginas de destino TAREFA 0-27 Armazena informações sobre listas de tarefas FORMA 0-28 Usado para coletar informações de leads sobre seus visitantes e contatos MARKETING_EMAIL 0-29 Detalhes sobre e-mails do centro de marketing AD_ACCOUNT 0-30 Armazena informações sobre suas contas de anúncios no Linkedin, Facebook e Google AD_CAMPAIGN 0-31 Detalhes sobre suas campanhas publicitárias. Uma campanha publicitária pode conter um ou mais anúncios AD_GROUP 0-32 Agrupamento lógico de anúncios em uma campanha publicitária DE ANÚNCIOS 0-33 Detalhes sobre anúncios individuais CAMPANHA 0-35 Informações sobre ativos e conteúdos de marketing relacionados, para que você possa medir facilmente a eficácia de seus esforços coletivos de marketing. SITE_PAGE 0-38 Dados sobre páginas individuais em seus sites BLOG_POST 0-39 Dados sobre postagens de blog OBJETO LISTA 0-45 Informações sobre agrupamentos de registros de objetos com base em suas propriedades ou atividades CHAMADA 0-48 Chamadas feitas por outros registros de CRM, por exemplo, contatos FATURA 0-53 Gerencie e sincronize faturas com sistemas de contabilidade externos PONTE_DE_MÍDIA 0-57 Informações sobre ativos de mídia importados para o HubSpot SEQÜÊNCIA 0-58 Uma sequência é uma série de modelos de e-mail direcionados e cronometrados para nutrir contatos ao longo do tempo DEAL_SPLIT 0-72 As divisões de negócios são usadas para compartilhar o crédito do negócio entre vários usuários VENDAS_DOCUMENT 0-83 Os documentos de vendas criam uma biblioteca de conteúdo para toda a sua equipe carregar e compartilhar documentos com seus contatos. FEEDBACK_SUBMISSION 0-19 Armazena informações enviadas para uma pesquisa de feedback. ASSINATURA 0-69 As assinaturas contêm detalhes de pagamentos recorrentes PAGAMENTO DE COMÉRCIO 0-101 Contém dados sobre fundos coletados de clientes object_with_object_properties Esta tabela contém dados dos seus registros do HubSpot. Você pode obter uma linha para cada registro dentro de um objecttype (por exemplo, todos os registros de contato no objecttype contacts). object_properties_history Esta tabela contém valores históricos de propriedades. Para contatos, contém os 45 valores mais recentes. Para todos os outros objetos, ele contém os 20 valores mais recentes. A tabela tem uma linha para cada valor histórico da propriedade. O valor atual de uma propriedade é determinado pelo registro de data e hora UPDATEDAT mais recente no histórico da propriedade. Consultas de associação Assim como os dados de objetos, os dados de associações são organizados de duas maneiras: Individual: cada tipo de associação é armazenado em sua própria tabela e contém apenas registros desse tipo. Por exemplo, associations_contacts_to_deals contém apenas registros de associação entre objetos de contato e negócio. E Combinado: todos os registros para todos os tipos de associação são combinados em uma tabela. associações_x_para_y Cada tipo de associação tem sua própria visão, rotulada como associations_<association type name> por exemplo associations_contacts_to_deals . association_definitions Esta tabela contém informações sobre todos os tipos de associação disponíveis entre objetos do HubSpot, com uma linha por tipo de associação. property_definitions Esta tabela contém informações sobre propriedades do objeto e propriedades de eventos na sua conta HubSpot. As propriedades do evento incluem eventos padrão, como aberturas e cliques de e-mail e propriedades de evento personalizado . Essas informações podem ser úteis para definir valores encontrados em propriedades_do_objeto e eventos dados. Eventos Os eventos incluem eventos padrão do HubSpot e eventos comportamentais personalizados. Cada evento tem sua própria tabela, rotulada como events_eventname . object_and_event_type_definitions Esta tabela contém definições para todos os objetos e eventos disponíveis na sua conta HubSpot. Frequência de sincronização e organização de dados Sincronização de dados diário entre HubSpot e AWS S3. Uma pasta será criada para cada dia em que os dados forem sincronizados. Cada uma das tabelas a seguir estará disponível como uma pasta com arquivos CSV compactados: ASSOCIATIONS ASSOCIATION_DEFINITIONS EVENTS_[Event name] LISTS LIST_MEMBERSHIPS OBJECTS OBJECT_AND_EVENT_TYPE_DEFINITIONS OBJECT_PROPERTIES OBJECT_PROPERTIES_HISTORY OBJECT_WITH_OBJECT_PROPERTIES OWNERS OWNER_TEAM PIPELINES PIPELINE_STAGES PROPERTY_DEFINITIONS TEAMS Haverá várias subpastas para cada tabela. Se o tamanho da tabela exceder 15 MB, haverá vários arquivos CSV compactados em cada pasta da tabela. Integrations BETA",https://knowledge.hubspot.com/pt/integrations/connect-hubspot-and-aws-s3
